INDY,iShares India 50 ETF,Blackrock,iShares,11/18/09,Open-Ended Fund,0.93%,$644.61M,$2.81M,,"PIN, NFTY ",,,,,Nifty 50 Index,Market Cap,Market Cap,MSCI India Large Cap,0.17%,$59.86B,25.84,2.63,0.08%,12/14/20,54,,,,,,,,,,,,,,,,,,,,,,,,,,,,,
INFR,Legg Mason Global Infrastructure ETF,Franklin Templeton,Legg Mason,12/29/16,Open-Ended Fund,0.40%,$8.89M,$55.99K,,"IGF, GII, NFRA, TOLZ, OBOR ",,,,,RARE Global Infrastructure Index,Multi-Factor,Fundamental,N/A,2.25%,$40.31B,30.84,1.63,3.27%,12/28/20,103,,,,,,,,,,,,,,,,,,,,,,,,,,,,,
INKM,SPDR SSGA Income Allocation ETF,State Street Global Advisors,SPDR,04/25/12,Open-Ended Fund,0.50%,$122.28M,,0.12%,"TDSC, DRSK, TAIL, NTSX, TDSB ",,,,,No Underlying Index,Proprietary,Proprietary,N/A,,,,,3.91%,,,,,,12/29/20,,,,,,,,,,,,,,,,,,,,,,,,,
INTF,iShares MSCI Intl Multifactor ETF,Blackrock,iShares,04/28/15,Open-Ended Fund,0.30%,$918.33M,$3.46M,,"NUDM, RODM, GSIE, JPIN, JHMD ",,,,,MSCI World ex USA Diversified Multi-Factor Index,Multi-Factor,Multi-Factor,MSCI World ex USA IMI,0.08%,$31.16B,16.74,1.32,2.90%,12/14/20,192,,,,,,,,,,,,,,,,,,,,,,,,,,,,,
IOO,iShares Global 100 ETF,Blackrock,iShares,12/05/00,Open-Ended Fund,0.40%,$2.75B,$5.31M,,"DGT, BLES, SPQQ ",,,,,S&P Global 100 Index,Market Cap,Committee,MSCI ACWI Large Cap Index,0.08%,$712.95B,31.23,2.79,1.53%,12/14/20,109,,,,,,,,,,,,,,,,,,,,,,,,,,,,,
IPAC,iShares Core MSCI Pacific ETF,Blackrock,iShares,06/10/14,Open-Ended Fund,0.09%,$1.09B,$2.82M,,"VPL, RFAP ",,,,,MSCI Pacific IMI,Market Cap,Market Cap,MSCI Pacific IMI,0.17%,$35.84B,27.90,1.26,2.73%,12/14/20,865,,,,,,,,,,,,,,,,,,,,,,,,,,,,,
IPAY,ETFMG Prime Mobile Payments ETF,ETFMG,ETF Managers Group,07/15/15,Open-Ended Fund,0.75%,$965.16M,$7.88M,,"IXN, CIBR, CLOU, FINX, SNSR ",,,,,Prime Mobile Payments Index,Market Cap,Market Cap,Thomson Reuters Global Technology,0.15%,$72.90B,49.46,4.17,0.02%,12/14/20,43,,,,,,,,,,,,,,,,,,,,,,,,,,,,,
IPFF,iShares International Preferred Stock ETF,Blackrock,iShares,11/15/11,Open-Ended Fund,0.55%,$41.05M,$124.68K,0.34%,N/A ,,,,,S&P International Preferred Stock Index,Market Value,Committee,S&P International Preferred Stock Index,,,,,,12/01/20,84,--,--,--,,,,,,,,,,,,,,,,,,,,,,,,,,
IPKW,Invesco International BuyBack Achievers ETF,Invesco,,03/06/14,Open-Ended Fund,0.55%,$112.08M,$425.02K,,"QINT, IGRO, VIGI, PID, VXUS ",,,,,NASDAQ International BuyBack Achievers,Market Cap,Share Buybacks,MSCI ACWI ex USA IMI Index -TR net,0.22%,$19.37B,54.24,1.21,1.59%,12/21/20,74,,,,,,,,,,,,,,,,,,,,,,,,,,,,,
IPO,Renaissance IPO ETF,Renaissance Capital,Renaissance,10/14/13,Open-Ended Fund,0.60%,$643.80M,$18.81M,,"FPX, CSD, SPAK, VTI, ITOT ",,,,,Renaissance IPO Index,Market Cap,Time Since Listing,MSCI USA IMI,0.31%,$27.71B,-43.83,9.97,0.20%,12/18/20,49,,,,,,,,,,,,,,,,,,,,,,,,,,,,,
IPOS,Renaissance International IPO ETF,Renaissance Capital,Renaissance,10/06/14,Open-Ended Fund,0.80%,$34.41M,$831.85K,,"FPXI, VXUS, VEU, IXUS, ACWX ",,,,,Renaissance International IPO Index,Market Cap,Time Since Listing,MSCI ACWI ex USA IMI Index -TR net,0.61%,$44.76B,46.43,5.70,0.16%,12/18/20,44,,,,,,,,,,,,,,,,,,,,,,,,,,,,,
IQDE,FlexShares International Quality Dividend Defensive Index Fund,Northern Trust,FlexShares,04/12/13,Open-Ended Fund,0.47%,$67.30M,$120.98K,,"IQDF, VIDI, DNL, IFV, MOTI ",,,,,Northern Trust International Quality Dividend Defensive Net (TR),Multi-Factor,Proprietary,MSCI ACWI ex USA IMI Index -TR net,0.20%,$66.34B,16.91,1.66,3.35%,12/18/20,190,,,,,,,,,,,,,,,,,,,,,,,,,,,,,
IQDF,FlexShares International Quality Dividend Index Fund,Northern Trust,FlexShares,04/12/13,Open-Ended Fund,0.47%,$525.28M,$1.62M,,"VIDI, DNL, IFV, IQDE, MOTI ",,,,,Northern Trust International Quality Dividend Index,Multi-Factor,Proprietary,MSCI ACWI ex USA IMI Index -TR net,0.13%,$67.55B,14.98,1.72,3.51%,12/18/20,198,,,,,,,,,,,,,,,,,,,,,,,,,,,,,
IQDG,WisdomTree International Quality Dividend Growth Fund,WisdomTree,,04/07/16,Open-Ended Fund,0.42%,$151.00M,$1.94M,,"NUDM, RODM, GSIE, JPIN, INTF ",,,,,WisdomTree International Quality Dividend Growth Index,Dividends,Multi-Factor,MSCI World ex USA IMI,0.11%,$56.10B,24.50,3.75,1.60%,12/21/20,208,,,,,,,,,,,,,,,,,,,,,,,,,,,,,
IQDY,FlexShares International Quality Dividend Dynamic Index Fund,Northern Trust,FlexShares,04/12/13,Open-Ended Fund,0.47%,$30.13M,$193.93K,,"IQDF, VIDI, DNL, IFV, IQDE ",,,,,Northern Trust International Quality Dividend Dynamic Index,Multi-Factor,Proprietary,MSCI ACWI ex USA IMI Index -TR net,0.24%,$65.05B,17.45,1.64,2.97%,12/18/20,187,,,,,,,,,,,,,,,,,,,,,,,,,,,,,
IQIN,IQ 500 International ETF,New York Life,IndexIQ,12/13/18,Open-Ended Fund,0.25%,$258.62M,$145.01K,,"IQLT, PXF, TLTD, IDHQ,  ICOW ",,,,,IQ 500 International Index,Fundamental,Fundamental,MSCI World ex USA IMI,0.24%,$41.81B,-66.08,1.05,1.68%,12/30/20,498,,,,,,,,,,,,,,,,,,,,,,,,,,,,,
IQLT,iShares MSCI Intl Quality Factor ETF,Blackrock,iShares,01/13/15,Open-Ended Fund,0.30%,$2.45B,$17.42M,,"PXF, TLTD, IQIN, IDHQ, ICOW ",,,,,MSCI World ex USA Sector Neutral Quality Index,Fundamental,Fundamental,MSCI World ex USA IMI,0.06%,$70.98B,26.33,2.62,1.75%,12/14/20,302,,,,,,,,,,,,,,,,,,,,,,,,,,,,,
IQM,Franklin Intelligent Machines ETF,Franklin Templeton,Franklin,02/25/20,Open-Ended Fund,0.50%,$4.05M,$119.91K,,"BTEK, ARKF, IXN, CIBR, CLOU ",,,,,No Underlying Index,Proprietary,Proprietary,Thomson Reuters Global Technology,0.23%,$172.70B,69.97,8.14,--,12/14/20,65,,,,,,,,,,,,,,,,,,,,,,,,,,,,,
IQSI,IQ Candriam ESG International Equity ETF,New York Life,IndexIQ,12/17/19,Open-Ended Fund,0.15%,$122.47M,$414.71K,,"ESGG, URTH, FDRR, KLDW, RFDI ",,,,,IQ Candriam ESG International Equity Index,Market Cap,Principles-based,MSCI World IMI,0.13%,$66.94B,28.81,1.59,--,12/30/20,565,,,,,,,,,,,,,,,,,,,,,,,,,,,,,
IQSU,IQ Candriam ESG U.S. Equity ETF,New York Life,IndexIQ,12/17/19,Open-Ended Fund,0.09%,$290.00M,$2.88M,,"ESGU, USSG, SUSL, DSI, ESGV ",,,,,IQ Candriam ESG US Equity Index,Market Cap,Principles-based,MSCI USA IMI,0.12%,$519.61B,31.74,4.96,--,12/30/20,302,,,,,,,,,,,,,,,,,,,,,,,,,,,,,
IRBO,iShares Robotics and Artificial Intelligence Multisector ETF,Blackrock,iShares,06/26/18,Open-Ended Fund,0.47%,$245.82M,$2.08M,,"ROBO, ROBT, BOTZ, AIQ, ARKQ ",,,,,NYSE FactSet Global Robotics and Artificial Intelligence Index,Equal,Market Cap,N/A,0.33%,$118.43B,72.99,3.19,0.28%,12/14/20,104,,,,,,,,,,,,,,,,,,,,,,,,,,,,,
ISCF,iShares MSCI Intl Small-Cap Multifactor ETF,Blackrock,iShares,04/28/15,Open-Ended Fund,0.40%,$152.42M,$394.92K,,"FDTS, SCZ, SCHC, GWX, FNDC ",,,,,MSCI World ex USA Small Cap Diversified Multiple-Factor Index,Multi-Factor,Multi-Factor,MSCI World ex USA Small Cap,0.31%,$1.94B,18.50,1.20,2.46%,12/14/20,732,,,,,,,,,,,,,,,,,,,,,,,,,,,,,
ISDX,Invesco RAFI Strategic Developed ex-US ETF,Invesco,,09/12/18,Open-Ended Fund,0.23%,$278.45M,$314.46K,,"FNDF, DOL, IDOG, DOO, BKIE ",,,,,Invesco Strategic Developed ex-U.S. Index,Fundamental,Fundamental,MSCI World ex USA Large Cap,0.21%,$48.84B,-32.51,1.10,1.68%,12/21/20,859,,,,,,,,,,,,,,,,,,,,,,,,,,,,,
ISEM,Invesco RAFI Strategic Emerging Markets ETF,Invesco,,09/12/18,Open-Ended Fund,0.35%,$22.26M,$36.43K,,"FNDE, EDOG, BKEM, ADRE, CEZ ",,,,,Invesco Strategic Emerging Markets Index,Fundamental,Fundamental,MSCI Emerging Markets Large Cap,0.24%,$129.10B,61.63,0.90,1.24%,12/21/20,400,,,,,,,,,,,,,,,,,,,,,,,,,,,,,
ISHG,iShares 1-3 Year International Treasury Bond ETF,Blackrock,iShares,01/21/09,Open-Ended Fund,0.35%,$58.82M,$281.65K,0.16%,N/A ,,,,,FTSE World Government Bond Index  Developed Markets 1-3 Years Capped Select Index,Market Value,Market Value,Bloomberg Barclays 1-3 Year Global Treasury ex-U.S. Capped Index,,,,,,12/01/20,113,--,--,--,,,,,,,,,,,,,,,,,,,,,,,,,,
ISMD,Inspire Small/Mid Cap Impact ETF,Inspire,,02/28/17,Open-Ended Fund,0.60%,$92.64M,$972.45K,,"VXF, SMMD, PRFZ, FSMD, HSMV ",,,,,Inspire Small/Mid Cap Impact Equal Weight Index,Equal,Principles-based,MSCI USA SMID Cap Index,0.38%,$1.92B,-14.64,1.48,1.04%,N/A,301,,,,,,,,,,,,,,,,,,,,,,,,,,,,,
ISRA,VanEck Vectors Israel ETF,VanEck,,06/25/13,Open-Ended Fund,0.62%,$69.95M,$154.94K,,EIS ,,,,,BlueStar Israel Global Index,Market Cap,Committee,MSCI Israel IMI,1.68%,$7.21B,44.58,1.89,1.15%,12/21/20,143,,,,,,,,,,,,,,,,,,,,,,,,,,,,,
ISTB,iShares Core 1-5 Year USD Bond ETF,Blackrock,iShares,10/18/12,Open-Ended Fund,0.06%,$4.74B,$26.96M,0.04%,"FTSM, USTB, LSST, LDSF ",,,,,Bloomberg Barclays US Universal 1-5 Year Index,Market Value,Market Value,Bloomberg Barclays US Universal 1-5 Year Index,,,,,,12/01/20,"4,696",--,--,--,,,,,,,,,,,,,,,,,,,,,,,,,,
ISZE,iShares MSCI Intl Size Factor ETF,Blackrock,iShares,06/16/15,Open-Ended Fund,0.30%,$29.24M,$17.39K,,"EFAV, IDLV, RNDM, VEA, IEFA ",,,,,MSCI World ex USA Low Size Index,Volatility,Market Cap,MSCI World ex USA IMI,0.50%,$18.93B,38.91,1.23,1.06%,12/14/20,950,,,,,,,,,,,,,,,,,,,,,,,,,,,,,
ITA,iShares U.S. Aerospace & Defense ETF,Blackrock,iShares,05/01/06,Open-Ended Fund,0.42%,$3.01B,$30.73M,,"PPA, XAR, FITE, ROKT ",,,,,DJ US Select / Aerospace & Defense,Market Cap,Market Cap,Thomson Reuters US Aerospace & Defense,0.05%,$48.26B,46.18,3.22,1.68%,12/14/20,37,,,,,,,,,,,,,,,,,,,,,,,,,,,,,
ITB,iShares U.S. Home Construction ETF,Blackrock,iShares,05/01/06,Open-Ended Fund,0.42%,$2.00B,$193.65M,,"XHB, HOMZ ",,,,,DJ US Select / Home Construction,Market Cap,Market Cap,Thomson Reuters US Homebuilding,0.02%,$32.43B,15.44,2.41,0.43%,12/14/20,48,,,,,,,,,,,,,,,,,,,,,,,,,,,,,
ITEQ,BlueStar Israel Technology ETF,ETFMG,BlueStar,11/02/15,Open-Ended Fund,0.75%,$150.72M,$1.05M,,IZRL ,,,,,TASE-BlueStar Israel Global Technology Index,Market Cap,Committee,MSCI Israel Information Technology Index,0.09%,$7.48B,190.83,4.70,0.02%,12/14/20,63,,,,,,,,,,,,,,,,,,,,,,,,,,,,,
ITM,VanEck Vectors AMT-Free Intermediate Municipal Index ETF,VanEck,,12/04/07,Open-Ended Fund,0.24%,$1.74B,$4.03M,0.11%,"IBMK, IBMJ, IBML, IBMM, IBMN ",,,,,Bloomberg Barclays AMT-Free Intermediate Continuous Municipal Index,Market Value,AMT-Free,N/A,,,,,,12/01/20,"2,488",6.17,--,2.25%,,,,,,,,,,,,,,,,,,,,,,,,,,
ITOT,iShares Core S&P Total U.S. Stock Market ETF,Blackrock,iShares,01/20/04,Open-Ended Fund,0.03%,$31.37B,$106.44M,,"VTI, SCHB, IWV, SPTM, IYY ",,,,,S&P Total Market Index,Market Cap,Committee,MSCI USA IMI,0.01%,$354.42B,45.05,3.45,1.57%,12/14/20,"3,551",,,,,,,,,,,,,,,,,,,,,,,,,,,,,
IUS,Invesco RAFI Strategic US ETF,Invesco,,09/12/18,Open-Ended Fund,0.19%,$154.59M,$449.77K,,"FTCS, FNDX, PRF, SPHQ, RDVY ",,,,,Invesco Strategic U.S. Index,Fundamental,Fundamental,MSCI USA Large Cap Index,0.11%,$273.46B,-80.39,2.46,1.28%,12/21/20,555,,,,,,,,,,,,,,,,,,,,,,,,,,,,,
IUSB,iShares Core Total USD Bond Market ETF,Blackrock,iShares,06/10/14,Open-Ended Fund,0.07%,$5.95B,$28.66M,0.03%,"FIBR, BYLD, AGGP, WBIN, TGIF ",,,,,Bloomberg Barclays U.S. Universal Index,Market Value,Market Value,Bloomberg Barclays U.S. Universal Index,,,,,,12/01/20,"10,783",5.83,--,1.60%,,,,,,,,,,,,,,,,,,,,,,,,,,
IUSG,iShares Core S&P U.S. Growth ETF,Blackrock,iShares,07/24/00,Open-Ended Fund,0.05%,$10.04B,$35.17M,,"FAD, BUL, FDG, TAAG, HIPR ",,,,,S&P 900 Growth Index,Market Cap,Multi-Factor,MSCI USA IMI Growth Index,0.03%,$582.86B,35.61,7.16,1.17%,12/14/20,530,,,,,,,,,,,,,,,,,,,,,,,,,,,,,
IUSS,Invesco RAFI Strategic US Small Company ETF,Invesco,,09/12/18,Open-Ended Fund,0.23%,$32.94M,$108.27K,,"FNDA, EES, RWJ, CALF, XSHQ ",,,,,Invesco Strategic U.S. Small Company Index,Fundamental,Fundamental,MSCI USA Small Cap Index,0.29%,$4.99B,-8.96,1.67,0.68%,12/21/20,"1,202",,,,,,,,,,,,,,,,,,,,,,,,,,,,,
IUSV,iShares Core S&P U.S. Value ETF,Blackrock,iShares,07/24/00,Open-Ended Fund,0.05%,$7.58B,$39.80M,,"FAB, FOVL, VLUE, QVAL, VLU ",,,,,S&P 900 Value Index,Multi-Factor,Multi-Factor,MSCI USA IMI Value Index,0.03%,$117.59B,32.89,1.98,2.36%,12/14/20,681,,,,,,,,,,,,,,,,,,,,,,,,,,,,,
IVAL,Alpha Architect International Quantitative Value ETF,EMPIRICAL FINANCE LLC,Alpha Architect,12/17/14,Open-Ended Fund,0.59%,$106.18M,$545.46K,,"EFV, IVLU, FIVA, DMDV ",,,,,Alpha Architect International Quantitative Value Index,Equal,Proprietary,MSCI World ex USA IMI Value,0.21%,$12.14B,13.33,0.99,2.23%,N/A,52,,,,,,,,,,,,,,,,,,,,,,,,,,,,,
IVE,iShares S&P 500 Value ETF,Blackrock,iShares,05/22/00,Open-Ended Fund,0.18%,$18.45B,$100.43M,,"SPYV, VOOV, RPV, FVAL, SPVU ",,,,,S&P 500 Value Index,Market Cap,Fundamental,MSCI USA Large Cap Value,0.02%,$125.43B,31.54,2.03,2.33%,12/14/20,388,,,,,,,,,,,,,,,,,,,,,,,,,,,,,
IVES,Wedbush ETFMG Global Cloud Technology ETF,ETFMG,ETF Managers Group,03/08/16,Open-Ended Fund,0.68%,$53.70M,$161.91K,,"TDIV, IXN, CIBR, CLOU, IPAY ",,,,,Dan Ives Global Cloud Technology Prime Index,Proprietary,Revenue,Thomson Reuters Global Technology,0.76%,$7.71B,-155.59,4.90,0.46%,12/14/20,66,,,,,,,,,,,,,,,,,,,,,,,,,,,,,
IVLU,iShares MSCI Intl Value Factor ETF,Blackrock,iShares,06/16/15,Open-Ended Fund,0.30%,$555.97M,$2.20M,,"IVAL, EFV, FIVA, DMDV ",,,,,MSCI World ex USA Enhanced Value Index,Fundamental,Fundamental,MSCI World ex USA IMI Value,0.26%,$42.61B,32.10,0.71,2.51%,12/14/20,354,,,,,,,,,,,,,,,,,,,,,,,,,,,,,
IVOG,Vanguard S&P Mid-Cap 400 Growth ETF,Vanguard,,09/09/10,Open-Ended Fund,0.15%,$793.12M,$2.55M,,"IJK, NUMG, IWP, VOT, MDYG ",,,,,S&P Mid Cap 400 Growth,Market Cap,Fundamental,MSCI USA Mid Cap Growth Index,0.12%,$7.11B,44.76,3.60,0.99%,N/A,246,,,,,,,,,,,,,,,,,,,,,,,,,,,,,
IVOL,Quadratic Interest Rate Volatility and Inflation Hedge ETF,CICC,Quadratic,05/13/19,Open-Ended Fund,0.99%,$851.67M,$13.29M,0.06%,"SPIP, TIP, SCHP, TIPZ, GTIP ",,,,,No Underlying Index,Proprietary,Proprietary,Bloomberg Barclays US Treasury Inflation Protected Notes (TIPS),,,,,,N/A,3,--,--,--,,,,,,,,,,,,,,,,,,,,,,,,,,
IVOO,Vanguard S&P Mid-Cap 400 ETF,Vanguard,,09/09/10,Open-Ended Fund,0.10%,$1.07B,$3.85M,,"IJH, MDY, VO, IWR, SCHM ",,,,,S&P Mid Cap 400,Market Cap,Committee,MSCI USA Mid Cap Index,0.08%,$6.10B,56.14,2.15,1.21%,N/A,402,,,,,,,,,,,,,,,,,,,,,,,,,,,,,
IVOV,Vanguard S&P Mid-Cap 400 Value ETF,Vanguard,,09/09/10,Open-Ended Fund,0.15%,$535.61M,$2.22M,,"IJJ, MDYV, RFV, NUMV, IWS ",,,,,S&P Mid Cap 400 Value,Market Cap,Fundamental,MSCI USA Mid Cap Value Index,0.08%,$4.82B,82.91,1.42,1.72%,N/A,295,,,,,,,,,,,,,,,,,,,,,,,,,,,,,
IVV,iShares Core S&P 500 ETF,Blackrock,iShares,05/15/00,Open-Ended Fund,0.03%,$238.54B,$1.24B,,"SPY, VOO, IWB, SCHX, VV ",,,,,S&P 500,Market Cap,Committee,MSCI USA Large Cap Index,0.01%,$422.48B,33.68,3.66,1.72%,12/14/20,507,,,,,,,,,,,,,,,,,,,,,,,,,,,,,
IVW,iShares S&P 500 Growth ETF,Blackrock,iShares,05/22/00,Open-Ended Fund,0.18%,$31.43B,$114.95M,,"VOOG, SPYG, RPG, NULG, VUG ",,,,,S&P 500 Growth,Market Cap,Fundamental,MSCI USA Large Cap Growth Index,0.03%,$615.89B,35.20,7.59,1.09%,12/14/20,284,,,,,,,,,,,,,,,,,,,,,,,,,,,,,
IWB,iShares Russell 1000 ETF,Blackrock,iShares,05/15/00,Open-Ended Fund,0.15%,$25.34B,$111.77M,,"VONE, SPY, IVV, VOO, SCHX ",,,,,Russell 1000,Market Cap,Market Cap,MSCI USA Large Cap Index,0.03%,$379.43B,37.10,3.62,1.42%,12/14/20,"1,014",,,,,,,,,,,,,,,,,,,,,,,,,,,,,
IWC,iShares Micro-Cap ETF,Blackrock,iShares,08/12/05,Open-Ended Fund,0.60%,$954.76M,$4.14M,,"FDM, DWMC ",,,,,Russell Microcap,Market Cap,Market Cap,MSCI USA Micro Cap Index,0.24%,$609.43M,-10.62,1.60,1.00%,12/14/20,"1,257",,,,,,,,,,,,,,,,,,,,,,,,,,,,,
IWD,iShares Russell 1000 Value ETF,Blackrock,iShares,05/22/00,Open-Ended Fund,0.19%,$43.10B,$322.10M,,"VONV, VTV, SCHV, MGV, IWX ",,,,,Russell 1000 Value,Multi-Factor,Multi-Factor,MSCI USA Large Cap Value,0.02%,$119.29B,34.62,2.11,2.48%,12/14/20,851,,,,,,,,,,,,,,,,,,,,,,,,,,,,,
IWF,iShares Russell 1000 Growth ETF,Blackrock,iShares,05/22/00,Open-Ended Fund,0.19%,$62.13B,$320.66M,,"VONG, VUG, SCHG, MGK, IWY ",,,,,Russell 1000 Growth,Multi-Factor,Multi-Factor,MSCI USA Large Cap Growth Index,0.02%,$621.47B,39.84,10.96,0.72%,12/14/20,447,,,,,,,,,,,,,,,,,,,,,,,,,,,,,
IWL,iShares Russell Top 200 ETF,Blackrock,iShares,09/22/09,Open-Ended Fund,0.15%,$900.97M,$6.22M,,"SPY, IVV, VOO, IWB, SCHX ",,,,,Russell Top 200,Market Cap,Market Cap,MSCI USA Large Cap Index,0.04%,$504.45B,30.54,4.05,1.48%,12/14/20,196,,,,,,,,,,,,,,,,,,,,,,,,,,,,,
IWM,iShares Russell 2000 ETF,Blackrock,iShares,05/22/00,Open-Ended Fund,0.20%,$54.85B,$3.90B,,"VTWO, IJR, VB, SCHA, SPSM ",,,,,Russell 2000 Index,Market Cap,Market Cap,MSCI USA Small Cap Index,0.01%,$2.57B,-27.46,1.98,1.08%,12/14/20,"2,009",,,,,,,,,,,,,,,,,,,,,,,,,,,,,
IWN,iShares Russell 2000 Value ETF,Blackrock,iShares,07/24/00,Open-Ended Fund,0.24%,$11.50B,$208.04M,,"VTWV, VBR, JKL, XSVM, FYT ",,,,,Russell 2000 Value Index,Multi-Factor,Multi-Factor,MSCI USA Small Cap Value Index,0.05%,$1.99B,-17.15,1.21,1.74%,12/14/20,"1,453",,,,,,,,,,,,,,,,,,,,,,,,,,,,,
IWO,iShares Russell 2000 Growth ETF,Blackrock,iShares,07/24/00,Open-Ended Fund,0.24%,$11.22B,$100.33M,,"VTWG, VBK, JKK, FYC, IJT ",,,,,Russell 2000 Growth Index,Multi-Factor,Multi-Factor,MSCI USA Small Cap Growth Index,0.09%,$3.11B,-63.70,4.81,0.54%,12/14/20,"1,092",,,,,,,,,,,,,,,,,,,,,,,,,,,,,
IWP,iShares Russell Mid-Cap Growth ETF,Blackrock,iShares,07/17/01,Open-Ended Fund,0.24%,$14.67B,$64.35M,,"NUMG, VOT, IJK, MDYG, JKH ",,,,,Russell Midcap Growth,Multi-Factor,Multi-Factor,MSCI USA Mid Cap Growth Index,0.05%,$20.22B,65.97,10.21,0.45%,12/14/20,342,,,,,,,,,,,,,,,,,,,,,,,,,,,,,
IWR,iShares Russell Mid-Cap ETF,Blackrock,iShares,07/17/01,Open-Ended Fund,0.19%,$24.26B,$72.78M,,"IJH, VO, MDY, SCHM, SPMD ",,,,,Russell Midcap,Market Cap,Market Cap,MSCI USA Mid Cap Index,0.02%,$17.38B,100.09,2.77,1.36%,12/14/20,820,,,,,,,,,,,,,,,,,,,,,,,,,,,,,
IWS,iShares Russell Mid-Cap Value ETF,Blackrock,iShares,07/17/01,Open-Ended Fund,0.24%,$11.65B,$44.81M,,"VOE, JKI, XMVM, FNK, NUMV ",,,,,Russell Midcap Value,Multi-Factor,Multi-Factor,MSCI USA Mid Cap Value Index,0.03%,$15.83B,140.16,1.98,2.01%,12/14/20,697,,,,,,,,,,,,,,,,,,,,,,,,,,,,,
IWV,iShares Russell 3000 ETF,Blackrock,iShares,05/22/00,Open-Ended Fund,0.20%,$10.49B,$34.92M,,"VTHR, VTI, ITOT, SCHB, SPTM ",,,,,Russell 3000,Market Cap,Market Cap,MSCI USA IMI,0.04%,$357.26B,42.96,3.45,1.36%,12/14/20,"2,843",,,,,,,,,,,,,,,,,,,,,,,,,,,,,
IWX,iShares Russell Top 200 Value ETF,Blackrock,iShares,09/22/09,Open-Ended Fund,0.20%,$909.73M,$4.80M,,"VTV, IWD, SCHV, MGV, VONV ",,,,,Russell Top 200 Value,Multi-Factor,Multi-Factor,MSCI USA Large Cap Value,0.04%,$173.37B,24.87,2.18,2.50%,12/14/20,155,,,,,,,,,,,,,,,,,,,,,,,,,,,,,
IWY,iShares Russell Top 200 Growth ETF,Blackrock,iShares,09/22/09,Open-Ended Fund,0.20%,$3.29B,$21.66M,,"VUG, IWF, SCHG, MGK, VONG ",,,,,Russell Top 200 Growth,Multi-Factor,Multi-Factor,MSCI USA Large Cap Growth Index,0.03%,$749.89B,36.76,11.14,0.74%,12/14/20,108,,,,,,,,,,,,,,,,,,,,,,,,,,,,,
IXC,iShares Global Energy ETF,Blackrock,iShares,11/12/01,Open-Ended Fund,0.46%,$962.59M,$18.55M,,ECLN ,,,,,S&P Global 1200 Energy Sector Index,Market Cap,Committee,Thomson Reuters Global Energy - Fossil Fuels,0.06%,$66.55B,-6.90,0.88,8.61%,12/14/20,61,,,,,,,,,,,,,,,,,,,,,,,,,,,,,
IXG,iShares Global Financials ETF,Blackrock,iShares,11/12/01,Open-Ended Fund,0.46%,$331.62M,$1.65M,,"DFNL, GFIN ",,,,,S&P Global 1200 Financials Sector Index,Market Cap,Committee,Thomson Reuters Global Financials,0.17%,$104.77B,13.81,0.91,2.49%,12/14/20,194,,,,,,,,,,,,,,,,,,,,,,,,,,,,,
IXJ,iShares Global Healthcare ETF,Blackrock,iShares,11/13/01,Open-Ended Fund,0.46%,$2.44B,$9.10M,,"GDNA, HTEC, EDOC, BMED ",,,,,S&P Global 1200 Healthcare Sector Index,Market Cap,Committee,Thomson Reuters Global Healthcare,0.10%,$133.48B,27.16,4.12,1.34%,12/14/20,115,,,,,,,,,,,,,,,,,,,,,,,,,,,,,
IXN,iShares Global Tech ETF,Blackrock,iShares,11/12/01,Open-Ended Fund,0.46%,$4.78B,$19.65M,,"CIBR, CLOU, IPAY, FINX, SNSR ",,,,,S&P Global 1200 Information Technology Sector Index,Market Cap,Committee,Thomson Reuters Global Technology,0.10%,$697.05B,32.06,6.24,0.74%,12/14/20,124,,,,,,,,,,,,,,,,,,,,,,,,,,,,,
IXP,iShares Global Comm Services ETF,Blackrock,iShares,11/12/01,Open-Ended Fund,0.46%,$326.74M,$1.24M,,"NXTG, FIVG, WUGI ",,,,,S&P Global 1200 Communication Services 4.5/22.5/45 Capped Index,Market Cap,Committee,Thomson Reuters Global Telecom,0.23%,$459.15B,31.04,2.94,1.00%,12/14/20,72,,,,,,,,,,,,,,,,,,,,,,,,,,,,,
IXSE,WisdomTree India ex-State-Owned Enterprises Fund,WisdomTree,,04/04/19,Open-Ended Fund,0.58%,$2.80M,$17.31K,,"EPI, INDA, FLIN ",,,,,WisdomTree India ex-State-Owned Enterprises Index,Market Cap,Principles-based,MSCI India IMI,0.16%,$44.83B,50.76,3.39,0.11%,12/21/20,116,,,,,,,,,,,,,,,,,,,,,,,,,,,,,
IXUS,iShares Core MSCI Total International Stock ETF,Blackrock,iShares,10/18/12,Open-Ended Fund,0.09%,$24.65B,$84.19M,,"VXUS, VEU, ACWX, CWI, DBAW ",,,,,MSCI ACWI ex USA IMI Index -TR net,Market Cap,Market Cap,MSCI ACWI ex USA IMI Index -TR net,0.02%,$89.81B,28.78,1.54,2.28%,12/14/20,"4,320",,,,,,,,,,,,,,,,,,,,,,,,,,,,,
IYC,iShares U.S. Consumer Services ETF,Blackrock,iShares,06/12/00,Open-Ended Fund,0.43%,$1.18B,$6.56M,,"XLY, VCR, FDIS, PSCD, FXD ",,,,,Dow Jones U.S. Consumer Services Capped Index,Market Cap,Market Cap,Thomson Reuters US Cyclicals,0.06%,$250.82B,117.38,6.58,0.69%,12/14/20,134,,,,,,,,,,,,,,,,,,,,,,,,,,,,,
IYE,iShares U.S. Energy ETF,Blackrock,iShares,06/12/00,Open-Ended Fund,0.42%,$529.34M,$41.75M,,"XLE, VDE, FENY, PSCE, FXN ",,,,,DJ Global United States (All) / Oil & Gas -IND,Market Cap,Market Cap,Thomson Reuters US Energy - Fossil Fuels,0.06%,$74.06B,-5.47,0.98,9.60%,12/14/20,38,,,,,,,,,,,,,,,,,,,,,,,,,,,,,
IYF,iShares U.S. Financials ETF,Blackrock,iShares,05/22/00,Open-Ended Fund,0.42%,$1.41B,$17.85M,,"XLF, VFH, FNCL, PSCF, LEND ",,,,,Dow Jones U.S. Financials Capped Index,Market Cap,Market Cap,Thomson Reuters US Financials,0.03%,$129.85B,19.94,1.50,1.78%,12/14/20,233,,,,,,,,,,,,,,,,,,,,,,,,,,,,,
IYG,iShares U.S. Financial Services ETF,Blackrock,iShares,06/12/00,Open-Ended Fund,0.42%,$1.15B,$28.43M,,N/A ,,,,,Dow Jones U.S. Financial Services Index,Market Cap,Market Cap,Thomson Reuters US Banking Services,0.04%,$143.28B,16.97,1.50,1.65%,12/14/20,104,,,,,,,,,,,,,,,,,,,,,,,,,,,,,
IYH,iShares U.S. Healthcare ETF,Blackrock,iShares,06/12/00,Open-Ended Fund,0.44%,$2.48B,$8.05M,,"XLV, VHT, FHLC, PSCH, FXH ",,,,,DJ Global United States (All) / Health Care -IND,Market Cap,Market Cap,Thomson Reuters US Healthcare,0.04%,$133.55B,27.71,4.45,1.13%,12/14/20,123,,,,,,,,,,,,,,,,,,,,,,,,,,,,,
IYJ,iShares U.S. Industrials ETF,Blackrock,iShares,06/12/00,Open-Ended Fund,0.42%,$1.24B,$10.50M,,"XLI, VIS, FIDU, PSCI, AMER ",,,,,DJ Global United States (All) / Industrials -IND,Market Cap,Market Cap,Thomson Reuters US Industrials,0.05%,$63.31B,34.11,4.48,1.04%,12/14/20,185,,,,,,,,,,,,,,,,,,,,,,,,,,,,,
IYK,iShares U.S. Consumer Goods ETF,Blackrock,iShares,06/12/00,Open-Ended Fund,0.43%,$718.38M,$4.04M,,"XLP, VDC, FSTA, PSCC, RHS ",,,,,DJ Global United States (All) / Consumer Goods -IND,Market Cap,Market Cap,Thomson Reuters US Non-Cyclicals,0.04%,$147.95B,32.04,5.27,1.59%,12/14/20,98,,,,,,,,,,,,,,,,,,,,,,,,,,,,,
IYLD,iShares Morningstar Multi-Asset Income ETF,Blackrock,iShares,04/05/12,Open-Ended Fund,0.60%,$269.82M,,0.17%,"PCEF, MDIV, YYY, YLD, CVY ",,,,,Morningstar Multi-Asset High Income Index,Fixed,Fixed,N/A,,,,,4.93%,,,,,,12/02/20,,,,,,,,,,,,,,,,,,,,,,,,,
IYM,iShares U.S. Basic Materials ETF,Blackrock,iShares,06/12/00,Open-Ended Fund,0.43%,$870.58M,$9.98M,,"XLB, VAW, FMAT, PSCM, RTM ",,,,,Dow Jones U.S. Basic Materials Index,Market Cap,Market Cap,Thomson Reuters US Basic Materials,0.06%,$48.74B,71.15,2.56,1.59%,12/14/20,37,,,,,,,,,,,,,,,,,,,,,,,,,,,,,
IYR,iShares U.S. Real Estate ETF,Blackrock,iShares,06/12/00,Open-Ended Fund,0.42%,$5.17B,$449.84M,,"NURE, VNQ, SCHH, XLRE, USRT ",,,,,DJ Global United States (All) / Real Estate -SS,Market Cap,Market Cap,Thomson Reuters US Residential & Commercial REITs,0.01%,$34.98B,44.96,2.56,2.96%,12/14/20,85,,,,,,,,,,,,,,,,,,,,,,,,,,,,,
IYT,iShares Transportation Average ETF,Blackrock,iShares,10/06/03,Open-Ended Fund,0.42%,$1.49B,$46.37M,,"XTN, FTXR ",,,,,Dow Jones Transportation Average Index,Price,Committee,Thomson Reuters United States Transportation,0.04%,$40.33B,-18.43,3.47,1.00%,12/14/20,22,,,,,,,,,,,,,,,,,,,,,,,,,,,,,
IYW,iShares U.S. Technology ETF,Blackrock,iShares,05/15/00,Open-Ended Fund,0.43%,$6.47B,$32.53M,,"VGT, XLK, SKYY, FTEC, IGM ",,,,,Dow Jones U.S. Technology Capped Index,Market Cap,Market Cap,Thomson Reuters US Technology,0.04%,$780.63B,35.28,8.65,0.60%,12/14/20,159,,,,,,,,,,,,,,,,,,,,,,,,,,,,,
IYY,iShares Dow Jones U.S. ETF,Blackrock,iShares,06/12/00,Open-Ended Fund,0.20%,$1.41B,$3.99M,,"VTI, ITOT, SCHB, IWV, SPTM ",,,,,Dow Jones U.S. Index,Market Cap,Market Cap,MSCI USA IMI,0.04%,$374.72B,37.54,3.62,1.48%,12/14/20,"1,044",,,,,,,,,,,,,,,,,,,,,,,,,,,,,
IYZ,iShares U.S. Telecommunications ETF,Blackrock,iShares,05/22/00,Open-Ended Fund,0.42%,$417.14M,$6.52M,,"XLC, VOX, FCOM, XTL, JHCS ",,,,,Dow Jones U.S. Select Telecommunications Index,Market Cap,Market Cap,Thomson Reuters US Telecom,0.04%,$114.39B,25.66,1.87,2.61%,12/14/20,47,,,,,,,,,,,,,,,,,,,,,,,,,,,,,
IZRL,ARK Israel Innovative Technology ETF,ARK,,12/05/17,Open-Ended Fund,0.49%,$53.84M,$937.54K,,ITEQ ,,,,,ARK Israeli Innovation Index,Equal,Market Cap,MSCI Israel Information Technology Index,0.89%,$2.37B,-37.43,2.43,1.66%,N/A,43,,,,,,,,,,,,,,,,,,,,,,,,,,,,,
JAGG,JPMorgan U.S. Aggregate Bond ETF,JPMorgan Chase,JPMorgan,12/12/18,Open-Ended Fund,0.07%,$795.65M,$8.40M,0.06%,"FLCB, OVB, BNDC, HTAB, AGG ",,,,,No Underlying Index,Proprietary,Proprietary,Bloomberg Barclays U.S. Aggregate Bond Index,,,,,,N/A,"1,973",--,--,--,,,,,,,,,,,,,,,,,,,,,,,,,,
JCPB,JPMorgan Core Plus Bond ETF,JPMorgan Chase,JPMorgan,01/28/19,Open-Ended Fund,0.40%,$128.52M,$2.60M,0.29%,"FIXD, BOND, TOTL, FBND, HTRB ",,,,,No Underlying Index,Proprietary,Proprietary,Bloomberg Barclays Multiverse,,,,,,N/A,808,--,--,--,,,,,,,,,,,,,,,,,,,,,,,,,,
JDIV,JPMorgan U.S. Dividend ETF,JPMorgan Chase,JPMorgan,11/08/17,Open-Ended Fund,0.12%,$15.25M,$688.70K,,"NOBL, DLN, SPYD, SDOG, DTN ",,,,,J.P. Morgan US Dividend Index,Tiered,Dividends,MSCI USA Large Cap Index,0.23%,$55.04B,-106.28,1.94,3.26%,12/22/20,218,,,,,,,,,,,,,,,,,,,,,,,,,,,,,
