DNL,WisdomTree Global ex-US Quality Dividend Growth Fund,WisdomTree,,06/16/06,Open-Ended Fund,0.58%,$269.33M,$1.39M,,"IQDF, VIDI, IFV, IQDE, MOTI ",,,,,WisdomTree Global ex-U.S. Quality Dividend Growth Index,Dividends,Multi-Factor,MSCI ACWI ex USA IMI Index -TR net,0.13%,$62.10B,18.31,3.46,1.95%,12/21/20,278,,,,,,,,,,,,,,,,,,,
DNOV,FT Cboe Vest U.S. Equity Deep Buffer ETF - November,First Trust,,11/15/19,Open-Ended Fund,0.85%,$108.23M,$1.18M,,"SPUC, SPYC, SPD, SECT, DFEB ",,,,,No Underlying Index,Fixed,Fixed,MSCI USA Large Cap Index,0.42%,--,--,--,--,11/23/20,3,,,,,,,,,,,,,,,,,,,
DOG,ProShares Short Dow30,ProShares,,06/19/06,Open-Ended Fund,0.95%,$350.69M,,0.02%,"SDOW, DXD, SH, SDS, SPXU ",,,,,DJ Industrial Average,Price,Committee,N/A,,,,,0.49%,,,,,,12/23/20,,,,,,,,,,,,,,,
DOL,WisdomTree International LargeCap Dividend Fund,WisdomTree,,06/16/06,Open-Ended Fund,0.48%,$341.36M,$1.20M,,"IDOG, DOO, FNDF, ISDX, BKIE ",,,,,WisdomTree International LargeCap Dividend Index,Dividends,Dividends,MSCI World ex USA Large Cap,0.16%,$82.56B,26.57,1.40,2.94%,12/21/20,273,,,,,,,,,,,,,,,,,,,
DON,WisdomTree U.S. MidCap Dividend Fund,WisdomTree,,06/16/06,Open-Ended Fund,0.38%,$2.58B,$10.82M,,"REGL, RNMC, EZM, RWK, IJH ",,,,,WisdomTree U.S. MidCap Dividend,Dividends,Dividends,MSCI USA Mid Cap Index,0.06%,$8.09B,77.77,1.67,2.80%,11/23/20,333,,,,,,,,,,,,,,,,,,,
DOO,WisdomTree International Dividend ex-Financials Fund,WisdomTree,,06/16/06,Open-Ended Fund,0.58%,$132.77M,$482.40K,,"DOL, IDOG, FNDF, ISDX, BKIE ",,,,,WisdomTree International Dividend ex-Financials Index,Dividends,Dividends,MSCI World ex USA Large Cap,0.17%,$46.57B,41.22,1.48,3.82%,12/21/20,94,,,,,,,,,,,,,,,,,,,
DPST,Direxion Daily Regional Banks Bull 3X Shares,Direxion,,08/19/15,Open-Ended Fund,0.99%,$123.50M,,0.18%,N/A ,,,,,S&P Regional Banks Select Industry,Equal,Committee,N/A,,,,,2.13%,,,,,,12/22/20,,,,,,,,,,,,,,,
DRIP,Direxion Daily S&P Oil & Gas Exp. & Prod. Bear 2X Shares,Direxion,,05/28/15,Open-Ended Fund,1.07%,$66.52M,,0.13%,N/A ,,,,,S&P Oil & Gas Exploration & Production Select Industry,Equal,Market Cap,N/A,,,,,0.07%,,,,,,12/22/20,,,,,,,,,,,,,,,
DRIV,Global X Autonomous & Electric Vehicles ETF,Mirae Asset,Global X,04/13/18,Open-Ended Fund,0.68%,$98.48M,$2.04M,,"HAIL, KARS, EKAR, IDRV, MOTO ",,,,,Solactive Autonomous & Electric Vehicles Index,Market Cap,Market Cap,N/A,0.27%,$213.18B,-47.68,1.83,0.58%,12/30/20,76,,,,,,,,,,,,,,,,,,,
DRN,Direxion Daily MSCI Real Estate Bull 3x Shares,Direxion,,07/16/09,Open-Ended Fund,0.99%,$60.58M,,0.12%,URE ,,,,,MSCI US IMI Real Estate 25/50 Index,Market Cap,Market Cap,N/A,,,,,1.42%,,,,,,12/22/20,,,,,,,,,,,,,,,
DRSK,Aptus Defined Risk ETF,Aptus Capital Advisors,Aptus,08/08/18,Open-Ended Fund,0.78%,$489.44M,,0.16%,"TDSC, TAIL, NTSX, TDSB, GAL ",,,,,No Underlying Index,Proprietary,Proprietary,N/A,,,,,2.60%,,,,,,N/A,,,,,,,,,,,,,,,
DRV,Direxion Daily MSCI Real Estate Bear 3x Shares,Direxion,,07/16/09,Open-Ended Fund,1.08%,$34.17M,,0.18%,"SRS, REK ",,,,,MSCI US IMI Real Estate 25/50 Index,Market Cap,Market Cap,N/A,,,,,0.85%,,,,,,12/22/20,,,,,,,,,,,,,,,
DRW,WisdomTree Global ex-U.S. Real Estate Fund,WisdomTree,,06/05/07,Open-Ended Fund,0.58%,$72.67M,$328.84K,,"RWX, VNQI, WPS, IFGL, HAUZ ",,,,,WisdomTree Global ex-US Real Estate Index,Dividends,Dividends,Thomson Reuters Global Ex-US Real Estate,0.19%,$11.71B,14.81,0.77,2.16%,12/21/20,181,,,,,,,,,,,,,,,,,,,
DSI,iShares MSCI KLD 400 Social ETF,Blackrock,iShares,11/14/06,Open-Ended Fund,0.25%,$2.44B,$8.87M,,"ESGU, USSG, SUSL, ESGV, SUSA ",,,,,MSCI KLD 400 Social Index,Market Cap,Principles-based,MSCI USA IMI,0.05%,$341.54B,36.60,4.80,1.30%,12/14/20,403,,,,,,,,,,,,,,,,,,,
DSTL,Distillate U.S. Fundamental Stability & Value ETF,Distillate Capital,Distillate,10/24/18,Open-Ended Fund,0.39%,$196.09M,$486.19K,,"FTCS, FNDX, PRF, SPHQ, RDVY ",,,,,Distillate U.S. Fundamental Stability & Value Index,Fundamental,Fundamental,MSCI USA Large Cap Index,0.22%,$252.16B,23.54,5.51,0.85%,N/A,103,,,,,,,,,,,,,,,,,,,
DTD,WisdomTree U.S. Total Dividend Fund,WisdomTree,,06/16/06,Open-Ended Fund,0.28%,$779.78M,$2.09M,,"VIG, PFM, DURA, TMDV, FEDX ",,,,,WisdomTree U.S. Dividend Index,Dividends,Dividends,MSCI USA IMI,0.04%,$278.55B,27.95,2.53,2.77%,11/23/20,684,,,,,,,,,,,,,,,,,,,
DTEC,ALPS Disruptive Technologies ETF,SS&C,ALPS,12/29/17,Open-Ended Fund,0.50%,$138.89M,$909.56K,,"XT, IXN, CIBR, CLOU, IPAY ",,,,,Indxx Disruptive Technologies Index,Equal,Proprietary,Thomson Reuters Global Technology,0.17%,$43.37B,63.85,5.33,0.33%,12/21/20,100,,,,,,,,,,,,,,,,,,,
DTH,WisdomTree International High Dividend Fund,WisdomTree,,06/16/06,Open-Ended Fund,0.58%,$165.92M,$1.34M,,"IDV, HDEF, EFAS, FIDI, IDY ",,,,,WisdomTree International High Dividend Index,Dividends,Dividends,MSCI World ex USA High Dividend Yield,0.14%,$46.86B,28.42,1.14,3.94%,12/21/20,353,,,,,,,,,,,,,,,,,,,
DTN,WisdomTree U.S. Dividend ex-Financials Fund,WisdomTree,,06/16/06,Open-Ended Fund,0.38%,$525.24M,$1.44M,,"NOBL, DLN, SPYD, SDOG, DJD ",,,,,WisdomTree U.S. Dividend ex-Financials Index,Dividends,Dividends,MSCI USA Large Cap Index,0.04%,$66.05B,88.10,2.17,3.76%,11/23/20,91,,,,,,,,,,,,,,,,,,,
DUAL,North Shore Dual Share Class ETF,Exchange Traded Concepts,North Shore,08/11/20,Open-Ended Fund,0.85%,$717.85K,$4.10K,,"FEDX, QUAL, DGRO, MOAT, KOMP ",,,,,North Shore Dual Share Class Index,Market Cap,Fundamental,MSCI USA IMI,0.25%,--,--,--,--,N/A,0,,,,,,,,,,,,,,,,,,,
DUG,ProShares UltraShort Oil & Gas,ProShares,,01/30/07,Open-Ended Fund,0.95%,$16.89M,,0.12%,"DDG, ERY ",,,,,DJ Global United States (All) / Oil & Gas -IND,Market Cap,Market Cap,S&P GSCI,,,,,0.23%,,,,,,12/23/20,,,,,,,,,,,,,,,
DURA,VanEck Vectors Morningstar Durable Dividend ETF,VanEck,,10/30/18,Open-Ended Fund,0.29%,$39.41M,$307.68K,,"VIG, DTD, PFM, TMDV, FEDX ",,,,,Morningstar U.S. Dividend Valuation Index,Dividends,Proprietary,MSCI USA IMI,0.06%,$137.76B,23.68,3.44,4.03%,12/29/20,55,,,,,,,,,,,,,,,,,,,
DUSA,Davis Select U.S. Equity ETF,Davis Advisers,Davis,01/11/17,Open-Ended Fund,0.63%,$297.68M,$325.18K,,"SPUC, SPYC, SPD, SECT, DFEB ",,,,,No Underlying Index,Proprietary,Proprietary,MSCI USA Large Cap Index,0.29%,$412.92B,26.09,1.74,1.03%,N/A,24,,,,,,,,,,,,,,,,,,,
DUSL,Direxion Daily Industrials Bull 3X Shares,Direxion,,05/03/17,Open-Ended Fund,1.01%,$34.59M,,0.33%,UXI ,,,,,S&P Industrial Select Sector Index,Market Cap,Committee,N/A,,,,,0.51%,,,,,,12/22/20,,,,,,,,,,,,,,,
DUST,Direxion Daily Gold Miners Index Bear 2x Shares,Direxion,,12/08/10,Open-Ended Fund,1.07%,$104.65M,,0.06%,JDST ,,,,,NYSE Arca Gold Miners,Market Cap,Market Cap,N/A,,,,,4.88%,,,,,,12/22/20,,,,,,,,,,,,,,,
DVLU,First Trust Dorsey Wright Momentum & Value ETF,First Trust,,09/05/18,Open-Ended Fund,0.60%,$15.45M,$132.17K,,"DGRW, QDF, TILT, LRGF, QUS ",,,,,Dorsey Wright Momentum Plus Value Index,Fundamental,Multi-Factor,MSCI USA IMI,0.18%,$27.51B,42.52,2.22,1.54%,12/24/20,51,,,,,,,,,,,,,,,,,,,
DVOL,First Trust Dorsey Wright Momentum & Low Volatility ETF,First Trust,,09/05/18,Open-Ended Fund,0.60%,$120.46M,$699.80K,,"MXDU, MTUM, PDP, MMTM, QMOM ",,,,,Dorsey Wright Momentum Plus Low Volatility Index,Volatility,Technical,MSCI USA IMI,0.15%,$159.18B,34.80,6.53,1.42%,12/24/20,51,,,,,,,,,,,,,,,,,,,
DVY,iShares Select Dividend ETF,Blackrock,iShares,11/03/03,Open-Ended Fund,0.39%,$13.91B,$66.89M,,"VYM, SDY, FVD, DHS, PEY ",,,,,Dow Jones US Select Dividend Index,Dividends,Dividends,MSCI USA IMI High Yield Dividend Index,0.02%,$47.58B,21.03,1.40,3.86%,12/14/20,103,,,,,,,,,,,,,,,,,,,
DVYA,iShares Asia/Pacific Dividend ETF,Blackrock,iShares,02/23/12,Open-Ended Fund,0.49%,$25.74M,$133.42K,,N/A ,,,,,Dow Jones Asia/Pacific Select Dividend 50 Index,Dividends,Dividends,MSCI AC Asia Pacific High Dividend Yield Index,0.31%,$15.23B,16.36,0.62,4.36%,12/14/20,46,,,,,,,,,,,,,,,,,,,
DVYE,iShares Emerging Markets Dividend ETF,Blackrock,iShares,02/23/12,Open-Ended Fund,0.49%,$609.19M,$7.07M,,"DEM, EDIV, SDEM ",,,,,Dow Jones Emerging Markets Select Dividend Index,Dividends,Fundamental,MSCI Emerging Markets High Dividend Yield Index,0.13%,$11.58B,7.59,0.88,5.92%,12/14/20,98,,,,,,,,,,,,,,,,,,,
DWAS,Invesco DWA SmallCap Momentum ETF,Invesco,,07/19/12,Open-Ended Fund,0.60%,$278.00M,$1.75M,,"XSMO, IJR, IWM, VB, SCHA ",,,,,Dorsey Wright SmallCap Technical Leaders Index,Tiered,Momentum,MSCI USA Small Cap Index,0.16%,$1.87B,-20.89,3.98,0.30%,12/21/20,202,,,,,,,,,,,,,,,,,,,
DWAT,Arrow DWA Tactical ETF,Arrow Funds,ArrowShares,10/01/14,Open-Ended Fund,1.69%,$3.50M,,1.02%,"TDSC, DRSK, TAIL, NTSX, TDSB ",,,,,No Underlying Index,Proprietary,Proprietary,N/A,,,,,2.83%,,,,,,12/24/20,,,,,,,,,,,,,,,
DWAW,AdvisorShares Dorsey Wright FSM All Cap World ETF,AdvisorShares,,12/26/19,Open-Ended Fund,1.24%,$112.15M,$407.16K,,"VNSE, ARKK, DWLD, GDVD, SQEW ",,,,,No Underlying Index,Proprietary,Proprietary,MSCI ACWI + Frontier Markets IMI Index,0.24%,$410.16B,59.04,8.94,--,12/24/20,3,,,,,,,,,,,,,,,,,,,
DWCR,Arrow DWA Country Rotation ETF,Arrow Funds,ArrowShares,12/29/17,Open-Ended Fund,0.95%,$11.89M,$3.32K,,"VXUS, VEU, IXUS, ACWX, CWI ",,,,,Dorsey Wright Country and Stock Momentum Index,Equal,Momentum,MSCI ACWI ex USA IMI Index -TR net,0.96%,$47.44B,24.58,2.75,1.42%,12/24/20,102,,,,,,,,,,,,,,,,,,,
DWEQ,AdvisorShares Dorsey Wright Alpha Equal Weight ETF,AdvisorShares,,12/26/19,Open-Ended Fund,1.03%,$62.25M,$209.67K,,"SPUC, SPYC, SPD, SECT, DFEB ",,,,,No Underlying Index,Proprietary,Proprietary,MSCI USA Large Cap Index,0.26%,$196.61B,66.06,10.27,--,12/24/20,41,,,,,,,,,,,,,,,,,,,
DWFI,SPDR Dorsey Wright Fixed Income Allocation ETF,State Street Global Advisors,SPDR,06/01/16,Open-Ended Fund,0.60%,$118.78M,$483.54K,0.11%,"FIXD, BOND, TOTL, FBND, HTRB ",,,,,Dorsey Wright Fixed Income Allocation Index,Tiered,Technical,Bloomberg Barclays Multiverse,,,,,,12/01/20,5,--,--,--,,,,,,,,,,,,,,,,
DWLD,Davis Select Worldwide ETF,Davis Advisers,Davis,01/11/17,Open-Ended Fund,0.63%,$313.87M,$528.15K,,"VNSE, ARKK, GDVD, DWAW, SQEW ",,,,,No Underlying Index,Proprietary,Proprietary,MSCI ACWI + Frontier Markets IMI Index,0.34%,$282.95B,29.47,1.73,1.95%,N/A,30,,,,,,,,,,,,,,,,,,,
DWM,WisdomTree International Equity Fund,WisdomTree,,06/16/06,Open-Ended Fund,0.48%,$586.59M,$2.41M,,"EFAD, IQLT, PXF, TLTD, IQIN ",,,,,WisdomTree International Equity Index,Dividends,Dividends,MSCI World ex USA IMI,0.18%,$59.37B,24.61,1.31,2.88%,12/21/20,721,,,,,,,,,,,,,,,,,,,
DWMC,AdvisorShares Dorsey Wright Micro-Cap ETF,AdvisorShares,,07/10/18,Open-Ended Fund,1.32%,$1.82M,$5.27K,,"FDM, IWC ",,,,,No Underlying Index,Proprietary,Proprietary,MSCI USA Micro Cap Index,0.81%,$1.14B,-64.69,3.76,0.07%,12/24/20,153,,,,,,,,,,,,,,,,,,,
DWMF,WisdomTree International Multifactor Fund,WisdomTree,,08/10/18,Open-Ended Fund,0.38%,$48.88M,$112.03K,,"AVDE, PQIN, MVIN, TTAI, AIIQ ",,,,,No Underlying Index,Proprietary,Proprietary,MSCI World ex USA IMI,0.15%,$30.26B,19.35,1.90,1.99%,12/21/20,200,,,,,,,,,,,,,,,,,,,
DWPP,First Trust Dorsey Wright People's Portfolio ETF,First Trust,,08/30/12,Open-Ended Fund,0.60%,$12.06M,$52.91K,,"PTLC, PTNQ, DYHG, SPLV, USMC ",,,,,NASDAQ Dorsey Wright People's Portfolio Index,Fixed,Momentum,MSCI USA Large Cap Index,0.50%,$466.60B,34.15,4.13,0.90%,12/24/20,500,,,,,,,,,,,,,,,,,,,
DWSH,AdvisorShares Dorsey Wright Short ETF,AdvisorShares,,07/10/18,Open-Ended Fund,3.67%,$55.07M,,0.36%,"SH, SDS, SPXU, SPXS, SPDN ",,,,,No Underlying Index,Proprietary,Proprietary,N/A,,,,,0.23%,,,,,,12/24/20,,,,,,,,,,,,,,,
DWUS,AdvisorShares Dorsey Wright FSM US Core ETF,AdvisorShares,,12/26/19,Open-Ended Fund,1.17%,$63.73M,$236.86K,,"SPUC, SPYC, SPD, SECT, DFEB ",,,,,No Underlying Index,Proprietary,Proprietary,MSCI USA Large Cap Index,0.26%,$621.10B,39.86,8.10,--,12/24/20,3,,,,,,,,,,,,,,,,,,,
DWX,SPDR S&P International Dividend ETF,State Street Global Advisors,SPDR,02/12/08,Open-Ended Fund,0.45%,$584.46M,$1.84M,,"FID, HDAW, VYMI ",,,,,S&P International Dividend Opportunities Index,Dividends,Dividends,MSCI ACWI Ex-USA High Dividend Yield,0.17%,$24.94B,15.33,1.29,4.74%,12/21/20,101,,,,,,,,,,,,,,,,,,,
DXD,ProShares UltraShort Dow30,ProShares,,07/11/06,Open-Ended Fund,0.95%,$138.76M,,0.06%,"SDOW, DOG, SH, SDS, SPXU ",,,,,DJ Industrial Average,Price,Committee,N/A,,,,,0.94%,,,,,,12/23/20,,,,,,,,,,,,,,,
DXGE,WisdomTree Germany Hedged Equity Fund,WisdomTree,,10/17/13,Open-Ended Fund,0.48%,$28.89M,$25.19K,,"HEWG, DBGR, EWG, ZDEU, FLGR ",,,,,WisdomTree Germany Hedged Equity Index,Dividends,Fundamental,MSCI Germany IMI,0.63%,$46.18B,27.30,1.40,2.53%,12/21/20,63,,,,,,,,,,,,,,,,,,,
DXJ,WisdomTree Japan Hedged Equity Fund,WisdomTree,,06/16/06,Open-Ended Fund,0.48%,$1.57B,$27.72M,,"HJPX, HEWJ, DBJP, FLJH, JPXN ",,,,,WisdomTree Japan Hedged Equity Index,Dividends,Fundamental,MSCI Japan IMI,0.02%,$38.64B,21.04,1.03,2.39%,12/21/20,401,,,,,,,,,,,,,,,,,,,
DXJS,WisdomTree Japan Hedged SmallCap Equity Fund,WisdomTree,,06/28/13,Open-Ended Fund,0.58%,$31.44M,$182.27K,,"SCJ,  DFJ ",,,,,WisdomTree Japan Hedged SmallCap Equity Index,Dividends,Dividends,MSCI Japan Small Cap Index,0.52%,$1.79B,18.48,0.86,2.92%,12/21/20,713,,,,,,,,,,,,,,,,,,,
DYHG,Direxion Dynamic Hedge ETF,Direxion,,06/11/20,Open-Ended Fund,0.57%,$6.34M,$38.81K,,"PTLC, PTNQ, DWPP, SPLV, USMC ",,,,,Salt truVol US Large Cap Dynamic Hedge Index,Volatility,Fixed,MSCI USA Large Cap Index,0.35%,$455.46B,33.85,3.78,--,N/A,3,,,,,,,,,,,,,,,,,,,
DYNF,BlackRock U.S. Equity Factor Rotation ETF,Blackrock,BlackRock,03/19/19,Open-Ended Fund,0.30%,$90.15M,$284.13K,,"EQOP, AVUS, TTAC, RFDA, FLLV ",,,,,NASDAQ 7 HANDL Index,Proprietary,Proprietary,MSCI USA IMI,0.10%,$220.46B,34.79,2.90,1.66%,12/14/20,617,,,,,,,,,,,,,,,,,,,
DZK,Direxion Daily MSCI Developed Markets Bull 3x Shares,,,,,,,,,,,,,,,,,,,,,,,,,,,,,,,,,,,,,,,,,,,
DZZ,DB Gold Double Short ETN,Deutsche Bank,Deutsche X-trackers,02/27/08,Exchange-Traded Note,0.75%,$7.01M,,1.46%,"GLL, DGZ ",,,,,Deutsche Bank Liquid Commodity Index - Optimum Yield Gold,Single Asset,Single Asset,N/A,,,,,0.00%,,,,,,N/A,,,,,,,,,,,,,,,
EAGG,iShares ESG Aware U.S. Aggregate Bond ETF,Blackrock,iShares,10/18/18,Open-Ended Fund,0.10%,$648.49M,$4.68M,0.07%,"NUBD, AGG, BND, SCHZ, SPAB ",,,,,Bloomberg Barclays MSCI U.S. Aggregate ESG Focus Index,Principles-based,Principles-based,Bloomberg Barclays U.S. Aggregate Bond Index,,,,,,12/01/20,"2,861",5.78,--,1.07%,,,,,,,,,,,,,,,,
EAOA,iShares ESG Aware Aggressive Allocation ETF,Blackrock,iShares,06/12/20,Open-Ended Fund,0.18%,$4.36M,,,"AOA, TAEQ, ARMR, AOR, AOM ",,,,,BlackRock ESG Aware Aggressive Allocation Index,Fixed,Principles-based,N/A,,,,,--,,,,,,,,12/14/20,,,,,,,,,,,,,
EAOK,iShares ESG Aware Conservative Allocation ETF,Blackrock,iShares,06/12/20,Open-Ended Fund,0.18%,$3.99M,,0.14%,"AOK, SNUG, PSMC, PSMM, AOR ",,,,,BlackRock ESG Aware Conservative Allocation Index,Fixed,Principles-based,N/A,,,,,--,,,,,,12/14/20,,,,,,,,,,,,,,,
EAOM,iShares ESG Aware Moderate Allocation ETF,Blackrock,iShares,06/12/20,Open-Ended Fund,0.18%,$4.06M,,,"AOR, AOM, AOA, AOK, OCIO ",,,,,BlackRock ESG Aware Moderate Allocation Index,Market Cap,Principles-based,N/A,,,,,--,,,,,,,,12/14/20,,,,,,,,,,,,,
EAOR,iShares ESG Aware Growth Allocation ETF,Blackrock,iShares,06/12/20,Open-Ended Fund,0.18%,$4.21M,,,"OCIO, PSMG, AOR, AOM, AOA ",,,,,BlackRock ESG Aware Growth Allocation Index,Market Cap,Principles-based,N/A,,,,,--,,,,,,,,12/14/20,,,,,,,,,,,,,
EASG,Xtrackers MSCI EAFE ESG Leaders Equity ETF,Deutsche Bank,Xtrackers,09/06/18,Open-Ended Fund,0.14%,$13.88M,$65.63K,,"ESGD, DMXF, VEA, IEFA, EFA ",,,,,MSCI EAFE ESG Leaders Index,Tiered,Principles-based,MSCI World ex USA IMI,0.19%,$56.17B,28.43,1.77,2.04%,N/A,431,,,,,,,,,,,,,,,,,,,
EBIZ,Global X E-commerce ETF,Mirae Asset,Global X,11/27/18,Open-Ended Fund,0.50%,$108.72M,$1.40M,,"RTH, IBUY, CLIX, ONLN ",,,,,Solactive E-commerce Index,Market Cap,Market Cap,Thomson Reuters Global Retailers Business,0.21%,$127.48B,-212.07,5.04,0.12%,12/30/20,41,,,,,,,,,,,,,,,,,,,
EBND,SPDR Bloomberg Barclays Emerging Markets Local Bond ETF,State Street Global Advisors,SPDR,02/23/11,Open-Ended Fund,0.30%,$923.70M,$4.67M,0.09%,"FEMB, EMLC, LEMB ",,,,,Bloomberg Barclays Emerging Market Local Currency Government Diversified,Market Value,Market Value,Bloomberg Barclays EM Local Currency Government Index,,,,,,12/01/20,370,--,--,--,,,,,,,,,,,,,,,,
ECH,iShares MSCI Chile ETF,Blackrock,iShares,11/12/07,Open-Ended Fund,0.59%,$485.03M,$10.99M,,N/A ,,,,,MSCI Chile IMI 25/50 Index,Market Cap,Market Cap,MSCI Chile IMI,0.19%,$5.41B,16.46,1.02,2.12%,12/14/20,32,,,,,,,,,,,,,,,,,,,
ECLN,First Trust EIP Carbon Impact ETF,First Trust,,08/19/19,Open-Ended Fund,0.96%,$2.21M,$25.67K,,IXC ,,,,,No Underlying Index,Proprietary,Proprietary,Thomson Reuters Global Energy - Fossil Fuels,0.14%,$30.84B,23.81,2.29,2.02%,12/24/20,39,,,,,,,,,,,,,,,,,,,
ECNS,iShares MSCI China Small-Cap ETF,Blackrock,iShares,09/28/10,Open-Ended Fund,0.59%,$48.84M,$333.44K,,ASHS ,,,,,MSCI China Small Cap Index,Market Cap,Market Cap,MSCI All China Small Cap Index,0.76%,$1.57B,15.27,1.02,2.55%,12/14/20,243,,,,,,,,,,,,,,,,,,,
ECON,Columbia Emerging Markets Consumer ETF,"Columbia Management Investment Advisers, LLC",Columbia,09/14/10,Open-Ended Fund,0.59%,$176.77M,$477.19K,,EMCG ,,,,,Dow Jones Emerging Markets Consumer Titans 30 Index,Market Cap,Fundamental,Thomson Reuters Global Emerging Markets Cyclicals,0.18%,$111.82B,26.59,3.39,1.45%,12/18/20,62,,,,,,,,,,,,,,,,,,,
ECOW,Pacer Emerging Markets Cash Cows 100 ETF,Pacer Advisors,Pacer,05/02/19,Open-Ended Fund,0.74%,$2.20M,$9.56K,,"PXH, TLTE, EMDV, TLEH, VWO ",,,,,Pacer Emerging Markets Cash Cows 100 Index,Fundamental,Fundamental,MSCI Emerging Markets Investable Market Index,0.19%,$20.67B,12.20,1.12,10.04%,12/21/20,98,,,,,,,,,,,,,,,,,,,
ECOZ,TrueShares ESG Active Opportunities ETF,TrueMark Investments,TrueMark,02/28/20,Open-Ended Fund,0.58%,$6.52M,$30.46K,,"SPUC, SPYC, SPD, SECT, DFEB ",,,,,No Underlying Index,Proprietary,Proprietary,MSCI USA Large Cap Index,0.10%,$303.40B,45.79,8.24,--,N/A,74,,,,,,,,,,,,,,,,,,,
EDC,Direxion Daily MSCI Emerging Markets Bull 3x Shares,Direxion,,12/17/08,Open-Ended Fund,1.33%,$175.19M,,0.07%,EET ,,,,,MSCI Emerging Markets Index,Market Cap,Market Cap,N/A,,,,,0.55%,,,,,,12/22/20,,,,,,,,,,,,,,,
EDEN,iShares MSCI Denmark ETF,Blackrock,iShares,01/25/12,Open-Ended Fund,0.53%,$138.35M,$2.47M,,N/A ,,,,,MSCI Denmark IMI 25/50 Index,Market Cap,Market Cap,MSCI Denmark IMI,0.30%,$46.29B,42.76,3.45,0.52%,12/14/20,47,,,,,,,,,,,,,,,,,,,
EDIV,SPDR S&P Emerging Markets Dividend ETF,State Street Global Advisors,SPDR,02/23/11,Open-Ended Fund,0.49%,$274.50M,$1.26M,,"DVYE, DEM, SDEM ",,,,,S&P Emerging Market Dividend Opportunities (NTR),Dividends,Fundamental,MSCI Emerging Markets High Dividend Yield Index,0.30%,$17.88B,10.06,1.09,3.66%,12/21/20,104,,,,,,,,,,,,,,,,,,,
EDOC,Global X Telemedicine & Digital Health ETF,Mirae Asset,Global X,07/29/20,Open-Ended Fund,0.68%,$415.16M,$2.79M,,"IXJ, GDNA, HTEC, BMED ",,,,,Solactive Telemedicine & Digital Health Index,Market Cap,Proprietary,Thomson Reuters Global Healthcare,0.22%,$14.96B,-46.70,6.85,--,N/A,41,,,,,,,,,,,,,,,,,,,
EDOG,ALPS Emerging Sector Dividend Dogs ETF,SS&C,ALPS,03/28/14,Open-Ended Fund,0.60%,$20.94M,$62.04K,,"FNDE, ISEM, BKEM, ADRE, CEZ ",,,,,S-Network Emerging Sector Dividend Dogs Index,Equal,Dividends,MSCI Emerging Markets Large Cap,0.29%,$9.77B,12.81,1.39,3.29%,12/21/20,52,,,,,,,,,,,,,,,,,,,
EDOW,First Trust Dow 30 Equal Weight ETF,First Trust,,08/08/17,Open-Ended Fund,0.50%,$45.53M,$598.09K,,"RSP, EQAL, GSEW, EQL, EQWL ",,,,,Dow Jones Industrial Average Equal Weight Index,Equal,Committee,MSCI USA Large Cap Index,0.25%,$300.89B,27.39,3.69,2.15%,12/24/20,31,,,,,,,,,,,,,,,,,,,
EDUT,Global X Education ETF,Mirae Asset,Global X,07/10/20,Open-Ended Fund,0.50%,$6.53M,$127.65K,,"GBUY, BUYZ, CCON, IWFH ",,,,,Indxx Global Education Thematic Index,Market Cap,Market Cap,N/A,0.55%,--,--,--,--,12/30/20,39,,,,,,,,,,,,,,,,,,,
EDV,Vanguard Extended Duration Treasury ETF,Vanguard,,12/06/07,Open-Ended Fund,0.07%,$1.64B,$51.99M,0.09%,"TLT, SPTL, VGLT, TLH, ZROZ ",,,,,Bloomberg Barclays U.S. Treasury STRIPS 20-30 Year Equal Par Bond Index,Market Value,Market Value,Bloomberg Barclays Long U.S. Treasury Index,,,,,,N/A,75,24.28,--,1.46%,,,,,,,,,,,,,,,,
EDZ,Direxion Daily MSCI Emerging Markets Bear 3X Shares,Direxion,,12/17/08,Open-Ended Fund,1.08%,$29.53M,,0.06%,"EEV, EUM ",,,,,MSCI Emerging Markets Index,Market Cap,Market Cap,N/A,,,,,1.29%,,,,,,12/22/20,,,,,,,,,,,,,,,
EEH,Elements Spectrum Large Cap US Sector Momentum Index ETN,Swedish Export Credit,ELEMENTS,08/01/07,Exchange-Traded Note,0.75%,$1.19M,$541.99,,"JMOM, LGH, SPMO, ALTL, PALC ",,,,,SPECTRUM Large Cap U.S. Sector Momentum Index,Fixed,Market Cap,MSCI USA Large Cap Index,6.26%,--,--,--,0.00%,N/A,0,,,,,,,,,,,,,,,,,,,
EELV,Invesco S&P Emerging Markets Low Volatility ETF,Invesco,,01/13/12,Open-Ended Fund,0.29%,$289.33M,$649.17K,,"EEMV, RNEM, VWO, IEMG, EEM ",,,,,S&P BMI Emerging Markets Low Volatility Index,Volatility,Volatility,MSCI Emerging Markets Investable Market Index,0.50%,$21.74B,12.76,1.13,3.31%,12/21/20,202,,,,,,,,,,,,,,,,,,,
EEM,iShares MSCI Emerging Markets ETF,Blackrock,iShares,04/07/03,Open-Ended Fund,0.68%,$26.43B,$2.01B,,"VWO, IEMG, SCHE, SPEM, BKF ",,,,,MSCI Emerging Markets Index,Market Cap,Market Cap,MSCI Emerging Markets Investable Market Index,0.02%,$176.02B,19.76,1.76,2.38%,12/14/20,"1,205",,,,,,,,,,,,,,,,,,,
EEMA,iShares MSCI Emerging Markets Asia ETF,Blackrock,iShares,02/08/12,Open-Ended Fund,0.50%,$609.91M,$5.82M,,"FNI, GMF ",,,,,MSCI EM Asia Custom Capped Index,Market Cap,Market Cap,MSCI Emerging Markets Asia IMI,0.33%,$168.86B,18.78,1.67,1.52%,12/14/20,881,,,,,,,,,,,,,,,,,,,
EEMD,AAM S&P Emerging Markets High Dividend Value ETF,Advisors Asset Management,AAM,11/28/17,Open-Ended Fund,0.50%,$3.42M,$75.66K,,N/A ,,,,,S&P Emerging Markets Dividend and Free Cash Flow Yield Index,Equal,Fundamental,MSCI Emerging Markets Investable Market Index,0.38%,$7.20B,9.00,0.77,6.26%,N/A,56,,,,,,,,,,,,,,,,,,,
EEMO,Invesco S&P Emerging Markets Momentum ETF,Invesco,,02/24/12,Open-Ended Fund,0.29%,$5.28M,$211.12K,,"PIE, VWO, IEMG, EEM, SCHE ",,,,,S&P Momentum Emerging Plus LargeMidCap Index,Momentum,Momentum,MSCI Emerging Markets Investable Market Index,0.63%,$228.59B,38.42,4.58,1.91%,12/21/20,204,,,,,,,,,,,,,,,,,,,
EEMS,iShares MSCI Emerging Markets Small-Cap ETF,Blackrock,iShares,08/16/11,Open-Ended Fund,0.69%,$223.36M,$582.96K,,"DGS, FEMS, EWX ",,,,,MSCI Emerging Markets Small Cap Index,Market Cap,Market Cap,MSCI Emerging Markets Small Cap Index,0.61%,$1.39B,45.78,1.32,2.34%,12/14/20,"1,261",,,,,,,,,,,,,,,,,,,
EEMV,iShares MSCI Emerging Markets Min Vol Factor ETF,Blackrock,iShares,10/18/11,Open-Ended Fund,0.25%,$4.20B,$21.37M,,"EELV, RNEM, VWO, IEMG, EEM ",,,,,MSCI Emerging Markets Minimum Volatility Index,Multi-Factor,Multi-Factor,MSCI Emerging Markets Investable Market Index,0.04%,$56.64B,16.88,1.64,2.47%,12/14/20,321,,,,,,,,,,,,,,,,,,,
EEMX,SPDR MSCI Emerging Markets Fossil Fuel Reserves Free ETF,State Street Global Advisors,SPDR,10/24/16,Open-Ended Fund,0.30%,$117.16M,$297.26K,,"VWO, IEMG, EEM, SCHE, SPEM ",,,,,MSCI Emerging Markets ex Fossil Fuels Index,Market Cap,Market Cap,MSCI Emerging Markets Investable Market Index,0.27%,$180.01B,19.15,1.87,2.38%,12/18/20,533,,,,,,,,,,,,,,,,,,,
EES,WisdomTree U.S. SmallCap Fund,WisdomTree,,02/23/07,Open-Ended Fund,0.38%,$429.08M,$1.53M,,"FNDA, RWJ, CALF, IUSS, XSHQ ",,,,,WisdomTree U.S. Small Cap Index,Earnings,Earnings,MSCI USA Small Cap Index,0.16%,$1.37B,-9.40,1.31,1.32%,12/21/20,830,,,,,,,,,,,,,,,,,,,
EET,ProShares Ultra MSCI Emerging Markets,ProShares,,06/04/09,Open-Ended Fund,0.95%,$46.14M,,0.28%,EDC ,,,,,MSCI Emerging Markets Index,Market Cap,Market Cap,N/A,,,,,0.36%,,,,,,12/23/20,,,,,,,,,,,,,,,
EEV,ProShares UltraShort MSCI Emerging Markets,ProShares,,11/01/07,Open-Ended Fund,0.95%,$8.67M,,0.04%,"EUM, EDZ ",,,,,MSCI Emerging Markets Index,Market Cap,Market Cap,N/A,,,,,0.53%,,,,,,12/23/20,,,,,,,,,,,,,,,
EFA,iShares MSCI EAFE ETF,Blackrock,iShares,08/14/01,Open-Ended Fund,0.32%,$50.34B,$1.44B,,"VEA, IEFA, SCHF, SPDW, IDEV ",,,,,MSCI EAFE Index,Market Cap,Market Cap,MSCI World ex USA IMI,0.02%,$64.68B,33.09,1.55,2.34%,12/14/20,904,,,,,,,,,,,,,,,,,,,
EFAD,ProShares MSCI EAFE Dividend Growers ETF,ProShares,,08/19/14,Open-Ended Fund,0.51%,$128.08M,$432.86K,,"DWM, IQLT, PXF, TLTD, IQIN ",,,,,MSCI EAFE Dividend Masters Index,Equal,Dividends,MSCI World ex USA IMI,0.21%,$33.08B,23.93,2.09,1.53%,12/23/20,64,,,,,,,,,,,,,,,,,,,
EFAS,Global X MSCI SuperDividend EAFE ETF,Mirae Asset,Global X,11/14/16,Open-Ended Fund,0.56%,$9.08M,$30.49K,,"IDV, DTH, HDEF, FIDI, IDY ",,,,,MSCI EAFE Top 50 Dividend Index,Equal,Multi-Factor,MSCI World ex USA High Dividend Yield,0.47%,$23.43B,182.58,0.94,4.88%,12/03/20,51,,,,,,,,,,,,,,,,,,,
EFAV,iShares MSCI EAFE Min Vol Factor ETF,Blackrock,iShares,10/18/11,Open-Ended Fund,0.20%,$10.72B,$53.44M,,"IDLV, RNDM, ISZE, VEA, IEFA ",,,,,MSCI EAFE Minimum Volatility Index,Multi-Factor,Multi-Factor,MSCI World ex USA IMI,0.02%,$43.56B,25.72,1.88,3.78%,12/14/20,272,,,,,,,,,,,,,,,,,,,
EFAX,SPDR MSCI EAFE Fossil Fuel Reserves Free ETF,State Street Global Advisors,SPDR,10/24/16,Open-Ended Fund,0.20%,$141.59M,$375.69K,,"VEA, IEFA, EFA, SCHF, SPDW ",,,,,MSCI EAFE ex Fossil Fuels Index,Market Cap,Market Cap,MSCI World ex USA IMI,0.35%,$65.62B,29.13,1.63,1.84%,12/18/20,859,,,,,,,,,,,,,,,,,,,
EFG,iShares MSCI EAFE Growth ETF,Blackrock,iShares,08/01/05,Open-Ended Fund,0.40%,$9.30B,$45.48M,,N/A ,,,,,MSCI EAFE Growth Index,Market Cap,Multi-Factor,MSCI World ex USA IMI Growth,0.09%,$79.65B,38.97,3.74,1.05%,12/14/20,449,,,,,,,,,,,,,,,,,,,
EFIV,SPDR S&P 500 ESG ETF,State Street Global Advisors,SPDR,07/27/20,Open-Ended Fund,0.10%,$76.71M,$547.52K,,"SNPE, CATH, JUST, SHE, BIBL ",,,,,S&P 500 ESG Index,Market Cap,Principles-based,MSCI USA Large Cap Index,0.10%,$566.07B,31.89,3.94,--,12/18/20,299,,,,,,,,,,,,,,,,,,,
