LNGR,Global X Longevity Thematic ETF,Mirae Asset,Global X,05/09/16,Open-Ended Fund,0.50%,$42.18M,$95.96K,,"BFIT, HERD, URTH, FDRR, KLDW ",,,,,Indxx Global Longevity Thematic Index,Market Cap,Proprietary,MSCI World IMI,0.31%,$43.87B,60.32,3.90,0.71%,12/30/20,102,,,,,,,,,,,,,,,,,,,
LOUP,Innovator Loup Frontier Tech ETF,Innovator,,07/25/18,Open-Ended Fund,0.70%,$23.52M,$180.11K,,"TDIV, IXN, CIBR, IPAY, FINX ",,,,,Loup Frontier Tech Index,Tiered,Fundamental,Thomson Reuters Global Technology,0.27%,$16.03B,-82.82,2.88,--,N/A,31,,,,,,,,,,,,,,,,,,,
LOWC,SPDR MSCI ACWI Low Carbon Target ETF,State Street Global Advisors,SPDR,11/25/14,Open-Ended Fund,0.20%,$76.04M,$372.21K,,"CRBN, SDG, SDGA, VT, ACWI ",,,,,MSCI ACWI Low Carbon Target Index,Proprietary,Principles-based,MSCI ACWI + Frontier Markets IMI Index,0.11%,$295.61B,31.02,2.50,1.78%,12/18/20,"1,587",,,,,,,,,,,,,,,,,,,
LQD,iShares iBoxx USD Investment Grade Corporate Bond ETF,Blackrock,iShares,07/22/02,Open-Ended Fund,0.14%,$57.39B,$1.58B,0.01%,"USIG, QLTA, CORP, VTC, SPXB ",,,,,Markit iBoxx USD Liquid Investment Grade Index,Market Value,Market Value,Bloomberg Barclays US Aggregate Corporate Index,,,,,,12/01/20,"2,297",9.50,--,2.20%,,,,,,,,,,,,,,,,
LQDH,iShares Interest Rate Hedged Corporate Bond ETF,Blackrock,iShares,05/27/14,Open-Ended Fund,0.24%,$460.81M,$9.39M,0.21%,"FLCO, IG, JIGB, LQDI, LQD ",,,,,No Underlying Index,Fixed,Fixed,Bloomberg Barclays US Aggregate Corporate Index,,,,,,12/02/20,3,--,--,--,,,,,,,,,,,,,,,,
LQDI,iShares Inflation Hedged Corporate Bond ETF,Blackrock,iShares,05/08/18,Open-Ended Fund,0.19%,$18.38M,$70.85K,0.44%,"FLCO, IG, LQDH, JIGB, LQD ",,,,,No Underlying Index,Fixed,Fixed,Bloomberg Barclays US Aggregate Corporate Index,,,,,,12/01/20,3,--,--,--,,,,,,,,,,,,,,,,
LRGE,ClearBridge Large Cap Growth ESG ETF,Franklin Templeton,Legg Mason,05/22/17,Open-Ended Fund,0.59%,$122.62M,$419.62K,,"FBCG, TGRW ",,,,,No Underlying Index,Proprietary,Proprietary,MSCI ACWI Large Cap Growth Index,0.38%,$492.94B,48.57,6.56,0.29%,12/28/20,43,,,,,,,,,,,,,,,,,,,
LRGF,iShares MSCI USA Multifactor ETF,Blackrock,,04/30/15,Open-Ended Fund,0.20%,$837.75M,$3.30M,,"DGRW, QDF, TILT, QUS, LVHD ",,,,,MSCI USA Diversified Multiple-Factor Index,Multi-Factor,Multi-Factor,MSCI USA IMI,0.05%,$205.55B,20.50,2.93,1.63%,12/14/20,144,,,,,,,,,,,,iShares,,,,,,,
LRNZ,"TrueShares Technology, AI & Deep Learning ETF",TrueMark Investments,TrueMark,02/28/20,Open-Ended Fund,0.68%,$18.56M,$298.93K,,"ARKQ, BOTZ, AIQ, ROBO, IRBO ",,,,,No Underlying Index,Proprietary,Proprietary,N/A,0.32%,$196.23B,-482.16,21.33,--,N/A,23,,,,,,,,,,,,,,,,,,,
LSAF,LeaderShares AlphaFactor U.S. Core Equity ETF,Redwood Investment Management,LeaderShares,10/02/18,Open-Ended Fund,0.75%,$80.09M,$416.30K,,"FTCS, FNDX, PRF, SPHQ, RDVY ",,,,,AlphaFactor U.S. Core Equity Index,Equal,Fundamental,MSCI USA Large Cap Index,0.26%,$72.61B,21.86,3.92,0.66%,N/A,101,,,,,,,,,,,,,,,,,,,
LSLT,Pacer Salt Low truBeta US Market ETF,Pacer Advisors,Pacer,03/12/19,Open-Ended Fund,0.60%,$8.49M,$8.82K,,"SPLV, USMC, LGLV, FDLO, JMIN ",,,,,Salt Low truBeta US Market Index,Equal,Beta,MSCI USA Large Cap Index,0.08%,$69.33B,26.05,3.14,3.33%,12/21/20,102,,,,,,,,,,,,,,,,,,,
LSST,Natixis Loomis Sayles Short Duration Income ETF,Natixis,,12/27/17,Open-Ended Fund,0.38%,$33.80M,$49.63K,0.10%,"FTSM, ISTB, USTB, LDSF ",,,,,No Underlying Index,Proprietary,Proprietary,Bloomberg Barclays US Universal 1-5 Year Index,,,,,,N/A,353,--,--,--,,,,,,,,,,,,,,,,
LTL,ProShares Ultra Telecommunications,ProShares,,03/27/08,Open-Ended Fund,0.95%,$930.66K,,0.39%,N/A ,,,,,Dow Jones U.S. Select Telecommunications Index,Market Cap,Market Cap,Thomson Reuters Global Phones & Handheld Devices Total Return Index,,,,,1.37%,,,,,,12/23/20,,,,,,,,,,,,,,,
LTPZ,PIMCO 15+ Year US TIPS Index ETF,PIMCO,,09/03/09,Open-Ended Fund,0.20%,$601.30M,$6.14M,0.20%,N/A ,,,,,ICE BofAML 15+ Year US Inflation-Linked Treasury Index,Market Value,Market Value,N/A,,,,,,12/01/20,12,21.28,--,1.55%,,,,,,,,,,,,,,,,
LVHD,Legg Mason Low Volatility High Dividend ETF,Franklin Templeton,Legg Mason,12/29/15,Open-Ended Fund,0.27%,$696.43M,$2.61M,,"DGRW, QDF, TILT, LRGF, QUS ",,,,,QS Low Volatility High Dividend Index,Multi-Factor,Multi-Factor,MSCI USA IMI,0.11%,$65.52B,18.33,2.43,3.37%,N/A,80,,,,,,,,,,,,,,,,,,,
LVHI,Legg Mason International Low Volatility High Dividend ETF,Franklin Templeton,Legg Mason,07/27/16,Open-Ended Fund,0.40%,$56.38M,$176.77K,,"IHDG, FLQH, DBEF, HEFA, HFXI ",,,,,QS International Low Volatility High Dividend Hedged Index,Multi-Factor,Multi-Factor,MSCI World ex USA IMI,0.33%,$48.79B,12.89,1.35,6.09%,12/03/20,91,,,,,,,,,,,,,,,,,,,
MAAX,VanEck Vectors Municipal Allocation ETF,VanEck,,05/15/19,Open-Ended Fund,0.38%,$4.92M,$30.33K,0.55%,"FMB, FMHI, HMOP, TAXF, MCEF ",,,,,No Underlying Index,Proprietary,Proprietary,Barclays Municipal Bond,,,,,,12/01/20,5,--,--,--,,,,,,,,,,,,,,,,
MAGA,Point Bridge GOP Stock Tracker ETF,Point Bridge Capital,,09/06/17,Open-Ended Fund,0.72%,$9.37M,$95.90K,,"CATH, SNPE, JUST, SHE, BIBL ",,,,,Point Bridge GOP Stock Tracker Index,Equal,Principles-based,MSCI USA Large Cap Index,0.15%,$44.27B,-47.40,1.82,2.18%,N/A,152,,,,,,,,,,,,,,,,,,,
MARB,First Trust Merger Arbitrage ETF,First Trust,,02/04/20,Open-Ended Fund,1.94%,$12.71M,$25.03K,0.32%,"RPAR, FTLS, CCOR, WTMF, DALT ",,,,,No Underlying Index,Proprietary,Proprietary,N/A,,,,,--,N/A,14,,,,,Merger Arbitrage,,,,,,,,,,,,,,
MBB,iShares MBS ETF,Blackrock,iShares,03/13/07,Open-Ended Fund,0.06%,$25.24B,$180.54M,0.01%,"GNMA, SPMB, VMBS, MBSD, JMBS ",,,,,Bloomberg Barclays U.S. MBS Index,Market Value,Market Value,Bloomberg Barclays U.S. MBS Index,,,,,,12/01/20,"9,385",1.68,--,0.86%,,,,,,,,,,,,,,,,
MBSD,FlexShares Disciplined Duration MBS Index Fund,Northern Trust,FlexShares,09/04/14,Open-Ended Fund,0.20%,$102.34M,$337.74K,0.22%,"GNMA, MBB, SPMB, VMBS, JMBS ",,,,,BofA Merrill Lynch Constrained Duration US Mortgage Backed Securities,Proprietary,Market Value,Bloomberg Barclays U.S. MBS Index,,,,,,12/01/20,761,2.55,--,1.05%,,,,,,,,,,,,,,,,
MCEF,First Trust Municipal CEF Income Opportunity ETF,First Trust,,09/27/16,Open-Ended Fund,2.59%,$8.78M,$37.05K,0.55%,"FMB, FMHI, HMOP, TAXF, MAAX ",,,,,No Underlying Index,Proprietary,Proprietary,Barclays Municipal Bond,,,,,,12/11/20,41,--,--,--,,,,,,,,,,,,,,,,
MCHI,iShares MSCI China ETF,Blackrock,iShares,03/29/11,Open-Ended Fund,0.59%,$6.42B,$300.30M,,"ASHR, GXC, KBA, CNYA, FLCH ",,,,,MSCI China Index,Market Cap,Market Cap,MSCI All China IMI Index,0.01%,$287.77B,17.84,2.04,1.01%,12/14/20,607,,,,,,,,,,,,,,,,,,,
MCRO,IQ Hedge Macro Tracker ETF,New York Life,IndexIQ,06/09/09,Open-Ended Fund,0.67%,$4.22M,$11.47K,0.18%,"RPAR, QAI, DALT, GAA, TRTY ",,,,,IQ Hedge Macro Index,Multi-Factor,Multi-Factor,N/A,,,,,1.28%,12/30/20,45,,,,,Tactical Asset Allocation,,,,,,,,,,,,,,
MDIV,Multi-Asset Diversified Income Index Fund,First Trust,,08/14/12,Open-Ended Fund,0.73%,$465.86M,,0.43%,"PCEF, IYLD, YYY, YLD, CVY ",,,,,NASDAQ Multi-Asset Diversified Income Index,Fixed,Fixed,N/A,,,,,6.62%,,,,,,11/24/20,,,,,,,,,,,,,,,
MDY,SPDR S&P Midcap 400 ETF Trust,State Street Global Advisors,SPDR,05/04/95,Unit Investment Trust,0.23%,$16.29B,$320.84M,,"IJH, IVOO, VO, IWR, SCHM ",,,,,S&P Mid Cap 400,Market Cap,Committee,MSCI USA Mid Cap Index,0.02%,$5.99B,56.74,2.12,1.20%,12/18/20,401,,,,,,,,,,,,,,,,,,,
MDYG,SPDR S&P 400 Mid Cap Growth ETF,State Street Global Advisors,SPDR,11/08/05,Open-Ended Fund,0.15%,$1.89B,$17.31M,,"NUMG, IWP, VOT, IJK, JKH ",,,,,S&P Mid Cap 400 Growth,Market Cap,Fundamental,MSCI USA Mid Cap Growth Index,0.09%,$7.02B,44.88,3.63,0.79%,12/21/20,248,,,,,,,,,,,,,,,,,,,
MDYV,SPDR S&P 400 Mid Cap Value ETF,State Street Global Advisors,SPDR,11/08/05,Open-Ended Fund,0.15%,$1.23B,$10.44M,,"IJJ, IVOV, RFV, NUMV, IWS ",,,,,S&P Mid Cap 400 Value,Market Cap,Fundamental,MSCI USA Mid Cap Value Index,0.08%,$4.66B,87.73,1.38,1.97%,12/21/20,294,,,,,,,,,,,,,,,,,,,
MEAR,iShares Short Maturity Municipal Bond ETF,Blackrock,iShares,03/03/15,Open-Ended Fund,0.25%,$286.08M,$2.93M,0.07%,"JMST, SMMU, SHM, SUB, SMB ",,,,,No Underlying Index,Proprietary,Proprietary,N/A,,,,,,12/01/20,169,--,--,--,,,,,,,,,,,,,,,,
MEXX,Direxion Daily MSCI Mexico Bull 3X Shares,Direxion,,05/03/17,Open-Ended Fund,1.21%,$12.51M,,1.21%,N/A ,,,,,MSCI Mexico IMI 25/50 Index,Market Cap,Market Cap,N/A,,,,,0.95%,,,,,,12/22/20,,,,,,,,,,,,,,,
MFDX,PIMCO RAFI Dynamic Multi-Factor International Equity ETF,PIMCO,,08/31/17,Open-Ended Fund,0.39%,$68.76M,$325.66K,,"NUDM, RODM, GSIE, JPIN, INTF ",,,,,RAFI Dynamic Multi-Factor Developed Ex-U.S. Index,Tiered,Multi-Factor,MSCI World ex USA IMI,0.12%,$40.06B,37.51,1.57,2.12%,12/30/20,"1,255",,,,,,,,,,,,,,,,,,,
MFEM,PIMCO RAFI Dynamic Multi-Factor Emerging Markets Equity ETF,PIMCO,,08/31/17,Open-Ended Fund,0.49%,$714.61M,$300.83K,,"NUEM, GEM, JHEM, EMGF, FEM ",,,,,RAFI Dynamic Multi-Factor Emerging Market Index,Tiered,Multi-Factor,MSCI Emerging Markets Investable Market Index,0.16%,$84.07B,22.75,1.29,2.18%,12/30/20,575,,,,,,,,,,,,,,,,,,,
MFMS,MFAM Small-Cap Growth ETF,The Motley Fool,Motley Fool,10/23/18,Open-Ended Fund,0.85%,$129.70M,$663.88K,,"PQSG, VBK, IWO, IJT, SLYG ",,,,,No Underlying Index,Proprietary,Proprietary,MSCI USA Small Cap Growth Index,0.55%,$4.34B,-91.12,4.73,0.94%,N/A,31,,,,,,,,,,,,,,,,,,,
MFUS,PIMCO RAFI Dynamic Multi-Factor U.S. Equity ETF,PIMCO,,08/31/17,Open-Ended Fund,0.30%,$65.04M,$279.39K,,"DGRW, QDF, TILT, LRGF, QUS ",,,,,RAFI Dynamic Multi-Factor U.S. Index,Multi-Factor,Multi-Factor,MSCI USA IMI,0.31%,$198.60B,58.89,3.33,2.16%,12/30/20,785,,,,,,,,,,,,,,,,,,,
MGC,Vanguard Mega Cap ETF,Vanguard,,12/24/07,Open-Ended Fund,0.07%,$3.12B,$11.43M,,"SPY, IVV, VOO, IWB, SCHX ",,,,,CRSP US Mega Cap,Market Cap,Market Cap,MSCI USA Large Cap Index,0.03%,$520.50B,31.42,4.18,1.45%,N/A,234,,,,,,,,,,,,,,,,,,,
MGK,Vanguard Mega Cap Growth ETF,Vanguard,,12/17/07,Open-Ended Fund,0.07%,$9.67B,$76.53M,,"VUG, IWF, SCHG, VONG, IWY ",,,,,CRSP US Mega Cap Growth Index,Multi-Factor,Multi-Factor,MSCI USA Large Cap Growth Index,0.02%,$783.83B,45.43,10.64,0.64%,N/A,102,,,,,,,,,,,,,,,,,,,
MGV,Vanguard Mega Cap Value ETF,Vanguard,,12/17/07,Open-Ended Fund,0.07%,$3.29B,$13.18M,,"VTV, IWD, SCHV, VONV, IWX ",,,,,CRSP US Mega Cap Value Index,Multi-Factor,Multi-Factor,MSCI USA Large Cap Value,0.03%,$166.29B,22.20,2.30,2.51%,N/A,147,,,,,,,,,,,,,,,,,,,
MID,American Century Mid Cap Growth Impact ETF,American Century Investments,American Century,07/13/20,Open-Ended Fund,0.45%,--,$37.28K,,N/A ,,,,,No Underlying Index,Proprietary,Proprietary,MSCI USA Mid Cap Growth Index,0.14%,--,--,--,--,N/A,0,,,,,,,,,,,,,,,,,,,
MIDF,American Century Mid Cap Growth Impact ETF,American Century Investments,American Century,07/13/20,Open-Ended Fund,0.45%,--,$37.28K,,N/A ,,,,,No Underlying Index,Proprietary,Proprietary,MSCI USA Mid Cap Growth Index,0.14%,--,--,--,--,N/A,0,,,,,,,,,,,,,,,,,,,
MIDU,Direxion Daily Mid Cap Bull 3x Shares,Direxion,,01/08/09,Open-Ended Fund,1.03%,$55.95M,,0.18%,"MVV, UMDD ",,,,,S&P Mid Cap 400,Market Cap,Committee,N/A,,,,,0.55%,,,,,,12/22/20,,,,,,,,,,,,,,,
MILN,Global X Millennials Thematic ETF,Mirae Asset,Global X,05/04/16,Open-Ended Fund,0.50%,$108.09M,$669.03K,,"FEDX, QUAL, DGRO, MOAT, KOMP ",,,,,Indxx Millennials Thematic Index,Market Cap,Proprietary,MSCI USA IMI,0.40%,$231.10B,-106.11,6.67,0.33%,12/30/20,83,,,,,,,,,,,,,,,,,,,
MINC,AdvisorShares Newfleet Multi-Sector Income ETF,AdvisorShares,,03/19/13,Open-Ended Fund,0.76%,$56.22M,$120.75K,0.41%,"LDUR, STOT, VNLA, HSRT ",,,,,No Underlying Index,Proprietary,Proprietary,N/A,,,,,,11/24/20,323,--,--,--,,,,,,,,,,,,,,,,
MINT,PIMCO Enhanced Short Maturity Active ETF,PIMCO,,11/16/09,Open-Ended Fund,0.37%,$14.45B,$101.63M,0.01%,"PULS, EMNT, HOLD, ARCM, BSV ",,,,,No Underlying Index,Proprietary,Proprietary,Bloomberg Barclays US Universal 1-5 Year Index,,,,,,12/01/20,735,--,--,--,,,,,,,,,,,,,,,,
MJ,ETFMG Alternative Harvest ETF,ETFMG,ETF Managers Group,12/02/15,Open-Ended Fund,0.75%,$793.13M,$20.05M,,"MJJ, THCX, POTX, YOLO, TOKE ",,,,,Prime Alternative Harvest Index,Market Cap,Market Cap,N/A,0.14%,$12.21B,-2.17,1.42,6.62%,12/14/20,33,,,,,,,,,,,,,,,,,,,
MJJ,MicroSectors Cannabis Index ETN,BMO,REX Microsectors,12/13/19,Exchange-Traded Note,0.70%,$36.70M,$97.73K,,"MJ, THCX, POTX,  YOLO, TOKE ",,,,,Indxx MicroSectors North American Cannabis Index,Market Cap,Market Cap,N/A,0.82%,--,--,--,--,N/A,0,,,,,,,,,,,,,,,,,,,
MJO,MicroSectors Cannabis 2x Leveraged ETN,BMO,REX Microsectors,12/10/19,Exchange-Traded Note,0.95%,$12.91M,,1.32%,N/A ,,,,,Indxx MicroSectors North American Cannabis Index,Market Cap,Market Cap,N/A,,,,,--,,,,,,N/A,,,,,,,,,,,,,,,
MLN,VanEck Vectors AMT-Free Long Municipal Index ETF,VanEck,,01/02/08,Open-Ended Fund,0.24%,$225.02M,$1.02M,0.23%,"RVNU, FLMB, BSMS, BSMT, BSMU ",,,,,Bloomberg Barclays AMT-Free Long Continuous Municipal Index,Market Value,AMT-Free,N/A,,,,,,12/01/20,562,8.96,--,3.33%,,,,,,,,,,,,,,,,
MLPA,Global X MLP ETF,Mirae Asset,Global X,04/18/12,C-Corporation,0.46%,$671.60M,$7.95M,,"MLPX, TPYP, MLPO, USAI, IMLP ",,,,,Solactive MLP Infrastructure Index,Market Cap,Committee,N/A,0.11%,$8.93B,-16.63,1.02,14.56%,N/A,21,,,,,,,,,,,,,,,,,,,
MLPB,ETRACS Alerian MLP Infrastructure Index ETN Series B,UBS,ETRACS,10/08/15,Exchange-Traded Note,0.85%,$167.05M,$576.59K,,"AMLP, MLPI, AMJ, AMUB, AMNA ",,,,,Alerian MLP Infrastructure,Market Cap,,N/A,0.29%,--,--,--,12.04%,N/A,0,,,,,,,,,,,,,,,,,Distributions,,
MLPC,C-Tracks Miller/Howard MLP Fundamental ETN,,,,,,,,,,,,,,,,,,,,,,,,,,,,,,,,,,,,,,,,,,,
MLPE,C-Tracks ETNs on the Miller/Howard MLP Fundamental Index Series B,,,,,,,,,,,,,,,,,,,,,,,,,,,,,,,,,,,,,,,,,,,
MLPG,ETRACS Alerian Natural Gas MLP ETN,UBS,ETRACS,07/14/10,Exchange-Traded Note,0.85%,$2.55M,$8.81K,,"AMLP, AMJ, MLPB, AMUB, MLPI ",,,,,"Alerian MLP Natural Gas Index (USD, Total Return)",Equal,Distributions,N/A,0.70%,--,--,--,12.59%,N/A,0,,,,,,,,,,,,,,,,,,,
MLPI,ETRACS Alerian MLP Infrastructure Index ETN,UBS,ETRACS,03/31/10,Exchange-Traded Note,0.85%,$46.20M,$595.67K,,"AMLP, MLPB, AMJ,  AMUB, AMNA ",,,,,Alerian MLP Infrastructure,Market Cap,Distributions,N/A,0.33%,--,--,--,12.56%,N/A,0,,,,,,,,,,,,,,,,,,,
MLPO,Credit Suisse S&P MLP Index ETN,Credit Suisse Group AG,Credit Suisse,12/03/14,Exchange-Traded Note,0.95%,$17.04M,$5.11K,,"IMLP, MLPA, MLPX, TPYP, USAI ",,,,,S&P MLP,Market Cap,Market Cap,N/A,14.51%,--,--,--,11.63%,N/A,0,,,,,,,,,,,,,,,,,,,
MLPR,ETRACS Quarterly Pay 1.5X Leveraged Alerian MLP Index ETN,UBS,ETRACS,06/02/20,Exchange-Traded Note,0.95%,$21.02M,,0.18%,N/A ,,,,,Alerian MLP,Market Cap,Distributions,N/A,,,,,--,,,,,,N/A,,,,,,,,,,,,,,,
MLPX,Global X MLP & Energy Infrastructure ETF,Mirae Asset,Global X,08/07/13,Open-Ended Fund,0.45%,$509.48M,$2.99M,,"MLPA, TPYP, MLPO, USAI, IMLP ",,,,,Solactive MLP & Energy Infrastructure Index,Tiered,Committee,N/A,0.12%,$19.97B,-21.07,1.24,8.87%,12/30/20,27,,,,,,,,,,,,,,,,,,,
MLPY,Morgan Stanley Cushing MLP High Income Index ETN,Morgan Stanley,,03/17/11,Exchange-Traded Note,0.85%,$47.59M,$10.03K,,"ATMP, MLPC, EINC, MLPE, AMLP ",,,,,S&P Cushing MLP High Income,Equal,Fundamental,N/A,2.65%,--,--,--,12.67%,N/A,0,,,,,,,,,,,,,,,,,,,
MMIN,IQ MacKay Municipal Insured ETF ,New York Life,IndexIQ,10/18/17,Open-Ended Fund,0.31%,$206.31M,$2.23M,0.09%,"OVM, MUB, VTEB, TFI, PZA ",,,,,No Underlying Index,Proprietary,Proprietary,Barclays Municipal Bond,,,,,,12/01/20,358,6.74,--,2.16%,,,,,,,,,,,,,,,,
MMIT,IQ MacKay Municipal Intermediate ETF,New York Life,IndexIQ,10/18/17,Open-Ended Fund,0.30%,$68.89M,$775.04K,0.12%,"MUNI, JMUB, ITM, IBMK, IBMJ ",,,,,No Underlying Index,Proprietary,Proprietary,N/A,,,,,,12/01/20,163,5.97,--,2.34%,,,,,,,,,,,,,,,,
MMLG,First Trust Multi-Manager Large Growth ETF,First Trust,,07/21/20,Open-Ended Fund,0.85%,$2.23M,$3.18K,,"SYG, LCG, NULG, VUG, IWF ",,,,,No Underlying Index,Proprietary,Proprietary,MSCI USA Large Cap Growth Index,0.10%,$397.09B,65.67,9.57,--,12/24/20,93,,,,,,,,,,,,,,,,,,,
MMTM,SPDR S&P 1500 Momentum Tilt ETF,State Street Global Advisors,SPDR,10/24/12,Open-Ended Fund,0.12%,$80.78M,$354.99K,,"MTUM, PDP, QMOM, DVOL, MXDU ",,,,,S&P 1500 Positive Momentum Tilt Index,Momentum,Market Cap,MSCI USA IMI,0.12%,$635.71B,33.67,5.95,1.30%,12/21/20,"1,373",,,,,,,,,,,,,,,,,,,
MNA,IQ Merger Arbitrage ETF,New York Life,IndexIQ,11/17/09,Open-Ended Fund,0.77%,$737.78M,$3.85M,0.13%,"MARB, MRGR, ARB, FTLS, BTAL ",,,,,IQ Merger Arbitrage Index,Multi-Factor,Multi-Factor,N/A,,,,,0.20%,12/30/20,36,,,,,Merger Arbitrage,,,,,,,,,,,,,,
MOAT,VanEck Vectors Morningstar Wide Moat ETF,VanEck,,04/25/12,Open-Ended Fund,0.48%,$3.80B,$20.26M,,"FEDX, QUAL, DGRO, KOMP, PKW ",,,,,Morningstar Wide Moat Focus Index,Equal,Proprietary,MSCI USA IMI,0.02%,$127.68B,27.93,3.13,1.20%,12/21/20,48,,,,,,,,,,,,,,,,,,,
MOM,AGFiQ U.S. Market Neutral Momentum Fund,AGF,AGFiQ,09/07/11,Open-Ended Fund,2.62%,$5.23M,$373.76K,0.93%,"FTLS, BTAL, CCOR, MSVX, DBEH ",,,,,Dow Jones U.S. Thematic Market Neutral Momentum Total Return Index,Equal,Momentum,N/A,,,,,0.00%,N/A,202,,,,,Long/Short Equity,,,,,,,,,,,,,,
MOO,VanEck Vectors Agribusiness ETF,VanEck,,08/31/07,Open-Ended Fund,0.56%,$719.97M,$5.89M,,"VEGI, FTAG ",,,,,MVIS Global Agribusiness Index,Market Cap,Market Cap,Thomson Reuters/Jefferies CRB In-The-Ground Global Agriculture,0.10%,$26.99B,46.59,1.91,1.24%,12/21/20,53,,,,,,,,,,,,,,,,,,,
MORT,VanEck Vectors Mortgage REIT Income ETF,VanEck,,08/16/11,Open-Ended Fund,0.41%,$204.43M,$1.32M,,REM ,,,,,MVIS US Mortgage REITs Index,Market Cap,Market Cap,FTSE Nareit All Mortgage Capped,0.15%,$3.84B,-4.02,0.81,10.44%,12/29/20,26,,,,,,,,,,,,,,,,,,,
MOTI,VanEck Vectors Morningstar International Moat ETF,VanEck,,07/14/15,Open-Ended Fund,0.57%,$57.18M,$162.32K,,"IQDF, VIDI, DNL, IFV, IQDE ",,,,,Morningstar Global ex-US Moat Focus Index,Equal,Proprietary,MSCI ACWI ex USA IMI Index -TR net,0.33%,$38.64B,16.29,1.13,3.84%,12/21/20,69,,,,,,,,,,,,,,,,,,,
MOTO,SmartETFs Smart Transportation & Technology ETF,Guinness Atkinson Asset Management,SmartETFs,11/15/19,Open-Ended Fund,0.68%,$4.61M,$65.49K,,"HAIL, KARS, EKAR, DRIV, IDRV ",,,,,No Underlying Index,Proprietary,Proprietary,N/A,0.12%,$103.66B,40.47,2.60,--,N/A,36,,,,,,,,,,,,,,,,,,,
MRGR,ProShares Merger ETF,ProShares,,12/11/12,Open-Ended Fund,0.75%,$7.74M,$8.56K,0.21%,"MNA, MARB, ARB, FTLS, BTAL ",,,,,S&P Merger Arbitrage Index,Multi-Factor,Multi-Factor,N/A,,,,,0.56%,12/23/20,23,,,,,Merger Arbitrage,,,,,,,,,,,,,,
MRSK,Agility Shares Managed Risk ETF,Toews Corp.,Agility Shares,06/25/20,Open-Ended Fund,0.96%,$6.31M,,,"TDSC, DRSK, TAIL, NTSX, TDSB ",,,,,No Underlying Index,Proprietary,Proprietary,N/A,,,,,--,,,,,,,,N/A,,,,,,,,,,,,,
MSVX,LHA Market State Alpha Seeker ETF,Little Harbor Advisors,,05/13/20,Open-Ended Fund,1.16%,$23.59M,$146.38K,0.83%,"RPAR, FTLS, CCOR, WTMF, DALT ",,,,,No Underlying Index,Proprietary,Proprietary,N/A,,,,,--,N/A,8,,,,,Long/Short Equity,,,,,,,,,,,,,,
MTGP,WisdomTree Mortgage Plus Bond Fund,WisdomTree,,11/14/19,Open-Ended Fund,0.45%,$30.98M,$130.07K,0.23%,N/A ,,,,,No Underlying Index,Proprietary,Proprietary,N/A,,,,,,11/23/20,67,--,--,--,,,,,,,,,,,,,,,,
MTUM,iShares MSCI USA Momentum Factor ETF,Blackrock,iShares,04/16/13,Open-Ended Fund,0.15%,$12.04B,$145.57M,,"PDP, MMTM, QMOM, DVOL, MXDU ",,,,,MSCI USA Momentum Index,Momentum,Momentum,MSCI USA IMI,0.02%,$457.14B,40.18,8.02,1.01%,12/14/20,127,,,,,,,,,,,,,,,,,,,
MUB,iShares National Muni Bond ETF,Blackrock,iShares,09/07/07,Open-Ended Fund,0.07%,$19.17B,$143.56M,0.01%,"VTEB, TFI, PZA, BAB, MMIN ",,,,,S&P National AMT-Free Municipal Bond,Market Value,AMT-Free,Barclays Municipal Bond,,,,,,12/01/20,"4,466",5.01,--,2.30%,,,,,,,,,,,,,,,,
MUNI,PIMCO Intermediate Municipal Bond Active ETF,PIMCO,,11/30/09,Open-Ended Fund,0.35%,$555.51M,$2.08M,0.11%,"MMIT, JMUB, ITM, IBMK, IBMJ ",,,,,No Underlying Index,Proprietary,Proprietary,N/A,,,,,,12/01/20,231,4.16,--,1.24%,,,,,,,,,,,,,,,,
MUST,Columbia Multi-Sector Municipal Income ETF,"Columbia Management Investment Advisers, LLC",Columbia,10/10/18,Open-Ended Fund,0.23%,$59.51M,$307.80K,0.39%,"XMPT, FMB, FMHI, HMOP, TAXF ",,,,,Beta Advantage Multi-Sector Municipal Bond Index,Fixed,Fixed,Barclays Municipal Bond,,,,,,12/01/20,286,5.53,--,2.68%,,,,,,,,,,,,,,,,
MUTE,Direxion Daily Communication Services Index Bear 3X Shares,,,,,,,,,,,,,,,,,,,,,,,,,,,,,,,,,,,,,,,,,,,
MVIN,Natixis Seeyond International Minimum Volatility ETF,Natixis,,10/25/16,Open-Ended Fund,0.56%,$12.23M,$135.58K,,"AVDE, DWMF, PQIN, TTAI, AIIQ ",,,,,No Underlying Index,Proprietary,Proprietary,MSCI World ex USA IMI,0.14%,$45.15B,23.80,2.13,5.01%,N/A,115,,,,,,,,,,,,,,,,,,,
MVRL,ETRACS Monthly Pay 1.5X Leveraged Mortgage REIT ETN,UBS,ETRACS,06/02/20,Exchange-Traded Note,0.95%,$36.17M,,,REML ,,,,,MVIS US Mortgage REITs Index,Market Cap,Market Cap,N/A,0.13%,,,,--,N/A,,,,,,,,,,,,,,,,,,,,
MVV,ProShares Ultra MidCap400,ProShares,,06/19/06,Open-Ended Fund,0.95%,$137.62M,,0.11%,"UMDD, MIDU ",,,,,S&P Mid Cap 400,Market Cap,Committee,N/A,,,,,0.46%,,,,,,12/23/20,,,,,,,,,,,,,,,
MXDE,Nationwide Maximum Diversification Emerging Markets Core Equity ETF,,,,,,,,,,,,,,,,,,,,,,,,,,,,,,,,,,,,,,,,,,,
MXDU,Nationwide Maximum Diversification U.S. Core Equity ETF,Nationwide,,09/15/17,Open-Ended Fund,0.34%,$103.77M,$36.04K,,"DVOL, MTUM, PDP, MMTM, QMOM ",,,,,TOBAM Maximum Diversification USA Index,Technical,Principles-based,MSCI USA IMI,0.20%,$112.66B,136.09,4.06,1.49%,N/A,471,,,,,,,,,,,,,,,,,,,
MXI,iShares Global Materials ETF,Blackrock,iShares,09/12/06,Open-Ended Fund,0.45%,$522.16M,$3.51M,,N/A ,,,,,S&P Global 1200 Materials Sector Index,Market Cap,Committee,Thomson Reuters Global Basic Materials,0.16%,$41.00B,37.34,1.94,1.57%,12/14/20,106,,,,,,,,,,,,,,,,,,,
MYY,ProShares Short MidCap400,ProShares,,06/19/06,Open-Ended Fund,0.95%,$22.25M,,0.09%,"MZZ, SMDD ",,,,,S&P Mid Cap 400,Market Cap,Committee,N/A,,,,,0.32%,,,,,,12/23/20,,,,,,,,,,,,,,,
MZZ,ProShares UltraShort MidCap400,ProShares,,07/11/06,Open-Ended Fund,0.95%,$3.55M,,0.27%,"MYY,  SMDD ",,,,,S&P Mid Cap 400,Market Cap,Committee,N/A,,,,,0.59%,,,,,,12/23/20,,,,,,,,,,,,,,,
NACP,Impact Shares NAACP Minority Empowerment ETF,Impact Shares,,07/18/18,Open-Ended Fund,0.49%,$17.11M,$219.71K,,"ESGU, USSG, SUSL, DSI, ESGV ",,,,,Morningstar Minority Empowerment Index,Principles-based,Principles-based,MSCI USA IMI,0.43%,$492.32B,28.73,3.72,0.82%,N/A,175,,,,,,,,,,,,,,,,,,,
NAIL,Direxion Daily Homebuilders & Supplies Bull 3X Shares,Direxion,,08/19/15,Open-Ended Fund,0.99%,$429.56M,,0.17%,HOML ,,,,,DJ US Select / Home Construction,Market Cap,Market Cap,N/A,,,,,0.01%,,,,,,12/22/20,,,,,,,,,,,,,,,
NANR,SPDR S&P North American Natural Resources ETF,State Street Global Advisors,SPDR,12/15/15,Open-Ended Fund,0.35%,$435.66M,$870.03K,,"IGE, GUNR, GNR, HAP, GRES ",,,,,S&P BMI North American Natural Resources Index,Tiered,Market Cap,Thomson Reuters CRB Commodity Producers Index,0.23%,$45.86B,-18.41,1.19,2.35%,12/18/20,40,,,,,,,,,,,,,,,,,,,
NAPR,Innovator Nasdaq-100 Power Buffer ETF - April,Innovator,,04/01/20,Open-Ended Fund,0.79%,$15.92M,$73.68K,,N/A ,,,,,No Underlying Index,Fixed,Fixed,MSCI USA Large Cap Index,0.59%,--,--,--,--,N/A,2,,,,,,,,,,,,,,,,,,,
NEAR,iShares Short Maturity Bond ETF,Blackrock,iShares,09/25/13,Open-Ended Fund,0.25%,$4.32B,$42.46M,0.02%,"FLTB, RAVI, AVSF ",,,,,No Underlying Index,Proprietary,Proprietary,N/A,,,,,,12/01/20,275,--,--,--,,,,,,,,,,,,,,,,
NEED,Direxion Daily Consumer Staples Bull 3X Shares,,,,,,,,,,,,,,,,,,,,,,,,,,,,,,,,,,,,,,,,,,,
NERD,Roundhill BITKRAFT Esports & Digital Entertainment ETF,Roundhill Investments,Roundhill,06/04/19,Open-Ended Fund,0.25%,$48.43M,$911.68K,,"GAMR, ESPO, HERO ",,,,,ROUNDHILL BITKRAFT ESPORTS INDEX,Tiered,Market Cap,N/A,0.14%,$47.07B,76.19,3.86,0.18%,N/A,34,,,,,,,,,,,,,,,,,,,
NETL,NETLease Corporate Real Estate ETF,Exchange Traded Concepts,NETL,03/22/19,Open-Ended Fund,0.60%,$45.35M,$196.44K,,"NURE, VNQ, SCHH, IYR, XLRE ",,,,,Fundamental Income Net Lease Real Estate Index,Tiered,Market Cap,Thomson Reuters US Residential & Commercial REITs,0.28%,$6.38B,48.48,1.54,4.24%,N/A,26,,,,,,,,,,,,,,,,,,,
NFLT,Virtus Newfleet Multi-Sector Bond ETF,Virtus Investment Partners,Virtus,08/11/15,Open-Ended Fund,0.50%,$18.90M,$97.95K,0.28%,"FIXD, BOND, TOTL, FBND,  HTRB ",,,,,No Underlying Index,Proprietary,Proprietary,Bloomberg Barclays Multiverse,,,,,,N/A,360,--,--,--,,,,,,,,,,,,,,,,
NFRA,FlexShares STOXX Global Broad Infrastructure Index Fund,Northern Trust,FlexShares,10/08/13,Open-Ended Fund,0.47%,$2.09B,$4.65M,,"TOLZ, OBOR, IGF, GII, PAVE ",,,,,STOXX Global Broad Infrastructure Index,Market Cap,Market Cap,N/A,0.08%,$71.10B,27.57,2.08,2.22%,12/18/20,178,,,,,,,,,,,,,,,,,,,
NFTY,First Trust India NIFTY 50 Equal Weight ETF,First Trust,,02/14/12,Open-Ended Fund,0.80%,$3.49M,$12.89K,,"INDY, PIN ",,,,,NIFTY 50 Equal Weight Index,Equal,Market Cap,MSCI India Large Cap,1.37%,$25.30B,178.52,1.97,0.63%,12/24/20,52,,,,,,,,,,,,,,,,,,,
NGE,Global X MSCI Nigeria ETF,Mirae Asset,Global X,04/03/13,Open-Ended Fund,0.89%,$48.14M,$179.16K,,N/A ,,,,,MSCI All Nigeria Select 25/50 Index,Market Cap,Market Cap,MSCI Nigeria IMI,0.72%,$2.07B,5.27,0.68,0.51%,12/30/20,21,,,,,,,,,,,,,,,,,,,
NIB,iPath Bloomberg Cocoa Subindex Total Return ETN,Barclays Capital Inc.,iPath,06/24/08,Exchange-Traded Note,0.70%,$13.04M,$595.53K,0.74%,N/A ,Futures,Extended Term,Annually,0,Bloomberg Cocoa Subindex Total Return,Single Asset,Single Asset,S&P GSCI Cocoa Index,,,,,,,,,,,,,,,,,,,,,,,,,,
NIFE,Direxion Fallen Knives ETF,Direxion,,06/11/20,Open-Ended Fund,0.50%,$7.82M,$30.56K,,"DGRW, QDF, TILT, LRGF, QUS ",,,,,Indxx US Fallen Knives Index,Market Cap,Multi-Factor,MSCI USA IMI,0.22%,$6.60B,77.76,1.44,--,N/A,51,,,,,,,,,,,,,,,,,,,
NJAN,Innovator Nasdaq-100 Power Buffer ETF - January,Innovator,,01/02/20,Open-Ended Fund,0.79%,$38.87M,$217.04K,,"SECT, HUSV, POCT, DUSA, PJAN ",,,,,No Underlying Index,Fixed,Fixed,MSCI USA Large Cap Index,0.44%,--,--,--,--,N/A,2,,,,,,,,,,,,,,,,,,,
