REM,iShares Mortgage Real Estate ETF,Blackrock,iShares,05/01/07,Open-Ended Fund,0.48%,$1.32B,$16.96M,,MORT ,,,,,FTSE Nareit All Mortgage Capped,Market Cap,Market Cap,FTSE Nareit All Mortgage Capped,0.05%,$4.15B,-4.18,0.80,9.15%,12/14/20,36,,,,,,,,,,,,,,,,,,,,,,,,
REML,Credit Suisse X-Links Monthly Pay 2xLeveraged Mortgage REIT ETN,Credit Suisse Group AG,Credit Suisse,07/12/16,Exchange-Traded Note,1.30%,$148.95M,,0.43%,MVRL ,,,,,FTSE Nareit All Mortgage Capped,Market Cap,Market Cap,N/A,,,,,34.35%,,,,,,11/19/20,,,,,,,,,,,,,,,,,,,,
REMX,VanEck Vectors Rare Earth/Strategic Metals ETF,VanEck,,10/27/10,Open-Ended Fund,0.60%,$241.35M,$7.52M,,"COPX, LIT, PICK, BATT ",,,,,MVIS Global Rare Earth/Strategic Metals Index,Market Cap,Market Cap,Thomson Reuters Global Metal & Mining,0.26%,$3.13B,-16.53,2.03,1.18%,12/21/20,22,,,,,,,,,,,,,,,,,,,,,,,,
RESD,WisdomTree International ESG Fund,WisdomTree,,11/03/16,Open-Ended Fund,0.30%,$19.32M,$47.54K,,"AVDE, DWMF, PQIN, FYLD, MVIN ",,,,,No Underlying Index,Proprietary,Proprietary,MSCI World ex USA IMI,0.12%,$55.79B,19.85,1.74,2.54%,12/21/20,300,,,,,,,,,,,,,,,,,,,,,,,,
RESE,WisdomTree Emerging Markets ESG Fund,WisdomTree,,04/07/16,Open-Ended Fund,0.32%,$34.26M,$116.20K,,"AVEM, DGRE, RFEM, EYLD, EMMF ",,,,,No Underlying Index,Proprietary,Proprietary,MSCI Emerging Markets Investable Market Index,0.29%,$161.18B,19.01,2.01,2.13%,12/21/20,299,,,,,,,,,,,,,,,,,,,,,,,,
RESP,WisdomTree U.S. ESG Fund,WisdomTree,,02/23/07,Open-Ended Fund,0.28%,$82.87M,$109.01K,,"EQOP, AVUS, TTAC, RFDA, FLLV ",,,,,No Underlying Index,Proprietary,Proprietary,MSCI USA IMI,0.53%,$355.18B,31.64,3.84,1.87%,12/21/20,299,,,,,,,,,,,,,,,,,,,,,,,,
RETL,Direxion Daily Retail Bull 3x Shares,Direxion,,07/14/10,Open-Ended Fund,0.99%,$39.98M,,0.28%,N/A ,,,,,S&P Retail Select Industry,Equal,Committee,S&P GSCI,,,,,0.24%,,,,,,12/22/20,,,,,,,,,,,,,,,,,,,,
REVS,Columbia Research Enhanced Value ETF,"Columbia Management Investment Advisers, LLC",Columbia,09/25/19,Open-Ended Fund,0.19%,$531.76K,$95.15K,,"VTV, IWD, SCHV, MGV, VONV ",,,,,Beta Advantage Research Enhanced U.S. Value Index,Market Cap,Multi-Factor,MSCI USA Large Cap Value,0.30%,$137.81B,20.73,2.07,0.71%,12/21/20,288,,,,,,,,,,,,,,,,,,,,,,,,
REW,ProShares UltraShort Technology,ProShares,,01/30/07,Open-Ended Fund,0.95%,$5.94M,,0.47%,TECS ,,,,,DJ Global United States (All) / Technology -IND,Market Cap,Market Cap,N/A,,,,,0.94%,,,,,,12/23/20,,,,,,,,,,,,,,,,,,,,
REZ,iShares Residential and Multisector Real Estate ETF,Blackrock,iShares,05/01/07,Open-Ended Fund,0.48%,$396.20M,$2.52M,,"NURE, VNQ, SCHH, IYR, XLRE ",,,,,FTSE Nareit All Residential Capped Index,Market Cap,Market Cap,Thomson Reuters US Residential & Commercial REITs,0.08%,$15.82B,38.33,2.20,3.07%,12/14/20,45,,,,,,,,,,,,,,,,,,,,,,,,
RFAP,First Trust RiverFront Dynamic Asia Pacific,First Trust,,04/13/16,Open-Ended Fund,0.83%,$11.15M,$19.54K,,"IPAC, VPL ",,,,,No Underlying Index,Proprietary,Proprietary,MSCI Pacific IMI,0.45%,$42.94B,20.47,1.90,2.33%,12/24/20,100,,,,,,,,,,,,,,,,,,,,,,,,
RFCI,RiverFront Dynamic Core Income ETF,SS&C,RiverFront,06/14/16,Open-Ended Fund,0.52%,$112.49M,$143.45K,0.43%,"FIXD, BOND, TOTL, FBND, HTRB ",,,,,No Underlying Index,Proprietary,Proprietary,Bloomberg Barclays Multiverse,,,,,,12/16/20,282,--,--,--,,,,,,,,,,,,,,,,,,,,,
RFDA,RiverFront Dynamic US Dividend Advantage ETF,SS&C,RiverFront,06/07/16,Open-Ended Fund,0.52%,$133.99M,$190.98K,,"EQOP, AVUS, TTAC, FLLV, AIEQ ",,,,,No Underlying Index,Proprietary,Proprietary,MSCI USA IMI,0.24%,$402.61B,22.67,4.28,1.58%,12/16/20,85,,,,,,,,,,,,,,,,,,,,,,,,
RFDI,First Trust RiverFront Dynamic Developed International,First Trust,,04/13/16,Open-Ended Fund,0.83%,$136.00M,$616.04K,,"HDMV, KLDW, URTH, FDRR, ESGG ",,,,,No Underlying Index,Proprietary,Proprietary,MSCI World IMI,0.07%,$62.65B,18.18,2.27,1.83%,12/24/20,127,,,,,,,,,,,,,,,,,,,,,,,,
RFEM,First Trust RiverFront Dynamic Emerging Markets ETF,First Trust,,06/14/16,Open-Ended Fund,0.95%,$50.19M,$258.61K,,"AVEM, DGRE, EMMF, RESE, EYLD ",,,,,No Underlying Index,Proprietary,Proprietary,MSCI Emerging Markets Investable Market Index,0.07%,$183.29B,13.05,2.10,3.17%,12/24/20,105,,,,,,,,,,,,,,,,,,,,,,,,
RFEU,First Trust RiverFront Dynamic Europe ETF,First Trust,,04/14/16,Open-Ended Fund,0.83%,$18.71M,$38.87K,,"HEDJ, HEZU, DBEU, DBEZ, FLEH ",,,,,No Underlying Index,Proprietary,Proprietary,MSCI Europe IMI,0.35%,$77.59B,20.76,2.35,1.90%,12/24/20,106,,,,,,,,,,,,,,,,,,,,,,,,
RFFC,RiverFront Dynamic U.S. Flex-Cap ETF,SS&C,RiverFront,06/07/16,Open-Ended Fund,0.52%,$73.48M,$186.34K,,"EQOP, AVUS, TTAC, RFDA, FLLV ",,,,,No Underlying Index,Proprietary,Proprietary,MSCI USA IMI,0.13%,$349.89B,24.87,4.20,1.17%,12/16/20,114,,,,,,,,,,,,,,,,,,,,,,,,
RFG,Invesco S&P MidCap 400 Pure Growth ETF,Invesco,,03/01/06,Open-Ended Fund,0.35%,$356.05M,$697.94K,,"NUMG, IWP, VOT, IJK, MDYG ",,,,,S&P Mid Cap 400 Pure Growth,Fundamental,Fundamental,MSCI USA Mid Cap Growth Index,0.12%,$7.06B,54.51,4.35,0.29%,12/21/20,92,,,,,,,,,,,,,,,,,,,,,,,,
RFUN,RiverFront Dynamic Unconstrained Income ETF,SS&C,RiverFront,06/14/16,Open-Ended Fund,0.52%,$12.79M,$18.73K,0.37%,"FIXD, BOND, TOTL, FBND,  HTRB ",,,,,No Underlying Index,Proprietary,Proprietary,Bloomberg Barclays Multiverse,,,,,,12/16/20,133,--,--,--,,,,,,,,,,,,,,,,,,,,,
RFV,Invesco S&P MidCap 400 Pure Value ETF,Invesco,,03/01/06,Open-Ended Fund,0.35%,$64.51M,$303.93K,,"IJJ, MDYV, IVOV, NUMV, IWS ",,,,,S&P Mid Cap 400 Pure Value,Fundamental,Fundamental,MSCI USA Mid Cap Value Index,0.18%,$3.52B,-16.54,0.75,1.95%,12/21/20,81,,,,,,,,,,,,,,,,,,,,,,,,
RGI,Invesco S&P 500 Equal Weight Industrials ETF,Invesco,,11/01/06,Open-Ended Fund,0.40%,$381.31M,$3.68M,,"XLI, VIS, IYJ, FIDU, PSCI ",,,,,S&P 500 Equal Weighted / Industrials -SEC,Equal,Committee,Thomson Reuters US Industrials,0.07%,$33.33B,53.26,3.94,1.04%,12/21/20,74,,,,,,,,,,,,,,,,,,,,,,,,
RHS,Invesco S&P 500 Equal Weight Consumer Staples ETF,Invesco,,11/01/06,Open-Ended Fund,0.40%,$508.49M,$2.27M,,"XLP, VDC, FSTA, IYK, PSCC ",,,,,S&P 500 Equal Weighted / Consumer Staples -SEC,Equal,Committee,Thomson Reuters US Non-Cyclicals,0.04%,$71.90B,27.05,3.48,2.04%,12/21/20,33,,,,,,,,,,,,,,,,,,,,,,,,
RIGS,RiverFront Strategic Income Fund,SS&C,RiverFront,10/09/13,Open-Ended Fund,0.47%,$118.85M,$432.73K,0.51%,"FIXD, BOND, TOTL, FBND, HTRB ",,,,,No Underlying Index,Proprietary,Proprietary,Bloomberg Barclays Multiverse,,,,,,12/16/20,109,--,--,--,,,,,,,,,,,,,,,,,,,,,
RINF,ProShares Inflation Expectations ETF,ProShares,,01/10/12,Open-Ended Fund,0.30%,$8.45M,,0.56%,N/A ,,,,,FTSE 30-Year TIPS (Treasury Rate-Hedged) Index,Duration,Fixed,N/A,,,,,0.72%,,,,,,12/23/20,,,,,,,,,,,,,,,,,,,,
RING,iShares MSCI Global Gold Miners ETF,Blackrock,iShares,01/31/12,Open-Ended Fund,0.39%,$439.51M,$6.09M,,"GDX, GDXJ, GOEX, SGDM, GOAU ",,,,,MSCI ACWI Select Gold Miners IMI Index,Market Cap,Market Cap,MSCI ACWI Select Gold Miners IMI Index,0.33%,$25.19B,22.44,2.24,0.56%,12/14/20,38,,,,,,,,,,,,,,,,,,,,,,,,
RISE,Sit Rising Rate ETF,,,,,,,,,,,,,,,,,,,,,,,,,,,,,,,,,,,,,,,,,,,,,,,,
RISN,Inspire Tactical Balanced ESG ETF,Inspire,,07/15/20,Open-Ended Fund,0.84%,$71.89M,,,"TDSC, DRSK, TAIL, NTSX, TDSB ",,,,,No Underlying Index,Proprietary,Proprietary,N/A,,,,,--,,,,,,,,,N/A,,,,,,,,,,,,,,,,,
RJA,Elements Rogers International Commodity Index-Agriculture TR ETN,Swedish Export Credit,ELEMENTS,10/17/07,Exchange-Traded Note,0.75%,$95.27M,$363.24K,0.56%,"FUD, UAG, DBA, TAGS, JJA ",Futures,Front Month,Monthly,0,Rogers International Commodity Index - Agriculture Total Return,Proprietary,Committee,N/A,,,,,,,,,,,,,,,,,,,,,,,,,,,,,,,
RJI,Elements Rogers International Commodity Index-Total Return ETN,Swedish Export Credit,ELEMENTS,10/17/07,Exchange-Traded Note,0.75%,$106.03M,$260.91K,0.49%,"GSG, GSP, PDBC, DBC, DJP ",Futures,Front Month,Monthly,0,Rogers International Commodity Index - Total Return,Proprietary,Committee,S&P GSCI,,,,,,,,,,,,,,,,,,,,,,,,,,,,,,,
RJN,Elements Rogers International Commodity Index-Energy TR ETN,Swedish Export Credit,ELEMENTS,10/17/07,Exchange-Traded Note,0.75%,$2.32M,$3.37K,2.77%,"DBE, JJE ",Futures,Front Month,Monthly,0,Rogers International Commodity - Energy Total Return,Proprietary,Committee,N/A,,,,,,,,,,,,,,,,,,,,,,,,,,,,,,,
RJZ,Elements Rogers International Commodity Index-Metals Total Return ETN,Swedish Export Credit,ELEMENTS,10/17/07,Exchange-Traded Note,0.75%,$4.38M,$6.22K,1.07%,N/A ,Futures,Front Month,Monthly,0,Rogers International Commodity Index - Metals Total Return,Proprietary,Committee,S&P GSCI All Metals Index,,,,,,,,,,,,,,,,,,,,,,,,,,,,,,,
RLY,SPDR SSgA Multi-Asset Real Return ETF,State Street Global Advisors,SPDR,04/25/12,Open-Ended Fund,0.50%,$55.31M,$105.50K,0.28%,"RPAR, FTLS, CCOR, WTMF, DALT ",,,,,No Underlying Index,Proprietary,Proprietary,N/A,,,,,3.07%,12/29/20,12,,,,,Inflation,,,,,,,,,,,,,,,,,,,
RNDM,First Trust Developed International Equity Select ETF,First Trust,,06/20/17,Open-Ended Fund,0.65%,$22.88M,$103.01K,,"EFAV, IDLV, ISZE, VEA, IEFA ",,,,,Nasdaq Riskalyze Developed Markets Index,Tiered,Volatility,MSCI World ex USA IMI,0.28%,$40.01B,23.91,1.51,1.76%,12/24/20,431,,,,,,,,,,,,,,,,,,,,,,,,
RNDV,First Trust US Equity Dividend Select ETF,First Trust,,06/20/17,Open-Ended Fund,0.50%,$4.91M,$27.13K,,"NOBL, DLN, SPYD, SDOG, DTN ",,,,,Nasdaq Riskalyze US Large Cap Select Dividend Index,Dividends,Dividends,MSCI USA Large Cap Index,0.60%,$66.47B,68.06,2.25,2.91%,12/24/20,216,,,,,,,,,,,,,,,,,,,,,,,,
RNEM,First Trust Emerging Markets Equity Select ETF,First Trust,,06/20/17,Open-Ended Fund,0.75%,$6.84M,$30.31K,,"EEMV, EELV, VWO, IEMG, EEM ",,,,,Nasdaq Riskalyze Emerging Markets Index,Tiered,Volatility,MSCI Emerging Markets Investable Market Index,0.36%,$49.36B,11.41,1.17,2.59%,12/24/20,244,,,,,,,,,,,,,,,,,,,,,,,,
RNLC,First Trust Large Cap U.S. Equity Select ETF,First Trust,,06/20/17,Open-Ended Fund,0.60%,$21.50M,$76.31K,,"NOBL, DLN, SPYD, SDOG, DTN ",,,,,Nasdaq Riskalyze US Large Cap Index,Tiered,Dividends,MSCI USA Large Cap Index,0.43%,$90.35B,42.07,2.93,1.67%,12/24/20,362,,,,,,,,,,,,,,,,,,,,,,,,
RNMC,First Trust Mid Cap U.S. Equity Select ETF,First Trust,,06/20/17,Open-Ended Fund,0.60%,$15.51M,$66.14K,,"DON, REGL, EZM, RWK, IJH ",,,,,Nasdaq Riskalyze US Mid Cap Index,Tiered,Dividends,MSCI USA Mid Cap Index,0.54%,$5.12B,-105.94,1.89,1.37%,12/24/20,341,,,,,,,,,,,,,,,,,,,,,,,,
RNSC,First Trust Small Cap U.S. Equity Select ETF,First Trust,,06/20/17,Open-Ended Fund,0.60%,$9.33M,$43.04K,,"DES, SMDV, KSCD, FNDA, EES ",,,,,Nasdaq Riskalyze US Small Cap Index,Tiered,Dividends,MSCI USA Small Cap Index,0.44%,$1.51B,-20.40,1.60,1.33%,12/24/20,367,,,,,,,,,,,,,,,,,,,,,,,,
ROAM,Hartford Multifactor Emerging Markets ETF,The Hartford,Hartford,02/26/15,Open-Ended Fund,0.44%,$43.95M,$217.28K,,"NUEM, GEM, JHEM, MFEM, EMGF ",,,,,Hartford Multifactor Emerging Markets Equity Index,Multi-Factor,Multi-Factor,MSCI Emerging Markets Investable Market Index,0.39%,$39.11B,11.22,1.28,3.84%,N/A,333,,,,,,,,,,,,,,,,,,,,,,,,
ROBO,ROBO Global Robotics and Automation Index ETF,Exchange Traded Concepts,ROBO Global,10/22/13,Open-Ended Fund,0.95%,$1.49B,$7.21M,,"IRBO, ROBT, BOTZ, AIQ, ARKQ ",,,,,Robo Global Robotics and Automation Index,Tiered,Committee,N/A,0.15%,$23.89B,51.00,3.14,0.28%,N/A,87,,,,,,,,,,,,,,,,,,,,,,,,
ROBT,First Trust Nasdaq Artificial Intelligence and Robotics ETF,First Trust,,02/21/18,Open-Ended Fund,0.65%,$160.23M,$878.87K,,"ROBO, IRBO, BOTZ, AIQ, ARKQ ",,,,,Nasdaq CTA Artificial Intelligence & Robotics Index,Tiered,Committee,N/A,0.10%,$45.89B,154.71,3.36,0.10%,12/24/20,110,,,,,,,,,,,,,,,,,,,,,,,,
RODE,Hartford Multifactor Diversified International ETF,The Hartford,Hartford,05/10/17,Open-Ended Fund,0.29%,$5.15M,$1.21K,,"IQDF, VIDI, DNL, IFV, IQDE ",,,,,Hartford Multifactor Diversified International Index,Multi-Factor,Multi-Factor,MSCI ACWI ex USA IMI Index -TR net,0.40%,$30.59B,12.28,1.21,3.17%,N/A,319,,,,,,,,,,,,,,,,,,,,,,,,
RODI,Barclays Return on Disability ETN,Barclays Capital Inc.,Barclays,09/11/14,Exchange-Traded Note,0.45%,$2.09M,$2.16K,,"ESGU, USSG, SUSL, DSI, ESGV ",,,,,Return on Disability US LargeCap ETN Total Return USD Index,Equal,Principles-based,MSCI USA IMI,0.04%,--,--,--,0.00%,N/A,0,,,,,,,,,,,,,,,,,,,,,,,,
RODM,Hartford Multifactor Developed Markets (ex-US) ETF,The Hartford,Hartford,02/25/15,Open-Ended Fund,0.29%,$2.06B,$14.75M,,"NUDM, GSIE,  JPIN, INTF, JHMD ",,,,,Hartfod Risk-Optimized Developed Markets (Ex US) Index,Multi-Factor,Multi-Factor,MSCI World ex USA IMI,0.05%,$25.06B,17.10,1.38,2.71%,N/A,493,,,,,,,,,,,,,,,,,,,,,,,,
ROKT,SPDR S&P Kensho Final Frontiers ETF,State Street Global Advisors,SPDR,10/22/18,Open-Ended Fund,0.45%,$10.90M,$88.73K,,"ITA, PPA, XAR, FITE ",,,,,S&P Kensho Final Frontiers Index,Tiered,Market Cap,Thomson Reuters US Aerospace & Defense,0.19%,$29.42B,-44.60,2.88,0.45%,12/21/20,30,,,,,,,,,,,,,,,,,,,,,,,,
ROM,ProShares Ultra Technology,ProShares,,01/30/07,Open-Ended Fund,0.95%,$685.34M,,0.07%,TECL ,,,,,DJ Global United States (All) / Technology -IND,Market Cap,Market Cap,N/A,,,,,0.10%,,,,,,12/23/20,,,,,,,,,,,,,,,,,,,,
ROMO,Strategy Shares Newfound/ReSolve Robust Momentum ETF,Strategy Shares,,11/01/19,Open-Ended Fund,0.85%,$38.98M,,0.19%,"SWAN,  TDSC, TAIL, DMRL, NTSX ",,,,,Newfound/ReSolve Robust Equity Momentum Index,Momentum,Momentum,N/A,,,,,0.62%,,,,,,N/A,,,,,,,,,,,,,,,,,,,,
ROOF,IQ U.S. Real Estate Small Cap ETF,New York Life,IndexIQ,06/14/11,Open-Ended Fund,0.70%,$44.76M,$194.21K,,"NURE, VNQ, SCHH, IYR, XLRE ",,,,,IQ US Real Estate Small Cap Index,Market Cap,Market Cap,Thomson Reuters US Residential & Commercial REITs,0.28%,$1.93B,-13.72,1.08,4.84%,12/30/20,85,,,,,,,,,,,,,,,,,,,,,,,,
ROSC,Hartford Multifactor Small Cap ETF,The Hartford,Hartford,03/24/15,Open-Ended Fund,0.34%,$7.63M,$27.09K,,"NUSC, PSC, SMLF, JHSC, FYX ",,,,,Hartford Multifactor Small Cap Index,Multi-Factor,Multi-Factor,MSCI USA Small Cap Index,0.43%,$1.41B,17.20,1.41,2.91%,N/A,349,,,,,,,,,,,,,,,,,,,,,,,,
ROUS,Hartford Multifactor US Equity ETF,The Hartford,Hartford,02/25/15,Open-Ended Fund,0.19%,$260.78M,$343.68K,,"NULC, GSLC, SPHD, FLQL, OMFL ",,,,,Hartford Multifactor Large Cap Index,Multi-Factor,Multi-Factor,MSCI USA Large Cap Index,0.21%,$145.62B,18.93,3.25,2.03%,N/A,370,,,,,,,,,,,,,,,,,,,,,,,,
RPAR,RPAR Risk Parity ETF,Toroso Investments,RPAR,12/13/19,Open-Ended Fund,0.50%,$878.11M,$3.94M,0.09%,"FTLS, CCOR, WTMF, DALT, FLSP ",,,,,No Underlying Index,Proprietary,Proprietary,N/A,,,,,--,N/A,98,,,,,Tactical Asset Allocation,,,,,,,,,,,,,,,,,,,
RPG,Invesco S&P 500 Pure Growth ETF,Invesco,,03/01/06,Open-Ended Fund,0.35%,$2.65B,$7.08M,,"IVW, SPYG, VOOG, NULG, VUG ",,,,,S&P 500 Pure Growth,Fundamental,Fundamental,MSCI USA Large Cap Growth Index,0.06%,$150.04B,31.64,7.01,0.55%,12/21/20,114,,,,,,,,,,,,,,,,,,,,,,,,
RPV,Invesco S&P 500 Pure Value ETF,Invesco,,03/01/06,Open-Ended Fund,0.35%,$1.02B,$18.01M,,"IVE, SPYV, VOOV, FVAL, SPVU ",,,,,S&P 500 Pure Value,Fundamental,Fundamental,MSCI USA Large Cap Value,0.05%,$42.87B,-24.31,0.92,2.37%,12/21/20,104,,,,,,,,,,,,,,,,,,,,,,,,
RSP,Invesco S&P 500 Equal Weight ETF,Invesco,,04/24/03,Open-Ended Fund,0.20%,$16.04B,$227.88M,,"EQAL, GSEW, EQL, EQWL, SZNE ",,,,,S&P 500 Equal Weight Index,Equal,Committee,MSCI USA Large Cap Index,0.02%,$59.88B,246.48,2.31,1.71%,12/21/20,506,,,,,,,,,,,,,,,,,,,,,,,,
RSX,VanEck Vectors Russia ETF,VanEck,,04/24/07,Open-Ended Fund,0.67%,$1.34B,$97.51M,,"ERUS, FLRU ",,,,,MVIS Russia Index,Market Cap,Market Cap,MSCI Russia IMI Index,0.05%,$26.31B,9.10,1.10,6.05%,12/21/20,28,,,,,,,,,,,,,,,,,,,,,,,,
RSXJ,VanEck Vectors Russia Small-Cap ETF,VanEck,,04/13/11,Open-Ended Fund,0.77%,$31.49M,$63.93K,,N/A ,,,,,MVIS Russia Small-Cap Index,Market Cap,Market Cap,MSCI Russia Small Cap,0.90%,$1.40B,12.59,2.01,4.67%,12/21/20,25,,,,,,,,,,,,,,,,,,,,,,,,
RTH,VanEck Vectors Retail ETF,VanEck,,05/02/01,Open-Ended Fund,0.35%,$192.60M,$1.91M,,"IBUY, CLIX, ONLN, EBIZ ",,,,,MVIS U.S. Listed Retail 25 Index,Market Cap,Market Cap,Thomson Reuters Global Retailers Business,0.05%,$422.97B,33.88,7.09,0.69%,12/21/20,26,,,,,,,,,,,,,,,,,,,,,,,,
RTM,Invesco S&P 500 Equal Weight Materials ETF,Invesco,,11/01/06,Open-Ended Fund,0.40%,$387.88M,$1.88M,,"XLB, VAW, IYM, FMAT, PSCM ",,,,,S&P 500 Equal Weighted / Materials -SEC,Equal,Committee,Thomson Reuters US Basic Materials,0.13%,$26.04B,39.17,2.33,1.64%,12/21/20,29,,,,,,,,,,,,,,,,,,,,,,,,
RUSL,Direxion Daily Russia Bull 2X Shares,Direxion,,05/25/11,Open-Ended Fund,1.23%,$62.14M,,0.08%,N/A ,,,,,MVIS Russia Index,Market Cap,Market Cap,N/A,,,,,0.67%,,,,,,12/22/20,,,,,,,,,,,,,,,,,,,,
RVNU,Xtrackers Municipal Infrastructure Revenue Bond ETF,Deutsche Bank,Xtrackers,06/04/13,Open-Ended Fund,0.15%,$115.50M,$404.31K,0.22%,"MLN, FLMB, BSMS, BSMT, BSMU ",,,,,Solactive Municipal Infrastructure Revenue Bond Index,Market Value,Revenue-backed,N/A,,,,,,N/A,266,8.34,--,3.59%,,,,,,,,,,,,,,,,,,,,,
RVRS,Reverse Cap Weighted U.S. Large Cap ETF,Exponential ETFs,,10/31/17,Open-Ended Fund,0.29%,$15.01M,$67.61K,,"CSM, QMJ, SPY, IVV, VOO ",,,,,Reverse Cap Weighted U.S. Large Cap Index,Inverse Market Cap,Committee,MSCI USA Large Cap Index,0.25%,$17.03B,-21.82,1.68,1.74%,N/A,504,,,,,,,,,,,,,,,,,,,,,,,,
RWCD,Direxion MSCI USA Cyclicals Over Defensives ETF,,,,,,,,,,,,,,,,,,,,,,,,,,,,,,,,,,,,,,,,,,,,,,,,
RWDC,Direxion MSCI Defensives Over Cyclicals ETF,,,,,,,,,,,,,,,,,,,,,,,,,,,,,,,,,,,,,,,,,,,,,,,,
RWDE,Direxion MSCI Developed Over Emerging Markets ETF,,,,,,,,,,,,,,,,,,,,,,,,,,,,,,,,,,,,,,,,,,,,,,,,
RWED,Direxion MSCI Emerging Over Developed Markets ETF,,,,,,,,,,,,,,,,,,,,,,,,,,,,,,,,,,,,,,,,,,,,,,,,
RWGV,Direxion Russell 1000 Growth Over Value ETF,Direxion,,01/16/19,Open-Ended Fund,0.63%,$33.97M,$813.59K,,"NULG, VUG, IWF, IVW, SCHG ",,,,,Russell 1000 Growth/Value 150/50 Net Spread Index,Fixed,Fixed,MSCI USA Large Cap Growth Index,0.10%,$664.55B,43.38,11.83,0.33%,12/22/20,3,,,,,,,,,,,,,,,,,,,,,,,,
RWIU,Direxion FTSE Russell International Over US ETF,,,,,,,,,,,,,,,,,,,,,,,,,,,,,,,,,,,,,,,,,,,,,,,,
RWJ,Invesco S&P SmallCap 600 Revenue ETF,Invesco,,02/22/08,Open-Ended Fund,0.39%,$276.84M,$945.30K,,"FNDA, EES, CALF, IUSS, XSHQ ",,,,,S&P SmallCap 600 Revenue-Weighted Index,Revenue,Committee,MSCI USA Small Cap Index,0.27%,$1.34B,-3.45,1.31,1.18%,12/21/20,590,,,,,,,,,,,,,,,,,,,,,,,,
RWK,Invesco S&P MidCap 400 Revenue ETF,Invesco,,02/22/08,Open-Ended Fund,0.39%,$247.29M,$520.46K,,"EZM, DON, REGL, RNMC, IJH ",,,,,S&P MidCap 400 Revenue-Weighted Index,Revenue,Committee,MSCI USA Mid Cap Index,0.28%,$4.53B,-62.75,1.41,0.92%,12/21/20,397,,,,,,,,,,,,,,,,,,,,,,,,
RWL,Invesco S&P 500 Revenue ETF,Invesco,,02/22/08,Open-Ended Fund,0.39%,$828.25M,$2.19M,,"FTCS, FNDX, PRF, SPHQ, RDVY ",,,,,S&P 500 Revenue-Weighted Index,Revenue,Committee,MSCI USA Large Cap Index,0.05%,$231.70B,55.62,2.07,1.41%,12/21/20,505,,,,,,,,,,,,,,,,,,,,,,,,
RWLS,Direxion Russell Large Over Small Cap ETF ,,,,,,,,,,,,,,,,,,,,,,,,,,,,,,,,,,,,,,,,,,,,,,,,
RWM,ProShares Short Russell2000,ProShares,,01/23/07,Open-Ended Fund,0.95%,$262.03M,,0.03%,"SBB, SDD, TZA, TWM, SRTY ",,,,,Russell 2000 Index,Market Cap,Market Cap,N/A,,,,,0.69%,,,,,,12/23/20,,,,,,,,,,,,,,,,,,,,
RWO,SPDR Dow Jones Global Real Estate ETF,State Street Global Advisors,SPDR,05/07/08,Open-Ended Fund,0.50%,$1.58B,$6.29M,,"GQRE, REET, SRET, OLD, BLDG ",,,,,Dow Jones Global Select Real Estate Securities Index,Market Cap,Market Cap,Thomson Reuters Global Real Estate,0.11%,$15.77B,44.17,1.35,4.19%,12/21/20,264,,,,,,,,,,,,,,,,,,,,,,,,
RWR,SPDR Dow Jones REIT ETF,State Street Global Advisors,SPDR,04/23/01,Open-Ended Fund,0.25%,$1.35B,$9.82M,,"NURE, VNQ, SCHH, IYR, XLRE ",,,,,Dow Jones US Select REIT,Market Cap,Market Cap,Thomson Reuters US Residential & Commercial REITs,0.06%,$21.10B,37.33,1.90,3.53%,12/21/20,116,,,,,,,,,,,,,,,,,,,,,,,,
RWSL,Direxion Russell Small Over Large Cap ETF,,,,,,,,,,,,,,,,,,,,,,,,,,,,,,,,,,,,,,,,,,,,,,,,
RWUI,Direxion FTSE Russell US Over International ETF,,,,,,,,,,,,,,,,,,,,,,,,,,,,,,,,,,,,,,,,,,,,,,,,
RWVG,Direxion Russell 1000 Value Over Growth ETF,Direxion,,01/16/19,Open-Ended Fund,0.64%,$32.14M,$346.90K,,"NULV, VTV, IWD, IVE,  SCHV ",,,,,Russell 1000 Value/Growth 150/50 Net Spread Index,Fixed,Fixed,MSCI USA Large Cap Value,0.12%,$121.18B,33.08,2.12,2.09%,12/22/20,4,,,,,,,,,,,,,,,,,,,,,,,,
RWX,SPDR Dow Jones International Real Estate ETF,State Street Global Advisors,SPDR,12/14/06,Open-Ended Fund,0.59%,$884.88M,$11.93M,,"VNQI, DRW, WPS, IFGL, HAUZ ",,,,,Dow Jones Global ex-U.S. Select Real Estate Securities Index,Market Cap,Market Cap,Thomson Reuters Global Ex-US Real Estate,0.04%,$7.79B,62.00,0.94,9.88%,12/21/20,149,,,,,,,,,,,,,,,,,,,,,,,,
RXD,ProShares UltraShort Health Care,ProShares,,01/30/07,Open-Ended Fund,0.95%,$1.71M,,0.55%,N/A ,,,,,DJ Global United States (All) / Health Care -IND,Market Cap,Market Cap,N/A,,,,,0.64%,,,,,,12/23/20,,,,,,,,,,,,,,,,,,,,
RXI,iShares Global Consumer Discretionary ETF,Blackrock,iShares,09/12/06,Open-Ended Fund,0.46%,$353.94M,$1.33M,,"JOYY, AWAY ",,,,,S&P Global 1200 Consumer Discretionary (Sector) Capped Index,Market Cap,Committee,Thomson Reuters Global Cyclicals,0.22%,$243.89B,46.16,3.19,0.84%,12/14/20,149,,,,,,,,,,,,,,,,,,,,,,,,
RXL,ProShares Ultra Health Care,ProShares,,01/30/07,Open-Ended Fund,0.95%,$109.97M,,0.13%,CURE ,,,,,DJ Global United States (All) / Health Care -IND,Market Cap,Market Cap,N/A,,,,,0.21%,,,,,,12/23/20,,,,,,,,,,,,,,,,,,,,
RYE,Invesco S&P 500 Equal Weight Energy ETF,Invesco,,11/01/06,Open-Ended Fund,0.40%,$60.86M,$1.79M,,"XLE, VDE, FENY, IYE, PSCE ",,,,,S&P 500 Equal Weighted / Energy -SEC,Equal,Committee,Thomson Reuters US Energy - Fossil Fuels,0.08%,$21.68B,-1.87,0.90,2.22%,12/21/20,26,,,,,,,,,,,,,,,,,,,,,,,,
RYF,Invesco S&P 500 Equal Weight Financials ETF,Invesco,,11/01/06,Open-Ended Fund,0.40%,$167.79M,$866.38K,,"XLF, VFH, IYF, FNCL, PSCF ",,,,,S&P 500 Equal Weighted / Financials -SEC,Equal,Committee,Thomson Reuters US Financials,0.06%,$43.69B,14.54,1.01,2.21%,12/21/20,66,,,,,,,,,,,,,,,,,,,,,,,,
RYH,Invesco S&P 500 Equal Weight Health Care ETF,Invesco,,11/01/06,Open-Ended Fund,0.40%,$728.15M,$1.63M,,"XLV, VHT, IYH, FHLC, PSCH ",,,,,S&P 500 Equal Weighted / Health Care -SEC,Equal,Committee,Thomson Reuters US Healthcare,0.07%,$64.22B,30.64,3.78,0.42%,12/21/20,64,,,,,,,,,,,,,,,,,,,,,,,,
RYJ,Invesco Raymond James SB-1 Equity ETF,Invesco,,05/19/06,Open-Ended Fund,0.76%,$120.37M,$145.63K,,"FEDX, QUAL, DGRO, MOAT, KOMP ",,,,,Raymond James SB-1 Index,Equal,Proprietary,MSCI USA IMI,0.28%,$36.88B,-32.57,1.64,0.20%,12/21/20,163,,,,,,,,,,,,,,,,,,,,,,,,
RYLD,Global X Russell 2000 Covered Call ETF,Mirae Asset,Global X,04/17/19,Open-Ended Fund,0.60%,$26.86M,$279.76K,,"XSLV, SMMV, SMLV, IJR, IWM ",,,,,CBOE Russell 2000 BuyWrite Index,Fixed,Fixed,MSCI USA Small Cap Index,0.54%,$2.51B,-25.34,1.94,10.60%,12/30/20,3,,,,,,,,,,,,,,,,,,,,,,,,
RYT,Invesco S&P 500 Equal Weight Technology ETF,Invesco,,11/01/06,Open-Ended Fund,0.40%,$2.13B,$7.81M,,"WCLD, XNTK, VGT, XLK, IYW ",,,,,S&P 500 Equal Weighted / Information Technology -SEC,Equal,Committee,Thomson Reuters US Technology,0.06%,$114.09B,52.72,4.88,1.19%,12/21/20,74,,,,,,,,,,,,,,,,,,,,,,,,
RYU,Invesco S&P 500 Equal Weight Utilities ETF,Invesco,,11/01/06,Open-Ended Fund,0.40%,$238.43M,$1.72M,,"XLU, VPU, FUTY, IDU, PSCU ",,,,,S&P 500 Equal Weighted/ Utilities & Telecommunications,Equal,Committee,Thomson Reuters US Utilities,0.05%,$30.03B,16.76,1.99,2.85%,12/21/20,29,,,,,,,,,,,,,,,,,,,,,,,,
RZG,Invesco S&P SmallCap 600 Pure Growth ETF,Invesco,,03/01/06,Open-Ended Fund,0.35%,$114.46M,$303.64K,,"IJT,  SLYG, VIOG, JSML, VBK ",,,,,S&P Small Cap 600 Pure Growth,Fundamental,Fundamental,MSCI USA Small Cap Growth Index,0.26%,$1.97B,70.60,2.75,0.62%,12/21/20,138,,,,,,,,,,,,,,,,,,,,,,,,
RZV,Invesco S&P SmallCap 600 Pure Value ETF,Invesco,,03/01/06,Open-Ended Fund,0.35%,$161.26M,$1.28M,,"IJS, SLYV, VIOV, VBR, IWN ",,,,,S&P Small Cap 600 Pure Value,Fundamental,Fundamental,MSCI USA Small Cap Value Index,0.34%,$942.83M,-2.24,0.84,0.75%,12/21/20,142,,,,,,,,,,,,,,,,,,,,,,,,
SAA,ProShares Ultra SmallCap600,ProShares,,01/23/07,Open-Ended Fund,0.95%,$24.68M,,0.56%,"TNA, UWM, URTY, SMHB ",,,,,S&P Small Cap 600,Market Cap,Committee,N/A,,,,,0.17%,,,,,,12/23/20,,,,,,,,,,,,,,,,,,,,
SBB,ProShares Short SmallCap600,ProShares,,01/23/07,Open-Ended Fund,0.95%,$7.95M,,0.26%,"SDD, TZA, RWM, TWM, SRTY ",,,,,S&P Small Cap 600,Market Cap,Committee,N/A,,,,,0.27%,,,,,,12/23/20,,,,,,,,,,,,,,,,,,,,
SBIO,ALPS Medical Breakthroughs ETF,SS&C,ALPS,12/31/14,Open-Ended Fund,0.50%,$232.30M,$1.99M,,IEIH ,,,,,S-Network Medical Breakthroughs Index,Market Cap,Fundamental,N/A,0.23%,$3.16B,-16.66,4.96,0.03%,12/21/20,90,,,,,,,,,,,,,,,,,,,,,,,,
SBM,ProShares Short Basic Materials,ProShares,,03/18/10,Open-Ended Fund,0.95%,$1.26M,,0.37%,SMN ,,,,,Dow Jones U.S. Basic Materials Index,Market Cap,Market Cap,N/A,,,,,0.20%,,,,,,12/23/20,,,,,,,,,,,,,,,,,,,,
SBUG,iPath Silver ETN,Barclays Capital Inc.,iPath,10/08/19,Exchange-Traded Note,0.00%,$13.45M,$9.81K,0.81%,"SIVR, SLV, DBS, USV, SLVO ",Futures,Laddered,Annually,0,Barclays Silver 3 Month Index,Single Asset,Single Asset,Silver Spot Price,,,,,,,,,,,,,,,,,,,,,,,,,,,,,,,
SCC,ProShares UltraShort Consumer Services,ProShares,,01/30/07,Open-Ended Fund,0.95%,$874.75K,,0.71%,N/A ,,,,,Dow Jones U.S. Consumer Services Index,Market Cap,Market Cap,N/A,,,,,0.75%,,,,,,12/23/20,,,,,,,,,,,,,,,,,,,,
SCHA,Schwab U.S. Small-Cap ETF,Charles Schwab,Schwab,11/03/09,Open-Ended Fund,0.04%,$12.03B,$32.96M,,"IJR, IWM, VB, SPSM, VTWO ",,,,,Dow Jones US Total Stock Market Small-Cap,Market Cap,Market Cap,MSCI USA Small Cap Index,0.09%,$3.18B,-35.31,1.91,1.21%,12/10/20,"1,746",,,,,,,,,,,,,,,,,,,,,,,,
SCHB,Schwab U.S. Broad Market ETF,Charles Schwab,Schwab,11/03/09,Open-Ended Fund,0.03%,$17.33B,$51.06M,,"VTI, ITOT, IWV, SPTM, IYY ",,,,,Dow Jones US Broad Stock Market,Market Cap,Market Cap,MSCI USA IMI,0.03%,$384.20B,44.17,3.57,1.80%,12/10/20,"2,490",,,,,,,,,,,,,,,,,,,,,,,,
