EUSC,WisdomTree Europe Hedged SmallCap Equity Fund,WisdomTree,,03/04/15,Open-Ended Fund,0.58%,$33.79M,$149.48K,,"IEUS, DFE, SMEZ ",,,,,WisdomTree Europe Hedged SmallCap Equity Index,Dividends,Dividends,MSCI Europe Small Cap Index,0.19%,$3.52B,19.22,1.37,3.24%,12/21/20,183,,,,,,,,,,,,,,,,,,,,,,,,,,,,,
EVX,VanEck Vectors Environmental Services ETF,VanEck,,10/10/06,Open-Ended Fund,0.55%,$37.67M,$148.90K,,PZD ,,,,,NYSE Arca Environmental Svcs (TR),Tiered,Proprietary,Thomson Reuters Global Environmental Services & Equipment,0.38%,$17.18B,147.99,3.33,0.40%,12/21/20,23,,,,,,,,,,,,,,,,,,,,,,,,,,,,,
EWA,iShares MSCI Australia ETF,Blackrock,iShares,03/12/96,Open-Ended Fund,0.50%,$1.69B,$72.41M,,"FAUS, FLAU ",,,,,MSCI Australia Index,Market Cap,Market Cap,MSCI Australia IMI Index,0.05%,$39.23B,32.82,1.93,3.10%,12/14/20,67,,,,,,,,,,,,,,,,,,,,,,,,,,,,,
EWC,iShares MSCI Canada ETF,Blackrock,iShares,03/12/96,Open-Ended Fund,0.49%,$2.54B,$67.73M,,"ZCAN, HEWC, FCAN, FLCA,  BBCA ",,,,,MSCI Canada Custom Capped Index,Market Cap,Market Cap,MSCI Canada IMI,0.04%,$42.41B,23.30,1.69,2.08%,12/14/20,90,,,,,,,,,,,,,,,,,,,,,,,,,,,,,
EWCO,Invesco S&P 500 Equal Weight Communication Services ETF,Invesco,,11/07/18,Open-Ended Fund,0.40%,$22.60M,$49.12K,,"XTL, XLC, VOX, FCOM, IYZ ",,,,,S&P 500 Equal Weight Communication Services Plus Index,Equal,Committee,Thomson Reuters US Telecom,0.32%,$151.95B,29.16,2.23,1.09%,12/21/20,27,,,,,,,,,,,,,,,,,,,,,,,,,,,,,
EWD,iShares MSCI Sweden ETF,Blackrock,iShares,03/12/96,Open-Ended Fund,0.55%,$370.87M,$6.17M,,N/A ,,,,,MSCI Sweden 25/50 Index,Market Cap,Market Cap,MSCI Sweden IMI,0.16%,$25.98B,15.91,2.08,1.28%,12/14/20,40,,,,,,,,,,,,,,,,,,,,,,,,,,,,,
EWG,iShares MSCI Germany ETF,Blackrock,iShares,03/12/96,Open-Ended Fund,0.49%,$2.74B,$161.10M,,"ZDEU, FLGR, HEWG, DBGR, FGM ",,,,,MSCI Germany Index,Market Cap,Market Cap,MSCI Germany IMI,0.03%,$52.61B,25.79,1.46,0.90%,12/14/20,65,,,,,,,,,,,,,,,,,,,,,,,,,,,,,
EWGS,iShares MSCI Germany Small Cap ETF,Blackrock,iShares,01/25/12,Open-Ended Fund,0.59%,$35.86M,$170.67K,,N/A ,,,,,MSCI Germany Small Cap Index,Market Cap,Market Cap,MSCI Germany Small Cap Index,0.26%,$3.38B,41.08,1.66,0.21%,12/14/20,108,,,,,,,,,,,,,,,,,,,,,,,,,,,,,
EWH,iShares MSCI Hong Kong ETF,Blackrock,iShares,03/12/96,Open-Ended Fund,0.49%,$1.44B,$131.87M,,"FHK, FLHK, ZHOK ",,,,,MSCI Hong Kong 25/50 Index,Market Cap,Market Cap,MSCI Hong Kong IMI,0.04%,$48.08B,30.01,1.08,2.55%,12/14/20,40,,,,,,,,,,,,,,,,,,,,,,,,,,,,,
EWI,iShares MSCI Italy ETF,Blackrock,iShares,03/12/96,Open-Ended Fund,0.49%,$222.69M,$21.48M,,FLIY ,,,,,MSCI Italy 25/50 Index,Market Cap,Market Cap,MSCI Italy IMI,0.04%,$31.82B,59.78,1.03,1.56%,12/14/20,28,,,,,,,,,,,,,,,,,,,,,,,,,,,,,
EWJ,iShares MSCI Japan ETF,Blackrock,iShares,03/12/96,Open-Ended Fund,0.49%,$13.04B,$411.54M,,"BBJP, FLJP, ZJPN, HEWJ, DBJP ",,,,,MSCI Japan Index,Market Cap,Market Cap,MSCI Japan IMI,0.02%,$43.67B,27.09,1.26,1.76%,12/14/20,304,,,,,,,,,,,,,,,,,,,,,,,,,,,,,
EWJE,iShares MSCI Japan Equal Weighted ETF,Blackrock,iShares,03/05/19,Open-Ended Fund,0.15%,$7.64M,$40.71K,,"EWJ, BBJP, FLJP, ZJPN, DXJ ",,,,,MSCI Japan Equal Weighted Index,Equal,Market Cap,MSCI Japan IMI,0.15%,$14.76B,36.64,1.05,2.38%,12/14/20,298,,,,,,,,,,,,,,,,,,,,,,,,,,,,,
EWJV,iShares MSCI Japan Value ETF,Blackrock,iShares,03/05/19,Open-Ended Fund,0.15%,$15.29M,$164.04K,,N/A ,,,,,MSCI Japan Value Index,Market Cap,Multi-Factor,N/A,0.14%,$44.34B,22.42,0.79,3.67%,12/14/20,191,,,,,,,,,,,,,,,,,,,,,,,,,,,,,
EWK,iShares MSCI Belgium ETF,Blackrock,iShares,03/12/96,Open-Ended Fund,0.49%,$33.25M,$401.33K,,N/A ,,,,,MSCI Belgium IMI 25/50 Index,Market Cap,Market Cap,MSCI Belgium IMI Index,0.34%,$27.12B,26.73,1.34,1.80%,12/14/20,47,,,,,,,,,,,,,,,,,,,,,,,,,,,,,
EWL,iShares MSCI Switzerland ETF,Blackrock,iShares,03/12/96,Open-Ended Fund,0.50%,$1.71B,$48.35M,,"FSZ, FLSW ",,,,,MSCI Switzerland 25/50 Index,Market Cap,Market Cap,MSCI Switzerland IMI,0.02%,$143.66B,22.62,2.64,1.43%,12/14/20,42,,,,,,,,,,,,,,,,,,,,,,,,,,,,,
EWM,iShares MSCI Malaysia ETF,Blackrock,iShares,03/12/96,Open-Ended Fund,0.49%,$399.96M,$11.33M,,N/A ,,,,,MSCI Malaysia Index,Market Cap,Market Cap,MSCI Malaysia IMI,0.04%,$9.49B,22.26,1.57,2.97%,12/14/20,40,,,,,,,,,,,,,,,,,,,,,,,,,,,,,
EWMC,Invesco S&P MidCap 400 Equal Weight ETF,Invesco,,12/08/10,Open-Ended Fund,0.40%,$85.03M,$203.03K,,"SMDY, IJH, VO, IWR, MDY ",,,,,S&P MidCap 400 Equal Weight Index,Equal,Market Cap,MSCI USA Mid Cap Index,0.33%,$4.62B,232.80,1.72,1.18%,12/21/20,402,,,,,,,,,,,,,,,,,,,,,,,,,,,,,
EWN,iShares MSCI Netherlands ETF,Blackrock,iShares,03/12/96,Open-Ended Fund,0.50%,$265.24M,$9.65M,,N/A ,,,,,MSCI Netherlands IMI 25/50 Index,Market Cap,Market Cap,MSCI Netherlands IMI,0.07%,$71.99B,28.48,2.06,0.81%,12/14/20,60,,,,,,,,,,,,,,,,,,,,,,,,,,,,,
EWO,iShares MSCI Austria ETF,Blackrock,iShares,03/12/96,Open-Ended Fund,0.50%,$52.75M,$492.45K,,N/A ,,,,,MSCI Austria IMI 25/50 Index,Market Cap,Market Cap,MSCI Austria IMI Index,0.52%,$4.35B,16.09,0.73,0.61%,12/14/20,29,,,,,,,,,,,,,,,,,,,,,,,,,,,,,
EWP,iShares MSCI Spain ETF,Blackrock,iShares,03/12/96,Open-Ended Fund,0.50%,$561.68M,$25.93M,,HEWP ,,,,,MSCI Spain 25/50 Index,Market Cap,Market Cap,MSCI Spain IMI,0.04%,$38.50B,-43.50,1.04,3.22%,12/14/20,21,,,,,,,,,,,,,,,,,,,,,,,,,,,,,
EWQ,iShares MSCI France ETF,Blackrock,iShares,03/12/96,Open-Ended Fund,0.50%,$902.49M,$25.25M,,FLFR ,,,,,MSCI France Index,Market Cap,Market Cap,MSCI France IMI Index,0.03%,$74.19B,46.73,1.45,0.74%,12/14/20,76,,,,,,,,,,,,,,,,,,,,,,,,,,,,,
EWRE,Invesco S&P 500 Equal Weight Real Estate ETF,Invesco,,08/13/15,Open-Ended Fund,0.40%,$21.17M,$151.49K,,"NURE, VNQ, SCHH, IYR, XLRE ",,,,,S&P 500 Equal Weight Real Estate Index,Equal,Committee,Thomson Reuters US Residential & Commercial REITs,0.16%,$24.17B,29.04,2.14,3.75%,12/21/20,32,,,,,,,,,,,,,,,,,,,,,,,,,,,,,
EWS,iShares MSCI Singapore ETF,Blackrock,iShares,03/12/96,Open-Ended Fund,0.50%,$642.38M,$20.59M,,N/A ,,,,,MSCI Singapore 25/50 Index,Market Cap,Market Cap,MSCI Singapore Investable Markets,0.05%,$17.65B,13.23,0.95,4.19%,12/14/20,21,,,,,,,,,,,,,,,,,,,,,,,,,,,,,
EWSC,Invesco S&P SmallCap 600 Equal Weight ETF,Invesco,,12/08/10,Open-Ended Fund,0.40%,$28.49M,$272.69K,,"SSLY, IJR, IWM, VB, SCHA ",,,,,S&P Small Cap 600 Equal Weight Index,Equal,Market Cap,MSCI USA Small Cap Index,0.47%,$1.27B,-5.53,1.24,1.49%,12/21/20,603,,,,,,,,,,,,,,,,,,,,,,,,,,,,,
EWT,iShares MSCI Taiwan ETF,Blackrock,iShares,06/20/00,Open-Ended Fund,0.59%,$5.42B,$188.83M,,FLTW ,,,,,MSCI Taiwan 25/50 Index,Market Cap,Market Cap,MSCI Taiwan IMI Index,0.02%,$101.72B,20.21,1.76,1.94%,12/14/20,89,,,,,,,,,,,,,,,,,,,,,,,,,,,,,
EWU,iShares MSCI United Kingdom ETF,Blackrock,iShares,03/12/96,Open-Ended Fund,0.50%,$2.83B,$117.34M,,"ZGBR, HEWU, FKU, FLGB ",,,,,MSCI United Kingdom Index,Market Cap,Market Cap,MSCI United Kingdom IMI,0.04%,$51.31B,163.81,1.36,3.34%,12/14/20,92,,,,,,,,,,,,,,,,,,,,,,,,,,,,,
EWUS,iShares MSCI United Kingdom Small Cap ETF,Blackrock,iShares,01/25/12,Open-Ended Fund,0.59%,$64.63M,$395.76K,,N/A ,,,,,MSCI United Kingdom Small Cap Index,Market Cap,Market Cap,MSCI United Kingdom Small Cap Index,0.29%,$2.87B,-76.97,1.49,2.53%,12/14/20,257,,,,,,,,,,,,,,,,,,,,,,,,,,,,,
EWV,ProShares UltraShort MSCI Japan,ProShares,,11/06/07,Open-Ended Fund,0.95%,$5.56M,,0.20%,N/A ,,,,,MSCI Japan Index,Market Cap,Market Cap,N/A,,,,,0.06%,,,,,,12/23/20,,,,,,,,,,,,,,,,,,,,,,,,,
EWW,iShares MSCI Mexico ETF,Blackrock,iShares,03/12/96,Open-Ended Fund,0.49%,$1.20B,$111.70M,,"HEWW, FLMX ",,,,,MSCI Mexico IMI 25/50 Index,Market Cap,Market Cap,MSCI Mexico IMI,0.03%,$13.72B,28.21,1.59,1.32%,12/14/20,49,,,,,,,,,,,,,,,,,,,,,,,,,,,,,
EWX,SPDR S&P Emerging Markets Small Cap ETF,State Street Global Advisors,SPDR,05/12/08,Open-Ended Fund,0.65%,$587.25M,$1.58M,,"EEMS, DGS, FEMS ",,,,,S&P Emerging Markets <2B,Market Cap,Market Cap,MSCI Emerging Markets Small Cap Index,0.21%,$1.05B,42.50,1.23,2.31%,12/21/20,"2,163",,,,,,,,,,,,,,,,,,,,,,,,,,,,,
EWY,iShares MSCI South Korea ETF,Blackrock,iShares,05/09/00,Open-Ended Fund,0.59%,$6.96B,$290.56M,,"FKO, FLKR ",,,,,MSCI Korea 25/50 Index,Market Cap,Market Cap,MSCI Korea IMI,0.02%,$92.59B,24.03,0.96,1.57%,12/14/20,110,,,,,,,,,,,,,,,,,,,,,,,,,,,,,
EWZ,iShares MSCI Brazil ETF,Blackrock,iShares,07/10/00,Open-Ended Fund,0.59%,$6.23B,$766.28M,,"FBZ, FLBR ",,,,,MSCI Brazil 25/50 Index,Market Cap,Market Cap,MSCI Brazil IMI,0.03%,$23.82B,36.51,1.94,2.88%,12/14/20,56,,,,,,,,,,,,,,,,,,,,,,,,,,,,,
EWZS,iShares MSCI Brazil Small-Cap ETF,Blackrock,iShares,09/29/10,Open-Ended Fund,0.59%,$115.33M,$744.11K,,BRF ,,,,,MSCI Brazil Small Cap Index,Market Cap,Market Cap,MSCI Brazil Small Cap Index,0.39%,$1.44B,-51.50,1.84,1.38%,12/14/20,88,,,,,,,,,,,,,,,,,,,,,,,,,,,,,
EXI,iShares Global Industrials ETF,Blackrock,iShares,09/12/06,Open-Ended Fund,0.46%,$367.48M,$2.91M,,GMAN ,,,,,S&P Global 1200 Industrials Sector Index,Market Cap,Committee,Thomson Reuters Global Industrials,0.18%,$48.13B,42.77,3.08,1.24%,12/14/20,205,,,,,,,,,,,,,,,,,,,,,,,,,,,,,
EYLD,Cambria Emerging Shareholder Yield ETF,Cambria,,07/14/16,Open-Ended Fund,0.69%,$45.91M,$140.32K,,"AVEM, DGRE, RFEM, RESE, EMMF ",,,,,No Underlying Index,Proprietary,Proprietary,MSCI Emerging Markets Investable Market Index,1.12%,$7.28B,10.25,1.19,3.95%,N/A,98,,,,,,,,,,,,,,,,,,,,,,,,,,,,,
EZA,iShares MSCI South Africa ETF,Blackrock,iShares,02/03/03,Open-Ended Fund,0.59%,$404.36M,$17.51M,,FLZA ,,,,,MSCI South Africa 25/50 Index,Market Cap,Market Cap,MSCI South Africa IMI Index,0.11%,$27.10B,41.16,1.67,12.04%,12/14/20,39,,,,,,,,,,,,,,,,,,,,,,,,,,,,,
EZJ,ProShares Ultra MSCI Japan,ProShares,,06/04/09,Open-Ended Fund,0.95%,$5.40M,,0.17%,JPNL ,,,,,MSCI Japan Index,Market Cap,Market Cap,N/A,,,,,0.04%,,,,,,12/23/20,,,,,,,,,,,,,,,,,,,,,,,,,
EZM,WisdomTree U.S. MidCap Fund,WisdomTree,,02/23/07,Open-Ended Fund,0.38%,$614.52M,$1.61M,,"RWK, DON, REGL, RNMC, IJH ",,,,,WisdomTree U.S Mid Cap Index,Earnings,Earnings,MSCI USA Mid Cap Index,0.10%,$5.42B,44.86,1.61,1.38%,12/21/20,545,,,,,,,,,,,,,,,,,,,,,,,,,,,,,
EZU,iShares MSCI Eurozone ETF,Blackrock,iShares,07/25/00,Open-Ended Fund,0.49%,$4.92B,$204.23M,,"VGK, BBEU, IEUR, FLEE, EURZ ",,,,,MSCI EMU Index -TR,Market Cap,Market Cap,MSCI Europe IMI,0.03%,$59.32B,39.17,1.45,1.11%,12/14/20,242,,,,,,,,,,,,,,,,,,,,,,,,,,,,,
FAAR,First Trust Alternative Absolute Return Strategy ETF,First Trust,,05/18/16,Open-Ended Fund,0.95%,$55.57M,$411.79K,1.07%,"RPAR, FTLS, CCOR, WTMF, DALT ",,,,,No Underlying Index,Proprietary,Proprietary,N/A,,,,,1.01%,12/24/20,2,,,,,Long/Short Commodities,,,,,,,,,,,,,,,,,,,,,,,,
FAB,First Trust Multi Cap Value AlphaDEX Fund,First Trust,,05/08/07,Open-Ended Fund,0.70%,$72.84M,$594.87K,,"IUSV, FOVL, VLUE, QVAL, VLU ",,,,,NASDAQ AlphaDEX Multi Cap Value Index,Tiered,Multi-Factor,MSCI USA IMI Value Index,0.25%,$24.48B,15.57,1.22,1.64%,12/24/20,675,,,,,,,,,,,,,,,,,,,,,,,,,,,,,
FAD,First Trust Multi Cap Growth AlphaDEX Fund,First Trust,,05/08/07,Open-Ended Fund,0.63%,$197.01M,$594.96K,,"IUSG, BUL,  FDG, TAAG, HIPR ",,,,,NASDAQ AlphaDEX Multi Cap Growth Index,Tiered,Multi-Factor,MSCI USA IMI Growth Index,0.28%,$47.07B,"1,390.43",6.25,0.45%,12/24/20,675,,,,,,,,,,,,,,,,,,,,,,,,,,,,,
FALN,iShares Fallen Angels USD Bond ETF,Blackrock,iShares,06/14/16,Open-Ended Fund,0.25%,$397.02M,$4.05M,0.15%,"ANGL, HYGV, GHYB, WFHY, HYG ",,,,,Bloomberg Barclays US High Yield Fallen Angel 3% Capped Index,Market Value,Credit Downgrade,Bloomberg Barclays US Corporate High Yield Index,,,,,,12/01/20,393,5.88,--,5.30%,,,,,,,,,,,,,,,,,,,,,,,,,,
FAN,First Trust Global Wind Energy ETF,First Trust,,06/16/08,Open-Ended Fund,0.62%,$329.17M,$4.31M,,"ICLN, QCLN, ACES, SMOG, YLCO ",,,,,ISE Clean Edge Global Wind Energy Index,Tiered,Market Cap,Thomson Reuters Global Renewable Energy,0.10%,$26.92B,29.71,2.32,1.31%,12/24/20,49,,,,,,,,,,,,,,,,,,,,,,,,,,,,,
FAS,Direxion Daily Financial Bull 3x Shares,Direxion,,11/06/08,Open-Ended Fund,0.99%,$1.96B,,0.05%,UYG ,,,,,Russell 1000 Financial Services,Market Cap,Market Cap,N/A,,,,,0.48%,,,,,,12/22/20,,,,,,,,,,,,,,,,,,,,,,,,,
FAUG,FT Cboe Vest U.S. Equity Buffer ETF - August,First Trust,,11/06/19,Open-Ended Fund,0.85%,$104.65M,$916.45K,,"SPUC, SPYC, SPD, SECT, DFEB ",,,,,No Underlying Index,Fixed,Fixed,MSCI USA Large Cap Index,0.29%,--,--,--,--,N/A,3,,,,,,,,,,,,,,,,,,,,,,,,,,,,,
FAUS,First Trust Australia AlphaDEX Fund,,,,,,,,,,,,,,,,,,,,,,,,,,,,,,,,,,,,,,,,,,,,,,,,,,,,,
FAZ,Direxion Daily Financial Bear 3X Shares,Direxion,,11/06/08,Open-Ended Fund,1.07%,$214.50M,,0.07%,"SKF, SEF ",,,,,Russell 1000 Financial Services,Market Cap,Market Cap,N/A,,,,,1.47%,,,,,,12/22/20,,,,,,,,,,,,,,,,,,,,,,,,,
FBCG,Fidelity Blue Chip Growth ETF,Fidelity,,06/03/20,Open-Ended Fund,0.59%,$164.18M,$4.05M,,"LRGE, TGRW ",,,,,Russell 1000 Growth Index,Proprietary,Proprietary,MSCI ACWI Large Cap Growth Index,0.21%,--,--,--,--,12/18/20,0,,,,,,,,,,,,,,,,,,,,,,,,,,,,,
FBCV,Fidelity Blue Chip Value ETF,Fidelity,,06/03/20,Open-Ended Fund,0.59%,$39.37M,$1.08M,,N/A ,,,,,No Underlying Index,Proprietary,Proprietary,MSCI ACWI Large Cap Value Index,0.26%,--,--,--,--,12/18/20,0,,,,,,,,,,,,,,,,,,,,,,,,,,,,,
FBGX,UBS AG FI Enhanced Large Cap Growth ETN,UBS,,06/11/14,Exchange-Traded Note,1.29%,$136.17M,,0.38%,"FLGE, FRLG ",,,,,Russell 1000 Growth,Multi-Factor,Multi-Factor,N/A,,,,,0.00%,,,,,,N/A,,,,,,,,,,,,,,,,,,,,,,,,,
FBND,Fidelity Total Bond ETF,Fidelity,,10/06/14,Open-Ended Fund,0.36%,$1.62B,$12.03M,0.05%,"FIXD, BOND, TOTL, HTRB, GTO ",,,,,No Underlying Index,Proprietary,Proprietary,Bloomberg Barclays Multiverse,,,,,,12/29/20,"1,383",--,--,--,,,,,,,,,,,,,,,,,,,,,,,,,,
FBT,First Trust NYSE Arca Biotechnology Index Fund,First Trust,,06/19/06,Open-Ended Fund,0.55%,$1.95B,$11.42M,,"XBI, CNCR, BBC, BBP, GERM ",,,,,NYSE Arca Biotechnology (TR),Equal,Market Cap,Thomson Reuters US Biotechnology & Medical Research,0.08%,$21.42B,-52.83,4.66,0.00%,12/24/20,31,,,,,,,,,,,,,,,,,,,,,,,,,,,,,
FBZ,First Trust Brazil AlphaDEX Fund,First Trust,,04/18/11,Open-Ended Fund,0.80%,$8.95M,$30.44K,,"EWZ, FLBR ",,,,,NASDAQ AlphaDEX Brazil Index,Tiered,Multi-Factor,MSCI Brazil IMI,1.12%,$9.60B,12.63,1.94,12.92%,12/24/20,51,,,,,,,,,,,,,,,,,,,,,,,,,,,,,
FCA,First Trust China AlphaDEX Fund,First Trust,,04/18/11,Open-Ended Fund,0.80%,$53.14M,$129.29K,,"MCHI, ASHR, GXC, KBA, CNYA ",,,,,Nasdaq AlphaDEX China Index,Tiered,Multi-Factor,MSCI All China IMI Index,0.92%,$22.52B,9.69,0.91,4.48%,12/24/20,51,,,,,,,,,,,,,,,,,,,,,,,,,,,,,
FCAL,First Trust California Municipal High Income ETF,First Trust,,06/20/17,Open-Ended Fund,0.50%,$97.11M,$302.89K,0.24%,CMF ,,,,,No Underlying Index,Proprietary,Proprietary,N/A,,,,,,12/24/20,229,6.32,--,2.95%,,,,,,,,,,,,,,,,,,,,,,,,,,
FCAN,First Trust Canada AlphaDEX Fund,,,,,,,,,,,,,,,,,,,,,,,,,,,,,,,,,,,,,,,,,,,,,,,,,,,,,
FCEF,First Trust CEF Income Opportunity ETF,First Trust,,09/27/16,Open-Ended Fund,3.21%,$35.47M,,0.56%,"TDSC, DRSK, TAIL, NTSX, TDSB ",,,,,No Underlying Index,Proprietary,Proprietary,N/A,,,,,7.53%,,,,,,12/11/20,,,,,,,,,,,,,,,,,,,,,,,,,
FCG,First Trust Natural Gas ETF,First Trust,,05/08/07,Open-Ended Fund,0.60%,$112.14M,$6.15M,,N/A ,,,,,ISE-REVERE Natural Gas Index,Equal,Multi-Factor,ISE-REVERE Natural Gas Index,0.15%,$6.12B,-1.29,0.61,3.37%,12/24/20,41,,,,,,,,,,,,,,,,,,,,,,,,,,,,,
FCOM,Fidelity MSCI Communication Services Index ETF,Fidelity,,10/21/13,Open-Ended Fund,0.08%,$656.37M,$3.32M,,"XLC, VOX, IYZ, XTL, JHCS ",,,,,MSCI USA IMI Telecommunication Services 25/50 Index,Market Cap,Market Cap,Thomson Reuters US Telecom,0.07%,$411.25B,48.67,3.30,0.72%,12/18/20,103,,,,,,,,,,,,,,,,,,,,,,,,,,,,,
FCOR,Fidelity Corporate Bond ETF,Fidelity,,10/06/14,Open-Ended Fund,0.36%,$251.10M,$1.87M,0.10%,REC ,,,,,No Underlying Index,Proprietary,Proprietary,N/A,,,,,,11/25/20,446,--,--,--,,,,,,,,,,,,,,,,,,,,,,,,,,
FCPI,Fidelity Stocks for Inflation ETF,Fidelity,,11/05/19,Open-Ended Fund,0.29%,$3.84M,$24.57K,,"DGRW, QDF, TILT, LRGF, QUS ",,,,,Fidelity Stocks for Inflation Factor Index,Tiered,Multi-Factor,MSCI USA IMI,0.29%,$248.55B,17.67,3.39,1.85%,12/18/20,98,,,,,,,,,,,,,,,,,,,,,,,,,,,,,
FCTR,First Trust Lunt U.S. Factor Rotation ETF,First Trust,,07/25/18,Open-Ended Fund,0.65%,$128.68M,$639.84K,,"RBUS, XRLV, UTRN, LFEQ, VSL ",,,,,Lunt Capital Large Cap Factor Rotation Index,Equal,Technical,MSCI USA Large Cap Index,0.20%,$84.92B,69.15,6.98,0.69%,12/24/20,155,,,,,,,,,,,,,,,,,,,,,,,,,,,,,
FCVT,First Trust SSI Strategic Convertible Securities ETF,First Trust,,11/04/15,Open-Ended Fund,0.95%,$296.32M,$2.76M,0.49%,N/A ,,,,,No Underlying Index,Proprietary,Proprietary,N/A,,,,,,12/24/20,121,--,--,--,,,,,,,,,,,,,,,,,,,,,,,,,,
FDD,First Trust Stoxx European Select Dividend Index Fund,First Trust,,08/27/07,Open-Ended Fund,0.58%,$217.80M,$1.16M,,N/A ,,,,,STOXX Europe Select Dividend 30,Dividends,Dividends,MSCI Europe High Dividend Yield,0.16%,$27.30B,15.56,0.64,3.84%,12/24/20,32,,,,,,,,,,,,,,,,,,,,,,,,,,,,,
FDEM,Fidelity Emerging Markets Multifactor ETF,Fidelity,,02/26/19,Open-Ended Fund,0.45%,$10.48M,$93.50K,,"NUEM, GEM, JHEM, MFEM, EMGF ",,,,,N/A,Proprietary,Proprietary,MSCI Emerging Markets Investable Market Index,0.72%,$130.20B,15.09,1.85,2.05%,12/18/20,199,,,,,,,,,,,,,,,,,,,,,,,,,,,,,
FDEV,Fidelity International Multifactor ETF,Fidelity,,02/26/19,Open-Ended Fund,0.39%,$10.74M,$57.26K,,"NUDM, RODM, GSIE, JPIN, INTF ",,,,,Fidelity Targeted International Factor Index,Proprietary,Proprietary,MSCI World ex USA IMI,0.50%,$43.48B,17.69,2.05,2.48%,12/18/20,204,,,,,,,,,,,,,,,,,,,,,,,,,,,,,
FDG,American Century Focused Dynamic Growth ETF,American Century Investments,American Century,03/31/20,Open-Ended Fund,0.45%,$198.45M,$2.23M,,"FAD, IUSG, BUL, TAAG, HIPR ",,,,,No Underlying Index,Proprietary,Proprietary,MSCI USA IMI Growth Index,0.13%,--,--,--,--,N/A,37,,,,,,,,,,,,,,,,,,,,,,,,,,,,,
FDHY,Fidelity High Yield Factor ETF,Fidelity,,06/12/18,Open-Ended Fund,0.45%,$167.42M,$1.79M,0.24%,"FLHY, FJNK ",,,,,No Underlying Index,Proprietary,Proprietary,N/A,,,,,,11/25/20,152,--,--,--,,,,,,,,,,,,,,,,,,,,,,,,,,
FDIS,Fidelity MSCI Consumer Discretionary Index ETF,Fidelity,,10/21/13,Open-Ended Fund,0.08%,$1.20B,$11.35M,,"XLY, VCR, IYC, PSCD, FXD ",,,,,MSCI US IMI Consumer Discretionary 25/50,Market Cap,Market Cap,Thomson Reuters US Cyclicals,0.06%,$434.90B,67.58,8.65,0.67%,12/18/20,274,,,,,,,,,,,,,,,,,,,,,,,,,,,,,
FDIV,First Trust Strategic Income ETF,First Trust,,08/13/14,Open-Ended Fund,0.87%,$79.25M,,0.25%,"TDSC, DRSK, TAIL, NTSX, TDSB ",,,,,No Underlying Index,Proprietary,Proprietary,N/A,,,,,4.19%,,,,,,12/24/20,,,,,,,,,,,,,,,,,,,,,,,,,
FDL,First Trust Morningstar Dividend Leaders Index Fund,First Trust,,03/09/06,Open-Ended Fund,0.45%,$1.44B,$8.07M,,"SCHD, HDV, RDIV, WBIY, VYM ",,,,,Morningstar Dividend Leaders TR USD,Dividends,Fundamental,MSCI USA IMI High Yield Dividend Index,0.04%,$104.88B,17.79,1.71,4.31%,12/24/20,100,,,,,,,,,,,,,,,,,,,,,,,,,,,,,
FDLO,Fidelity Low Volatility Factor ETF,Fidelity,,09/12/16,Open-Ended Fund,0.29%,$391.67M,$2.60M,,"SPLV, USMC, LGLV, JMIN, LSLT ",,,,,Fidelity U.S. Low Volatility Factor Index,Tiered,Multi-Factor,MSCI USA Large Cap Index,0.12%,$230.58B,26.73,4.54,1.46%,12/18/20,127,,,,,,,,,,,,,,,,,,,,,,,,,,,,,
FDM,First Trust Dow Jones Select MicroCap Index Fund,First Trust,,09/27/05,Open-Ended Fund,0.60%,$119.24M,$690.94K,,"IWC, DWMC ",,,,,DJ Select Micro-Cap,Market Cap,Fundamental,MSCI USA Micro Cap Index,0.18%,$393.54M,38.75,1.22,1.28%,12/24/20,155,,,,,,,,,,,,,,,,,,,,,,,,,,,,,
FDMO,Fidelity Momentum Factor ETF,Fidelity,,09/12/16,Open-Ended Fund,0.29%,$102.55M,$796.84K,,"NULC, GSLC, SPHD, FLQL, OMFL ",,,,,Fidelity U.S. Momentum Factor Index,Tiered,Multi-Factor,MSCI USA Large Cap Index,0.17%,$416.04B,41.55,6.18,0.91%,12/18/20,125,,,,,,,,,,,,,,,,,,,,,,,,,,,,,
FDN,First Trust Dow Jones Internet Index Fund,First Trust,,06/19/06,Open-Ended Fund,0.52%,$10.74B,$70.89M,,"PNQI, PXQ, XWEB ",,,,,Dow Jones Internet Composite Index,Market Cap,Market Cap,Thomson Reuters US Internet Services Total Return Index,0.03%,$331.19B,162.11,8.84,0.00%,12/24/20,41,,,,,,,,,,,,,,,,,,,,,,,,,,,,,
FDNI,First Trust Dow Jones International Internet ETF,First Trust,,11/05/18,Open-Ended Fund,0.65%,$82.66M,$1.21M,,N/A ,,,,,Dow Jones International Internet Index,Market Cap,Market Cap,N/A,0.55%,$234.21B,84.76,7.02,0.71%,12/24/20,41,,,,,,,,,,,,,,,,,,,,,,,,,,,,,
FDRR,Fidelity Dividend ETF for Rising Rates,Fidelity,,09/12/16,Open-Ended Fund,0.29%,$307.50M,$1.09M,,"QWLD, WLDR, URTH, KLDW, RFDI ",,,,,Fidelity Dividend Index for Rising Rates,Tiered,Multi-Factor,MSCI World IMI,0.18%,$364.46B,25.34,2.67,2.63%,12/18/20,114,,,,,,,,,,,,,,,,,,,,,,,,,,,,,
FDT,First Trust Developed Markets ex-US AlphaDEX Fund,First Trust,,04/18/11,Open-Ended Fund,0.80%,$362.55M,$2.59M,,"NUDM, RODM, GSIE, JPIN, INTF ",,,,,NASDAQ AlphaDEX Developed Markets Ex-US Index,Tiered,Multi-Factor,MSCI World ex USA IMI,0.23%,$13.64B,12.63,1.07,1.96%,12/24/20,302,,,,,,,,,,,,,,,,,,,,,,,,,,,,,
FDTS,First Trust Developed Markets ex-US Small Cap AlphaDEX Fund,First Trust,,02/15/12,Open-Ended Fund,0.80%,$8.23M,$45.58K,,"ISCF, SCZ, SCHC, GWX, FNDC ",,,,,NASDAQ AlphaDEX Developed Markets Ex-US Small Cap Index,Tiered,Multi-Factor,MSCI World ex USA Small Cap,0.41%,$1.28B,10.33,0.84,2.28%,12/24/20,403,,,,,,,,,,,,,,,,,,,,,,,,,,,,,
FDVV,Fidelity High Dividend ETF,Fidelity,,09/12/16,Open-Ended Fund,0.29%,$623.67M,$3.69M,,"FGD, SDIV, DEW, LVL, WDIV ",,,,,Fidelity High Dividend Index,Tiered,Dividends,N/A,0.14%,$287.93B,44.12,1.86,3.28%,12/18/20,107,,,,,,,,,,,,,,,,,,,,,,,,,,,,,
FEM,First Trust Emerging Markets AlphaDEX Fund,First Trust,,04/18/11,Open-Ended Fund,0.80%,$413.40M,$2.79M,,"NUEM, GEM, JHEM, MFEM, EMGF ",,,,,NASDAQ AlphaDEX Emerging Markets Index,Tiered,Multi-Factor,MSCI Emerging Markets Investable Market Index,0.15%,$14.66B,9.65,0.99,3.23%,12/24/20,151,,,,,,,,,,,,,,,,,,,,,,,,,,,,,
FEMB,First Trust Emerging Markets Local Currency Bond ETF,First Trust,,11/04/14,Open-Ended Fund,0.85%,$209.70M,$1.73M,0.25%,"EMLC, LEMB, EBND ",,,,,No Underlying Index,Proprietary,Proprietary,Bloomberg Barclays EM Local Currency Government Index,,,,,,12/24/20,55,--,--,--,,,,,,,,,,,,,,,,,,,,,,,,,,
FEMS,First Trust Emerging Markets Small Cap AlphaDEX Fund,First Trust,,02/15/12,Open-Ended Fund,0.80%,$145.83M,$741.31K,,"EEMS, DGS, EWX ",,,,,NASDAQ AlphaDEX Emerging Markets Small Cap Index,Tiered,Multi-Factor,MSCI Emerging Markets Small Cap Index,0.38%,$1.34B,9.29,0.89,4.02%,12/24/20,204,,,,,,,,,,,,,,,,,,,,,,,,,,,,,
FENY,Fidelity MSCI Energy Index ETF,Fidelity,,10/24/13,Open-Ended Fund,0.08%,$606.51M,$8.08M,,"XLE, VDE, IYE, PSCE, FXN ",,,,,N/A,Market Cap,Market Cap,Thomson Reuters US Energy - Fossil Fuels,0.11%,$71.08B,-4.79,0.95,8.62%,12/18/20,84,,,,,,,,,,,,,,,,,,,,,,,,,,,,,
FEP,First Trust Europe AlphaDEX Fund,First Trust,,04/18/11,Open-Ended Fund,0.80%,$388.80M,$1.33M,,"EUDG, FEUZ, GSEU, VGK, BBEU ",,,,,NASDAQ AlphaDEX Europe Index,Tiered,Multi-Factor,MSCI Europe IMI,0.22%,$13.90B,13.39,1.24,1.70%,12/24/20,201,,,,,,,,,,,,,,,,,,,,,,,,,,,,,
FEUL,Credit Suisse FI Enhanced Europe 50 ETN - May 11 - 2028,Credit Suisse Group AG,Credit Suisse,05/11/18,Exchange-Traded Note,2.00%,$15.59M,,2.67%,"FIEE, FLEU, FFEU ",,,,,STOXX Europe 50 Index,Market Cap,Market Cap,N/A,,,,,--,,,,,,N/A,,,,,,,,,,,,,,,,,,,,,,,,,
FEUZ,First Trust Eurozone AlphaDEX ETF,First Trust,,10/22/14,Open-Ended Fund,0.80%,$26.88M,$99.20K,,"FEP, EUDG, GSEU, VGK, BBEU ",,,,,NASDAQ AlphaDEX Eurozone Index,Tiered,Multi-Factor,MSCI Europe IMI,1.09%,$15.21B,15.19,1.06,1.34%,12/24/20,150,,,,,,,,,,,,,,,,,,,,,,,,,,,,,
FEX,First Trust Large Cap Core AlphaDEX Fund,First Trust,,05/08/07,Open-Ended Fund,0.59%,$1.00B,$2.24M,,"NULC, GSLC, SPHD, FLQL, OMFL ",,,,,NASDAQ AlphaDEX Large Cap Core Index,Tiered,Multi-Factor,MSCI USA Large Cap Index,0.05%,$67.03B,24.91,2.58,1.23%,12/24/20,376,,,,,,,,,,,,,,,,,,,,,,,,,,,,,
FEZ,SPDR Euro STOXX 50 ETF,State Street Global Advisors,SPDR,10/15/02,Open-Ended Fund,0.29%,$1.86B,$124.04M,,"IEV, OEUR ",,,,,EURO STOXX 50,Market Cap,Market Cap,MSCI Europe Large Cap,0.03%,$87.69B,36.88,1.66,1.78%,12/21/20,53,,,,,,,,,,,,,,,,,,,,,,,,,,,,,
FFEB,FT Cboe Vest U.S. Equity Buffer ETF - February,First Trust,,02/21/20,Open-Ended Fund,0.85%,$226.11M,$1.86M,,"SPUC, SPYC, SPD, SECT,  DFEB ",,,,,No Underlying Index,Fixed,Fixed,MSCI USA Large Cap Index,0.43%,--,--,--,--,12/24/20,3,,,,,,,,,,,,,,,,,,,,,,,,,,,,,
FFEU,Barclays ETN+ FI Enhanced Europe 50 ETN Series C,,,,,,,,,,,,,,,,,,,,,,,,,,,,,,,,,,,,,,,,,,,,,,,,,,,,,
FFHG,FormulaFolios Hedged Growth ETF,Al Marketing LLC,FormulaFolios,06/06/17,Open-Ended Fund,1.17%,$51.63M,,0.39%,"TDSC, DRSK, TAIL, NTSX, TDSB ",,,,,No Underlying Index,Proprietary,Proprietary,N/A,,,,,0.83%,,,,,,N/A,,,,,,,,,,,,,,,,,,,,,,,,,
FFIU,UVA Unconstrained Medium-Term Fixed Income ETF,OBP Capital LLC,Fieldstone,08/21/17,Open-Ended Fund,0.51%,$77.61M,$206.72K,0.37%,N/A ,,,,,No Underlying Index,Proprietary,Proprietary,N/A,,,,,,N/A,194,--,--,--,,,,,,,,,,,,,,,,,,,,,,,,,,
FFR,First Trust FTSE EPRA/NAREIT Developed Markets Real Estate,First Trust,,08/27/07,Open-Ended Fund,0.60%,$29.74M,$197.98K,,N/A ,,,,,FTSE EPRA/NAREIT Developed Index,Market Cap,Market Cap,Thomson Reuters G7 Real Estate,0.22%,$15.45B,39.61,1.16,4.58%,12/24/20,342,,,,,,,,,,,,,,,,,,,,,,,,,,,,,
FFSG,FormulaFolios Smart Growth ETF,Al Marketing LLC,FormulaFolios,10/31/17,Open-Ended Fund,0.70%,$45.36M,$301.78K,,"WBIE, CACG, PLAT, GXTG, TCHP ",,,,,No Underlying Index,Proprietary,Proprietary,MSCI ACWI IMI Growth Index,0.43%,$181.60B,53.62,2.24,0.96%,N/A,7,,,,,,,,,,,,,,,,,,,,,,,,,,,,,
FFTG,FormulaFolios Tactical Growth ETF,Al Marketing LLC,FormulaFolios,10/31/17,Open-Ended Fund,1.12%,$54.81M,,0.31%,"TDSC, DRSK, TAIL, NTSX, TDSB ",,,,,No Underlying Index,Proprietary,Proprietary,N/A,,,,,0.90%,,,,,,N/A,,,,,,,,,,,,,,,,,,,,,,,,,
FFTI,FormulaFolios Tactical Income ETF,Al Marketing LLC,FormulaFolios,06/06/17,Open-Ended Fund,1.04%,$224.22M,$1.17M,0.24%,"FIXD, BOND, TOTL, FBND, HTRB ",,,,,No Underlying Index,Proprietary,Proprietary,Bloomberg Barclays Multiverse,,,,,,N/A,0,--,--,--,,,,,,,,,,,,,,,,,,,,,,,,,,
