Ticker,Description,Issuer,Brand,Inception Date,Legal Structure,Expense Ratio,Assets Under Management,Average Daily $ Volume,Average Spread (60-Day),Competing ETFs,Exposure Type,Rolling Strategy,Rebalancing Frequency,Number of Commodities,Index Tracked,Index Weighting Methodology,Index Selection Methodology,Segment Benchmark,Average Spread (%),Weighted Average Market Cap,Price / Earnings Ratio,Price / Book Ratio,Distribution Yield,Next Ex-Dividend Date,Number of Holdings,Duration,Weighted Avg. Maturity,Yield to Maturity,Next Distribution Date,Strategy,, Next Ex-Dividend Date,Income Yield (TTM),Access, Competing ETFs, Index Selection Methodology, Weighted Average Market Cap, Duration,Inception Date , Issuer, Average Daily $ Volume,Average Daily $ Volume , Inception Date, Distribution Yield, Number of Holdings, Segment Benchmark,Average Spread (60-Day) ,Expense Ratio ,Legal Structure , Expense Ratio, Legal Structure, Brand, Assets Under Management,Competing ETFs 
AAAU,Perth Mint Physical Gold ETF,Exchange Traded Concepts,Perth Mint,07/26/18,Grantor Trust,0.18%,$514.00M,$9.59M,0.05%,"OUNZ, SGOL, GLD, GLDM, BAR ",Physically Held,Physically Held,N/A,1,Gold Spot,Single Asset,Single Asset,Gold Spot,,,,,,,,,,,,,,,,,,,,,,,,,,,,,,,,,,,,
AADR,AdvisorShares Dorsey Wright ADR ETF,AdvisorShares,,07/20/10,Open-Ended Fund,1.10%,$73.61M,$629.44K,,"DINT, VXUS, VEU, IXUS, ACWX ",,,,,No Underlying Index,Proprietary,Proprietary,MSCI ACWI ex USA IMI Index -TR net,0.55%,$73.63B,43.72,4.84,0.11%,12/24/20,36,,,,,,,,,,,,,,,,,,,,,,,,,,,,,
AAXJ,iShares MSCI All Country Asia ex Japan ETF,Blackrock,iShares,08/13/08,Open-Ended Fund,0.68%,$5.55B,$98.96M,,FLAX ,,,,,MSCI AC Asia ex Japan Index,Market Cap,Market Cap,MSCI AC Asia Pacific Ex-Japan IMI Index,0.01%,$211.91B,20.87,1.74,1.36%,12/14/20,"1,083",,,,,,,,,,,,,,,,,,,,,,,,,,,,,
ABEQ,Absolute Core Strategy ETF,Absolute Investment Advisers LLC,Absolute,01/22/20,Open-Ended Fund,0.88%,$35.36M,$136.14K,,"VFVA, DBLV, TEQI, QVAL, VLUE ",,,,,No Underlying Index,Proprietary,Proprietary,MSCI USA IMI Value Index,0.32%,$100.13B,32.59,1.64,--,N/A,31,,,,,,,,,,,,,,,,,,,,,,,,,,,,,
ACES,ALPS Clean Energy ETF,SS&C,ALPS,06/29/18,Open-Ended Fund,0.55%,$621.74M,$6.69M,,"ICLN, QCLN, FAN, SMOG, YLCO ",,,,,CIBC Atlas Clean Energy Index,Market Cap,Market Cap,Thomson Reuters Global Renewable Energy,0.16%,$21.87B,255.99,4.08,0.73%,12/21/20,36,,,,,,,,,,,,,,,,,,,,,,,,,,,,,
ACIO,Aptus Collared Income Opportunity ETF,Aptus Capital Advisors,Aptus,07/10/19,Open-Ended Fund,0.79%,$174.10M,$884.94K,,"SPUC, SPYC, SPD, SECT, DFEB ",,,,,No Underlying Index,Proprietary,Proprietary,MSCI USA Large Cap Index,0.28%,$446.05B,27.61,5.12,1.50%,N/A,59,,,,,,,,,,,,,,,,,,,,,,,,,,,,,
ACSG,Xtrackers MSCI ACWI ex U.S.A. ESG Leaders Equity ETF,Deutsche Bank,Xtrackers,12/06/18,Open-Ended Fund,0.16%,$9.28M,$16.61K,,"VSGX, VXUS, VEU, IXUS, ACWX ",,,,,MSCI ACWI ex USA ESG Leaders Index,Tiered,Principles-based,MSCI ACWI ex USA IMI Index -TR net,0.26%,$131.79B,26.76,1.84,2.36%,N/A,830,,,,,,,,,,,,,,,,,,,,,,,,,,,,,
ACSI,American Customer Satisfaction ETF,Exponential ETFs,,11/01/16,Open-Ended Fund,0.66%,$67.21M,$9.23K,,"CATH, SNPE, JUST, SHE, BIBL ",,,,,American Customer Satisfaction Investable Index,Tiered,Proprietary,MSCI USA Large Cap Index,0.12%,$419.75B,41.38,3.76,1.37%,N/A,35,,,,,,,,,,,,,,,,,,,,,,,,,,,,,
ACT,AdvisorShares Vice ETF,AdvisorShares,,12/12/17,Open-Ended Fund,0.99%,$11.11M,$51.00K,,"EQOP, AVUS, TTAC, RFDA, FLLV ",,,,,No Underlying Index,Proprietary,Proprietary,MSCI USA IMI,0.35%,$46.70B,41.37,4.02,2.08%,12/24/20,36,,,,,,,,,,,,,,,,,,,,,,,,,,,,,
ACWF,iShares MSCI Global Multifactor ETF,Blackrock,iShares,04/28/15,Open-Ended Fund,0.35%,$87.45M,$262.48K,,"FV, FLQG, VT, ACWI, SPGM ",,,,,MSCI ACWI Diversified Multiple-Factor Index,Multi-Factor,Multi-Factor,MSCI ACWI + Frontier Markets IMI Index,0.32%,$83.29B,17.54,2.03,2.08%,12/14/20,467,,,,,,,,,,,,,,,,,,,,,,,,,,,,,
ACWI,iShares MSCI ACWI ETF,Blackrock,iShares,03/26/08,Open-Ended Fund,0.32%,$14.42B,$281.46M,,"VT, SPGM, PAWZ, VNSE, ARKK ",,,,,MSCI ACWI Index,Market Cap,Market Cap,MSCI ACWI + Frontier Markets IMI Index,0.01%,$276.39B,30.61,2.39,1.74%,12/14/20,"2,253",,,,,,,,,,,,,,,,,,,,,,,,,,,,,
ACWV,iShares MSCI Global Min Vol Factor ETF,Blackrock,iShares,10/18/11,Open-Ended Fund,0.32%,$5.88B,$25.91M,,"VT, ACWI, SPGM, PAWZ, VNSE ",,,,,MSCI ACWI Minimum Volatility Index,Multi-Factor,Multi-Factor,MSCI ACWI + Frontier Markets IMI Index,0.05%,$76.81B,23.87,2.42,2.42%,12/14/20,387,,,,,,,,,,,,,,,,,,,,,,,,,,,,,
ACWX,iShares MSCI ACWI ex U.S. ETF,Blackrock,iShares,03/26/08,Open-Ended Fund,0.32%,$3.69B,$69.14M,,"CWI, VXUS, VEU, IXUS, DBAW ",,,,,MSCI ACWI ex USA Index,Market Cap,Market Cap,MSCI ACWI ex USA IMI Index -TR net,0.02%,$102.73B,27.06,1.59,2.48%,12/14/20,"1,848",,,,,,,,,,,,,,,,,,,,,,,,,,,,,
ADFI,Anfield Dynamic Fixed Income ETF,Regents Park Funds,Anfield,08/18/20,Open-Ended Fund,1.99%,$3.98M,$32.16K,0.35%,"FIXD, BOND, TOTL, FBND, HTRB ",,,,,No Underlying Index,Proprietary,Proprietary,Bloomberg Barclays Multiverse,,,,,,N/A,11,--,--,--,,,,,,,,,,,,,,,,,,,,,,,,,,
ADME,Aptus Drawdown Managed Equity ETF,Aptus Capital Advisors,Aptus,06/08/16,Open-Ended Fund,0.79%,$192.61M,$822.15K,,"SPUC, SPYC, SPD, SECT, DFEB ",,,,,No Underlying Index,Proprietary,Proprietary,MSCI USA Large Cap Index,0.19%,$440.89B,34.38,6.10,0.98%,N/A,67,,,,,,,,,,,,,,,,,,,,,,,,,,,,,
ADRE,Invesco BLDRS Emerging Markets 50 ADR Index Fund,Invesco,,11/13/02,Unit Investment Trust,0.18%,$172.36M,$853.30K,,"BKEM, FNDE, CEZ, CEY, EDOG ",,,,,Bank of New York Mellon Emerging Markets 50 ADR Index,Market Cap,Depository Receipts,MSCI Emerging Markets Large Cap,0.35%,$287.57B,32.95,2.57,1.07%,12/21/20,51,,,,,,,,,,,,,,,,,,,,,,,,,,,,,
AESR,Anfield U.S. Equity Sector Rotation ETF,Regents Park Funds,Anfield,12/17/19,Open-Ended Fund,1.42%,$50.10M,$193.16K,,"SPUC, SPYC, SPD, SECT, DFEB ",,,,,No Underlying Index,Proprietary,Proprietary,MSCI USA Large Cap Index,0.29%,$487.06B,31.98,5.01,--,N/A,9,,,,,,,,,,,,,,,,,,,,,,,,,,,,,
AFIF,Anfield Universal Fixed Income ETF,Regents Park Funds,Anfield,09/18/18,Open-Ended Fund,1.21%,$109.89M,$781.74K,0.30%,"FIXD, BOND, TOTL, FBND, HTRB ",,,,,No Underlying Index,Proprietary,Proprietary,Bloomberg Barclays Multiverse,,,,,,N/A,254,--,--,--,,,,,,,,,,,,,,,,,,,,,,,,,,
AFK,VanEck Vectors Africa Index ETF,VanEck,,07/10/08,Open-Ended Fund,0.79%,$48.66M,$307.87K,,N/A ,,,,,MVIS GDP Africa Index,Tiered,Multi-Factor,MSCI Emerging Frontier Markets Africa Index,0.48%,$16.07B,21.82,1.61,6.37%,12/21/20,75,,,,,,,,,,,,,,,,,,,,,,,,,,,,,
AFLG,First Trust Active Factor Large Cap ETF,First Trust,,12/03/19,Open-Ended Fund,0.55%,$4.37M,$15.87K,,"SPUC, SPYC, SPD, SECT, DFEB ",,,,,No Underlying Index,Proprietary,Proprietary,MSCI USA Large Cap Index,0.10%,$341.72B,25.29,3.61,1.10%,12/24/20,270,,,,,,,,,,,,,,,,,,,,,,,,,,,,,
AFMC,First Trust Active Factor Mid Cap ETF,First Trust,,12/03/19,Open-Ended Fund,0.65%,$2.08M,$1.59K,,"VNMC, IJH, VO, IWR, MDY ",,,,,No Underlying Index,Proprietary,Proprietary,MSCI USA Mid Cap Index,0.21%,$6.71B,27.91,2.09,0.89%,12/24/20,303,,,,,,,,,,,,,,,,,,,,,,,,,,,,,
AFSM,First Trust Active Factor Small Cap ETF,First Trust,,12/03/19,Open-Ended Fund,0.75%,$2.11M,$1.78K,,"SIXS, OVS, IJR, IWM, VB ",,,,,No Underlying Index,Proprietary,Proprietary,MSCI USA Small Cap Index,0.24%,$3.08B,46.08,1.98,0.58%,12/24/20,347,,,,,,,,,,,,,,,,,,,,,,,,,,,,,
AFTY,Pacer CSOP FTSE China A50 ETF,Pacer Advisors,Pacer,03/12/15,Open-Ended Fund,0.70%,$10.06M,$73.15K,,"FXI, CHIL ",,,,,FTSE China A50 Net Total Return Index,Market Cap,Market Cap,MSCI All China Large Cap Index,0.23%,$115.23B,12.07,1.54,3.42%,12/21/20,51,,,,,,,,,,,,,,,,,,,,,,,,,,,,,
AGG,iShares Core U.S. Aggregate Bond ETF,Blackrock,iShares,09/22/03,Open-Ended Fund,0.04%,$83.93B,$605.55M,0.01%,"SCHZ, SPAB, BKAG, BND, GBF ",,,,,Bloomberg Barclays U.S. Aggregate Bond Index,Market Value,Market Value,Bloomberg Barclays U.S. Aggregate Bond Index,,,,,,12/01/20,"9,190",5.92,--,1.19%,,,,,,,,,,,,,,,,,,,,,,,,,,
AGGP,IQ Enhanced Core Plus Bond U.S. ETF,New York Life,IndexIQ,05/10/16,Open-Ended Fund,0.30%,$24.89M,$132.22K,0.14%,"FIBR, BYLD, IUSB, WBIN, TGIF ",,,,,IQ Enhanced Core Plus Bond U.S. Index,Technical,Proprietary,Bloomberg Barclays U.S. Universal Index,,,,,,12/08/20,21,--,--,--,,,,,,,,,,,,,,,,,,,,,,,,,,
AGGY,WisdomTree Yield Enhanced U.S. Aggregate Bond Fund,WisdomTree,,07/09/15,Open-Ended Fund,0.12%,$1.19B,$9.96M,0.04%,"AGG, BND, SCHZ, SPAB, GBF ",,,,,Bloomberg Barclays U.S. Aggregate Enhanced Yield Index,Multi-Factor,Multi-Factor,Bloomberg Barclays U.S. Aggregate Bond Index,,,,,,12/21/20,"2,855",--,--,--,,,,,,,,,,,,,,,,,,,,,,,,,,
AGQ,ProShares Ultra Silver,ProShares,,12/01/08,Commodities Pool,0.93%,$653.78M,,0.10%,USLV ,,,,,Bloomberg Silver Subindex,Single Asset,Single Asset,N/A,,,,,0.00%,,,,,,12/23/20,,,,,,,,,,,,,,,,,,,,,,,,,
AGT,iShares MSCI Argentina and Global Exposure ETF,Blackrock,iShares,04/25/17,Open-Ended Fund,0.59%,$7.41M,$44.74K,,ARGT ,,,,,MSCI All Argentina 25/50 Index,Market Cap,Market Cap,MSCI Argentina IMI Index,0.20%,$17.39B,43.40,1.95,0.59%,12/14/20,27,,,,,,,,,,,,,,,,,,,,,,,,,,,,,
AGZ,iShares Agency Bond ETF,Blackrock,iShares,11/05/08,Open-Ended Fund,0.20%,$972.75M,$6.28M,0.06%,N/A ,,,,,Bloomberg Barclays U.S. Agency Index,Market Value,Market Value,Bloomberg Barclays U.S. Agency Index,,,,,,12/01/20,73,4.09,--,0.59%,,,,,,,,,,,,,,,,,,,,,,,,,,
AGZD,WisdomTree Interest Rate Hedged U.S. Aggregate Bond Fund,WisdomTree,,12/18/13,Open-Ended Fund,0.23%,$99.11M,$538.85K,0.26%,"FLDR, AGG, BND, SCHZ, SPAB ",,,,,"Bloomberg Barclays Rate Hedged U.S. Aggregate Bond Index, Zero Duration",Market Value,Market Value,Bloomberg Barclays U.S. Aggregate Bond Index,,,,,,12/21/20,"1,325",--,--,--,,,,,,,,,,,,,,,,,,,,,,,,,,
AIA,iShares Asia 50 ETF,Blackrock,iShares,11/13/07,Open-Ended Fund,0.50%,$2.52B,$14.49M,,N/A ,,,,,S&P Asia 50 Index,Market Cap,Committee,MSCI All Country Asia Pacific Ex-Japan Large Cap,0.11%,$286.80B,18.49,1.68,1.55%,12/14/20,54,,,,,,,,,,,,,,,,,,,,,,,,,,,,,
AIEQ,AI Powered Equity ETF,ETFMG,ETF Managers Group,10/17/17,Open-Ended Fund,0.87%,$110.05M,$624.03K,,"EQOP, AVUS, TTAC, RFDA, FLLV ",,,,,No Underlying Index,Proprietary,Proprietary,MSCI USA IMI,0.41%,$258.35B,684.48,5.79,0.38%,N/A,127,,,,,,,,,,,,,,,,,,,,,,,,,,,,,
AIIQ,AI Powered International Equity ETF,EquBot,,06/05/18,Open-Ended Fund,0.79%,$6.03M,$48.62K,,"AVDE, DWMF, PQIN, MVIN, TTAI ",,,,,No Underlying Index,Proprietary,Proprietary,MSCI World ex USA IMI,0.11%,$43.59B,223.31,2.33,1.09%,N/A,160,,,,,,,,,,,,,,,,,,,,,,,,,,,,,
AIQ,Global X Artificial Intelligence & Technology ETF,Mirae Asset,Global X,05/11/18,Open-Ended Fund,0.68%,$127.57M,$1.01M,,"BOTZ, ROBO, ARKQ, IRBO, ROBT ",,,,,Indxx Artificial Intelligence and Big Data Index,Market Cap,Market Cap,N/A,0.25%,$279.50B,54.97,5.40,0.45%,12/30/20,86,,,,,,,,,,,,,,,,,,,,,,,,,,,,,
AIRR,First Trust RBA American Industrial Renaissance ETF,First Trust,,03/10/14,Open-Ended Fund,0.70%,$72.08M,$506.55K,,"FXR, JHMI, XLI, VIS, IYJ ",,,,,Richard Bernstein Advisors American Industrial Renaissance,Proprietary,Multi-Factor,Thomson Reuters US Industrials,0.19%,$2.61B,37.60,1.86,0.19%,12/24/20,56,,,,,,,,,,,,,,,,,,,,,,,,,,,,,
ALFA,AlphaClone Alternative Alpha ETF,Exchange Traded Concepts,AlphaClone,05/31/12,Open-Ended Fund,0.65%,$27.52M,$47.48K,,"TMFC, GVIP, GURU, VTI, ITOT ",,,,,AlphaClone Hedge Fund Masters Index,Tiered,Proprietary,MSCI USA IMI,0.25%,$206.09B,-450.03,8.72,0.13%,N/A,44,,,,,,,,,,,,,,,,,,,,,,,,,,,,,
ALTL,Pacer Lunt Large Cap Alternator ETF,Pacer Advisors,Pacer,06/24/20,Open-Ended Fund,0.60%,$49.98M,$385.75K,,N/A ,,,,,Lunt Capital U.S. Large Cap Equity Rotation Index,Momentum,Fixed,MSCI USA Large Cap Index,0.20%,$102.80B,24.10,4.17,--,12/21/20,101,,,,,,,,,,,,,,,,,,,,,,,,,,,,,
ALTS,,,,,,,,,,,,,,,,,,,,,,,,,,,,,,,,,,,,,,,,,,,,,,,,,,,,,,
ALTY,Global X SuperDividend Alternatives ETF,Mirae Asset,Global X,07/14/15,Open-Ended Fund,2.95%,$19.90M,$135.56K,0.41%,"RPAR, QAI, DALT, GAA, TRTY ",,,,,Indxx SuperDividend Alternatives Index,Technical,Dividends,N/A,,,,,10.46%,12/03/20,46,,,,,Tactical Asset Allocation,,,,,,,,,,,,,,,,,,,,,,,,
AMCA,iShares Russell 1000 Pure U.S. Revenue ETF,Blackrock,iShares,08/08/17,Open-Ended Fund,0.15%,$3.14M,$23.43K,,"FTCS, FNDX, PRF, SPHQ, RDVY ",,,,,Russell 1000 Pure Domestic Exposure Index,Market Cap,Revenue,MSCI USA Large Cap Index,0.19%,$79.15B,29.07,2.18,2.34%,12/14/20,414,,,,,,,,,,,,,,,,,,,,,,,,,,,,,
AMJ,JPMorgan Alerian MLP Index ETN,JPMorgan Chase,JPMorgan,04/02/09,Exchange-Traded Note,0.85%,$1.74B,$15.20M,,"AMUB, AMU, AMLP, MLPB, MLPI ",,,,,Alerian MLP,Market Cap,Distributions,N/A,0.09%,--,--,--,9.90%,11/26/20,0,,,,,,,,,,,,,,,,,,,,,,,,,,,,,
AMLP,Alerian MLP ETF,SS&C,Alerian,08/25/10,C-Corporation,0.87%,$4.31B,$81.71M,,"MLPB, MLPI, AMJ, AMUB, AMNA ",,,,,Alerian MLP Infrastructure,Market Cap,Distributions,N/A,0.05%,$10.12B,-15.30,1.12,11.15%,N/A,21,,,,,,,,,,,,,,,,,,,,,,,,,,,,,
AMNA,ETRACS Alerian Midstream Energy Index ETN,UBS,ETRACS,06/19/20,Exchange-Traded Note,0.75%,$53.54M,$15.43K,,"ENFR, AMLP, AMJ, MLPB, AMUB ",,,,,Alerian Midstream Energy Select Index,Market Cap,Distributions,N/A,0.09%,$99.85B,32.11,2.30,--,01/07/21,0,,,,,,,,,,,,,,,,,,,,,,,,,,,,,
AMND,ETRACS Alerian Midstream Energy Dividend Index ETN,UBS,ETRACS,07/15/20,Exchange-Traded Note,0.75%,$28.57M,$42.85K,,"AMLP, AMJ, MLPB, AMUB, MLPI ",,,,,Alerian Midstream Energy Dividend Index,Dividends,Dividends,N/A,0.10%,--,--,--,--,N/A,0,,,,,,,,,,,,,,,,,,,,,,,,,,,,,
AMOM,QRAFT AI-Enhanced U.S. Large Cap Momentum ETF,Exchange Traded Concepts,QRAFT,05/21/19,Open-Ended Fund,0.75%,$5.77M,$55.35K,,"SPUC, SPYC, SPD, SECT, DFEB ",,,,,No Underlying Index,Proprietary,Proprietary,MSCI USA Large Cap Index,0.28%,$372.37B,44.60,16.10,3.70%,N/A,51,,,,,,,,,,,,,,,,,,,,,,,,,,,,,
AMU,ETRACS Alerian MLP Index ETN,,,,,,,,,,,,,,,,,,,,,,,,,,,,,,,,,,,,,,,,,,,,,,,,,,,,,
AMUB,ETRACS Alerian MLP Index ETN Series B,UBS,ETRACS,10/08/15,Exchange-Traded Note,0.80%,$79.36M,$230.68K,,"AMJ, AMU, AMLP, MLPB, MLPI ",,,,,Alerian MLP,Market Cap,Distributions,N/A,0.32%,--,--,--,9.93%,N/A,0,,,,,,,,,,,,,,,,,,,,,,,,,,,,,
AMZA,InfraCap MLP ETF,Virtus Investment Partners,InfraCap,10/07/14,C-Corporation,2.41%,$155.54M,$1.92M,,"EMLP, MLPA, MLPX, TPYP, MLPO ",,,,,No Underlying Index,Proprietary,Proprietary,N/A,0.38%,$9.36B,-26.56,1.16,18.46%,N/A,26,,,,,,,,,,,,,,,,,,,,,,,,,,,,,
ANGL,VanEck Vectors Fallen Angel High Yield Bond ETF,VanEck,,04/10/12,Open-Ended Fund,0.35%,$3.93B,$40.40M,0.04%,"FALN, HYGV, GHYB, WFHY, HYG ",,,,,ICE U.S. Fallen Angel High Yield 10% Constrained Index,Market Value,Credit Downgrade,Bloomberg Barclays US Corporate High Yield Index,,,,,,12/28/20,325,6.25,--,5.30%,,,,,,,,,,,,,,,,,,,,,,,,,,
AOA,iShares Core Aggressive Allocation ETF,Blackrock,iShares,11/04/08,Open-Ended Fund,0.33%,$1.15B,,0.15%,"TAEQ, ARMR, EAOA, AOR, AOM ",,,,,S&P Target Risk Aggressive,Proprietary,Proprietary,N/A,,,,,1.93%,,,,,,12/14/20,,,,,,,,,,,,,,,,,,,,,,,,,
AOK,iShares Core Conservative Allocation ETF,Blackrock,iShares,11/04/08,Open-Ended Fund,0.34%,$836.01M,,0.12%,"SNUG, PSMC, PSMM, EAOK, AOR ",,,,,S&P Target Risk Conservative,Proprietary,Proprietary,N/A,,,,,2.16%,,,,,,12/02/20,,,,,,,,,,,,,,,,,,,,,,,,,
AOM,iShares Core Moderate Allocation ETF,Blackrock,iShares,11/04/08,Open-Ended Fund,0.34%,$1.44B,,0.11%,"AOR, PSMB, AOA, AOK, OCIO ",,,,,S&P Target Risk Moderate,Proprietary,Proprietary,N/A,,,,,2.14%,,,,,,12/14/20,,,,,,,,,,,,,,,,,,,,,,,,,
AOR,iShares Core Growth Allocation ETF,Blackrock,iShares,11/04/08,Open-Ended Fund,0.33%,$1.57B,,0.07%,"AOM, PSMB, AOA, AOK, OCIO ",,,,,S&P Target Risk Growth,Proprietary,Proprietary,N/A,,,,,2.04%,,,,,,12/14/20,,,,,,,,,,,,,,,,,,,,,,,,,
ARB,AltShares Merger Arbitrage ETF,Water Island Capital Partners LP,Altshares,05/07/20,Open-Ended Fund,0.76%,$6.60M,$29.74K,0.12%,"MNA, MARB, MRGR, FTLS, BTAL ",,,,,Water Island Merger Arbitrage USD Hedged Index,Multi-Factor,Multi-Factor,N/A,,,,,--,N/A,0,,,,,Merger Arbitrage,,,,,,,,,,,,,,,,,,,,,,,,
ARCM,Arrow Reserve Capital Management ETF,Arrow Funds,ArrowShares,03/31/17,Open-Ended Fund,0.42%,$51.10M,$99.42K,0.29%,"MINT, PULS, EMNT, HOLD, BSV ",,,,,No Underlying Index,Proprietary,Proprietary,Bloomberg Barclays US Universal 1-5 Year Index,,,,,,N/A,101,0.32,--,0.43%,,,,,,,,,,,,,,,,,,,,,,,,,,
ARGT,Global X MSCI Argentina ETF,Mirae Asset,Global X,03/02/11,Open-Ended Fund,0.60%,$45.35M,$371.35K,,AGT ,,,,,MSCI All Argentina 25/50 Index,Market Cap,Market Cap,MSCI Argentina IMI Index,0.58%,$17.38B,43.52,1.95,0.27%,12/30/20,27,,,,,,,,,,,,,,,,,,,,,,,,,,,,,
ARKF,ARK Fintech Innovation ETF,ARK,,02/04/19,Open-Ended Fund,0.75%,$1.42B,$36.85M,,"BTEK, IQM, IXN, CIBR, CLOU ",,,,,No Underlying Index,Proprietary,Proprietary,Thomson Reuters Global Technology,0.07%,$217.49B,194.06,6.59,0.63%,N/A,50,,,,,,,,,,,,,,,,,,,,,,,,,,,,,
ARKG,ARK Genomic Revolution ETF,ARK,,10/31/14,Open-Ended Fund,0.75%,$5.35B,$124.43M,,"IDNA, HELX ",,,,,No Underlying Index,Proprietary,Proprietary,N/A,0.10%,$10.72B,-23.97,7.01,1.08%,N/A,49,,,,,,,,,,,,,,,,,,,,,,,,,,,,,
ARKK,ARK Innovation ETF,ARK,,10/31/14,Open-Ended Fund,0.75%,$15.06B,$310.80M,,"VNSE, DWLD, GDVD, DWAW, SQEW ",,,,,No Underlying Index,Proprietary,Proprietary,MSCI ACWI + Frontier Markets IMI Index,0.06%,$71.19B,-39.33,7.43,0.15%,N/A,50,,,,,,,,,,,,,,,,,,,,,,,,,,,,,
ARKQ,ARK Autonomous Technology & Robotics ETF,ARK,,09/30/14,Open-Ended Fund,0.75%,$1.26B,$23.30M,,"LRNZ, BOTZ, AIQ, ROBO, IRBO ",,,,,No Underlying Index,Proprietary,Proprietary,N/A,0.12%,$168.24B,-207.09,4.26,2.25%,N/A,41,,,,,,,,,,,,,,,,,,,,,,,,,,,,,
ARKW,ARK Next Generation Internet ETF,ARK,,09/29/14,Open-Ended Fund,0.79%,$4.63B,$113.04M,,"OGIG, TTTN ",,,,,No Underlying Index,Proprietary,Proprietary,Thomson Reuters Global Internet Services Total Return Index,0.09%,$151.13B,-95.61,7.71,9.46%,N/A,54,,,,,,,,,,,,,,,,,,,,,,,,,,,,,
ARMR,Armor U.S. Equity Index ETF,Exchange Traded Concepts,Armor,02/11/20,Open-Ended Fund,0.60%,$4.84M,,,"AOA, TAEQ, EAOA, AOR, AOM ",,,,,Armor U.S. Equity Index,Equal,Proprietary,N/A,,,,,--,,,,,,,,N/A,,,,,,,,,,,,,,,,,,,,,,,
ASEA,Global X FTSE Southeast Asia ETF,Mirae Asset,Global X,02/17/11,Open-Ended Fund,0.65%,$32.81M,$233.14K,,N/A ,,,,,FTSE ASEAN 40 Index,Market Cap,Market Cap,MSCI AC ASEAN IMI,1.15%,$21.44B,13.61,1.24,2.65%,12/30/20,42,,,,,,,,,,,,,,,,,,,,,,,,,,,,,
ASET,FlexShares Real Assets Allocation Index Fund,Northern Trust,FlexShares,11/23/15,Open-Ended Fund,0.57%,$5.17M,$34.88K,,"FVC, VT, ACWI, SPGM, PAWZ ",,,,,Northern Trust Real Assets Allocation Index,Technical,Fixed,MSCI ACWI + Frontier Markets IMI Index,0.10%,$52.20B,36.14,1.61,2.88%,12/18/20,3,,,,,,,,,,,,,,,,,,,,,,,,,,,,,
ASHR,Xtrackers Harvest CSI 300 China A-Shares ETF,Deutsche Bank,Xtrackers,11/06/13,Open-Ended Fund,0.65%,$2.54B,$116.64M,,"MCHI, GXC, KBA, CNYA, FLCH ",,,,,CSI 300 Index,Market Cap,Market Cap,MSCI All China IMI Index,0.03%,$62.98B,15.31,1.66,0.76%,12/18/20,317,,,,,,,,,,,,,,,,,,,,,,,,,,,,,
ASHS,Xtrackers Harvest CSI 500 China-A Shares Small Cap ETF,Deutsche Bank,Xtrackers,05/21/14,Open-Ended Fund,0.65%,$35.28M,$253.19K,,ECNS ,,,,,CSI 500 Index,Market Cap,Market Cap,MSCI All China Small Cap Index,0.19%,$3.84B,28.28,1.88,0.45%,12/03/20,501,,,,,,,,,,,,,,,,,,,,,,,,,,,,,
ASHX,Xtrackers MSCI China A Inclusion Equity ETF,Deutsche Bank,Xtrackers,10/20/15,Open-Ended Fund,0.60%,$12.69M,$9.54K,,"MCHI, ASHR, GXC, KBA, CNYA ",,,,,MSCI China A Inclusion Index,Market Cap,Market Cap,MSCI All China IMI Index,0.85%,$55.85B,17.29,1.81,1.34%,N/A,484,,,,,,,,,,,,,,,,,,,,,,,,,,,,,
ATMP,Barclays ETN+ Select MLP ETN,Barclays Capital Inc.,Barclays,03/13/13,Exchange-Traded Note,0.95%,$166.81M,$685.64K,,"MLPY, MLPC, EINC, MLPE, AMLP ",,,,,CIBC Atlas Select MLP Index,Tiered,Fundamental,N/A,0.34%,--,--,--,8.18%,11/23/20,0,,,,,,,,,,,,,,,,,,,,,,,,,,,,,
AUGZ,TrueShares Structured Outcome ETF - August,TrueMark Investments,TrueMark,07/31/20,Open-Ended Fund,0.79%,$8.89M,$56.37K,,"SPUC,  SPYC, SPD, SECT, DFEB ",,,,,No Underlying Index,Fixed,Fixed,MSCI USA Large Cap Index,0.39%,--,--,--,--,N/A,0,,,,,,,,,,,,,,,,,,,,,,,,,,,,,
AUSF,Global X Adaptive U.S. Factor ETF,Mirae Asset,Global X,08/24/18,Open-Ended Fund,0.27%,$149.41M,$636.91K,,"DGRW, QDF, TILT, LRGF, QUS ",,,,,Adaptive Wealth Strategies U.S. Factor Index,Proprietary,Proprietary,MSCI USA IMI,0.33%,$48.20B,17.49,1.23,3.27%,12/30/20,195,,,,,,,,,,,,,,,,,,,,,,,,,,,,,
AVDE,Avantis International Equity ETF,American Century Investments,Avantis,09/24/19,Open-Ended Fund,0.23%,$435.08M,$1.75M,,"DWMF, PQIN, MVIN, TTAI, AIIQ ",,,,,No Underlying Index,Proprietary,Proprietary,MSCI World ex USA IMI,0.17%,$35.71B,32.43,1.32,0.98%,12/17/20,"3,386",,,,,,,,,,,,,,,,,,,,,,,,,,,,,
AVDV,Avantis International Small Cap Value ETF,American Century Investments,Avantis,09/24/19,Open-Ended Fund,0.36%,$358.38M,$1.31M,,N/A ,,,,,No Underlying Index,Proprietary,Proprietary,N/A,0.20%,$2.00B,81.56,0.89,0.90%,12/17/20,952,,,,,,,,,,,,,,,,,,,,,,,,,,,,,
AVEM,Avantis Emerging Markets Equity ETF,American Century Investments,Avantis,09/17/19,Open-Ended Fund,0.33%,$418.80M,$3.40M,,"DGRE, RFEM, EMMF, RESE, EYLD ",,,,,No Underlying Index,Proprietary,Proprietary,MSCI Emerging Markets Investable Market Index,0.16%,$113.52B,19.51,1.40,0.90%,12/17/20,"2,570",,,,,,,,,,,,,,,,,,,,,,,,,,,,,
AVUS,Avantis U.S. Equity ETF,American Century Investments,Avantis,09/24/19,Open-Ended Fund,0.15%,$559.68M,$1.79M,,"EQOP, TTAC, RFDA, FLLV, AIEQ ",,,,,No Underlying Index,Proprietary,Proprietary,MSCI USA IMI,0.11%,$283.43B,54.37,2.74,1.16%,12/17/20,"2,018",,,,,,,,,,,,,,,,,,,,,,,,,,,,,
AVUV,Avantis U.S. Small Cap Value ETF,American Century Investments,Avantis,09/24/19,Open-Ended Fund,0.25%,$516.94M,$2.07M,,"OSCV, PQSV, VBR, IWN, IJS ",,,,,No Underlying Index,Proprietary,Proprietary,MSCI USA Small Cap Value Index,0.12%,$2.25B,-18.03,1.07,1.06%,12/17/20,545,,,,,,,,,,,,,,,,,,,,,,,,,,,,,
AWAY,ETFMG Travel Tech ETF,ETFMG,ETF Managers Group,02/12/20,Open-Ended Fund,0.75%,$62.71M,$1.81M,,"RXI, JOYY ",,,,,Prime Travel Technology Index,Proprietary,Fundamental,Thomson Reuters Global Cyclicals,0.39%,$10.14B,-9.24,2.62,--,12/14/20,28,,,,,,,,,,,,,,,,,,,,,,,,,,,,,
AWTM,Aware Ultra-Short Duration Enhanced Income ETF,Toroso Investments,Aware,01/29/19,Open-Ended Fund,0.23%,$224.10M,$993.49K,0.14%,"USI, VALT, ULTR, FLUD ",,,,,No Underlying Index,Proprietary,Proprietary,N/A,,,,,,12/30/20,81,--,--,--,,,,,,,,,,,,,,,,,,,,,,,,,,
AZAA,AllianzIM U.S. Large Cap Buffer10 Apr ETF,PIMCO,Allianz,05/28/20,Open-Ended Fund,0.74%,$3.40M,$23.31K,,"SPUC, SPYC, SPD, SECT, DFEB ",,,,,No Underlying Index,Fixed,Fixed,MSCI USA Large Cap Index,0.21%,--,--,--,--,N/A,0,,,,,,,,,,,,,,,,,,,,,,,,,,,,,
AZAL,AllianzIM U.S. Large Cap Buffer10 Jul ETF,PIMCO,Allianz,06/30/20,Open-Ended Fund,0.74%,$3.44M,$118.18,,"SPUC, SPYC, SPD, SECT, DFEB ",,,,,No Underlying Index,Fixed,Fixed,MSCI USA Large Cap Index,0.36%,--,--,--,--,N/A,0,,,,,,,,,,,,,,,,,,,,,,,,,,,,,
AZBA,AllianzIM U.S. Large Cap Buffer20 Apr ETF,PIMCO,Allianz,05/28/20,Open-Ended Fund,0.74%,$3.38M,$349.97,,"SPUC, SPYC, SPD, SECT, DFEB ",,,,,No Underlying Index,Fixed,Fixed,MSCI USA Large Cap Index,0.36%,--,--,--,--,N/A,0,,,,,,,,,,,,,,,,,,,,,,,,,,,,,
AZBL,AllianzIM U.S. Large Cap Buffer20 Jul ETF,PIMCO,Allianz,06/30/20,Open-Ended Fund,0.74%,$3.96M,$472.21,,"SPUC, SPYC, SPD, SECT, DFEB ",,,,,No Underlying Index,Fixed,Fixed,MSCI USA Large Cap Index,0.37%,--,--,--,--,N/A,0,,,,,,,,,,,,,,,,,,,,,,,,,,,,,
BAB,Invesco Taxable Municipal Bond ETF,Invesco,,11/17/09,Open-Ended Fund,0.28%,$2.23B,$12.94M,0.07%,"MUB, VTEB, TFI, PZA, MMIN ",,,,,BofA Merrill Lynch US Taxable Municipal Securities Plus Index,Market Value,Market Value,Barclays Municipal Bond,,,,,,12/21/20,390,10.23,--,2.59%,,,,,,,,,,,,,,,,,,,,,,,,,,
BAL,iPath Series B Bloomberg Cotton Subindex Total Return ETN,Barclays Capital Inc.,iPath,01/17/18,Exchange-Traded Note,0.45%,$9.37M,$116.91K,0.58%,N/A ,Futures,Extended Term,Annually,0,Bloomberg Cotton Subindex Total Return,Single Asset,Single Asset,S&P GSCI Cotton Index,,,,,,,,,,,,,,,,,,,,,,,,,,,,,,,,,,,,
BAPR,Innovator S&P 500 Buffer ETF - April,Innovator,,04/01/19,Open-Ended Fund,0.79%,$59.90M,$568.45K,,"SECT, HUSV, POCT, DUSA, PJAN ",,,,,No Underlying Index,Fixed,Fixed,MSCI USA Large Cap Index,0.37%,--,--,--,--,N/A,2,,,,,,,,,,,,,,,,,,,,,,,,,,,,,
BAR,GraniteShares Gold Trust ,GraniteShares,,08/31/17,Grantor Trust,0.17%,$1.08B,$12.46M,0.05%,"OUNZ, SGOL, GLD, GLDM, AAAU ",Physically Held,Physically Held,N/A,1,Gold Spot,Single Asset,Single Asset,Gold Spot,,,,,,,,,,,,,,,,,,,,,,,,,,,,,,,,,,,,
BATT,Amplify Lithium & Battery Technology ETF,Amplify Investments,Amplify,06/06/18,Open-Ended Fund,0.59%,$27.57M,$754.61K,,"COPX, LIT, REMX, PICK ",,,,,N/A,Market Cap,Single Asset,Thomson Reuters Global Metal & Mining,0.38%,$58.74B,262.53,2.94,2.49%,12/30/20,75,,,,,,,,,,,,,,,,,,,,,,,,,,,,,
BAUG,Innovator S&P 500 Buffer ETF - August,Innovator,,08/01/19,Open-Ended Fund,0.79%,$50.73M,$122.03K,,"SECT, HUSV, POCT, DUSA, PJAN ",,,,,No Underlying Index,Fixed,Fixed,MSCI USA Large Cap Index,0.49%,--,--,--,--,N/A,2,,,,,,,,,,,,,,,,,,,,,,,,,,,,,
BBAX,JPMorgan BetaBuilders Developed Asia ex-Japan ETF,JPMorgan Chase,JPMorgan,08/07/18,Open-Ended Fund,0.19%,$1.75B,$2.86M,,"FPA, EPP ",,,,,Morningstar Developed Asia Pacific ex-Japan Target Market Exposure Index,Market Cap,Market Cap,MSCI Asia Pacific Ex-Japan IMI Index,0.10%,$38.92B,27.98,1.46,2.96%,12/22/20,157,,,,,,,,,,,,,,,,,,,,,,,,,,,,,
BBC,Virtus LifeSci Biotech Clinical Trials ETF,Virtus Investment Partners,Virtus,12/16/14,Open-Ended Fund,0.79%,$45.97M,$351.05K,,"XBI, FBT, CNCR, BBP, GERM ",,,,,LifeSci Biotechnology Clinical Trials Index,Equal,Proprietary,Thomson Reuters US Biotechnology & Medical Research,0.23%,$2.63B,-7.50,4.58,1.24%,N/A,129,,,,,,,,,,,,,,,,,,,,,,,,,,,,,
BBCA,JPMorgan BetaBuilders Canada ETF,JPMorgan Chase,JPMorgan,08/07/18,Open-Ended Fund,0.19%,$4.33B,$4.76M,,"EWC, ZCAN, HEWC, FCAN, FLCA ",,,,,Morningstar Canada Target Market Exposure Index,Market Cap,Market Cap,MSCI Canada IMI,0.07%,$43.07B,24.38,1.72,2.31%,12/22/20,84,,,,,,,,,,,,,,,,,,,,,,,,,,,,,
