GNAF,MicroSectors FANG+ Index Inverse ETN,BMO,REX Microsectors,08/01/18,Exchange-Traded Note,0.95%,$19.08M,,0.20%,"HDGE, FNGD, FNGZ ",,,,,NYSE FANG+ Index,Equal,Committee,N/A,,,,,--,,,,,,N/A,,,,,,,,,,,,,,,
GNMA,iShares GNMA Bond ETF,Blackrock,iShares,02/14/12,Open-Ended Fund,0.15%,$496.45M,$2.49M,0.08%,"MBB, SPMB, VMBS, MBSD, JMBS ",,,,,Bloomberg Barclays U.S. GNMA Bond Index,Market Value,Market Value,Bloomberg Barclays U.S. MBS Index,,,,,,12/01/20,214,1.62,--,1.02%,,,,,,,,,,,,,,,,
GNOM,Global X Genomics & Biotechnology ETF,Mirae Asset,Global X,04/05/19,Open-Ended Fund,0.50%,$72.68M,$517.79K,,"BBH, IBBJ ",,,,,Solactive Genomics Index,Market Cap,Market Cap,Thomson Reuters Global Biotechnology & Medical Research,0.35%,$9.47B,-16.68,5.58,--,12/30/20,41,,,,,,,,,,,,,,,,,,,
GNR,SPDR S&P Global Natural Resources ETF,State Street Global Advisors,SPDR,09/13/10,Open-Ended Fund,0.40%,$1.14B,$5.39M,,"NANR, IGE, GUNR, HAP, GRES ",,,,,S&P Global Natural Resources,Tiered,Committee,Thomson Reuters CRB Commodity Producers Index,0.13%,$41.86B,-291.13,1.25,3.46%,12/18/20,97,,,,,,,,,,,,,,,,,,,
GOAT,VanEck Vectors Morningstar Global Wide Moat ETF,VanEck,,10/30/18,Open-Ended Fund,0.56%,$11.96M,$73.48K,,"GENY, FLQD, VT, ACWI, SPGM ",,,,,Morningstar Global Wide Moat Focus Index,Equal,Proprietary,MSCI ACWI + Frontier Markets IMI Index,0.09%,$182.21B,27.50,3.37,2.11%,12/21/20,67,,,,,,,,,,,,,,,,,,,
GOAU,U.S. Global GO Gold and Precious Metal Miners ETF,US Global Investors,US Global,06/27/17,Open-Ended Fund,0.60%,$111.54M,$1.37M,,"SGDM, GDX, GDXJ, RING, GOEX ",,,,,U.S. Global GO Gold and Precious Metal Miners Index,Tiered,Fundamental,MSCI ACWI Select Gold Miners IMI Index,0.48%,$7.33B,-309.96,2.13,0.14%,N/A,30,,,,,,,,,,,,,,,,,,,
GOEX,Global X Gold Explorers ETF,Mirae Asset,Global X,11/03/10,Open-Ended Fund,0.65%,$59.82M,$469.52K,,"GDX, GDXJ, RING, SGDM, GOAU ",,,,,Solactive Global Gold Explorers & Developers Index,Market Cap,Market Cap,MSCI ACWI Select Gold Miners IMI Index,0.76%,$2.83B,120.46,2.02,1.33%,12/30/20,50,,,,,,,,,,,,,,,,,,,
GOVT,iShares U.S. Treasury Bond ETF,Blackrock,iShares,02/14/12,Open-Ended Fund,0.15%,$14.49B,$158.76M,0.04%,"PLW, FLGV ",,,,,ICE U.S. Treasury Core Bond Index,Market Value,Market Value,Barclays US Aggregate Government - Treasury,,,,,,12/01/20,199,7.19,--,0.50%,,,,,,,,,,,,,,,,
GQRE,FlexShares Global Quality Real Estate Index Fund,Northern Trust,FlexShares,11/06/13,Open-Ended Fund,0.45%,$288.07M,$751.79K,,"RWO, REET, SRET, OLD, BLDG ",,,,,Northern Trust Global Quality Real Estate (NR),Market Cap,Multi-Factor,Thomson Reuters Global Real Estate,0.12%,$23.24B,18.64,1.43,4.48%,12/18/20,130,,,,,,,,,,,,,,,,,,,
GREK,Global X MSCI Greece ETF,Mirae Asset,Global X,12/07/11,Open-Ended Fund,0.57%,$134.17M,$857.31K,,N/A ,,,,,MSCI All Greece Select 25/50 Index,Market Cap,Market Cap,MSCI Greece IMI,0.87%,$2.56B,-19.89,0.53,3.11%,12/30/20,32,,,,,,,,,,,,,,,,,,,
GRES,IQ Global Resources ETF,New York Life,IndexIQ,10/27/09,Open-Ended Fund,0.78%,$21.68M,$142.54K,,"GUNR, NANR, IGE, GNR, HAP ",,,,,IQ Global Resources Index,Multi-Factor,Market Cap,Thomson Reuters CRB Commodity Producers Index,0.15%,$28.69B,134.65,1.27,1.75%,12/30/20,218,,,,,,,,,,,,,,,,,,,
GRID,First Trust NASDAQ Clean Edge Smart Grid Infrastructure Index Fund,First Trust,,11/17/09,Open-Ended Fund,0.70%,$94.32M,$1.03M,,"SIMS, NFRA, TOLZ, OBOR, IGF ",,,,,NASDAQ OMX Clean Edge Smart Grid Infrastructure Index,Tiered,Market Cap,N/A,0.12%,$49.10B,30.97,2.74,0.67%,12/24/20,65,,,,,,,,,,,,,,,,,,,
GRN,iPath Series B Carbon ETN,Barclays Capital Inc.,iPath,09/10/19,Exchange-Traded Note,0.75%,$5.67M,$3.82K,0.65%,KRBN ,Futures,Laddered,Annually,0,Barclays Global Carbon II Index,Liquidity,Liquidity,Barclays Global Carbon Index Total Return,,,,,,,,,,,,,,,,,,,,,,,,,,
GRNB,VanEck Vectors Green Bond ETF,VanEck,,03/03/17,Open-Ended Fund,0.20%,$49.85M,$411.67K,0.16%,"FIXD, BOND, TOTL, FBND, HTRB ",,,,,S&P Green Bond U.S. Dollar Select Index,Market Value,Principles-based,Bloomberg Barclays Multiverse,,,,,,12/01/20,195,--,--,--,,,,,,,,,,,,,,,,
GRU,Elements MLCX Grains Index-Total Return ETN,Swedish Export Credit,ELEMENTS,02/05/08,Exchange-Traded Note,0.75%,$3.47M,$12.37K,4.34%,"FUE, JJG ",Futures,Laddered,Annually,0,ICE BofAML Commodity Index eXtra Grains (Intraday Indicative),Proprietary,Committee,N/A,,,,,,,,,,,,,,,,,,,,,,,,,,
GSC,GS Connect S&P GSCI Enhanced Commodity TR Strategy Index ETN,Goldman Sachs,,07/31/07,Exchange-Traded Note,1.25%,$184.54M,$13.78K,15.21%,"DBC, USCI, BCM, SDCI, GSG ",Futures,Optimized,Annually,0,S&P GSCI Enhanced Commodity,Production,Liquidity,S&P GSCI,,,,,,,,,,,,,,,,,,,,,,,,,,
GSEE,Goldman Sachs MarketBeta Emerging Markets Equity ETF,Goldman Sachs,,05/12/20,Open-Ended Fund,0.36%,$41.18M,$1.88K,,"VWO, IEMG, EEM, SCHE, SPEM ",,,,,Solactive GBS Emerging Markets Large & Mid Cap Index,Market Cap,Market Cap,MSCI Emerging Markets Investable Market Index,0.52%,$189.87B,21.14,1.86,--,12/24/20,"1,352",,,,,,,,,,,,,,,,,,,
GSEU,Goldman Sachs ActiveBeta Europe Equity ETF,Goldman Sachs,,03/02/16,Open-Ended Fund,0.25%,$17.27M,$43.31K,,"FEP, EUDG, FEUZ, VGK, BBEU ",,,,,Goldman Sachs ActiveBeta Europe Equity Index,Tiered,Market Cap,MSCI Europe IMI,0.13%,$65.97B,28.79,1.99,1.77%,12/24/20,398,,,,,,,,,,,,,,,,,,,
GSEW,Goldman Sachs Equal Weight U.S. Large Cap Equity ETF ,Goldman Sachs,,09/12/17,Open-Ended Fund,0.09%,$427.59M,$2.40M,,"RSP, EQAL, EQL, EQWL, SZNE ",,,,,Solactive U.S. Large Cap Equal Weight Index,Equal,Market Cap,MSCI USA Large Cap Index,0.11%,$62.74B,43.07,2.80,1.14%,12/24/20,503,,,,,,,,,,,,,,,,,,,
GSG,iShares S&P GSCI Commodity Indexed Trust,Blackrock,iShares,07/10/06,Commodities Pool,0.85%,$721.40M,$4.16M,0.09%,"GSP, PDBC, DBC, DJP, BCI ",Futures,Front Month,Annually,15,S&P GSCI,Production,Liquidity,S&P GSCI,,,,,,,,,,,,,,,,,,,,,,,,,,
GSID,Goldman Sachs MarketBeta International Equity ETF,Goldman Sachs,,05/12/20,Open-Ended Fund,0.20%,$299.46M,$388.19K,,"VEA, IEFA, EFA, SCHF, SPDW ",,,,,Solactive GBS Developed Markets ex North America Large & Mid Cap Index,Market Cap,Market Cap,MSCI World ex USA IMI,0.33%,$64.36B,32.49,1.54,--,12/24/20,993,,,,,,,,,,,,,,,,,,,
GSIE,Goldman Sachs ActiveBeta International Equity ETF,Goldman Sachs,,11/06/15,Open-Ended Fund,0.25%,$1.97B,$10.70M,,"NUDM, RODM, JPIN, INTF, JHMD ",,,,,Goldman Sachs ActiveBeta International Equity Index,Tiered,Market Cap,MSCI World ex USA IMI,0.06%,$50.21B,27.15,1.78,1.81%,12/24/20,781,,,,,,,,,,,,,,,,,,,
GSIG,Goldman Sachs Access Investment Grade Corporate 1-5 Year Bond ETF,Goldman Sachs,,07/07/20,Open-Ended Fund,0.14%,$27.63M,$1.46K,0.19%,"SFIG, VCSH, IGSB, SPSB, SLQD ",,,,,FTSE Goldman Sachs US Investment-Grade Corporate Bond 1-5 Years Index,Market Value,Fundamental,Bloomberg Barclays U.S. Corporate Bond 1-3 Year Index,,,,,,12/29/20,230,2.76,--,0.99%,,,,,,,,,,,,,,,,
GSJY,Goldman Sachs ActiveBeta Japan Equity ETF,Goldman Sachs,,03/02/16,Open-Ended Fund,0.25%,$21.28M,$86.29K,,"FJP, EWJ, BBJP, FLJP, ZJPN ",,,,,Goldman Sachs ActiveBeta Japan Equity Index,Tiered,Market Cap,MSCI Japan IMI,0.12%,$37.70B,24.08,1.32,2.34%,12/24/20,306,,,,,,,,,,,,,,,,,,,
GSLC,Goldman Sachs ActiveBeta U.S. Large Cap Equity ETF,Goldman Sachs,,09/21/15,Open-Ended Fund,0.09%,$10.72B,$28.28M,,"NULC, SPHD, FLQL, OMFL, JHML ",,,,,Goldman Sachs ActiveBeta U.S. Large Cap Equity Index,Tiered,Market Cap,MSCI USA Large Cap Index,0.04%,$382.93B,28.91,4.23,1.03%,12/24/20,445,,,,,,,,,,,,,,,,,,,
GSP,iPath S&P GSCI Total Return Index ETN,Barclays Capital Inc.,iPath,06/06/06,Exchange-Traded Note,0.75%,$12.02M,$76.59K,0.75%,"GSG, PDBC, DBC, DJP, BCI ",Futures,Front Month,Annually,0,S&P GSCI,Production,Liquidity,S&P GSCI,,,,,,,,,,,,,,,,,,,,,,,,,,
GSSC,Goldman Sachs ActiveBeta U.S. Small Cap Equity ETF,Goldman Sachs,,06/28/17,Open-Ended Fund,0.20%,$200.78M,$1.29M,,"NUSC, PSC, SMLF, JHSC, FYX ",,,,,Goldman Sachs ActiveBeta U.S. Small Cap Equity Index,Tiered,Market Cap,MSCI USA Small Cap Index,0.29%,$2.15B,-137.63,1.93,0.81%,12/24/20,"1,453",,,,,,,,,,,,,,,,,,,
GSST,Goldman Sachs Access Ultra Short Bond ETF,Goldman Sachs,,04/15/19,Open-Ended Fund,0.16%,$175.19M,$2.27M,0.08%,"ICSH, ULST, JPST, OPER ",,,,,No Underlying Index,Proprietary,Proprietary,N/A,,,,,,12/29/20,250,--,--,--,,,,,,,,,,,,,,,,
GSUS,Goldman Sachs MarketBeta U.S. Equity ETF,Goldman Sachs,,05/12/20,Open-Ended Fund,0.07%,$262.19M,$21.33K,,"VTI, ITOT, SCHB, IWV, SPTM ",,,,,Solactive GBS United States Large & Mid Cap Index,Market Cap,Market Cap,MSCI USA IMI,0.12%,$454.07B,33.36,3.97,--,12/24/20,512,,,,,,,,,,,,,,,,,,,
GSY,Invesco Ultra Short Duration ETF,Invesco,,02/12/08,Open-Ended Fund,0.23%,$3.02B,$27.86M,0.02%,N/A ,,,,,No Underlying Index,Proprietary,Proprietary,N/A,,,,,,12/21/20,243,--,--,--,,,,,,,,,,,,,,,,
GTIP,Goldman Sachs Access Inflation Protected USD Bond ETF,Goldman Sachs,,10/02/18,Open-Ended Fund,0.12%,$36.61M,$736.40K,0.03%,"SPIP, TIP, SCHP, TIPZ, IVOL ",,,,,FTSE Goldman Sachs Treasury Inflation Protected USD Bond Index,Duration,Time Since Listing,Bloomberg Barclays US Treasury Inflation Protected Notes (TIPS),,,,,,12/29/20,22,7.89,--,0.66%,,,,,,,,,,,,,,,,
GTO,Invesco Total Return Bond ETF,Invesco,,02/10/16,Open-Ended Fund,0.50%,$495.40M,$4.02M,0.10%,"FIXD, BOND, TOTL, FBND, HTRB ",,,,,No Underlying Index,Proprietary,Proprietary,Bloomberg Barclays Multiverse,,,,,,12/21/20,436,--,--,--,,,,,,,,,,,,,,,,
GUDB,Sage ESG Intermediate Credit ETF,Sage,,10/30/17,Open-Ended Fund,0.35%,$7.88M,$4.93K,0.65%,"IBD, VCIT, IGIB, SPIB, SCHI ",,,,,Sage ESG Intermediate Credit Index,Multi-Factor,Principles-based,Bloomberg Barclays Intermediate Corporate Bond Index,,,,,,N/A,86,4.22,--,1.22%,,,,,,,,,,,,,,,,
GUNR,FlexShares Morningstar Global Upstream Natural Resources Index Fund,Northern Trust,FlexShares,09/16/11,Open-Ended Fund,0.46%,$3.30B,$21.70M,,"GRES, NANR, IGE, GNR, HAP ",,,,,Morningstar Global Upstream Natural Resources Index,Tiered,Proprietary,Thomson Reuters CRB Commodity Producers Index,0.04%,$45.14B,245.34,1.31,3.08%,12/18/20,123,,,,,,,,,,,,,,,,,,,
GURU,Global X Guru Index ETF,Mirae Asset,Global X,06/04/12,Open-Ended Fund,0.75%,$62.48M,$163.58K,,"TMFC, GVIP, ALFA, VTI, ITOT ",,,,,Solactive Guru Index,Equal,Committee,MSCI USA IMI,0.54%,$102.77B,-58.43,3.39,0.87%,12/30/20,53,,,,,,,,,,,,,,,,,,,
GUSH,Direxion Daily S&P Oil & Gas Exp. & Prod. Bull 2X Shares,Direxion,,05/28/15,Open-Ended Fund,1.17%,$444.96M,,0.05%,N/A ,,,,,S&P Oil & Gas Exploration & Production Select Industry,Equal,Market Cap,N/A,,,,,9.25%,,,,,,12/22/20,,,,,,,,,,,,,,,
GVAL,Cambria Global Value ETF,Cambria,,03/12/14,Open-Ended Fund,0.65%,$100.12M,$436.02K,,WBIF ,,,,,No Underlying Index,Proprietary,Proprietary,MSCI ACWI IMI Value Index,0.26%,$11.76B,29.27,0.77,2.73%,N/A,97,,,,,,,,,,,,,,,,,,,
GVI,iShares Intermediate Government/Credit Bond ETF,Blackrock,iShares,01/05/07,Open-Ended Fund,0.20%,$2.31B,$6.97M,0.08%,BIV ,,,,,Bloomberg Barclays US Intermediate Government/Credit,Market Value,Market Value,Bloomberg Barclays US Intermediate Government/Credit,,,,,,12/01/20,"3,378",4.01,--,0.66%,,,,,,,,,,,,,,,,
GVIP,Goldman Sachs Hedge Industry VIP ETF,Goldman Sachs,,11/01/16,Open-Ended Fund,0.45%,$129.29M,$551.19K,,"TMFC, GURU, ALFA, VTI, ITOT ",,,,,Goldman Sachs Hedge Fund VIP Index,Equal,Committee,MSCI USA IMI,0.14%,$258.33B,-121.58,4.52,0.01%,12/24/20,50,,,,,,,,,,,,,,,,,,,
GWX,SPDR S&P International Small Cap ETF,State Street Global Advisors,SPDR,04/20/07,Open-Ended Fund,0.40%,$747.08M,$1.56M,,"SCZ, SCHC, HSCZ, FNDC, DLS ",,,,,S&P Developed x United States <2B,Market Cap,Market Cap,MSCI World ex USA Small Cap,0.28%,$1.05B,95.72,1.08,3.06%,12/21/20,"2,588",,,,,,,,,,,,,,,,,,,
GXC,SPDR S&P China ETF,State Street Global Advisors,SPDR,03/19/07,Open-Ended Fund,0.59%,$1.73B,$10.02M,,"MCHI, ASHR, KBA, CNYA, FLCH ",,,,,S&P China BMI Index,Market Cap,Market Cap,MSCI All China IMI Index,0.14%,$249.77B,17.74,1.89,1.09%,12/21/20,762,,,,,,,,,,,,,,,,,,,
GXF,Global X FTSE Nordic Region ETF,Mirae Asset,Global X,08/17/09,Open-Ended Fund,0.56%,$23.88M,$302.26K,,N/A ,,,,,FTSE Nordic 30 Index,Market Cap,Market Cap,MSCI Nordic Countries Investable Markets Index,1.29%,$47.84B,26.33,2.75,0.55%,12/30/20,31,,,,,,,,,,,,,,,,,,,
GXG,Global X MSCI Colombia ETF,Mirae Asset,Global X,02/05/09,Open-Ended Fund,0.62%,$39.38M,$225.52K,,ICOL ,,,,,MSCI All Colombia Select 25/50 Index,Market Cap,Market Cap,MSCI Colombia IMI,1.07%,$6.03B,11.39,1.01,3.90%,12/30/20,23,,,,,,,,,,,,,,,,,,,
GXTG,Global X Thematic Growth ETF,Mirae Asset,Global X,10/25/19,Open-Ended Fund,0.50%,$30.92M,$215.55K,,"WBIE, CACG, FFSG, PLAT, TCHP ",,,,,Solactive Thematic Growth Index,Tiered,Fundamental,MSCI ACWI IMI Growth Index,0.39%,$61.07B,-6.25,2.74,0.28%,12/30/20,8,,,,,,,,,,,,,,,,,,,
GYLD,Arrow Dow Jones Global Yield ETF,Arrow Funds,ArrowShares,05/08/12,Open-Ended Fund,0.75%,$37.21M,,1.33%,"PCEF, MDIV, IYLD, YYY, YLD ",,,,,Dow Jones Global Composite Yield Index,Equal,Fixed,N/A,,,,,7.93%,,,,,,N/A,,,,,,,,,,,,,,,
HACK,ETFMG Prime Cyber Security ETF,ETFMG,ETF Managers Group,11/11/14,Open-Ended Fund,0.60%,$1.59B,$8.62M,,"PRNT, QTUM, IXN, CIBR, CLOU ",,,,,Prime Cyber Defense Index,Tiered,Market Cap,Thomson Reuters Global Technology,0.13%,$13.72B,148.48,4.57,1.33%,12/14/20,60,,,,,,,,,,,,,,,,,,,
HAIL,SPDR S&P Kensho Smart Mobility ETF,State Street Global Advisors,SPDR,12/26/17,Open-Ended Fund,0.45%,$49.22M,$1.41M,,"KARS, EKAR, DRIV, IDRV, MOTO ",,,,,S&P Kensho Smart Transportation Index,Tiered,Market Cap,N/A,0.19%,$44.44B,-20.56,2.44,0.93%,12/21/20,57,,,,,,,,,,,,,,,,,,,
HAP,VanEck Vectors Natural Resources ETF,VanEck,,08/29/08,Open-Ended Fund,0.50%,$48.84M,$93.86K,,"FTRI, NANR, IGE, GUNR, GNR ",,,,,Van Eck Natural Resources Index,Proprietary,Committee,Thomson Reuters CRB Commodity Producers Index,0.23%,$38.22B,"-1,254.86",1.38,2.76%,12/21/20,307,,,,,,,,,,,,,,,,,,,
HAUZ,Xtrackers International Real Estate ETF,Deutsche Bank,Xtrackers,10/01/13,Open-Ended Fund,0.10%,$305.98M,$946.68K,,"RWX, VNQI, DRW, WPS, IFGL ",,,,,iSTOXX Developed and Emerging Markets ex USA PK VN Real Estate,Market Cap,Market Cap,Thomson Reuters Global Ex-US Real Estate,0.22%,$8.28B,24.73,0.93,4.57%,N/A,544,,,,,,,,,,,,,,,,,,,
HAWX,iShares Currency Hedged MSCI ACWI ex U.S. ETF,Blackrock,iShares,06/29/15,Open-Ended Fund,0.35%,$82.72M,$265.43K,,"DBAW, VXUS, VEU, IXUS, ACWX ",,,,,MSCI ACWI ex USA US Dollar Hedged Index,Market Cap,Market Cap,MSCI ACWI ex USA IMI Index -TR net,0.37%,$97.41B,26.60,1.60,2.69%,12/14/20,2,,,,,,,,,,,,,,,,,,,
HCRB,Hartford Core Bond ETF,The Hartford,Hartford,02/20/20,Open-Ended Fund,0.29%,$126.53M,$2.77K,0.13%,"BNDW, BGRN, SPSK, AVIG ",,,,,No Underlying Index,Proprietary,Proprietary,N/A,,,,,,N/A,451,--,--,--,,,,,,,,,,,,,,,,
HDAW,Xtrackers MSCI All World ex U.S. High Dividend Yield Equity ETF,Deutsche Bank,Xtrackers,08/12/15,Open-Ended Fund,0.20%,$21.02M,$64.91K,,"DWX, FID, VYMI ",,,,,MSCI ACWI Ex-USA High Dividend Yield,Market Cap,Multi-Factor,MSCI ACWI Ex-USA High Dividend Yield,0.67%,$53.31B,14.39,1.18,4.31%,N/A,337,,,,,,,,,,,,,,,,,,,
HDEF,Xtrackers MSCI EAFE High Dividend Yield Equity ETF,Deutsche Bank,Xtrackers,08/12/15,Open-Ended Fund,0.20%,$512.04M,$1.91M,,"IDV, DTH, EFAS, FIDI, IDY ",,,,,MSCI EAFE High Dividend Yield Index,Market Cap,Multi-Factor,MSCI World ex USA High Dividend Yield,0.22%,$51.16B,15.62,1.24,3.38%,N/A,120,,,,,,,,,,,,,,,,,,,
HDG,ProShares Hedge Replication ETF,ProShares,,07/12/11,Open-Ended Fund,0.95%,$29.23M,$181.13K,0.34%,"RPAR, QAI, DALT, GAA, TRTY ",,,,,Merrill Lynch Factor Model - Exchange Series,Multi-Factor,Multi-Factor,N/A,,,,,0.28%,12/23/20,"2,005",,,,,Tactical Asset Allocation,,,,,,,,,,,,,,
HDGE,AdvisorShares Ranger Equity Bear ETF,AdvisorShares,,01/26/11,Open-Ended Fund,3.36%,$80.30M,,0.24%,"FNGD, GNAF, FNGZ ",,,,,No Underlying Index,Proprietary,Proprietary,N/A,,,,,0.34%,,,,,,12/24/20,,,,,,,,,,,,,,,
HDIV,QRAFT AI-Enhanced U.S. High Dividend ETF,Exchange Traded Concepts,QRAFT,02/27/20,Open-Ended Fund,0.75%,$2.57M,$13.49K,,N/A ,,,,,No Underlying Index,Proprietary,Proprietary,MSCI USA IMI High Yield Dividend Index,0.26%,$123.59B,46.15,4.26,--,N/A,101,,,,,,,,,,,,,,,,,,,
HDLB,ETRACS Monthly Pay 2xLeveraged U.S. High Dividend Low Volatility ETN Series B,UBS,ETRACS,10/24/19,Exchange-Traded Note,1.65%,$10.54M,,0.25%,"SSO, UPRO, SPXL, SPUU, TQQQ ",,,,,Solactive US High Dividend Low Volatility Index,Liquidity,Multi-Factor,N/A,,,,,17.14%,,,,,,11/10/20,,,,,,,,,,,,,,,
HDMV,First Trust Horizon Managed Volatility Developed International ETF,First Trust,,08/24/16,Open-Ended Fund,0.80%,$95.30M,$579.16K,,"RFDI, KLDW, URTH, FDRR, ESGG ",,,,,No Underlying Index,Proprietary,Proprietary,MSCI World IMI,0.21%,$42.52B,18.00,1.36,2.14%,12/24/20,126,,,,,,,,,,,,,,,,,,,
HDV,iShares Core High Dividend ETF,Blackrock,iShares,03/29/11,Open-Ended Fund,0.08%,$5.62B,$31.98M,,"SCHD, FDL, RDIV, WBIY, VYM ",,,,,Morningstar Dividend Yield Focus TR,Dividends,Fundamental,MSCI USA IMI High Yield Dividend Index,0.02%,$147.73B,27.30,2.16,3.99%,12/14/20,77,,,,,,,,,,,,,,,,,,,
HEDJ,WisdomTree Europe Hedged Equity Fund,WisdomTree,,12/31/09,Open-Ended Fund,0.58%,$1.87B,$19.18M,,"HEZU, DBEU, RFEU, DBEZ, FLEH ",,,,,WisdomTree Europe Hedged Equity Index,Dividends,Fundamental,MSCI Europe IMI,0.02%,$76.88B,36.74,2.01,2.33%,12/21/20,105,,,,,,,,,,,,,,,,,,,
HEEM,iShares Currency Hedged MSCI Emerging Markets ETF,Blackrock,iShares,09/23/14,Open-Ended Fund,0.68%,$188.00M,$917.15K,,"DBEM, RFEM, TLEH, VWO, IEMG ",,,,,MSCI Emerging Markets 100% Hedged to USD Index,Market Cap,Market Cap,MSCI Emerging Markets Investable Market Index,0.19%,$175.69B,19.76,1.76,2.42%,12/14/20,2,,,,,,,,,,,,,,,,,,,
HEFA,iShares Currency Hedged MSCI EAFE ETF,Blackrock,iShares,01/31/14,Open-Ended Fund,0.35%,$2.33B,$11.34M,,"DBEF, HFXI, DEFA, IHDG, DDWM ",,,,,MSCI EAFE 100% Hedged to USD,Market Cap,Market Cap,MSCI World ex USA IMI,0.04%,$64.68B,33.09,1.55,4.67%,12/02/20,3,,,,,,,,,,,,,,,,,,,
HELX,Franklin Genomic Advancements ETF,Franklin Templeton,Franklin,02/25/20,Open-Ended Fund,0.50%,$7.61M,$149.06K,,"ARKG, IDNA ",,,,,No Underlying Index,Proprietary,Proprietary,N/A,0.21%,$28.90B,-168.37,8.31,--,12/14/20,52,,,,,,,,,,,,,,,,,,,
HERD,Pacer Cash Cows Fund of Funds ETF,Pacer Advisors,Pacer,05/03/19,Open-Ended Fund,0.73%,$1.32M,$12.71K,,"LNGR, BFIT, URTH, FDRR, KLDW ",,,,,Pacer Cash Cows Fund of Funds Index,Tiered,Fundamental,MSCI World IMI,0.40%,$31.54B,56.35,1.67,1.98%,12/22/20,6,,,,,,,,,,,,,,,,,,,
HERO,Global X Video Games & Esports ETF,Mirae Asset,Global X,10/25/19,Open-Ended Fund,0.50%,$441.05M,$4.98M,,"GAMR, ESPO, NERD ",,,,,Solactive Video Games & Esports Index,Market Cap,Market Cap,N/A,0.16%,$46.27B,42.88,4.42,0.15%,12/30/20,41,,,,,,,,,,,,,,,,,,,
HEWC,iShares Currency Hedged MSCI Canada ETF,Blackrock,iShares,07/01/15,Open-Ended Fund,0.52%,$11.88M,$14.28K,,"EWC, ZCAN, FCAN, FLCA, BBCA ",,,,,MSCI Canada 100% Hedged to USD Index,Market Cap,Market Cap,MSCI Canada IMI,0.47%,$45.23B,23.58,1.74,6.59%,12/14/20,2,,,,,,,,,,,,,,,,,,,
HEWG,iShares Currency Hedged MSCI Germany ETF,Blackrock,iShares,01/31/14,Open-Ended Fund,0.53%,$63.76M,$5.94M,,"DBGR, DXGE, EWG, ZDEU, FLGR ",,,,,MSCI Germany 100% Hedged to USD,Market Cap,Market Cap,MSCI Germany IMI,0.04%,$65.80B,28.04,1.57,1.24%,12/02/20,3,,,,,,,,,,,,,,,,,,,
HEWJ,iShares Currency Hedged MSCI Japan ETF,Blackrock,iShares,01/31/14,Open-Ended Fund,0.49%,$315.20M,$5.11M,,"DBJP, FLJH, DXJ, HJPX, EWJ ",,,,,MSCI Japan 100% Hedged to USD,Market Cap,Market Cap,MSCI Japan IMI,0.10%,$42.55B,25.92,1.29,2.06%,12/02/20,3,,,,,,,,,,,,,,,,,,,
HEWU,iShares Currency Hedged MSCI United Kingdom ETF,Blackrock,iShares,06/29/15,Open-Ended Fund,0.50%,$10.20M,$76.92K,,"EWU, ZGBR, FKU, FLGB ",,,,,MSCI United Kingdom US Dollar Hedged Index,Market Cap,Market Cap,MSCI United Kingdom IMI,0.33%,$53.51B,137.75,1.40,3.70%,12/14/20,2,,,,,,,,,,,,,,,,,,,
HEWW,iShares Currency Hedged MSCI Mexico ETF,Blackrock,iShares,07/01/15,Open-Ended Fund,0.52%,$783.36K,$15.68K,,"EWW, FLMX ",,,,,MSCI Mexico IMI 25/50 US Dollar Hedged Index,Market Cap,Market Cap,MSCI Mexico IMI,0.43%,$13.53B,19.92,1.59,1.76%,12/14/20,2,,,,,,,,,,,,,,,,,,,
HEZU,iShares Currency Hedged MSCI Eurozone ETF,Blackrock,iShares,07/10/14,Open-Ended Fund,0.52%,$599.45M,$12.22M,,"DBEU, DBEZ, FLEH, HEDJ, RFEU ",,,,,MSCI EMU 100% Hedged to USD Index,Market Cap,Market Cap,MSCI Europe IMI,0.04%,$64.30B,39.02,1.53,3.91%,12/14/20,2,,,,,,,,,,,,,,,,,,,
HFXI,IQ 50 Percent Hedged FTSE International ETF,New York Life,IndexIQ,07/22/15,Open-Ended Fund,0.20%,$289.29M,$614.34K,,"DBEF, HEFA, DEFA, IHDG, DDWM ",,,,,FTSE Developed ex North America 50% Hedged to USD Index,Market Cap,Market Cap,MSCI World ex USA IMI,0.23%,$65.32B,31.43,1.50,1.96%,12/30/20,805,,,,,,,,,,,,,,,,,,,
HIBL,Direxion Daily S&P 500 High Beta Bull 3X Shares,Direxion,,11/07/19,Open-Ended Fund,0.98%,$41.73M,,0.18%,"SSO, UPRO, SPXL, SPUU, TQQQ ",,,,,S&P 500 High Beta Index,Beta,Beta,N/A,,,,,0.57%,,,,,,12/22/20,,,,,,,,,,,,,,,
HIBS,Direxion Daily S&P 500 High Beta Bear 3X Shares,Direxion,,11/07/19,Open-Ended Fund,1.07%,$38.48M,,0.19%,"SH, SDS, SPXU, SPXS, SPDN ",,,,,S&P 500 High Beta Index,Beta,Beta,N/A,,,,,1.78%,,,,,,12/22/20,,,,,,,,,,,,,,,
HIPR,Direxion High Growth ETF,Direxion,,06/11/20,Open-Ended Fund,0.40%,$8.34M,$74.83K,,"FAD, IUSG, BUL, FDG, TAAG ",,,,,Russell 1000 Hyper Growth Index,Multi-Factor,Multi-Factor,MSCI USA IMI Growth Index,0.26%,$740.88B,31.31,5.55,--,N/A,92,,,,,,,,,,,,,,,,,,,
HIPS,GraniteShares HIPS U.S. High Income ETF,GraniteShares,,01/06/15,Open-Ended Fund,3.19%,$9.63M,,0.29%,"PCEF, MDIV, IYLD, YYY, YLD ",,,,,TFMS HIPS 300 Index,Market Cap,Proprietary,N/A,,,,,9.95%,,,,,,12/30/20,,,,,,,,,,,,,,,
HJPX,iShares Currency Hedged JPX-Nikkei 400 ETF,Blackrock,iShares,10/01/15,Open-Ended Fund,0.48%,$3.11M,$5.09K,,"DXJ, HEWJ, DBJP, FLJH, JPXN ",,,,,JPX-Nikkei 400 USD Hedged Index,Market Cap,Fundamental,MSCI Japan IMI,0.32%,$35.71B,24.51,1.33,1.81%,12/14/20,3,,,,,,,,,,,,,,,,,,,
HLAL,Wahed FTSE USA Shariah ETF,Wahed Invest LLC,Wahed,07/16/19,Open-Ended Fund,0.50%,$56.03M,$371.87K,,"ESGU, USSG, SUSL, DSI, ESGV ",,,,,FTSE Shariah USA Index,Market Cap,Principles-based,MSCI USA IMI,0.13%,$492.85B,37.38,4.35,1.10%,N/A,203,,,,,,,,,,,,,,,,,,,
HMOP,Hartford Municipal Opportunities ETF,The Hartford,Hartford,12/13/17,Open-Ended Fund,0.30%,$124.01M,$601.64K,0.15%,"FMB, FMHI, TAXF, MCEF, MAAX ",,,,,No Underlying Index,Proprietary,Proprietary,Barclays Municipal Bond,,,,,,N/A,238,5.69,--,2.38%,,,,,,,,,,,,,,,,
HNDL,Strategy Shares NASDAQ 7 HANDL Index ETF,Strategy Shares,,01/17/18,Open-Ended Fund,1.17%,$89.20M,,0.22%,"PCEF, MDIV, IYLD, YYY, YLD ",,,,,NASDAQ 7 HANDL Index,Tiered,Fixed,N/A,,,,,6.80%,,,,,,N/A,,,,,,,,,,,,,,,
HOLD,AdvisorShares Sage Core Reserves ETF,AdvisorShares,,01/14/14,Open-Ended Fund,0.36%,$96.35M,$678.29K,0.06%,"MINT, PULS, EMNT, ARCM, BSV ",,,,,No Underlying Index,Proprietary,Proprietary,Bloomberg Barclays US Universal 1-5 Year Index,,,,,,11/24/20,85,--,--,--,,,,,,,,,,,,,,,,
HOMZ,Hoya Capital Housing ETF,Pettee Investors,Hoya,03/20/19,Open-Ended Fund,0.30%,$37.81M,$262.25K,,"ITB, XHB ",,,,,Hoya Capital Housing 100 Index,Tiered,Market Cap,Thomson Reuters US Homebuilding,0.26%,$44.25B,-879.00,1.93,1.80%,N/A,102,,,,,,,,,,,,,,,,,,,
HSCZ,iShares Currency Hedged MSCI EAFE Small-Cap ETF,Blackrock,iShares,07/01/15,Open-Ended Fund,0.43%,$56.49M,$256.40K,,"DDLS, SCZ, SCHC, GWX, FNDC ",,,,,MSCI EAFE Small Cap 100% Hedged to USD Index,Market Cap,Market Cap,MSCI World ex USA Small Cap,0.13%,$2.68B,41.66,1.32,3.91%,12/14/20,2,,,,,,,,,,,,,,,,,,,
HSMV,First Trust Horizon Managed Volatility Small/Mid ETF,First Trust,,04/06/20,Open-Ended Fund,0.80%,$13.53M,$136.96K,,"VXF, SMMD, PRFZ, ISMD, FSMD ",,,,,No Underlying Index,Proprietary,Proprietary,MSCI USA SMID Cap Index,0.14%,$4.21B,23.77,2.21,--,12/24/20,151,,,,,,,,,,,,,,,,,,,
HSPX,Global X S&P 500 Covered Call ETF,Mirae Asset,Global X,06/24/13,Open-Ended Fund,0.60%,$115.30M,$737.90K,,"QYLD, PBP, PUTW, KNG, QYLG ",,,,,CBOE S&P 500 BuyWrite Index,Fixed,Fixed,MSCI USA Large Cap Index,0.64%,$456.89B,34.38,3.75,6.69%,11/23/20,508,,,,,,,,,,,,,,,,,,,
HSRT,Hartford Short Duration ETF,The Hartford,Hartford,05/30/18,Open-Ended Fund,0.30%,$100.66M,$812.77K,0.19%,"MINC, LDUR, STOT, VNLA ",,,,,No Underlying Index,Proprietary,Proprietary,N/A,,,,,,N/A,378,--,--,--,,,,,,,,,,,,,,,,
HTAB,Hartford Schroders Tax-Aware Bond ETF,The Hartford,Hartford,04/18/18,Open-Ended Fund,0.39%,$117.27M,$309.82K,0.27%,"FLCB, JAGG, OVB, BNDC, AGG ",,,,,No Underlying Index,Proprietary,Proprietary,Bloomberg Barclays U.S. Aggregate Bond Index,,,,,,N/A,0,--,--,--,,,,,,,,,,,,,,,,
HTEC,ROBO Global Healthcare Technology and Innovation ETF,Exchange Traded Concepts,ROBO Global,06/25/19,Open-Ended Fund,0.68%,$73.45M,$1.14M,,"IXJ, GDNA, EDOC,  BMED ",,,,,ROBO Global Healthcare Technology and Innovation Index,Proprietary,Proprietary,Thomson Reuters Global Healthcare,0.11%,$26.85B,"-6,492.96",5.76,--,N/A,86,,,,,,,,,,,,,,,,,,,
HTRB,Hartford Total Return Bond ETF,The Hartford,Hartford,09/27/17,Open-Ended Fund,0.30%,$775.64M,$2.16M,0.15%,"FIXD, BOND, TOTL, FBND, GTO ",,,,,No Underlying Index,Proprietary,Proprietary,Bloomberg Barclays Multiverse,,,,,,N/A,"1,115",--,--,--,,,,,,,,,,,,,,,,
HTUS,Hull Tactical U.S. ETF,Exchange Traded Concepts,Hull,06/25/15,Open-Ended Fund,0.97%,$26.02M,$31.60K,0.76%,"RPAR, FTLS, CCOR, WTMF, DALT ",,,,,No Underlying Index,Proprietary,Proprietary,N/A,,,,,0.85%,N/A,2,,,,,Tactical Asset Allocation,,,,,,,,,,,,,,
HUSV,First Trust Horizon Managed Volatility Domestic ETF,First Trust,,08/24/16,Open-Ended Fund,0.70%,$186.52M,$1.66M,,"SPUC, SPYC, SPD, SECT, DFEB ",,,,,No Underlying Index,Proprietary,Proprietary,MSCI USA Large Cap Index,0.11%,$108.15B,20.89,4.03,1.22%,12/24/20,77,,,,,,,,,,,,,,,,,,,
HYD,VanEck Vectors High-Yield Municipal Index ETF,VanEck,,02/04/09,Open-Ended Fund,0.35%,$2.96B,$23.19M,0.04%,HYMB ,,,,,Bloomberg Barclays Municipal Custom High Yield Composite,Tiered,Market Value,Bloomberg Barclays Muni High Yield Index,,,,,,12/01/20,"1,849",7.32,--,4.87%,,,,,,,,,,,,,,,,
