EWH,iShares MSCI Hong Kong ETF,Blackrock,iShares,03/12/96,Open-Ended Fund,0.49%,$1.41B,$137.30M,,"FHK, FLHK, ZHOK ",,,,,MSCI Hong Kong 25/50 Index,Market Cap,Market Cap,MSCI Hong Kong IMI,0.04%,$48.95B,30.19,1.08,2.53%,12/14/20,43,,,,,,,,,,,,,,,,,,,,,,,,
EWI,iShares MSCI Italy ETF,Blackrock,iShares,03/12/96,Open-Ended Fund,0.49%,$191.65M,$19.30M,,FLIY ,,,,,MSCI Italy 25/50 Index,Market Cap,Market Cap,MSCI Italy IMI,0.04%,$34.23B,67.86,1.06,1.57%,12/14/20,30,,,,,,,,,,,,,,,,,,,,,,,,
EWJ,iShares MSCI Japan ETF,Blackrock,iShares,03/12/96,Open-Ended Fund,0.49%,$12.63B,$384.13M,,"BBJP, FLJP, ZJPN, HEWJ, DBJP ",,,,,MSCI Japan Index,Market Cap,Market Cap,MSCI Japan IMI,0.02%,$42.55B,25.92,1.29,1.77%,12/14/20,320,,,,,,,,,,,,,,,,,,,,,,,,
EWJE,iShares MSCI Japan Equal Weighted ETF,Blackrock,iShares,03/05/19,Open-Ended Fund,0.15%,$7.55M,$47.97K,,"EWJ, BBJP, FLJP, ZJPN, DXJ ",,,,,MSCI Japan Equal Weighted Index,Equal,Market Cap,MSCI Japan IMI,0.15%,$14.52B,32.99,1.09,2.40%,12/14/20,312,,,,,,,,,,,,,,,,,,,,,,,,
EWJV,iShares MSCI Japan Value ETF,Blackrock,iShares,03/05/19,Open-Ended Fund,0.15%,$12.63M,$115.54K,,N/A ,,,,,MSCI Japan Value Index,Market Cap,Multi-Factor,N/A,0.14%,$42.99B,20.46,0.80,3.68%,12/14/20,196,,,,,,,,,,,,,,,,,,,,,,,,
EWK,iShares MSCI Belgium ETF,Blackrock,iShares,03/12/96,Open-Ended Fund,0.49%,$29.45M,$229.68K,,N/A ,,,,,MSCI Belgium IMI 25/50 Index,Market Cap,Market Cap,MSCI Belgium IMI Index,0.34%,$27.49B,28.85,1.43,1.83%,12/14/20,47,,,,,,,,,,,,,,,,,,,,,,,,
EWL,iShares MSCI Switzerland ETF,Blackrock,iShares,03/12/96,Open-Ended Fund,0.50%,$1.68B,$44.81M,,"FSZ, FLSW ",,,,,MSCI Switzerland 25/50 Index,Market Cap,Market Cap,MSCI Switzerland IMI,0.02%,$152.54B,25.07,2.64,1.46%,12/14/20,41,,,,,,,,,,,,,,,,,,,,,,,,
EWM,iShares MSCI Malaysia ETF,Blackrock,iShares,03/12/96,Open-Ended Fund,0.49%,$378.34M,$11.85M,,N/A ,,,,,MSCI Malaysia Index,Market Cap,Market Cap,MSCI Malaysia IMI,0.04%,$9.62B,23.47,1.61,3.07%,12/14/20,42,,,,,,,,,,,,,,,,,,,,,,,,
EWMC,Invesco S&P MidCap 400 Equal Weight ETF,Invesco,,12/08/10,Open-Ended Fund,0.40%,$83.95M,$166.75K,,"SMDY, IJH, VO, IWR, MDY ",,,,,S&P MidCap 400 Equal Weight Index,Equal,Market Cap,MSCI USA Mid Cap Index,0.33%,$4.48B,273.85,1.67,1.21%,12/21/20,401,,,,,,,,,,,,,,,,,,,,,,,,
EWN,iShares MSCI Netherlands ETF,Blackrock,iShares,03/12/96,Open-Ended Fund,0.50%,$259.03M,$8.19M,,N/A ,,,,,MSCI Netherlands IMI 25/50 Index,Market Cap,Market Cap,MSCI Netherlands IMI,0.07%,$72.62B,29.84,2.11,0.85%,12/14/20,56,,,,,,,,,,,,,,,,,,,,,,,,
EWO,iShares MSCI Austria ETF,Blackrock,iShares,03/12/96,Open-Ended Fund,0.50%,$50.01M,$401.29K,,N/A ,,,,,MSCI Austria IMI 25/50 Index,Market Cap,Market Cap,MSCI Austria IMI Index,0.52%,$4.48B,13.17,0.73,0.63%,12/14/20,29,,,,,,,,,,,,,,,,,,,,,,,,
EWP,iShares MSCI Spain ETF,Blackrock,iShares,03/12/96,Open-Ended Fund,0.50%,$511.75M,$24.16M,,HEWP ,,,,,MSCI Spain 25/50 Index,Market Cap,Market Cap,MSCI Spain IMI,0.04%,$40.85B,-46.18,1.05,3.30%,12/14/20,25,,,,,,,,,,,,,,,,,,,,,,,,
EWQ,iShares MSCI France ETF,Blackrock,iShares,03/12/96,Open-Ended Fund,0.50%,$889.20M,$25.46M,,FLFR ,,,,,MSCI France Index,Market Cap,Market Cap,MSCI France IMI Index,0.03%,$76.26B,41.07,1.52,0.75%,12/14/20,79,,,,,,,,,,,,,,,,,,,,,,,,
EWRE,Invesco S&P 500 Equal Weight Real Estate ETF,Invesco,,08/13/15,Open-Ended Fund,0.40%,$19.41M,$100.31K,,"NURE, VNQ, SCHH, IYR, XLRE ",,,,,S&P 500 Equal Weight Real Estate Index,Equal,Committee,Thomson Reuters US Residential & Commercial REITs,0.16%,$24.67B,27.07,2.21,3.77%,12/21/20,32,,,,,,,,,,,,,,,,,,,,,,,,
EWS,iShares MSCI Singapore ETF,Blackrock,iShares,03/12/96,Open-Ended Fund,0.50%,$621.92M,$20.00M,,N/A ,,,,,MSCI Singapore 25/50 Index,Market Cap,Market Cap,MSCI Singapore Investable Markets,0.05%,$17.49B,13.71,0.99,4.14%,12/14/20,24,,,,,,,,,,,,,,,,,,,,,,,,
EWSC,Invesco S&P SmallCap 600 Equal Weight ETF,Invesco,,12/08/10,Open-Ended Fund,0.40%,$27.80M,$258.35K,,"SSLY, IJR, IWM, VB, SCHA ",,,,,S&P Small Cap 600 Equal Weight Index,Equal,Market Cap,MSCI USA Small Cap Index,0.47%,$1.23B,-4.52,1.24,1.54%,12/21/20,602,,,,,,,,,,,,,,,,,,,,,,,,
EWT,iShares MSCI Taiwan ETF,Blackrock,iShares,06/20/00,Open-Ended Fund,0.59%,$5.01B,$193.45M,,FLTW ,,,,,MSCI Taiwan 25/50 Index,Market Cap,Market Cap,MSCI Taiwan IMI Index,0.02%,$99.85B,19.25,1.75,2.06%,12/14/20,89,,,,,,,,,,,,,,,,,,,,,,,,
EWU,iShares MSCI United Kingdom ETF,Blackrock,iShares,03/12/96,Open-Ended Fund,0.50%,$2.77B,$95.38M,,"ZGBR, HEWU, FKU, FLGB ",,,,,MSCI United Kingdom Index,Market Cap,Market Cap,MSCI United Kingdom IMI,0.04%,$53.51B,137.75,1.40,3.44%,12/14/20,90,,,,,,,,,,,,,,,,,,,,,,,,
EWUS,iShares MSCI United Kingdom Small Cap ETF,Blackrock,iShares,01/25/12,Open-Ended Fund,0.59%,$63.90M,$250.67K,,N/A ,,,,,MSCI United Kingdom Small Cap Index,Market Cap,Market Cap,MSCI United Kingdom Small Cap Index,0.29%,$2.95B,-97.56,1.51,2.59%,12/14/20,250,,,,,,,,,,,,,,,,,,,,,,,,
EWV,ProShares UltraShort MSCI Japan,ProShares,,11/06/07,Open-Ended Fund,0.95%,$5.50M,,0.20%,N/A ,,,,,MSCI Japan Index,Market Cap,Market Cap,N/A,,,,,0.06%,,,,,,12/23/20,,,,,,,,,,,,,,,,,,,,
EWW,iShares MSCI Mexico ETF,Blackrock,iShares,03/12/96,Open-Ended Fund,0.49%,$1.22B,$105.00M,,"HEWW, FLMX ",,,,,MSCI Mexico IMI 25/50 Index,Market Cap,Market Cap,MSCI Mexico IMI,0.03%,$13.53B,19.92,1.59,1.35%,12/14/20,48,,,,,,,,,,,,,,,,,,,,,,,,
EWX,SPDR S&P Emerging Markets Small Cap ETF,State Street Global Advisors,SPDR,05/12/08,Open-Ended Fund,0.65%,$560.62M,$1.63M,,"EEMS, DGS, FEMS ",,,,,S&P Emerging Markets <2B,Market Cap,Market Cap,MSCI Emerging Markets Small Cap Index,0.21%,$1.05B,41.31,1.25,2.41%,12/21/20,"2,162",,,,,,,,,,,,,,,,,,,,,,,,
EWY,iShares MSCI South Korea ETF,Blackrock,iShares,05/09/00,Open-Ended Fund,0.59%,$6.03B,$276.19M,,"FKO, FLKR ",,,,,MSCI Korea 25/50 Index,Market Cap,Market Cap,MSCI Korea IMI,0.02%,$91.51B,24.39,0.99,1.71%,12/14/20,110,,,,,,,,,,,,,,,,,,,,,,,,
EWZ,iShares MSCI Brazil ETF,Blackrock,iShares,07/10/00,Open-Ended Fund,0.59%,$5.76B,$729.15M,,"FBZ, FLBR ",,,,,MSCI Brazil 25/50 Index,Market Cap,Market Cap,MSCI Brazil IMI,0.03%,$23.62B,33.72,1.96,3.06%,12/14/20,58,,,,,,,,,,,,,,,,,,,,,,,,
EWZS,iShares MSCI Brazil Small-Cap ETF,Blackrock,iShares,09/29/10,Open-Ended Fund,0.59%,$105.24M,$720.26K,,BRF ,,,,,MSCI Brazil Small Cap Index,Market Cap,Market Cap,MSCI Brazil Small Cap Index,0.39%,$1.47B,-55.05,1.88,1.49%,12/14/20,84,,,,,,,,,,,,,,,,,,,,,,,,
EXI,iShares Global Industrials ETF,Blackrock,iShares,09/12/06,Open-Ended Fund,0.46%,$345.51M,$3.15M,,GMAN ,,,,,S&P Global 1200 Industrials Sector Index,Market Cap,Committee,Thomson Reuters Global Industrials,0.18%,$48.56B,34.50,3.12,1.25%,12/14/20,205,,,,,,,,,,,,,,,,,,,,,,,,
EYLD,Cambria Emerging Shareholder Yield ETF,Cambria,,07/14/16,Open-Ended Fund,0.69%,$43.76M,$111.79K,,"AVEM, DGRE, RFEM, RESE, EMMF ",,,,,No Underlying Index,Proprietary,Proprietary,MSCI Emerging Markets Investable Market Index,1.12%,$8.02B,10.09,1.22,4.13%,N/A,99,,,,,,,,,,,,,,,,,,,,,,,,
EZA,iShares MSCI South Africa ETF,Blackrock,iShares,02/03/03,Open-Ended Fund,0.59%,$357.35M,$16.44M,,FLZA ,,,,,MSCI South Africa 25/50 Index,Market Cap,Market Cap,MSCI South Africa IMI Index,0.11%,$24.04B,43.27,1.69,12.53%,12/14/20,41,,,,,,,,,,,,,,,,,,,,,,,,
EZJ,ProShares Ultra MSCI Japan,ProShares,,06/04/09,Open-Ended Fund,0.95%,$5.50M,,0.17%,JPNL ,,,,,MSCI Japan Index,Market Cap,Market Cap,N/A,,,,,0.04%,,,,,,12/23/20,,,,,,,,,,,,,,,,,,,,
EZM,WisdomTree U.S. MidCap Fund,WisdomTree,,02/23/07,Open-Ended Fund,0.38%,$613.21M,$1.86M,,"RWK, DON, REGL, RNMC, IJH ",,,,,WisdomTree U.S Mid Cap Index,Earnings,Earnings,MSCI USA Mid Cap Index,0.10%,$5.25B,43.12,1.56,1.42%,12/21/20,543,,,,,,,,,,,,,,,,,,,,,,,,
EZU,iShares MSCI Eurozone ETF,Blackrock,iShares,07/25/00,Open-Ended Fund,0.49%,$4.67B,$210.98M,,"VGK, BBEU, IEUR, FLEE, EURZ ",,,,,MSCI EMU Index -TR,Market Cap,Market Cap,MSCI Europe IMI,0.03%,$64.30B,39.02,1.53,1.13%,12/14/20,252,,,,,,,,,,,,,,,,,,,,,,,,
FAAR,First Trust Alternative Absolute Return Strategy ETF,First Trust,,05/18/16,Open-Ended Fund,0.95%,$52.44M,$459.69K,1.07%,"RPAR, FTLS, CCOR, WTMF, DALT ",,,,,No Underlying Index,Proprietary,Proprietary,N/A,,,,,1.02%,12/24/20,2,,,,,Long/Short Commodities,,,,,,,,,,,,,,,,,,,
FAB,First Trust Multi Cap Value AlphaDEX Fund,First Trust,,05/08/07,Open-Ended Fund,0.70%,$63.75M,$368.85K,,"IUSV, FOVL,  VLUE, QVAL, VLU ",,,,,NASDAQ AlphaDEX Multi Cap Value Index,Tiered,Multi-Factor,MSCI USA IMI Value Index,0.25%,$20.46B,27.93,1.09,1.67%,12/24/20,676,,,,,,,,,,,,,,,,,,,,,,,,
FAD,First Trust Multi Cap Growth AlphaDEX Fund,First Trust,,05/08/07,Open-Ended Fund,0.63%,$189.89M,$616.07K,,"IUSG, BUL, FDG, TAAG, HIPR ",,,,,NASDAQ AlphaDEX Multi Cap Growth Index,Tiered,Multi-Factor,MSCI USA IMI Growth Index,0.28%,$61.58B,129.83,6.44,0.46%,12/24/20,675,,,,,,,,,,,,,,,,,,,,,,,,
FALN,iShares Fallen Angels USD Bond ETF,Blackrock,iShares,06/14/16,Open-Ended Fund,0.25%,$380.04M,$4.27M,0.15%,"ANGL, HYGV, GHYB, WFHY, HYG ",,,,,Bloomberg Barclays US High Yield Fallen Angel 3% Capped Index,Market Value,Credit Downgrade,Bloomberg Barclays US Corporate High Yield Index,,,,,,12/01/20,371,5.88,--,5.30%,,,,,,,,,,,,,,,,,,,,,
FAN,First Trust Global Wind Energy ETF,First Trust,,06/16/08,Open-Ended Fund,0.62%,$308.54M,$4.17M,,"ICLN, QCLN, ACES, SMOG, YLCO ",,,,,ISE Clean Edge Global Wind Energy Index,Tiered,Market Cap,Thomson Reuters Global Renewable Energy,0.10%,$26.14B,31.58,2.28,1.32%,12/24/20,49,,,,,,,,,,,,,,,,,,,,,,,,
FAS,Direxion Daily Financial Bull 3x Shares,Direxion,,11/06/08,Open-Ended Fund,0.99%,$1.92B,,0.05%,UYG ,,,,,Russell 1000 Financial Services,Market Cap,Market Cap,N/A,,,,,0.48%,,,,,,12/22/20,,,,,,,,,,,,,,,,,,,,
FAUG,FT Cboe Vest U.S. Equity Buffer ETF - August,First Trust,,11/06/19,Open-Ended Fund,0.85%,$107.47M,$1.03M,,"SPUC, SPYC, SPD, SECT, DFEB ",,,,,No Underlying Index,Fixed,Fixed,MSCI USA Large Cap Index,0.29%,--,--,--,--,11/23/20,3,,,,,,,,,,,,,,,,,,,,,,,,
FAUS,First Trust Australia AlphaDEX Fund,,,,,,,,,,,,,,,,,,,,,,,,,,,,,,,,,,,,,,,,,,,,,,,,
FAZ,Direxion Daily Financial Bear 3X Shares,Direxion,,11/06/08,Open-Ended Fund,1.07%,$218.70M,,0.07%,"SKF, SEF ",,,,,Russell 1000 Financial Services,Market Cap,Market Cap,N/A,,,,,1.43%,,,,,,12/22/20,,,,,,,,,,,,,,,,,,,,
FBCG,Fidelity Blue Chip Growth ETF,Fidelity,,06/03/20,Open-Ended Fund,0.59%,$139.16M,$3.75M,,"LRGE, TGRW ",,,,,Russell 1000 Growth Index,Proprietary,Proprietary,MSCI ACWI Large Cap Growth Index,0.21%,--,--,--,--,12/18/20,0,,,,,,,,,,,,,,,,,,,,,,,,
FBCV,Fidelity Blue Chip Value ETF,Fidelity,,06/03/20,Open-Ended Fund,0.59%,$27.37M,$806.41K,,N/A ,,,,,No Underlying Index,Proprietary,Proprietary,MSCI ACWI Large Cap Value Index,0.26%,--,--,--,--,12/18/20,0,,,,,,,,,,,,,,,,,,,,,,,,
FBGX,UBS AG FI Enhanced Large Cap Growth ETN,UBS,,06/11/14,Exchange-Traded Note,1.29%,$136.38M,,0.38%,"FLGE, FRLG ",,,,,Russell 1000 Growth,Multi-Factor,Multi-Factor,N/A,,,,,0.00%,,,,,,N/A,,,,,,,,,,,,,,,,,,,,
FBND,Fidelity Total Bond ETF,Fidelity,,10/06/14,Open-Ended Fund,0.36%,$1.64B,$12.42M,0.05%,"FIXD, BOND, TOTL, HTRB, GTO ",,,,,No Underlying Index,Proprietary,Proprietary,Bloomberg Barclays Multiverse,,,,,,11/25/20,"1,386",--,--,--,,,,,,,,,,,,,,,,,,,,,
FBT,First Trust NYSE Arca Biotechnology Index Fund,First Trust,,06/19/06,Open-Ended Fund,0.55%,$1.93B,$11.35M,,"XBI, CNCR, BBC, BBP, GERM ",,,,,NYSE Arca Biotechnology (TR),Equal,Market Cap,Thomson Reuters US Biotechnology & Medical Research,0.08%,$25.08B,-67.30,4.98,0.00%,12/24/20,31,,,,,,,,,,,,,,,,,,,,,,,,
FBZ,First Trust Brazil AlphaDEX Fund,First Trust,,04/18/11,Open-Ended Fund,0.80%,$8.42M,$29.62K,,"EWZ, FLBR ",,,,,NASDAQ AlphaDEX Brazil Index,Tiered,Multi-Factor,MSCI Brazil IMI,1.12%,$9.12B,12.99,1.97,13.50%,12/24/20,51,,,,,,,,,,,,,,,,,,,,,,,,
FCA,First Trust China AlphaDEX Fund,First Trust,,04/18/11,Open-Ended Fund,0.80%,$56.06M,$65.13K,,"MCHI, ASHR, GXC, KBA, CNYA ",,,,,Nasdaq AlphaDEX China Index,Tiered,Multi-Factor,MSCI All China IMI Index,0.92%,$18.51B,9.66,0.91,4.38%,12/24/20,51,,,,,,,,,,,,,,,,,,,,,,,,
FCAL,First Trust California Municipal High Income ETF,First Trust,,06/20/17,Open-Ended Fund,0.50%,$96.44M,$300.09K,0.24%,CMF ,,,,,No Underlying Index,Proprietary,Proprietary,N/A,,,,,,12/24/20,229,6.32,--,2.95%,,,,,,,,,,,,,,,,,,,,,
FCAN,First Trust Canada AlphaDEX Fund,,,,,,,,,,,,,,,,,,,,,,,,,,,,,,,,,,,,,,,,,,,,,,,,
FCEF,First Trust CEF Income Opportunity ETF,First Trust,,09/27/16,Open-Ended Fund,3.21%,$35.66M,,0.56%,"TDSC, DRSK, TAIL, NTSX, TDSB ",,,,,No Underlying Index,Proprietary,Proprietary,N/A,,,,,8.17%,,,,,,12/11/20,,,,,,,,,,,,,,,,,,,,
FCG,First Trust Natural Gas ETF,First Trust,,05/08/07,Open-Ended Fund,0.60%,$115.17M,$4.68M,,N/A ,,,,,ISE-REVERE Natural Gas Index,Equal,Multi-Factor,ISE-REVERE Natural Gas Index,0.15%,$6.41B,-1.56,0.59,3.52%,12/24/20,42,,,,,,,,,,,,,,,,,,,,,,,,
FCOM,Fidelity MSCI Communication Services Index ETF,Fidelity,,10/21/13,Open-Ended Fund,0.08%,$625.09M,$3.28M,,"XLC, VOX, IYZ, XTL, JHCS ",,,,,MSCI USA IMI Telecommunication Services 25/50 Index,Market Cap,Market Cap,Thomson Reuters US Telecom,0.07%,$382.20B,49.66,3.37,0.74%,12/18/20,103,,,,,,,,,,,,,,,,,,,,,,,,
FCOR,Fidelity Corporate Bond ETF,Fidelity,,10/06/14,Open-Ended Fund,0.36%,$241.18M,$1.83M,0.10%,REC ,,,,,No Underlying Index,Proprietary,Proprietary,N/A,,,,,,11/25/20,432,--,--,--,,,,,,,,,,,,,,,,,,,,,
FCPI,Fidelity Stocks for Inflation ETF,Fidelity,,11/05/19,Open-Ended Fund,0.29%,$3.81M,$24.34K,,"DGRW, QDF, TILT, LRGF, QUS ",,,,,Fidelity Stocks for Inflation Factor Index,Tiered,Multi-Factor,MSCI USA IMI,0.29%,$268.58B,17.35,3.48,1.87%,12/18/20,98,,,,,,,,,,,,,,,,,,,,,,,,
FCTR,First Trust Lunt U.S. Factor Rotation ETF,First Trust,,07/25/18,Open-Ended Fund,0.65%,$121.73M,$653.67K,,"RBUS, XRLV, UTRN, LFEQ, VSL ",,,,,Lunt Capital Large Cap Factor Rotation Index,Equal,Technical,MSCI USA Large Cap Index,0.20%,$113.46B,-472.04,3.87,0.70%,12/24/20,150,,,,,,,,,,,,,,,,,,,,,,,,
FCVT,First Trust SSI Strategic Convertible Securities ETF,First Trust,,11/04/15,Open-Ended Fund,0.95%,$285.42M,$3.63M,0.49%,N/A ,,,,,No Underlying Index,Proprietary,Proprietary,N/A,,,,,,12/24/20,125,--,--,--,,,,,,,,,,,,,,,,,,,,,
FDD,First Trust Stoxx European Select Dividend Index Fund,First Trust,,08/27/07,Open-Ended Fund,0.58%,$211.00M,$943.02K,,N/A ,,,,,STOXX Europe Select Dividend 30,Dividends,Dividends,MSCI Europe High Dividend Yield,0.16%,$27.71B,15.37,0.66,3.89%,12/24/20,32,,,,,,,,,,,,,,,,,,,,,,,,
FDEM,Fidelity Targeted Emerging Markets Factor ETF,Fidelity,,02/26/19,Open-Ended Fund,0.45%,$10.23M,$76.24K,,"NUEM, GEM, JHEM, MFEM, EMGF ",,,,,Fidelity Targeted Emerging Markets Factor Index,Proprietary,Proprietary,MSCI Emerging Markets Investable Market Index,0.72%,$113.01B,14.85,1.86,2.11%,12/18/20,199,,,,,,,,,,,,,,,,,,,,,,,,
FDEV,Fidelity Targeted International Factor ETF,Fidelity,,02/26/19,Open-Ended Fund,0.39%,$10.54M,$52.01K,,"NUDM, RODM, GSIE, JPIN, INTF ",,,,,Fidelity Targeted International Factor Index,Proprietary,Proprietary,MSCI World ex USA IMI,0.50%,$45.48B,18.09,2.08,2.52%,12/18/20,205,,,,,,,,,,,,,,,,,,,,,,,,
FDG,American Century Focused Dynamic Growth ETF,American Century Investments,American Century,03/31/20,Open-Ended Fund,0.45%,$191.84M,$2.39M,,"FAD, IUSG, BUL, TAAG, HIPR ",,,,,No Underlying Index,Proprietary,Proprietary,MSCI USA IMI Growth Index,0.13%,--,--,--,--,N/A,37,,,,,,,,,,,,,,,,,,,,,,,,
FDHY,Fidelity High Yield Factor ETF,Fidelity,,06/12/18,Open-Ended Fund,0.45%,$155.32M,$1.68M,0.24%,"FLHY, FJNK ",,,,,No Underlying Index,Proprietary,Proprietary,N/A,,,,,,11/25/20,148,--,--,--,,,,,,,,,,,,,,,,,,,,,
FDIS,Fidelity MSCI Consumer Discretionary Index ETF,Fidelity,,10/21/13,Open-Ended Fund,0.08%,$1.16B,$11.66M,,"XLY, VCR, IYC, PSCD, FXD ",,,,,MSCI USA IMI Consumer Discretionary Index,Market Cap,Market Cap,Thomson Reuters US Cyclicals,0.06%,$604.63B,76.26,9.53,0.68%,12/18/20,258,,,,,,,,,,,,,,,,,,,,,,,,
FDIV,First Trust Strategic Income ETF,First Trust,,08/13/14,Open-Ended Fund,0.87%,$79.03M,,0.25%,"TDSC, DRSK, TAIL, NTSX, TDSB ",,,,,No Underlying Index,Proprietary,Proprietary,N/A,,,,,4.21%,,,,,,12/24/20,,,,,,,,,,,,,,,,,,,,
FDL,First Trust Morningstar Dividend Leaders Index Fund,First Trust,,03/09/06,Open-Ended Fund,0.45%,$1.40B,$8.27M,,"SCHD, HDV, RDIV, WBIY, VYM ",,,,,Morningstar Dividend Leaders TR USD,Dividends,Fundamental,MSCI USA IMI High Yield Dividend Index,0.04%,$109.64B,17.17,1.71,4.46%,12/24/20,100,,,,,,,,,,,,,,,,,,,,,,,,
FDLO,Fidelity Low Volatility Factor ETF,Fidelity,,09/12/16,Open-Ended Fund,0.29%,$387.88M,$2.87M,,"SPLV, USMC, LGLV, JMIN, LSLT ",,,,,Fidelity U.S. Low Volatility Factor Index,Tiered,Multi-Factor,MSCI USA Large Cap Index,0.12%,$236.18B,27.32,4.73,1.47%,12/18/20,127,,,,,,,,,,,,,,,,,,,,,,,,
FDM,First Trust Dow Jones Select MicroCap Index Fund,First Trust,,09/27/05,Open-Ended Fund,0.60%,$120.07M,$966.30K,,"IWC, DWMC ",,,,,DJ Select Micro-Cap,Market Cap,Fundamental,MSCI USA Micro Cap Index,0.18%,$378.47M,74.92,1.21,1.31%,12/24/20,155,,,,,,,,,,,,,,,,,,,,,,,,
FDMO,Fidelity Momentum Factor ETF,Fidelity,,09/12/16,Open-Ended Fund,0.29%,$100.32M,$856.37K,,"NULC, GSLC, SPHD, FLQL, OMFL ",,,,,Fidelity U.S. Momentum Factor Index,Tiered,Multi-Factor,MSCI USA Large Cap Index,0.17%,$439.20B,43.88,6.54,0.93%,12/18/20,125,,,,,,,,,,,,,,,,,,,,,,,,
FDN,First Trust Dow Jones Internet Index Fund,First Trust,,06/19/06,Open-Ended Fund,0.52%,$10.58B,$82.83M,,"PNQI, PXQ, XWEB ",,,,,Dow Jones Internet Composite Index,Market Cap,Market Cap,Thomson Reuters US Internet Services Total Return Index,0.03%,$329.50B,143.34,8.53,0.00%,12/24/20,41,,,,,,,,,,,,,,,,,,,,,,,,
FDNI,First Trust Dow Jones International Internet ETF,First Trust,,11/05/18,Open-Ended Fund,0.65%,$77.50M,$1.22M,,N/A ,,,,,Dow Jones International Internet Index,Market Cap,Market Cap,N/A,0.55%,$196.88B,81.96,6.83,0.72%,12/24/20,41,,,,,,,,,,,,,,,,,,,,,,,,
FDRR,Fidelity Dividend ETF for Rising Rates,Fidelity,,09/12/16,Open-Ended Fund,0.29%,$300.83M,$1.22M,,"QWLD, WLDR, URTH, KLDW, RFDI ",,,,,Fidelity Dividend Index for Rising Rates,Tiered,Multi-Factor,MSCI World IMI,0.18%,$400.06B,26.22,2.74,2.69%,12/18/20,114,,,,,,,,,,,,,,,,,,,,,,,,
FDT,First Trust Developed Markets ex-US AlphaDEX Fund,First Trust,,04/18/11,Open-Ended Fund,0.80%,$354.88M,$3.22M,,"NUDM, RODM, GSIE, JPIN, INTF ",,,,,NASDAQ AlphaDEX Developed Markets Ex-US Index,Tiered,Multi-Factor,MSCI World ex USA IMI,0.23%,$16.41B,25.26,1.20,2.01%,12/24/20,301,,,,,,,,,,,,,,,,,,,,,,,,
FDTS,First Trust Developed Markets ex-US Small Cap AlphaDEX Fund,First Trust,,02/15/12,Open-Ended Fund,0.80%,$8.07M,$45.90K,,"ISCF, SCZ, SCHC, GWX, FNDC ",,,,,NASDAQ AlphaDEX Developed Markets Ex-US Small Cap Index,Tiered,Multi-Factor,MSCI World ex USA Small Cap,0.41%,$1.49B,25.35,0.93,2.34%,12/24/20,403,,,,,,,,,,,,,,,,,,,,,,,,
FDVV,Fidelity High Dividend ETF,Fidelity,,09/12/16,Open-Ended Fund,0.29%,$607.79M,$3.71M,,"FGD, SDIV, DEW, LVL, WDIV ",,,,,Fidelity High Dividend Index,Tiered,Dividends,N/A,0.14%,$316.97B,42.15,1.89,3.37%,12/18/20,107,,,,,,,,,,,,,,,,,,,,,,,,
FEM,First Trust Emerging Markets AlphaDEX Fund,First Trust,,04/18/11,Open-Ended Fund,0.80%,$417.26M,$2.76M,,"NUEM, GEM, JHEM, MFEM, EMGF ",,,,,NASDAQ AlphaDEX Emerging Markets Index,Tiered,Multi-Factor,MSCI Emerging Markets Investable Market Index,0.15%,$10.94B,11.85,1.08,3.24%,12/24/20,151,,,,,,,,,,,,,,,,,,,,,,,,
FEMB,First Trust Emerging Markets Local Currency Bond ETF,First Trust,,11/04/14,Open-Ended Fund,0.85%,$190.82M,$1.95M,0.25%,"EMLC, LEMB, EBND ",,,,,No Underlying Index,Proprietary,Proprietary,Bloomberg Barclays EM Local Currency Government Index,,,,,,12/24/20,54,--,--,--,,,,,,,,,,,,,,,,,,,,,
FEMS,First Trust Emerging Markets Small Cap AlphaDEX Fund,First Trust,,02/15/12,Open-Ended Fund,0.80%,$139.86M,$857.52K,,"EEMS, DGS, EWX ",,,,,NASDAQ AlphaDEX Emerging Markets Small Cap Index,Tiered,Multi-Factor,MSCI Emerging Markets Small Cap Index,0.38%,$1.50B,14.02,0.94,4.20%,12/24/20,203,,,,,,,,,,,,,,,,,,,,,,,,
FENY,Fidelity MSCI Energy Index ETF,Fidelity,,10/24/13,Open-Ended Fund,0.08%,$594.76M,$7.55M,,"XLE, VDE, IYE, PSCE, FXN ",,,,,MSCI USA IMI Energy Index,Market Cap,Market Cap,Thomson Reuters US Energy - Fossil Fuels,0.11%,$67.99B,-4.84,0.92,9.14%,12/18/20,89,,,,,,,,,,,,,,,,,,,,,,,,
FEP,First Trust Europe AlphaDEX Fund,First Trust,,04/18/11,Open-Ended Fund,0.80%,$378.16M,$1.63M,,"EUDG, FEUZ, GSEU, VGK, BBEU ",,,,,NASDAQ AlphaDEX Europe Index,Tiered,Multi-Factor,MSCI Europe IMI,0.22%,$18.22B,23.60,1.38,1.74%,12/24/20,201,,,,,,,,,,,,,,,,,,,,,,,,
FEUL,Credit Suisse FI Enhanced Europe 50 ETN - May 11 - 2028,Credit Suisse Group AG,Credit Suisse,05/11/18,Exchange-Traded Note,2.00%,$14.95M,,2.67%,"FIEE, FLEU, FFEU ",,,,,STOXX Europe 50 Index,Market Cap,Market Cap,N/A,,,,,--,,,,,,N/A,,,,,,,,,,,,,,,,,,,,
FEUZ,First Trust Eurozone AlphaDEX ETF,First Trust,,10/22/14,Open-Ended Fund,0.80%,$26.14M,$96.78K,,"FEP, EUDG, GSEU, VGK, BBEU ",,,,,NASDAQ AlphaDEX Eurozone Index,Tiered,Multi-Factor,MSCI Europe IMI,1.09%,$19.91B,26.94,1.16,1.37%,12/24/20,150,,,,,,,,,,,,,,,,,,,,,,,,
FEX,First Trust Large Cap Core AlphaDEX Fund,First Trust,,05/08/07,Open-Ended Fund,0.59%,$986.68M,$2.63M,,"NULC, GSLC, SPHD, FLQL, OMFL ",,,,,NASDAQ AlphaDEX Large Cap Core Index,Tiered,Multi-Factor,MSCI USA Large Cap Index,0.05%,$78.29B,30.53,2.31,1.26%,12/24/20,377,,,,,,,,,,,,,,,,,,,,,,,,
FEZ,SPDR Euro STOXX 50 ETF,State Street Global Advisors,SPDR,10/15/02,Open-Ended Fund,0.29%,$1.85B,$135.16M,,"IEV, OEUR ",,,,,EURO STOXX 50,Market Cap,Market Cap,MSCI Europe Large Cap,0.03%,$94.61B,38.20,1.75,1.82%,12/21/20,53,,,,,,,,,,,,,,,,,,,,,,,,
FFEB,FT Cboe Vest U.S. Equity Buffer ETF - February,First Trust,,02/21/20,Open-Ended Fund,0.85%,$226.67M,$2.07M,,"SPUC, SPYC, SPD, SECT, DFEB ",,,,,No Underlying Index,Fixed,Fixed,MSCI USA Large Cap Index,0.43%,--,--,--,--,12/24/20,2,,,,,,,,,,,,,,,,,,,,,,,,
FFEU,Barclays ETN+ FI Enhanced Europe 50 ETN Series C,Barclays Capital Inc.,Barclays,03/15/18,Exchange-Traded Note,1.05%,$2.51M,,1.12%,"FIEE, FLEU, FEUL ",,,,,STOXX Europe 50 Index,Market Cap,Market Cap,N/A,,,,,--,,,,,,N/A,,,,,,,,,,,,,,,,,,,,
FFHG,FormulaFolios Hedged Growth ETF,Al Marketing LLC,FormulaFolios,06/06/17,Open-Ended Fund,1.17%,$52.34M,,0.39%,"TDSC, DRSK, TAIL, NTSX, TDSB ",,,,,No Underlying Index,Proprietary,Proprietary,N/A,,,,,0.85%,,,,,,N/A,,,,,,,,,,,,,,,,,,,,
FFIU,UVA Unconstrained Medium-Term Fixed Income ETF,OBP Capital LLC,Fieldstone,08/21/17,Open-Ended Fund,0.51%,$77.56M,$174.11K,0.37%,N/A ,,,,,No Underlying Index,Proprietary,Proprietary,N/A,,,,,,N/A,188,--,--,--,,,,,,,,,,,,,,,,,,,,,
FFR,First Trust FTSE EPRA/NAREIT Developed Markets Real Estate,First Trust,,08/27/07,Open-Ended Fund,0.60%,$29.83M,$200.34K,,N/A ,,,,,FTSE EPRA/NAREIT Developed Index,Market Cap,Market Cap,Thomson Reuters G7 Real Estate,0.22%,$15.51B,36.18,1.23,4.57%,12/24/20,342,,,,,,,,,,,,,,,,,,,,,,,,
FFSG,FormulaFolios Smart Growth ETF,Al Marketing LLC,FormulaFolios,10/31/17,Open-Ended Fund,0.70%,$44.87M,$345.53K,,"WBIE, CACG, PLAT, GXTG, TCHP ",,,,,No Underlying Index,Proprietary,Proprietary,MSCI ACWI IMI Growth Index,0.43%,$194.91B,53.59,2.27,0.98%,N/A,7,,,,,,,,,,,,,,,,,,,,,,,,
FFTG,FormulaFolios Tactical Growth ETF,Al Marketing LLC,FormulaFolios,10/31/17,Open-Ended Fund,1.12%,$53.03M,,0.31%,"TDSC, DRSK, TAIL, NTSX, TDSB ",,,,,No Underlying Index,Proprietary,Proprietary,N/A,,,,,0.92%,,,,,,N/A,,,,,,,,,,,,,,,,,,,,
FFTI,FormulaFolios Tactical Income ETF,Al Marketing LLC,FormulaFolios,06/06/17,Open-Ended Fund,1.04%,$222.64M,$1.21M,0.24%,"FIXD, BOND, TOTL, FBND, HTRB ",,,,,No Underlying Index,Proprietary,Proprietary,Bloomberg Barclays Multiverse,,,,,,N/A,0,--,--,--,,,,,,,,,,,,,,,,,,,,,
FFTY,Innovator IBD 50 ETF,Innovator,,04/09/15,Open-Ended Fund,0.80%,$192.08M,$2.71M,,"DGRW, QDF, TILT, LRGF, LVHD ",,,,,IBD 50 Index,Tiered,Multi-Factor,MSCI USA IMI,0.07%,$143.25B,22.46,5.84,0.21%,N/A,51,,,,,,,,,,,,,,,,,,,,,,,,
FGD,First Trust Dow Jones Global Select Dividend Index Fund,First Trust,,11/21/07,Open-Ended Fund,0.59%,$387.49M,$1.97M,,"SDIV, DEW, WDIV, VWID ",,,,,Dow Jones Global Select Dividend Index,Dividends,Fundamental,MSCI ACWI High Dividend Yield Index,0.15%,$18.74B,18.60,0.72,5.96%,12/24/20,97,,,,,,,,,,,,,,,,,,,,,,,,
FGM,First Trust Germany AlphaDEX Fund,First Trust,,02/14/12,Open-Ended Fund,0.80%,$77.97M,$263.53K,,"EWG, ZDEU, FLGR, HEWG, DXGE ",,,,,Nasdaq AlphaDEX Germany Index,Tiered,Multi-Factor,MSCI Germany IMI,0.87%,$18.61B,22.38,1.18,0.94%,12/24/20,40,,,,,,,,,,,,,,,,,,,,,,,,
FHK,First Trust Hong Kong AlphaDEX Fund,,,,,,,,,,,,,,,,,,,,,,,,,,,,,,,,,,,,,,,,,,,,,,,,
FHLC,Fidelity MSCI Health Care Index ETF,Fidelity,,10/21/13,Open-Ended Fund,0.08%,$2.21B,$10.90M,,"XLV, VHT, IYH, PSCH, FXH ",,,,,MSCI USA IMI Health Care Index,Market Cap,Market Cap,Thomson Reuters US Healthcare,0.07%,$126.08B,37.74,4.64,1.27%,12/18/20,394,,,,,,,,,,,,,,,,,,,,,,,,
FIBR,iShares Edge U.S. Fixed Income Balanced Risk ETF,Blackrock,iShares,02/24/15,Open-Ended Fund,0.25%,$132.67M,$574.46K,0.15%,"BYLD, IUSB, AGGP, WBIN, TGIF ",,,,,Bloomberg Barclays U.S. Fixed Income Balanced Risk Index,Multi-Factor,Market Value,Bloomberg Barclays U.S. Universal Index,,,,,,12/01/20,734,2.53,--,1.78%,,,,,,,,,,,,,,,,,,,,,
FID,First Trust S&P International Dividend Aristocrats ETF,First Trust,,08/23/13,Open-Ended Fund,0.60%,$21.79M,$80.48K,,"DWX, HDAW, VYMI ",,,,,S&P International Dividend Aristocrats Index,Dividends,Dividends,MSCI ACWI Ex-USA High Dividend Yield,0.42%,$17.84B,15.91,1.03,4.17%,12/24/20,61,,,,,,,,,,,,,,,,,,,,,,,,
FIDI,Fidelity International High Dividend ETF,Fidelity,,01/16/18,Open-Ended Fund,0.39%,$54.72M,$556.88K,,"IDV, DTH, HDEF, EFAS, IDY ",,,,,Fidelity International High Dividend Index,Tiered,Fundamental,MSCI World ex USA High Dividend Yield,0.22%,$52.12B,31.20,0.83,3.52%,12/18/20,80,,,,,,,,,,,,,,,,,,,,,,,,
FIDU,Fidelity MSCI Industrials Index ETF,Fidelity,,10/21/13,Open-Ended Fund,0.08%,$514.87M,$3.85M,,"XLI, VIS, IYJ, PSCI, AMER ",,,,,MSCI USA IMI Industrials Index,Market Cap,Market Cap,Thomson Reuters US Industrials,0.07%,$49.37B,34.10,4.21,1.41%,12/18/20,331,,,,,,,,,,,,,,,,,,,,,,,,
