IQLT,iShares MSCI Intl Quality Factor ETF,Blackrock,iShares,01/13/15,Open-Ended Fund,0.30%,$2.37B,$18.09M,,"PXF, TLTD, IQIN, IDHQ, ICOW ",,,,,MSCI World ex USA Sector Neutral Quality Index,Fundamental,Fundamental,MSCI World ex USA IMI,0.06%,$73.77B,27.20,2.71,1.78%,12/14/20,299,,,,,,,,,,,,,,,,,,,,,,,,
IQM,Franklin Intelligent Machines ETF,Franklin Templeton,Franklin,02/25/20,Open-Ended Fund,0.50%,$3.86M,$107.33K,,"BTEK, ARKF, IXN, CIBR, CLOU ",,,,,No Underlying Index,Proprietary,Proprietary,Thomson Reuters Global Technology,0.23%,$192.64B,72.52,8.79,--,12/14/20,65,,,,,,,,,,,,,,,,,,,,,,,,
IQSI,IQ Candriam ESG International Equity ETF,New York Life,IndexIQ,12/17/19,Open-Ended Fund,0.15%,$119.85M,$411.06K,,"ESGG, URTH, FDRR, KLDW, RFDI ",,,,,IQ Candriam ESG International Equity Index,Market Cap,Principles-based,MSCI World IMI,0.13%,$70.59B,29.45,1.65,--,12/30/20,569,,,,,,,,,,,,,,,,,,,,,,,,
IQSU,IQ Candriam ESG U.S. Equity ETF,New York Life,IndexIQ,12/17/19,Open-Ended Fund,0.09%,$284.30M,$2.86M,,"ESGU, USSG, SUSL, DSI, ESGV ",,,,,IQ Candriam ESG US Equity Index,Market Cap,Principles-based,MSCI USA IMI,0.12%,$560.73B,33.99,5.20,--,12/30/20,302,,,,,,,,,,,,,,,,,,,,,,,,
IRBO,iShares Robotics and Artificial Intelligence Multisector ETF,Blackrock,iShares,06/26/18,Open-Ended Fund,0.47%,$228.79M,$1.98M,,"ROBO, ROBT, BOTZ, AIQ, ARKQ ",,,,,NYSE FactSet Global Robotics and Artificial Intelligence Index,Equal,Market Cap,N/A,0.33%,$123.10B,81.60,3.21,0.29%,12/14/20,103,,,,,,,,,,,,,,,,,,,,,,,,
ISCF,iShares MSCI Intl Small-Cap Multifactor ETF,Blackrock,iShares,04/28/15,Open-Ended Fund,0.40%,$148.53M,$408.60K,,"FDTS, SCZ, SCHC, GWX, FNDC ",,,,,MSCI World ex USA Small Cap Diversified Multiple-Factor Index,Multi-Factor,Multi-Factor,MSCI World ex USA Small Cap,0.31%,$2.02B,19.23,1.25,2.53%,12/14/20,697,,,,,,,,,,,,,,,,,,,,,,,,
ISDX,Invesco RAFI Strategic Developed ex-US ETF,Invesco,,09/12/18,Open-Ended Fund,0.23%,$278.61M,$290.28K,,"FNDF, DOL, IDOG, DOO, BKIE ",,,,,Invesco Strategic Developed ex-U.S. Index,Fundamental,Fundamental,MSCI World ex USA Large Cap,0.21%,$50.11B,-41.33,1.12,1.74%,12/21/20,863,,,,,,,,,,,,,,,,,,,,,,,,
ISEM,Invesco RAFI Strategic Emerging Markets ETF,Invesco,,09/12/18,Open-Ended Fund,0.35%,$22.06M,$35.69K,,"FNDE, EDOG, BKEM, ADRE, CEZ ",,,,,Invesco Strategic Emerging Markets Index,Fundamental,Fundamental,MSCI Emerging Markets Large Cap,0.24%,$116.27B,76.66,0.91,1.25%,12/21/20,400,,,,,,,,,,,,,,,,,,,,,,,,
ISHG,iShares 1-3 Year International Treasury Bond ETF,Blackrock,iShares,01/21/09,Open-Ended Fund,0.35%,$58.00M,$181.33K,0.16%,N/A ,,,,,FTSE World Government Bond Index  Developed Markets 1-3 Years Capped Select Index,Market Value,Market Value,Bloomberg Barclays 1-3 Year Global Treasury ex-U.S. Capped Index,,,,,,12/01/20,111,--,--,--,,,,,,,,,,,,,,,,,,,,,
ISMD,Inspire Small/Mid Cap Impact ETF,Inspire,,02/28/17,Open-Ended Fund,0.60%,$88.91M,$991.10K,,"VXF, SMMD, PRFZ, FSMD, HSMV ",,,,,Inspire Small/Mid Cap Impact Equal Weight Index,Equal,Principles-based,MSCI USA SMID Cap Index,0.38%,$1.86B,-9.45,1.48,1.07%,N/A,301,,,,,,,,,,,,,,,,,,,,,,,,
ISRA,VanEck Vectors Israel ETF,VanEck,,06/25/13,Open-Ended Fund,0.62%,$69.39M,$159.01K,,EIS ,,,,,BlueStar Israel Global Index,Market Cap,Committee,MSCI Israel IMI,1.68%,$7.19B,44.00,1.88,1.20%,12/21/20,143,,,,,,,,,,,,,,,,,,,,,,,,
ISTB,iShares Core 1-5 Year USD Bond ETF,Blackrock,iShares,10/18/12,Open-Ended Fund,0.06%,$4.72B,$22.52M,0.04%,"FTSM, USTB, LSST, LDSF ",,,,,Bloomberg Barclays US Universal 1-5 Year Index,Market Value,Market Value,Bloomberg Barclays US Universal 1-5 Year Index,,,,,,12/01/20,"4,742",--,--,--,,,,,,,,,,,,,,,,,,,,,
ISZE,iShares MSCI Intl Size Factor ETF,Blackrock,iShares,06/16/15,Open-Ended Fund,0.30%,$28.70M,$16.28K,,"EFAV, IDLV, RNDM, VEA, IEFA ",,,,,MSCI World ex USA Low Size Index,Volatility,Market Cap,MSCI World ex USA IMI,0.50%,$19.49B,38.64,1.27,1.08%,12/14/20,967,,,,,,,,,,,,,,,,,,,,,,,,
ITA,iShares U.S. Aerospace & Defense ETF,Blackrock,iShares,05/01/06,Open-Ended Fund,0.42%,$3.02B,$30.32M,,"PPA, XAR, FITE, ROKT ",,,,,DJ US Select / Aerospace & Defense,Market Cap,Market Cap,Thomson Reuters US Aerospace & Defense,0.05%,$52.83B,37.36,3.41,1.71%,12/14/20,37,,,,,,,,,,,,,,,,,,,,,,,,
ITB,iShares U.S. Home Construction ETF,Blackrock,iShares,05/01/06,Open-Ended Fund,0.42%,$2.11B,$202.85M,,"XHB, HOMZ ",,,,,DJ US Select / Home Construction,Market Cap,Market Cap,Thomson Reuters US Homebuilding,0.02%,$33.22B,17.49,2.68,0.42%,12/14/20,48,,,,,,,,,,,,,,,,,,,,,,,,
ITEQ,BlueStar Israel Technology ETF,ETFMG,BlueStar,11/02/15,Open-Ended Fund,0.75%,$143.64M,$1.07M,,IZRL ,,,,,TASE-BlueStar Israel Global Technology Index,Market Cap,Committee,MSCI Israel Information Technology Index,0.09%,$7.33B,199.31,4.75,0.02%,12/14/20,63,,,,,,,,,,,,,,,,,,,,,,,,
ITM,VanEck Vectors AMT-Free Intermediate Municipal Index ETF,VanEck,,12/04/07,Open-Ended Fund,0.24%,$1.73B,$4.11M,0.11%,"IBMK, IBMJ, IBML, IBMM, IBMN ",,,,,Bloomberg Barclays AMT-Free Intermediate Continuous Municipal Index,Market Value,AMT-Free,N/A,,,,,,12/01/20,"2,484",6.17,--,2.25%,,,,,,,,,,,,,,,,,,,,,
ITOT,iShares Core S&P Total U.S. Stock Market ETF,Blackrock,iShares,01/20/04,Open-Ended Fund,0.03%,$30.81B,$101.76M,,"VTI, SCHB, IWV, SPTM, IYY ",,,,,S&P Total Market Index,Market Cap,Committee,MSCI USA IMI,0.01%,$382.87B,45.95,3.55,1.59%,12/14/20,"3,552",,,,,,,,,,,,,,,,,,,,,,,,
IUS,Invesco RAFI Strategic US ETF,Invesco,,09/12/18,Open-Ended Fund,0.19%,$156.77M,$348.79K,,"FTCS, FNDX, PRF, SPHQ, RDVY ",,,,,Invesco Strategic U.S. Index,Fundamental,Fundamental,MSCI USA Large Cap Index,0.11%,$297.88B,-96.78,2.48,1.31%,12/21/20,553,,,,,,,,,,,,,,,,,,,,,,,,
IUSB,iShares Core Total USD Bond Market ETF,Blackrock,iShares,06/10/14,Open-Ended Fund,0.06%,$5.95B,$27.31M,0.03%,"FIBR, BYLD, AGGP, WBIN, TGIF ",,,,,Bloomberg Barclays U.S. Universal Index,Market Value,Market Value,Bloomberg Barclays U.S. Universal Index,,,,,,12/01/20,"10,808",5.83,--,1.60%,,,,,,,,,,,,,,,,,,,,,
IUSG,iShares Core S&P U.S. Growth ETF,Blackrock,iShares,07/24/00,Open-Ended Fund,0.04%,$9.89B,$34.19M,,"FAD, BUL, FDG, TAAG, HIPR ",,,,,S&P 900 Growth Index,Market Cap,Multi-Factor,MSCI USA IMI Growth Index,0.03%,$626.88B,37.36,7.55,1.18%,12/14/20,530,,,,,,,,,,,,,,,,,,,,,,,,
IUSS,Invesco RAFI Strategic US Small Company ETF,Invesco,,09/12/18,Open-Ended Fund,0.23%,$34.97M,$63.40K,,"FNDA, EES, RWJ, CALF, XSHQ ",,,,,Invesco Strategic U.S. Small Company Index,Fundamental,Fundamental,MSCI USA Small Cap Index,0.29%,$5.13B,-6.82,1.70,0.70%,12/21/20,"1,203",,,,,,,,,,,,,,,,,,,,,,,,
IUSV,iShares Core S&P U.S. Value ETF,Blackrock,iShares,07/24/00,Open-Ended Fund,0.04%,$7.38B,$37.65M,,"FAB,  FOVL, VLUE, QVAL, VLU ",,,,,S&P 900 Value Index,Multi-Factor,Multi-Factor,MSCI USA IMI Value Index,0.03%,$122.41B,31.04,1.99,2.40%,12/14/20,681,,,,,,,,,,,,,,,,,,,,,,,,
IVAL,Alpha Architect International Quantitative Value ETF,EMPIRICAL FINANCE LLC,Alpha Architect,12/17/14,Open-Ended Fund,0.59%,$100.65M,$444.01K,,"EFV, IVLU, FIVA, DMDV ",,,,,Alpha Architect International Quantitative Value Index,Equal,Proprietary,MSCI World ex USA IMI Value,0.21%,$12.71B,13.67,1.04,2.24%,N/A,47,,,,,,,,,,,,,,,,,,,,,,,,
IVE,iShares S&P 500 Value ETF,Blackrock,iShares,05/22/00,Open-Ended Fund,0.18%,$18.14B,$98.55M,,"SPYV, VOOV, RPV, FVAL, SPVU ",,,,,S&P 500 Value Index,Market Cap,Fundamental,MSCI USA Large Cap Value,0.02%,$130.24B,29.78,2.06,2.37%,12/14/20,388,,,,,,,,,,,,,,,,,,,,,,,,
IVES,Wedbush ETFMG Global Cloud Technology ETF,ETFMG,ETF Managers Group,03/08/16,Open-Ended Fund,0.68%,$50.22M,$163.86K,,"TDIV, IXN, CIBR, CLOU, IPAY ",,,,,Dan Ives Global Cloud Technology Prime Index,Proprietary,Revenue,Thomson Reuters Global Technology,0.76%,$7.94B,-173.98,5.21,0.49%,12/14/20,66,,,,,,,,,,,,,,,,,,,,,,,,
IVLU,iShares MSCI Intl Value Factor ETF,Blackrock,iShares,06/16/15,Open-Ended Fund,0.30%,$545.32M,$2.43M,,"IVAL, EFV, FIVA, DMDV ",,,,,MSCI World ex USA Enhanced Value Index,Fundamental,Fundamental,MSCI World ex USA IMI Value,0.26%,$44.52B,30.69,0.73,2.55%,12/14/20,332,,,,,,,,,,,,,,,,,,,,,,,,
IVOG,Vanguard S&P Mid-Cap 400 Growth ETF,Vanguard,,09/09/10,Open-Ended Fund,0.15%,$783.01M,$4.29M,,"IJK, NUMG, IWP, VOT, MDYG ",,,,,S&P Mid Cap 400 Growth,Market Cap,Fundamental,MSCI USA Mid Cap Growth Index,0.12%,$7.02B,44.87,3.63,1.01%,N/A,246,,,,,,,,,,,,,,,,,,,,,,,,
IVOL,Quadratic Interest Rate Volatility and Inflation Hedge ETF,CICC,Quadratic,05/13/19,Open-Ended Fund,0.99%,$816.64M,$12.75M,0.06%,"SPIP, TIP, SCHP, TIPZ, GTIP ",,,,,No Underlying Index,Proprietary,Proprietary,Bloomberg Barclays US Treasury Inflation Protected Notes (TIPS),,,,,,N/A,3,--,--,--,,,,,,,,,,,,,,,,,,,,,
IVOO,Vanguard S&P Mid-Cap 400 ETF,Vanguard,,09/09/10,Open-Ended Fund,0.10%,$1.06B,$4.70M,,"IJH, MDY, VO, IWR, SCHM ",,,,,S&P Mid Cap 400,Market Cap,Committee,MSCI USA Mid Cap Index,0.08%,$5.99B,56.74,2.12,1.24%,N/A,402,,,,,,,,,,,,,,,,,,,,,,,,
IVOV,Vanguard S&P Mid-Cap 400 Value ETF,Vanguard,,09/09/10,Open-Ended Fund,0.15%,$524.48M,$3.36M,,"IJJ, MDYV, RFV, NUMV, IWS ",,,,,S&P Mid Cap 400 Value,Market Cap,Fundamental,MSCI USA Mid Cap Value Index,0.08%,$4.67B,86.60,1.38,1.75%,N/A,295,,,,,,,,,,,,,,,,,,,,,,,,
IVV,iShares Core S&P 500 ETF,Blackrock,iShares,05/15/00,Open-Ended Fund,0.03%,$235.41B,$1.25B,,"SPY, VOO, IWB, SCHX, VV ",,,,,S&P 500,Market Cap,Committee,MSCI USA Large Cap Index,0.01%,$455.46B,33.85,3.78,1.74%,12/14/20,507,,,,,,,,,,,,,,,,,,,,,,,,
IVW,iShares S&P 500 Growth ETF,Blackrock,iShares,05/22/00,Open-Ended Fund,0.18%,$31.17B,$117.74M,,"VOOG, SPYG, RPG, NULG, VUG ",,,,,S&P 500 Growth,Market Cap,Fundamental,MSCI USA Large Cap Growth Index,0.03%,$660.90B,37.02,8.02,1.11%,12/14/20,284,,,,,,,,,,,,,,,,,,,,,,,,
IWB,iShares Russell 1000 ETF,Blackrock,iShares,05/15/00,Open-Ended Fund,0.15%,$25.12B,$107.25M,,"VONE, SPY, IVV, VOO, SCHX ",,,,,Russell 1000,Market Cap,Market Cap,MSCI USA Large Cap Index,0.03%,$408.79B,37.82,3.75,1.44%,12/14/20,"1,013",,,,,,,,,,,,,,,,,,,,,,,,
IWC,iShares Micro-Cap ETF,Blackrock,iShares,08/12/05,Open-Ended Fund,0.60%,$903.73M,$3.46M,,"FDM, DWMC ",,,,,Russell Microcap,Market Cap,Market Cap,MSCI USA Micro Cap Index,0.24%,$660.38M,-9.67,1.59,1.04%,12/14/20,"1,258",,,,,,,,,,,,,,,,,,,,,,,,
IWD,iShares Russell 1000 Value ETF,Blackrock,iShares,05/22/00,Open-Ended Fund,0.19%,$42.19B,$315.28M,,"VONV, VTV, SCHV, MGV, IWX ",,,,,Russell 1000 Value,Multi-Factor,Multi-Factor,MSCI USA Large Cap Value,0.02%,$121.18B,33.08,2.12,2.51%,12/14/20,850,,,,,,,,,,,,,,,,,,,,,,,,
IWF,iShares Russell 1000 Growth ETF,Blackrock,iShares,05/22/00,Open-Ended Fund,0.19%,$61.03B,$329.12M,,"VONG, VUG, SCHG, MGK, IWY ",,,,,Russell 1000 Growth,Multi-Factor,Multi-Factor,MSCI USA Large Cap Growth Index,0.02%,$664.55B,43.38,11.83,0.73%,12/14/20,447,,,,,,,,,,,,,,,,,,,,,,,,
IWL,iShares Russell Top 200 ETF,Blackrock,iShares,09/22/09,Open-Ended Fund,0.15%,$915.41M,$6.71M,,"SPY, IVV, VOO, IWB, SCHX ",,,,,Russell Top 200,Market Cap,Market Cap,MSCI USA Large Cap Index,0.04%,$539.17B,31.59,4.25,1.50%,12/14/20,196,,,,,,,,,,,,,,,,,,,,,,,,
IWM,iShares Russell 2000 ETF,Blackrock,iShares,05/22/00,Open-Ended Fund,0.19%,$51.31B,$3.89B,,"VTWO, IJR, VB, SCHA, SPSM ",,,,,Russell 2000 Index,Market Cap,Market Cap,MSCI USA Small Cap Index,0.01%,$2.50B,-25.90,1.94,1.12%,12/14/20,"2,011",,,,,,,,,,,,,,,,,,,,,,,,
IWN,iShares Russell 2000 Value ETF,Blackrock,iShares,07/24/00,Open-Ended Fund,0.24%,$11.23B,$194.54M,,"VTWV, VBR, JKL, XSVM, FYT ",,,,,Russell 2000 Value Index,Multi-Factor,Multi-Factor,MSCI USA Small Cap Value Index,0.05%,$1.92B,-16.40,1.16,1.78%,12/14/20,"1,454",,,,,,,,,,,,,,,,,,,,,,,,
IWO,iShares Russell 2000 Growth ETF,Blackrock,iShares,07/24/00,Open-Ended Fund,0.24%,$10.88B,$96.19M,,"VTWG, VBK, JKK, FYC, IJT ",,,,,Russell 2000 Growth Index,Multi-Factor,Multi-Factor,MSCI USA Small Cap Growth Index,0.09%,$3.01B,-54.82,4.87,0.56%,12/14/20,"1,093",,,,,,,,,,,,,,,,,,,,,,,,
IWP,iShares Russell Mid-Cap Growth ETF,Blackrock,iShares,07/17/01,Open-Ended Fund,0.24%,$14.16B,$67.46M,,"NUMG, VOT, IJK, MDYG, JKH ",,,,,Russell Midcap Growth,Multi-Factor,Multi-Factor,MSCI USA Mid Cap Growth Index,0.05%,$20.23B,73.02,10.87,0.46%,12/14/20,342,,,,,,,,,,,,,,,,,,,,,,,,
IWR,iShares Russell Mid-Cap ETF,Blackrock,iShares,07/17/01,Open-Ended Fund,0.19%,$23.77B,$75.86M,,"IJH, VO, MDY, SCHM, SPMD ",,,,,Russell Midcap,Market Cap,Market Cap,MSCI USA Mid Cap Index,0.02%,$17.21B,95.05,2.78,1.38%,12/14/20,819,,,,,,,,,,,,,,,,,,,,,,,,
IWS,iShares Russell Mid-Cap Value ETF,Blackrock,iShares,07/17/01,Open-Ended Fund,0.24%,$11.60B,$46.63M,,"VOE, JKI, XMVM, FNK, NUMV ",,,,,Russell Midcap Value,Multi-Factor,Multi-Factor,MSCI USA Mid Cap Value Index,0.03%,$15.51B,114.17,1.95,2.03%,12/14/20,696,,,,,,,,,,,,,,,,,,,,,,,,
IWV,iShares Russell 3000 ETF,Blackrock,iShares,05/22/00,Open-Ended Fund,0.20%,$10.45B,$39.32M,,"VTHR, VTI, ITOT, SCHB, SPTM ",,,,,Russell 3000,Market Cap,Market Cap,MSCI USA IMI,0.04%,$385.86B,43.64,3.56,1.38%,12/14/20,"2,845",,,,,,,,,,,,,,,,,,,,,,,,
IWX,iShares Russell Top 200 Value ETF,Blackrock,iShares,09/22/09,Open-Ended Fund,0.20%,$900.41M,$6.82M,,"VTV, IWD, SCHV, MGV, VONV ",,,,,Russell Top 200 Value,Multi-Factor,Multi-Factor,MSCI USA Large Cap Value,0.04%,$175.04B,24.36,2.22,2.54%,12/14/20,155,,,,,,,,,,,,,,,,,,,,,,,,
IWY,iShares Russell Top 200 Growth ETF,Blackrock,iShares,09/22/09,Open-Ended Fund,0.20%,$3.29B,$24.73M,,"VUG, IWF, SCHG, MGK, VONG ",,,,,Russell Top 200 Growth,Multi-Factor,Multi-Factor,MSCI USA Large Cap Growth Index,0.03%,$797.91B,40.06,12.04,0.75%,12/14/20,108,,,,,,,,,,,,,,,,,,,,,,,,
IXC,iShares Global Energy ETF,Blackrock,iShares,11/12/01,Open-Ended Fund,0.46%,$947.74M,$15.46M,,ECLN ,,,,,S&P Global 1200 Energy Sector Index,Market Cap,Committee,Thomson Reuters Global Energy - Fossil Fuels,0.06%,$64.27B,-7.31,0.87,8.77%,12/14/20,61,,,,,,,,,,,,,,,,,,,,,,,,
IXG,iShares Global Financials ETF,Blackrock,iShares,11/12/01,Open-Ended Fund,0.46%,$313.27M,$1.25M,,"DFNL, GFIN ",,,,,S&P Global 1200 Financials Sector Index,Market Cap,Committee,Thomson Reuters Global Financials,0.17%,$106.05B,13.98,0.91,2.51%,12/14/20,195,,,,,,,,,,,,,,,,,,,,,,,,
IXJ,iShares Global Healthcare ETF,Blackrock,iShares,11/13/01,Open-Ended Fund,0.46%,$2.35B,$9.49M,,"GDNA, HTEC, EDOC, BMED ",,,,,S&P Global 1200 Healthcare Sector Index,Market Cap,Committee,Thomson Reuters Global Healthcare,0.10%,$138.42B,28.18,4.28,1.38%,12/14/20,113,,,,,,,,,,,,,,,,,,,,,,,,
IXN,iShares Global Tech ETF,Blackrock,iShares,11/12/01,Open-Ended Fund,0.46%,$4.60B,$20.49M,,"CIBR, CLOU, IPAY, FINX, SNSR ",,,,,S&P Global 1200 Information Technology Sector Index,Market Cap,Committee,Thomson Reuters Global Technology,0.10%,$755.37B,34.26,6.68,0.76%,12/14/20,124,,,,,,,,,,,,,,,,,,,,,,,,
IXP,iShares Global Comm Services ETF,Blackrock,iShares,11/12/01,Open-Ended Fund,0.46%,$338.75M,$1.18M,,"NXTG, FIVG, WUGI ",,,,,S&P Global 1200 Communication Services 4.5/22.5/45 Capped Index,Market Cap,Committee,Thomson Reuters Global Telecom,0.23%,$417.76B,31.18,2.94,1.02%,12/14/20,73,,,,,,,,,,,,,,,,,,,,,,,,
IXSE,WisdomTree India ex-State-Owned Enterprises Fund,WisdomTree,,04/04/19,Open-Ended Fund,0.58%,$2.69M,$15.61K,,"EPI, INDA, FLIN ",,,,,WisdomTree India ex-State-Owned Enterprises Index,Market Cap,Principles-based,MSCI India IMI,0.16%,$57.09B,47.15,3.36,0.11%,12/21/20,116,,,,,,,,,,,,,,,,,,,,,,,,
IXUS,iShares Core MSCI Total International Stock ETF,Blackrock,iShares,10/18/12,Open-Ended Fund,0.09%,$24.06B,$78.48M,,"VXUS, VEU, ACWX, CWI, DBAW ",,,,,MSCI ACWI ex USA IMI Index -TR net,Market Cap,Market Cap,MSCI ACWI ex USA IMI Index -TR net,0.02%,$84.30B,28.60,1.57,2.33%,12/14/20,"4,292",,,,,,,,,,,,,,,,,,,,,,,,
IYC,iShares U.S. Consumer Services ETF,Blackrock,iShares,06/12/00,Open-Ended Fund,0.43%,$1.19B,$5.69M,,"XLY, VCR, FDIS, PSCD, FXD ",,,,,Dow Jones U.S. Consumer Services Capped Index,Market Cap,Market Cap,Thomson Reuters US Cyclicals,0.06%,$270.11B,68.24,6.68,0.69%,12/14/20,134,,,,,,,,,,,,,,,,,,,,,,,,
IYE,iShares U.S. Energy ETF,Blackrock,iShares,06/12/00,Open-Ended Fund,0.42%,$516.26M,$37.42M,,"XLE, VDE, FENY, PSCE, FXN ",,,,,DJ Global United States (All) / Oil & Gas -IND,Market Cap,Market Cap,Thomson Reuters US Energy - Fossil Fuels,0.06%,$71.00B,-5.55,0.96,9.83%,12/14/20,38,,,,,,,,,,,,,,,,,,,,,,,,
IYF,iShares U.S. Financials ETF,Blackrock,iShares,05/22/00,Open-Ended Fund,0.42%,$1.39B,$18.43M,,"XLF, VFH, FNCL, PSCF, LEND ",,,,,Dow Jones U.S. Financials Capped Index,Market Cap,Market Cap,Thomson Reuters US Financials,0.03%,$139.19B,20.38,1.53,1.78%,12/14/20,232,,,,,,,,,,,,,,,,,,,,,,,,
IYG,iShares U.S. Financial Services ETF,Blackrock,iShares,06/12/00,Open-Ended Fund,0.42%,$1.17B,$29.16M,,N/A ,,,,,Dow Jones U.S. Financial Services Index,Market Cap,Market Cap,Thomson Reuters US Banking Services,0.04%,$157.31B,17.01,1.55,1.67%,12/14/20,103,,,,,,,,,,,,,,,,,,,,,,,,
IYH,iShares U.S. Healthcare ETF,Blackrock,iShares,06/12/00,Open-Ended Fund,0.43%,$2.39B,$8.52M,,"XLV, VHT, FHLC, PSCH, FXH ",,,,,DJ Global United States (All) / Health Care -IND,Market Cap,Market Cap,Thomson Reuters US Healthcare,0.04%,$136.80B,29.06,4.63,1.17%,12/14/20,123,,,,,,,,,,,,,,,,,,,,,,,,
IYJ,iShares U.S. Industrials ETF,Blackrock,iShares,06/12/00,Open-Ended Fund,0.42%,$1.17B,$9.17M,,"XLI, VIS, FIDU, PSCI, AMER ",,,,,DJ Global United States (All) / Industrials -IND,Market Cap,Market Cap,Thomson Reuters US Industrials,0.05%,$65.86B,32.31,4.54,1.04%,12/14/20,184,,,,,,,,,,,,,,,,,,,,,,,,
IYK,iShares U.S. Consumer Goods ETF,Blackrock,iShares,06/12/00,Open-Ended Fund,0.43%,$701.79M,$4.06M,,"XLP, VDC, FSTA, PSCC, RHS ",,,,,DJ Global United States (All) / Consumer Goods -IND,Market Cap,Market Cap,Thomson Reuters US Non-Cyclicals,0.04%,$157.58B,36.49,5.59,1.62%,12/14/20,98,,,,,,,,,,,,,,,,,,,,,,,,
IYLD,iShares Morningstar Multi-Asset Income ETF,Blackrock,iShares,04/05/12,Open-Ended Fund,0.60%,$269.61M,,0.17%,"PCEF, MDIV, YYY, YLD, CVY ",,,,,Morningstar Multi-Asset High Income Index,Fixed,Fixed,N/A,,,,,4.98%,,,,,,12/02/20,,,,,,,,,,,,,,,,,,,,
IYM,iShares U.S. Basic Materials ETF,Blackrock,iShares,06/12/00,Open-Ended Fund,0.43%,$852.33M,$15.45M,,"XLB, VAW, FMAT, PSCM, RTM ",,,,,Dow Jones U.S. Basic Materials Index,Market Cap,Market Cap,Thomson Reuters US Basic Materials,0.06%,$50.67B,64.90,2.44,1.61%,12/14/20,37,,,,,,,,,,,,,,,,,,,,,,,,
IYR,iShares U.S. Real Estate ETF,Blackrock,iShares,06/12/00,Open-Ended Fund,0.42%,$4.83B,$501.62M,,"NURE, VNQ, SCHH, XLRE, USRT ",,,,,DJ Global United States (All) / Real Estate -SS,Market Cap,Market Cap,Thomson Reuters US Residential & Commercial REITs,0.01%,$36.06B,48.07,2.63,2.93%,12/14/20,85,,,,,,,,,,,,,,,,,,,,,,,,
IYT,iShares Transportation Average ETF,Blackrock,iShares,10/06/03,Open-Ended Fund,0.42%,$1.45B,$51.40M,,"XTN, FTXR ",,,,,Dow Jones Transportation Average Index,Price,Committee,Thomson Reuters United States Transportation,0.04%,$48.35B,94.02,3.68,1.02%,12/14/20,22,,,,,,,,,,,,,,,,,,,,,,,,
IYW,iShares U.S. Technology ETF,Blackrock,iShares,05/15/00,Open-Ended Fund,0.43%,$6.35B,$34.68M,,"VGT, XLK, SKYY, FTEC, IGM ",,,,,Dow Jones U.S. Technology Capped Index,Market Cap,Market Cap,Thomson Reuters US Technology,0.04%,$835.53B,37.71,9.12,0.61%,12/14/20,159,,,,,,,,,,,,,,,,,,,,,,,,
IYY,iShares Dow Jones U.S. ETF,Blackrock,iShares,06/12/00,Open-Ended Fund,0.20%,$1.38B,$3.98M,,"VTI, ITOT, SCHB, IWV, SPTM ",,,,,Dow Jones U.S. Index,Market Cap,Market Cap,MSCI USA IMI,0.04%,$404.06B,38.14,3.74,1.50%,12/14/20,"1,042",,,,,,,,,,,,,,,,,,,,,,,,
IYZ,iShares U.S. Telecommunications ETF,Blackrock,iShares,05/22/00,Open-Ended Fund,0.42%,$382.06M,$7.44M,,"XLC, VOX, FCOM, XTL, JHCS ",,,,,Dow Jones U.S. Select Telecommunications Index,Market Cap,Market Cap,Thomson Reuters US Telecom,0.04%,$120.76B,25.40,1.91,2.70%,12/14/20,47,,,,,,,,,,,,,,,,,,,,,,,,
IZRL,ARK Israel Innovative Technology ETF,ARK,,12/05/17,Open-Ended Fund,0.49%,$45.82M,$786.17K,,ITEQ ,,,,,ARK Israeli Innovation Index,Equal,Market Cap,MSCI Israel Information Technology Index,0.89%,$2.52B,-38.97,2.66,1.75%,N/A,43,,,,,,,,,,,,,,,,,,,,,,,,
JAGG,JPMorgan U.S. Aggregate Bond ETF,JPMorgan Chase,JPMorgan,12/12/18,Open-Ended Fund,0.07%,$792.08M,$6.75M,0.06%,"FLCB, OVB, BNDC, HTAB, AGG ",,,,,No Underlying Index,Proprietary,Proprietary,Bloomberg Barclays U.S. Aggregate Bond Index,,,,,,12/01/20,"1,991",--,--,--,,,,,,,,,,,,,,,,,,,,,
JCPB,JPMorgan Core Plus Bond ETF,JPMorgan Chase,JPMorgan,01/28/19,Open-Ended Fund,0.40%,$123.13M,$2.75M,0.29%,"FIXD, BOND, TOTL, FBND, HTRB ",,,,,No Underlying Index,Proprietary,Proprietary,Bloomberg Barclays Multiverse,,,,,,12/01/20,813,--,--,--,,,,,,,,,,,,,,,,,,,,,
JDIV,JPMorgan U.S. Dividend ETF,JPMorgan Chase,JPMorgan,11/08/17,Open-Ended Fund,0.12%,$34.44M,$252.38K,,"NOBL, DLN, SPYD, SDOG, DTN ",,,,,J.P. Morgan US Dividend Index,Tiered,Dividends,MSCI USA Large Cap Index,0.23%,$57.96B,-60.46,1.90,3.31%,12/22/20,218,,,,,,,,,,,,,,,,,,,,,,,,
JDST,Direxion Daily Junior Gold Miners Index Bear 2X Shares,Direxion,,10/03/13,Open-Ended Fund,1.10%,$78.25M,,0.09%,DUST ,,,,,MVIS Global Junior Gold Miners Index,Market Cap,Market Cap,N/A,,,,,14.18%,,,,,,12/22/20,,,,,,,,,,,,,,,,,,,,
JEPI,JPMorgan Equity Premium Income ETF,JPMorgan Chase,JPMorgan,05/20/20,Open-Ended Fund,0.35%,$138.32M,$2.01M,,"SPUC, SPYC, SPD, SECT, DFEB ",,,,,No Underlying Index,Proprietary,Proprietary,MSCI USA Large Cap Index,0.13%,--,--,--,--,12/01/20,0,,,,,,,,,,,,,,,,,,,,,,,,
JETS,US Global Jets ETF,US Global Investors,US Global,04/28/15,Open-Ended Fund,0.60%,$2.62B,$101.44M,,N/A ,,,,,US Global Jets Index,Tiered,Market Cap,Thomson Reuters Global Transportation Index Total Return,0.07%,$9.43B,-5.77,1.99,1.73%,N/A,41,,,,,,,,,,,,,,,,,,,,,,,,
JHCS,John Hancock Multifactor Media and Communications ETF,John Hancock,,03/13/19,Open-Ended Fund,0.40%,$29.37M,$25.14K,,"XLC, VOX, FCOM, IYZ, XTL ",,,,,John Hancock Dimensional Media and Communications Index,Multi-Factor,Market Cap,Thomson Reuters US Telecom,0.30%,$177.91B,36.84,2.86,0.85%,N/A,49,,,,,,,,,,,,,,,,,,,,,,,,
JHEM,John Hancock Multifactor Emerging Markets ETF,John Hancock,,09/27/18,Open-Ended Fund,0.49%,$723.74M,$1.31M,,"NUEM, GEM, MFEM, EMGF, FEM ",,,,,John Hancock Dimensional Emerging Markets Index,Multi-Factor,Market Cap,MSCI Emerging Markets Investable Market Index,0.17%,$125.24B,17.54,1.49,2.31%,N/A,629,,,,,,,,,,,,,,,,,,,,,,,,
JHMA,John Hancock Multifactor Materials ETF,John Hancock,,03/28/16,Open-Ended Fund,0.40%,$26.32M,$39.76K,,"FXZ, XLB, VAW, IYM, FMAT ",,,,,John Hancock Dimensional Materials Index,Multi-Factor,Market Cap,Thomson Reuters US Basic Materials,0.18%,$29.46B,36.42,2.77,1.56%,N/A,51,,,,,,,,,,,,,,,,,,,,,,,,
JHMC,John Hancock Multifactor Consumer Discretionary ETF,John Hancock,,09/28/15,Open-Ended Fund,0.40%,$38.84M,$206.22K,,"FXD, XLY, VCR, IYC, FDIS ",,,,,John Hancock Dimensional Consumer Discretionary Index,Multi-Factor,Market Cap,Thomson Reuters US Cyclicals,0.21%,$156.74B,67.03,7.38,0.86%,N/A,114,,,,,,,,,,,,,,,,,,,,,,,,
JHMD,John Hancock Multifactor Developed International ETF,John Hancock,,12/15/16,Open-Ended Fund,0.39%,$472.20M,$688.41K,,"NUDM, RODM, GSIE, JPIN, INTF ",,,,,John Hancock Dimensional Developed International Index,Multi-Factor,Market Cap,MSCI World ex USA IMI,0.24%,$51.48B,28.64,1.45,1.93%,N/A,737,,,,,,,,,,,,,,,,,,,,,,,,
JHME,John Hancock Multifactor Energy ETF,John Hancock,,03/28/16,Open-Ended Fund,0.40%,$13.23M,$82.60K,,"FXN, XLE, VDE, FENY, IYE ",,,,,John Hancock Dimensional Energy Index,Multi-Factor,Market Cap,Thomson Reuters US Energy - Fossil Fuels,0.29%,$30.20B,-3.51,1.01,9.00%,N/A,34,,,,,,,,,,,,,,,,,,,,,,,,
JHMF,John Hancock Multifactor Financials ETF,John Hancock,,09/28/15,Open-Ended Fund,0.40%,$27.77M,$77.07K,,"FXO, XLF, VFH, IYF, FNCL ",,,,,John Hancock Dimensional Financials Index,Multi-Factor,Market Cap,Thomson Reuters US Financials,0.19%,$98.44B,17.65,1.36,2.17%,N/A,142,,,,,,,,,,,,,,,,,,,,,,,,
JHMH,John Hancock Multifactor Healthcare ETF,John Hancock,,09/29/15,Open-Ended Fund,0.40%,$46.39M,$98.09K,,"FXH, XLV, VHT, IYH, FHLC ",,,,,John Hancock Dimensional Healthcare Index,Multi-Factor,Market Cap,Thomson Reuters US Healthcare,0.13%,$102.03B,31.99,4.39,1.65%,N/A,141,,,,,,,,,,,,,,,,,,,,,,,,
JHMI,John Hancock Multifactor Industrials ETF,John Hancock,,03/28/16,Open-Ended Fund,0.40%,$43.28M,$181.27K,,"FXR, AIRR, XLI, VIS, IYJ ",,,,,John Hancock Dimensional Industrials Index,Multi-Factor,Market Cap,Thomson Reuters US Industrials,0.20%,$39.23B,26.92,4.08,1.16%,N/A,153,,,,,,,,,,,,,,,,,,,,,,,,
JHML,John Hancock Multifactor Large Cap ETF,John Hancock,,09/28/15,Open-Ended Fund,0.29%,$988.83M,$3.43M,,"NULC, GSLC, SPHD, FLQL, OMFL ",,,,,John Hancock Dimensional Large Cap Index,Multi-Factor,Market Cap,MSCI USA Large Cap Index,0.06%,$282.18B,31.90,3.37,1.65%,N/A,780,,,,,,,,,,,,,,,,,,,,,,,,
JHMM,John Hancock Multifactor Mid Cap ETF,John Hancock,,09/28/15,Open-Ended Fund,0.42%,$1.80B,$5.47M,,"JKG, FNX, JPME, CZA, XMHQ ",,,,,John Hancock Dimensional Mid Cap Index,Multi-Factor,Market Cap,MSCI USA Mid Cap Index,0.08%,$13.30B,41.79,2.78,1.07%,N/A,679,,,,,,,,,,,,,,,,,,,,,,,,
JHMS,John Hancock Multifactor Consumer Staples ETF,John Hancock,,03/28/16,Open-Ended Fund,0.40%,$24.89M,$47.35K,,"FXG, XLP, VDC, FSTA, IYK ",,,,,John Hancock Dimensional Consumer Staples Index,Multi-Factor,Market Cap,Thomson Reuters US Non-Cyclicals,0.20%,$104.73B,27.84,4.01,2.26%,N/A,53,,,,,,,,,,,,,,,,,,,,,,,,
JHMT,John Hancock Multifactor Technology ETF,John Hancock,,09/29/15,Open-Ended Fund,0.40%,$46.04M,$126.35K,,"FXL, VGT, XLK, IYW, SKYY ",,,,,John Hancock Dimensional Technology Index,Multi-Factor,Market Cap,Thomson Reuters US Technology,0.13%,$274.76B,39.62,6.74,1.21%,N/A,144,,,,,,,,,,,,,,,,,,,,,,,,
JHMU,John Hancock Multifactor Utilities ETF,John Hancock,,03/28/16,Open-Ended Fund,0.40%,$23.87M,$38.30K,,"FXU, XLU, VPU, FUTY, IDU ",,,,,John Hancock Dimensional Utilities Index,Multi-Factor,Market Cap,Thomson Reuters US Utilities,0.19%,$32.37B,19.92,1.87,2.95%,N/A,42,,,,,,,,,,,,,,,,,,,,,,,,
