IMTM,iShares MSCI Intl Momentum Factor ETF,Blackrock,iShares,01/13/15,Open-Ended Fund,0.30%,$750.23M,$3.95M,,"IDMO, PIZ, IMOM, VEA, IEFA ",,,,,MSCI World ex USA Momentum,Momentum,Momentum,MSCI World ex USA IMI,0.10%,$71.52B,30.08,3.75,1.19%,12/14/20,296,,,,,,,,,,,,,,,,,,,,,,,,,,,,,
INCO,Columbia India Consumer ETF,"Columbia Management Investment Advisers, LLC",Columbia,08/10/11,Open-Ended Fund,0.75%,$81.57M,$192.85K,,N/A ,,,,,Indxx India Consumer Index,Market Cap,Market Cap,MSCI India IMI Consumer Discretionary,0.97%,$11.49B,-74.15,3.03,0.27%,12/18/20,33,,,,,,,,,,,,,,,,,,,,,,,,,,,,,
INDA,iShares MSCI India ETF,Blackrock,iShares,02/02/12,Open-Ended Fund,0.69%,$3.59B,$134.17M,,"EPI, FLIN, IXSE ",,,,,MSCI India Index,Market Cap,Market Cap,MSCI India IMI,0.03%,$61.53B,33.00,2.96,0.30%,12/14/20,88,,,,,,,,,,,,,,,,,,,,,,,,,,,,,
INDL,Direxion Daily MSCI India Bull 2X Shares,Direxion,,03/11/10,Open-Ended Fund,1.33%,$99.96M,,0.19%,N/A ,,,,,MSCI India Index,Market Cap,Market Cap,N/A,,,,,0.04%,,,,,,12/22/20,,,,,,,,,,,,,,,,,,,,,,,,,
INDS,Pacer Benchmark Industrial Real Estate SCTR ETF,Pacer Advisors,Pacer,05/14/18,Open-Ended Fund,0.60%,$124.71M,$1.06M,,"NURE, VNQ, SCHH, IYR, XLRE ",,,,,Benchmark Industrial Real Estate SCTR Index,Tiered,Market Cap,Thomson Reuters US Residential & Commercial REITs,0.21%,$16.47B,46.12,2.41,1.90%,12/21/20,18,,,,,,,,,,,,,,,,,,,,,,,,,,,,,
INDY,iShares India 50 ETF,Blackrock,iShares,11/18/09,Open-Ended Fund,0.93%,$617.08M,$2.79M,,"PIN, NFTY ",,,,,Nifty 50 Index,Market Cap,Market Cap,MSCI India Large Cap,0.17%,$66.15B,29.11,2.80,0.08%,12/14/20,54,,,,,,,,,,,,,,,,,,,,,,,,,,,,,
INFR,Legg Mason Global Infrastructure ETF,Franklin Templeton,Legg Mason,12/29/16,Open-Ended Fund,0.40%,$8.89M,$67.35K,,"IGF, GII, NFRA, TOLZ, OBOR ",,,,,RARE Global Infrastructure Index,Multi-Factor,Fundamental,N/A,2.25%,$43.68B,26.24,1.73,3.34%,12/28/20,103,,,,,,,,,,,,,,,,,,,,,,,,,,,,,
INKM,SPDR SSGA Income Allocation ETF,State Street Global Advisors,SPDR,04/25/12,Open-Ended Fund,0.50%,$119.83M,,0.12%,"TDSC, DRSK, TAIL, NTSX, TDSB ",,,,,No Underlying Index,Proprietary,Proprietary,N/A,,,,,3.94%,,,,,,12/29/20,,,,,,,,,,,,,,,,,,,,,,,,,
INTF,iShares MSCI Intl Multifactor ETF,Blackrock,iShares,04/28/15,Open-Ended Fund,0.30%,$907.62M,$3.43M,,"NUDM, RODM, GSIE, JPIN,  JHMD ",,,,,MSCI World ex USA Diversified Multi-Factor Index,Multi-Factor,Multi-Factor,MSCI World ex USA IMI,0.08%,$32.30B,17.61,1.38,2.94%,12/14/20,183,,,,,,,,,,,,,,,,,,,,,,,,,,,,,
IOO,iShares Global 100 ETF,Blackrock,iShares,12/05/00,Open-Ended Fund,0.40%,$2.71B,$6.37M,,"DGT, BLES, SPQQ ",,,,,S&P Global 100 Index,Market Cap,Committee,MSCI ACWI Large Cap Index,0.08%,$765.44B,32.20,2.88,1.55%,12/14/20,108,,,,,,,,,,,,,,,,,,,,,,,,,,,,,
IPAC,iShares Core MSCI Pacific ETF,Blackrock,iShares,06/10/14,Open-Ended Fund,0.09%,$1.10B,$2.73M,,"VPL, RFAP ",,,,,MSCI Pacific IMI,Market Cap,Market Cap,MSCI Pacific IMI,0.17%,$35.31B,26.78,1.29,2.73%,12/14/20,840,,,,,,,,,,,,,,,,,,,,,,,,,,,,,
IPAY,ETFMG Prime Mobile Payments ETF,ETFMG,ETF Managers Group,07/15/15,Open-Ended Fund,0.75%,$929.94M,$7.48M,,"IXN, CIBR, CLOU, FINX,  SNSR ",,,,,Prime Mobile Payments Index,Market Cap,Market Cap,Thomson Reuters Global Technology,0.15%,$82.50B,46.15,4.56,0.02%,12/14/20,43,,,,,,,,,,,,,,,,,,,,,,,,,,,,,
IPFF,iShares International Preferred Stock ETF,Blackrock,iShares,11/15/11,Open-Ended Fund,0.55%,$40.23M,$110.21K,0.34%,N/A ,,,,,S&P International Preferred Stock Index,Market Value,Committee,S&P International Preferred Stock Index,,,,,,12/01/20,84,--,--,--,,,,,,,,,,,,,,,,,,,,,,,,,,
IPKW,Invesco International BuyBack Achievers ETF,Invesco,,03/06/14,Open-Ended Fund,0.55%,$110.19M,$440.67K,,"QINT, IGRO, VIGI, PID, VXUS ",,,,,NASDAQ International BuyBack Achievers,Market Cap,Share Buybacks,MSCI ACWI ex USA IMI Index -TR net,0.22%,$18.82B,38.48,1.24,1.62%,12/21/20,74,,,,,,,,,,,,,,,,,,,,,,,,,,,,,
IPO,Renaissance IPO ETF,Renaissance Capital,Renaissance,10/14/13,Open-Ended Fund,0.60%,$456.25M,$13.89M,,"FPX, CSD, SPAK, VTI, ITOT ",,,,,Renaissance IPO Index,Market Cap,Time Since Listing,MSCI USA IMI,0.31%,$27.88B,-44.65,10.92,0.20%,12/18/20,49,,,,,,,,,,,,,,,,,,,,,,,,,,,,,
IPOS,Renaissance International IPO ETF,Renaissance Capital,Renaissance,10/06/14,Open-Ended Fund,0.80%,$34.56M,$1.05M,,"FPXI, VXUS, VEU, IXUS, ACWX ",,,,,Renaissance International IPO Index,Market Cap,Time Since Listing,MSCI ACWI ex USA IMI Index -TR net,0.61%,$33.46B,46.41,5.84,0.16%,12/18/20,44,,,,,,,,,,,,,,,,,,,,,,,,,,,,,
IQDE,FlexShares International Quality Dividend Defensive Index Fund,Northern Trust,FlexShares,04/12/13,Open-Ended Fund,0.47%,$66.15M,$175.27K,,"IQDF, VIDI, DNL, IFV, MOTI ",,,,,Northern Trust International Quality Dividend Defensive Net (TR),Multi-Factor,Proprietary,MSCI ACWI ex USA IMI Index -TR net,0.20%,$65.10B,16.96,1.69,3.47%,12/18/20,195,,,,,,,,,,,,,,,,,,,,,,,,,,,,,
IQDF,FlexShares International Quality Dividend Index Fund,Northern Trust,FlexShares,04/12/13,Open-Ended Fund,0.47%,$516.47M,$1.55M,,"VIDI, DNL, IFV, IQDE, MOTI ",,,,,Northern Trust International Quality Dividend Index,Multi-Factor,Proprietary,MSCI ACWI ex USA IMI Index -TR net,0.13%,$65.94B,14.97,1.75,3.64%,12/18/20,214,,,,,,,,,,,,,,,,,,,,,,,,,,,,,
IQDG,WisdomTree International Quality Dividend Growth Fund,WisdomTree,,04/07/16,Open-Ended Fund,0.42%,$148.20M,$1.89M,,"NUDM, RODM, GSIE, JPIN, INTF ",,,,,WisdomTree International Quality Dividend Growth Index,Dividends,Multi-Factor,MSCI World ex USA IMI,0.11%,$62.08B,26.29,3.97,1.64%,12/21/20,208,,,,,,,,,,,,,,,,,,,,,,,,,,,,,
IQDY,FlexShares International Quality Dividend Dynamic Index Fund,Northern Trust,FlexShares,04/12/13,Open-Ended Fund,0.47%,$26.95M,$132.36K,,"IQDF, VIDI, DNL, IFV, IQDE ",,,,,Northern Trust International Quality Dividend Dynamic Index,Multi-Factor,Proprietary,MSCI ACWI ex USA IMI Index -TR net,0.24%,$63.10B,17.38,1.68,3.08%,12/18/20,178,,,,,,,,,,,,,,,,,,,,,,,,,,,,,
IQIN,IQ 500 International ETF,New York Life,IndexIQ,12/13/18,Open-Ended Fund,0.25%,$253.69M,$147.89K,,"IQLT, PXF, TLTD, IDHQ, ICOW ",,,,,IQ 500 International Index,Fundamental,Fundamental,MSCI World ex USA IMI,0.24%,$43.53B,-109.11,1.07,1.74%,12/30/20,498,,,,,,,,,,,,,,,,,,,,,,,,,,,,,
IQLT,iShares MSCI Intl Quality Factor ETF,Blackrock,iShares,01/13/15,Open-Ended Fund,0.30%,$2.55B,$18.04M,,"PXF, TLTD, IQIN, IDHQ, ICOW ",,,,,MSCI World ex USA Sector Neutral Quality Index,Fundamental,Fundamental,MSCI World ex USA IMI,0.06%,$73.77B,27.20,2.71,1.76%,12/14/20,299,,,,,,,,,,,,,,,,,,,,,,,,,,,,,
IQM,Franklin Intelligent Machines ETF,Franklin Templeton,Franklin,02/25/20,Open-Ended Fund,0.50%,$3.97M,$111.85K,,"BTEK, ARKF, IXN, CIBR, CLOU ",,,,,No Underlying Index,Proprietary,Proprietary,Thomson Reuters Global Technology,0.23%,$192.64B,72.52,8.79,--,12/14/20,65,,,,,,,,,,,,,,,,,,,,,,,,,,,,,
IQSI,IQ Candriam ESG International Equity ETF,New York Life,IndexIQ,12/17/19,Open-Ended Fund,0.15%,$121.20M,$411.06K,,"ESGG, URTH, FDRR, KLDW, RFDI ",,,,,IQ Candriam ESG International Equity Index,Market Cap,Principles-based,MSCI World IMI,0.13%,$70.59B,29.45,1.65,--,12/30/20,567,,,,,,,,,,,,,,,,,,,,,,,,,,,,,
IQSU,IQ Candriam ESG U.S. Equity ETF,New York Life,IndexIQ,12/17/19,Open-Ended Fund,0.09%,$285.78M,$2.85M,,"ESGU, USSG, SUSL, DSI, ESGV ",,,,,IQ Candriam ESG US Equity Index,Market Cap,Principles-based,MSCI USA IMI,0.12%,$560.73B,33.99,5.20,--,12/30/20,302,,,,,,,,,,,,,,,,,,,,,,,,,,,,,
IRBO,iShares Robotics and Artificial Intelligence Multisector ETF,Blackrock,iShares,06/26/18,Open-Ended Fund,0.47%,$240.39M,$1.97M,,"ROBO, ROBT, BOTZ, AIQ, ARKQ ",,,,,NYSE FactSet Global Robotics and Artificial Intelligence Index,Equal,Market Cap,N/A,0.33%,$123.10B,81.60,3.21,0.29%,12/14/20,103,,,,,,,,,,,,,,,,,,,,,,,,,,,,,
ISCF,iShares MSCI Intl Small-Cap Multifactor ETF,Blackrock,iShares,04/28/15,Open-Ended Fund,0.40%,$150.49M,$405.64K,,"FDTS, SCZ, SCHC, GWX, FNDC ",,,,,MSCI World ex USA Small Cap Diversified Multiple-Factor Index,Multi-Factor,Multi-Factor,MSCI World ex USA Small Cap,0.31%,$2.02B,19.23,1.25,2.49%,12/14/20,696,,,,,,,,,,,,,,,,,,,,,,,,,,,,,
ISDX,Invesco RAFI Strategic Developed ex-US ETF,Invesco,,09/12/18,Open-Ended Fund,0.23%,$270.60M,$286.41K,,"FNDF, DOL, IDOG, DOO, BKIE ",,,,,Invesco Strategic Developed ex-U.S. Index,Fundamental,Fundamental,MSCI World ex USA Large Cap,0.21%,$50.11B,-41.33,1.12,1.73%,12/21/20,862,,,,,,,,,,,,,,,,,,,,,,,,,,,,,
ISEM,Invesco RAFI Strategic Emerging Markets ETF,Invesco,,09/12/18,Open-Ended Fund,0.35%,$22.28M,$37.50K,,"FNDE, EDOG, BKEM, ADRE, CEZ ",,,,,Invesco Strategic Emerging Markets Index,Fundamental,Fundamental,MSCI Emerging Markets Large Cap,0.24%,$116.27B,76.66,0.91,1.24%,12/21/20,400,,,,,,,,,,,,,,,,,,,,,,,,,,,,,
ISHG,iShares 1-3 Year International Treasury Bond ETF,Blackrock,,01/21/09,Open-Ended Fund,0.35%,$58.34M,$180.92K,0.16%,N/A ,,,,,FTSE World Government Bond Index  Developed Markets 1-3 Years Capped Select Index,Market Value,Market Value,Bloomberg Barclays 1-3 Year Global Treasury ex-U.S. Capped Index,,,,,,12/01/20,111,--,--,--,,,,,,,,,,,iShares,,,,,,,,,,,,,,,
ISMD,Inspire Small/Mid Cap Impact ETF,Inspire,,02/28/17,Open-Ended Fund,0.60%,$88.01M,$987.44K,,"VXF, SMMD, PRFZ, FSMD, HSMV ",,,,,Inspire Small/Mid Cap Impact Equal Weight Index,Equal,Principles-based,MSCI USA SMID Cap Index,0.38%,$1.86B,-9.45,1.48,1.10%,N/A,301,,,,,,,,,,,,,,,,,,,,,,,,,,,,,
ISRA,VanEck Vectors Israel ETF,VanEck,,06/25/13,Open-Ended Fund,0.62%,$71.03M,$160.42K,,EIS ,,,,,BlueStar Israel Global Index,Market Cap,Committee,MSCI Israel IMI,1.68%,$7.19B,44.00,1.88,1.19%,12/21/20,143,,,,,,,,,,,,,,,,,,,,,,,,,,,,,
ISTB,iShares Core 1-5 Year USD Bond ETF,Blackrock,iShares,10/18/12,Open-Ended Fund,0.06%,$4.75B,$22.49M,0.04%,"FTSM, USTB, LSST, LDSF ",,,,,Bloomberg Barclays US Universal 1-5 Year Index,Market Value,Market Value,Bloomberg Barclays US Universal 1-5 Year Index,,,,,,12/01/20,"4,741",--,--,--,,,,,,,,,,,,,,,,,,,,,,,,,,
ISZE,iShares MSCI Intl Size Factor ETF,Blackrock,iShares,06/16/15,Open-Ended Fund,0.30%,$28.98M,$16.28K,,"EFAV, IDLV, RNDM, VEA, IEFA ",,,,,MSCI World ex USA Low Size Index,Volatility,Market Cap,MSCI World ex USA IMI,0.50%,$19.49B,38.64,1.27,1.07%,12/14/20,969,,,,,,,,,,,,,,,,,,,,,,,,,,,,,
ITA,iShares U.S. Aerospace & Defense ETF,Blackrock,iShares,05/01/06,Open-Ended Fund,0.42%,$2.96B,$30.03M,,"PPA, XAR,  FITE, ROKT ",,,,,DJ US Select / Aerospace & Defense,Market Cap,Market Cap,Thomson Reuters US Aerospace & Defense,0.05%,$52.83B,37.36,3.41,1.76%,12/14/20,37,,,,,,,,,,,,,,,,,,,,,,,,,,,,,
ITB,iShares U.S. Home Construction ETF,Blackrock,iShares,05/01/06,Open-Ended Fund,0.42%,$2.13B,$198.61M,,"XHB, HOMZ ",,,,,DJ US Select / Home Construction,Market Cap,Market Cap,Thomson Reuters US Homebuilding,0.02%,$33.22B,17.49,2.68,0.42%,12/14/20,48,,,,,,,,,,,,,,,,,,,,,,,,,,,,,
ITEQ,BlueStar Israel Technology ETF,ETFMG,BlueStar,11/02/15,Open-Ended Fund,0.75%,$147.70M,$1.07M,,IZRL ,,,,,TASE-BlueStar Israel Global Technology Index,Market Cap,Committee,MSCI Israel Information Technology Index,0.09%,$7.33B,199.31,4.75,0.02%,12/14/20,63,,,,,,,,,,,,,,,,,,,,,,,,,,,,,
ITM,VanEck Vectors AMT-Free Intermediate Municipal Index ETF,VanEck,,12/04/07,Open-Ended Fund,0.24%,$1.73B,$4.03M,0.11%,"IBMK, IBMJ, IBML, IBMM, IBMN ",,,,,Bloomberg Barclays AMT-Free Intermediate Continuous Municipal Index,Market Value,AMT-Free,N/A,,,,,,12/01/20,"2,484",6.17,--,2.25%,,,,,,,,,,,,,,,,,,,,,,,,,,
ITOT,iShares Core S&P Total U.S. Stock Market ETF,Blackrock,iShares,01/20/04,Open-Ended Fund,0.03%,$30.91B,$100.79M,,"VTI, SCHB, IWV, SPTM, IYY ",,,,,S&P Total Market Index,Market Cap,Committee,MSCI USA IMI,0.01%,$382.87B,45.95,3.55,1.60%,12/14/20,"3,551",,,,,,,,,,,,,,,,,,,,,,,,,,,,,
IUS,Invesco RAFI Strategic US ETF,Invesco,,09/12/18,Open-Ended Fund,0.19%,$155.87M,$341.94K,,"FTCS, FNDX, PRF, SPHQ, RDVY ",,,,,Invesco Strategic U.S. Index,Fundamental,Fundamental,MSCI USA Large Cap Index,0.11%,$297.88B,-96.78,2.48,1.31%,12/21/20,553,,,,,,,,,,,,,,,,,,,,,,,,,,,,,
IUSB,iShares Core Total USD Bond Market ETF,Blackrock,iShares,06/10/14,Open-Ended Fund,0.06%,$5.99B,$27.30M,0.03%,"FIBR,  BYLD, AGGP, WBIN, TGIF ",,,,,Bloomberg Barclays U.S. Universal Index,Market Value,Market Value,Bloomberg Barclays U.S. Universal Index,,,,,,12/01/20,"10,829",5.83,--,1.60%,,,,,,,,,,,,,,,,,,,,,,,,,,
IUSG,iShares Core S&P U.S. Growth ETF,Blackrock,iShares,07/24/00,Open-Ended Fund,0.04%,$9.94B,$33.15M,,"FAD, BUL, FDG, TAAG, HIPR ",,,,,S&P 900 Growth Index,Market Cap,Multi-Factor,MSCI USA IMI Growth Index,0.03%,$626.88B,37.36,7.55,1.17%,12/14/20,530,,,,,,,,,,,,,,,,,,,,,,,,,,,,,
IUSS,Invesco RAFI Strategic US Small Company ETF,Invesco,,09/12/18,Open-Ended Fund,0.23%,$34.73M,$62.39K,,"FNDA, EES, RWJ, CALF, XSHQ ",,,,,Invesco Strategic U.S. Small Company Index,Fundamental,Fundamental,MSCI USA Small Cap Index,0.29%,$5.13B,-6.82,1.70,0.70%,12/21/20,"1,202",,,,,,,,,,,,,,,,,,,,,,,,,,,,,
IUSV,iShares Core S&P U.S. Value ETF,Blackrock,iShares,07/24/00,Open-Ended Fund,0.04%,$7.33B,$37.17M,,"FAB, FOVL, VLUE, QVAL, VLU ",,,,,S&P 900 Value Index,Multi-Factor,Multi-Factor,MSCI USA IMI Value Index,0.03%,$122.41B,31.04,1.99,2.43%,12/14/20,681,,,,,,,,,,,,,,,,,,,,,,,,,,,,,
IVAL,Alpha Architect International Quantitative Value ETF,EMPIRICAL FINANCE LLC,Alpha Architect,12/17/14,Open-Ended Fund,0.59%,$101.40M,$438.84K,,"EFV, IVLU, FIVA, DMDV ",,,,,Alpha Architect International Quantitative Value Index,Equal,Proprietary,MSCI World ex USA IMI Value,0.21%,$12.71B,13.67,1.04,2.22%,N/A,47,,,,,,,,,,,,,,,,,,,,,,,,,,,,,
IVE,iShares S&P 500 Value ETF,Blackrock,iShares,05/22/00,Open-Ended Fund,0.18%,$18.05B,$97.90M,,"SPYV, VOOV, RPV, FVAL, SPVU ",,,,,S&P 500 Value Index,Market Cap,Fundamental,MSCI USA Large Cap Value,0.02%,$130.24B,29.78,2.06,2.40%,12/14/20,388,,,,,,,,,,,,,,,,,,,,,,,,,,,,,
IVES,Wedbush ETFMG Global Cloud Technology ETF,ETFMG,ETF Managers Group,03/08/16,Open-Ended Fund,0.68%,$52.78M,$162.70K,,"TDIV, IXN, CIBR, CLOU, IPAY ",,,,,Dan Ives Global Cloud Technology Prime Index,Proprietary,Revenue,Thomson Reuters Global Technology,0.76%,$7.94B,-173.98,5.21,0.48%,12/14/20,66,,,,,,,,,,,,,,,,,,,,,,,,,,,,,
IVLU,iShares MSCI Intl Value Factor ETF,Blackrock,iShares,06/16/15,Open-Ended Fund,0.30%,$546.61M,$2.40M,,"IVAL, EFV, FIVA, DMDV ",,,,,MSCI World ex USA Enhanced Value Index,Fundamental,Fundamental,MSCI World ex USA IMI Value,0.26%,$44.52B,30.69,0.73,2.55%,12/14/20,332,,,,,,,,,,,,,,,,,,,,,,,,,,,,,
IVOG,Vanguard S&P Mid-Cap 400 Growth ETF,Vanguard,,09/09/10,Open-Ended Fund,0.15%,$783.47M,$4.26M,,"IJK, NUMG, IWP, VOT, MDYG ",,,,,S&P Mid Cap 400 Growth,Market Cap,Fundamental,MSCI USA Mid Cap Growth Index,0.12%,$7.02B,44.87,3.63,1.02%,N/A,246,,,,,,,,,,,,,,,,,,,,,,,,,,,,,
IVOL,Quadratic Interest Rate Volatility and Inflation Hedge ETF,CICC,Quadratic,05/13/19,Open-Ended Fund,0.99%,$821.05M,$12.56M,0.06%,"SPIP, TIP, SCHP, TIPZ, GTIP ",,,,,No Underlying Index,Proprietary,Proprietary,Bloomberg Barclays US Treasury Inflation Protected Notes (TIPS),,,,,,N/A,3,--,--,--,,,,,,,,,,,,,,,,,,,,,,,,,,
IVOO,Vanguard S&P Mid-Cap 400 ETF,Vanguard,,09/09/10,Open-Ended Fund,0.10%,$1.05B,$4.57M,,"IJH, MDY, VO, IWR, SCHM ",,,,,S&P Mid Cap 400,Market Cap,Committee,MSCI USA Mid Cap Index,0.08%,$5.99B,56.74,2.12,1.26%,N/A,402,,,,,,,,,,,,,,,,,,,,,,,,,,,,,
IVOV,Vanguard S&P Mid-Cap 400 Value ETF,Vanguard,,09/09/10,Open-Ended Fund,0.15%,$518.20M,$3.37M,,"IJJ, MDYV, RFV, NUMV, IWS ",,,,,S&P Mid Cap 400 Value,Market Cap,Fundamental,MSCI USA Mid Cap Value Index,0.08%,$4.67B,86.60,1.38,1.80%,N/A,295,,,,,,,,,,,,,,,,,,,,,,,,,,,,,
IVV,iShares Core S&P 500 ETF,Blackrock,iShares,05/15/00,Open-Ended Fund,0.03%,$235.74B,$1.23B,,"SPY, VOO, IWB, SCHX, VV ",,,,,S&P 500,Market Cap,Committee,MSCI USA Large Cap Index,0.01%,$455.46B,33.85,3.78,1.74%,12/14/20,507,,,,,,,,,,,,,,,,,,,,,,,,,,,,,
IVW,iShares S&P 500 Growth ETF,Blackrock,iShares,05/22/00,Open-Ended Fund,0.18%,$31.36B,$115.47M,,"VOOG, SPYG, RPG, NULG, VUG ",,,,,S&P 500 Growth,Market Cap,Fundamental,MSCI USA Large Cap Growth Index,0.03%,$660.90B,37.02,8.02,1.10%,12/14/20,284,,,,,,,,,,,,,,,,,,,,,,,,,,,,,
IWB,iShares Russell 1000 ETF,Blackrock,iShares,05/15/00,Open-Ended Fund,0.15%,$25.22B,$101.90M,,"VONE, SPY, IVV, VOO, SCHX ",,,,,Russell 1000,Market Cap,Market Cap,MSCI USA Large Cap Index,0.03%,$408.79B,37.82,3.75,1.44%,12/14/20,"1,013",,,,,,,,,,,,,,,,,,,,,,,,,,,,,
IWC,iShares Micro-Cap ETF,Blackrock,iShares,08/12/05,Open-Ended Fund,0.60%,$912.94M,$3.43M,,"FDM, DWMC ",,,,,Russell Microcap,Market Cap,Market Cap,MSCI USA Micro Cap Index,0.24%,$660.38M,-9.67,1.59,1.04%,12/14/20,"1,258",,,,,,,,,,,,,,,,,,,,,,,,,,,,,
IWD,iShares Russell 1000 Value ETF,Blackrock,iShares,05/22/00,Open-Ended Fund,0.19%,$42.04B,$311.94M,,"VONV, VTV, SCHV, MGV, IWX ",,,,,Russell 1000 Value,Multi-Factor,Multi-Factor,MSCI USA Large Cap Value,0.02%,$121.18B,33.08,2.12,2.54%,12/14/20,850,,,,,,,,,,,,,,,,,,,,,,,,,,,,,
IWF,iShares Russell 1000 Growth ETF,Blackrock,iShares,05/22/00,Open-Ended Fund,0.19%,$61.94B,$327.19M,,"VONG, VUG, SCHG, MGK, IWY ",,,,,Russell 1000 Growth,Multi-Factor,Multi-Factor,MSCI USA Large Cap Growth Index,0.02%,$664.55B,43.38,11.83,0.72%,12/14/20,447,,,,,,,,,,,,,,,,,,,,,,,,,,,,,
IWL,iShares Russell Top 200 ETF,Blackrock,iShares,09/22/09,Open-Ended Fund,0.15%,$892.74M,$6.69M,,"SPY, IVV, VOO, IWB, SCHX ",,,,,Russell Top 200,Market Cap,Market Cap,MSCI USA Large Cap Index,0.04%,$539.17B,31.59,4.25,1.50%,12/14/20,196,,,,,,,,,,,,,,,,,,,,,,,,,,,,,
IWM,iShares Russell 2000 ETF,Blackrock,iShares,05/22/00,Open-Ended Fund,0.19%,$52.01B,$3.83B,,"VTWO, IJR, VB, SCHA, SPSM ",,,,,Russell 2000 Index,Market Cap,Market Cap,MSCI USA Small Cap Index,0.01%,$2.50B,-25.90,1.94,1.13%,12/14/20,"2,012",,,,,,,,,,,,,,,,,,,,,,,,,,,,,
IWN,iShares Russell 2000 Value ETF,Blackrock,iShares,07/24/00,Open-Ended Fund,0.24%,$11.09B,$194.66M,,"VTWV, VBR, JKL, XSVM, FYT ",,,,,Russell 2000 Value Index,Multi-Factor,Multi-Factor,MSCI USA Small Cap Value Index,0.05%,$1.92B,-16.40,1.16,1.84%,12/14/20,"1,454",,,,,,,,,,,,,,,,,,,,,,,,,,,,,
IWO,iShares Russell 2000 Growth ETF,Blackrock,iShares,07/24/00,Open-Ended Fund,0.24%,$10.98B,$94.58M,,"VTWG, VBK, JKK, FYC, IJT ",,,,,Russell 2000 Growth Index,Multi-Factor,Multi-Factor,MSCI USA Small Cap Growth Index,0.09%,$3.01B,-54.82,4.87,0.56%,12/14/20,"1,093",,,,,,,,,,,,,,,,,,,,,,,,,,,,,
IWP,iShares Russell Mid-Cap Growth ETF,Blackrock,iShares,07/17/01,Open-Ended Fund,0.24%,$14.47B,$65.81M,,"NUMG, VOT, IJK, MDYG, JKH ",,,,,Russell Midcap Growth,Multi-Factor,Multi-Factor,MSCI USA Mid Cap Growth Index,0.05%,$20.23B,73.02,10.87,0.45%,12/14/20,342,,,,,,,,,,,,,,,,,,,,,,,,,,,,,
IWR,iShares Russell Mid-Cap ETF,Blackrock,iShares,07/17/01,Open-Ended Fund,0.19%,$23.78B,$73.31M,,"IJH, VO, MDY, SCHM, SPMD ",,,,,Russell Midcap,Market Cap,Market Cap,MSCI USA Mid Cap Index,0.02%,$17.21B,95.05,2.78,1.39%,12/14/20,819,,,,,,,,,,,,,,,,,,,,,,,,,,,,,
IWS,iShares Russell Mid-Cap Value ETF,Blackrock,iShares,07/17/01,Open-Ended Fund,0.24%,$11.49B,$44.39M,,"VOE, JKI, XMVM, FNK, NUMV ",,,,,Russell Midcap Value,Multi-Factor,Multi-Factor,MSCI USA Mid Cap Value Index,0.03%,$15.51B,114.17,1.95,2.07%,12/14/20,696,,,,,,,,,,,,,,,,,,,,,,,,,,,,,
IWV,iShares Russell 3000 ETF,Blackrock,iShares,05/22/00,Open-Ended Fund,0.20%,$10.48B,$39.32M,,"VTHR, VTI, ITOT, SCHB, SPTM ",,,,,Russell 3000,Market Cap,Market Cap,MSCI USA IMI,0.04%,$385.86B,43.64,3.56,1.38%,12/14/20,"2,845",,,,,,,,,,,,,,,,,,,,,,,,,,,,,
IWX,iShares Russell Top 200 Value ETF,Blackrock,iShares,09/22/09,Open-Ended Fund,0.20%,$896.07M,$6.81M,,"VTV, IWD, SCHV, MGV, VONV ",,,,,Russell Top 200 Value,Multi-Factor,Multi-Factor,MSCI USA Large Cap Value,0.04%,$175.04B,24.36,2.22,2.56%,12/14/20,155,,,,,,,,,,,,,,,,,,,,,,,,,,,,,
IWY,iShares Russell Top 200 Growth ETF,Blackrock,iShares,09/22/09,Open-Ended Fund,0.20%,$3.28B,$24.76M,,"VUG, IWF, SCHG, MGK, VONG ",,,,,Russell Top 200 Growth,Multi-Factor,Multi-Factor,MSCI USA Large Cap Growth Index,0.03%,$797.91B,40.06,12.04,0.74%,12/14/20,108,,,,,,,,,,,,,,,,,,,,,,,,,,,,,
IXC,iShares Global Energy ETF,Blackrock,iShares,11/12/01,Open-Ended Fund,0.46%,$927.92M,$15.19M,,ECLN ,,,,,S&P Global 1200 Energy Sector Index,Market Cap,Committee,Thomson Reuters Global Energy - Fossil Fuels,0.06%,$64.27B,-7.31,0.87,8.84%,12/14/20,60,,,,,,,,,,,,,,,,,,,,,,,,,,,,,
IXG,iShares Global Financials ETF,Blackrock,iShares,11/12/01,Open-Ended Fund,0.46%,$312.37M,$1.21M,,"DFNL, GFIN ",,,,,S&P Global 1200 Financials Sector Index,Market Cap,Committee,Thomson Reuters Global Financials,0.17%,$106.05B,13.98,0.91,2.51%,12/14/20,194,,,,,,,,,,,,,,,,,,,,,,,,,,,,,
IXJ,iShares Global Healthcare ETF,Blackrock,iShares,11/13/01,Open-Ended Fund,0.46%,$2.38B,$9.27M,,"GDNA, HTEC, EDOC, BMED ",,,,,S&P Global 1200 Healthcare Sector Index,Market Cap,Committee,Thomson Reuters Global Healthcare,0.10%,$138.42B,28.18,4.28,1.36%,12/14/20,113,,,,,,,,,,,,,,,,,,,,,,,,,,,,,
IXN,iShares Global Tech ETF,Blackrock,iShares,11/12/01,Open-Ended Fund,0.46%,$4.65B,$20.41M,,"CIBR, CLOU, IPAY, FINX, SNSR ",,,,,S&P Global 1200 Information Technology Sector Index,Market Cap,Committee,Thomson Reuters Global Technology,0.10%,$755.37B,34.26,6.68,0.75%,12/14/20,124,,,,,,,,,,,,,,,,,,,,,,,,,,,,,
IXP,iShares Global Comm Services ETF,Blackrock,iShares,11/12/01,Open-Ended Fund,0.46%,$341.68M,$1.18M,,"NXTG, FIVG, WUGI ",,,,,S&P Global 1200 Communication Services 4.5/22.5/45 Capped Index,Market Cap,Committee,Thomson Reuters Global Telecom,0.23%,$417.76B,31.18,2.94,1.01%,12/14/20,72,,,,,,,,,,,,,,,,,,,,,,,,,,,,,
IXSE,WisdomTree India ex-State-Owned Enterprises Fund,WisdomTree,,04/04/19,Open-Ended Fund,0.58%,$2.68M,$15.61K,,"EPI, INDA, FLIN ",,,,,WisdomTree India ex-State-Owned Enterprises Index,Market Cap,Principles-based,MSCI India IMI,0.16%,$57.09B,47.15,3.36,0.11%,12/21/20,116,,,,,,,,,,,,,,,,,,,,,,,,,,,,,
IXUS,iShares Core MSCI Total International Stock ETF,Blackrock,iShares,10/18/12,Open-Ended Fund,0.09%,$24.28B,$77.54M,,"VXUS, VEU, ACWX, CWI, DBAW ",,,,,MSCI ACWI ex USA IMI Index -TR net,Market Cap,Market Cap,MSCI ACWI ex USA IMI Index -TR net,0.02%,$84.30B,28.60,1.57,2.31%,12/14/20,"4,291",,,,,,,,,,,,,,,,,,,,,,,,,,,,,
IYC,iShares U.S. Consumer Services ETF,Blackrock,iShares,06/12/00,Open-Ended Fund,0.43%,$1.19B,$5.61M,,"XLY, VCR, FDIS, PSCD, FXD ",,,,,Dow Jones U.S. Consumer Services Capped Index,Market Cap,Market Cap,Thomson Reuters US Cyclicals,0.06%,$270.11B,68.24,6.68,0.69%,12/14/20,134,,,,,,,,,,,,,,,,,,,,,,,,,,,,,
IYE,iShares U.S. Energy ETF,Blackrock,iShares,06/12/00,Open-Ended Fund,0.42%,$495.29M,$37.34M,,"XLE, VDE, FENY, PSCE, FXN ",,,,,DJ Global United States (All) / Oil & Gas -IND,Market Cap,Market Cap,Thomson Reuters US Energy - Fossil Fuels,0.06%,$71.00B,-5.55,0.96,10.51%,12/14/20,38,,,,,,,,,,,,,,,,,,,,,,,,,,,,,
IYF,iShares U.S. Financials ETF,Blackrock,iShares,05/22/00,Open-Ended Fund,0.42%,$1.39B,$17.91M,,"XLF, VFH, FNCL, PSCF, LEND ",,,,,Dow Jones U.S. Financials Capped Index,Market Cap,Market Cap,Thomson Reuters US Financials,0.03%,$139.19B,20.38,1.53,1.82%,12/14/20,232,,,,,,,,,,,,,,,,,,,,,,,,,,,,,
IYG,iShares U.S. Financial Services ETF,Blackrock,iShares,06/12/00,Open-Ended Fund,0.42%,$1.16B,$28.91M,,N/A ,,,,,Dow Jones U.S. Financial Services Index,Market Cap,Market Cap,Thomson Reuters US Banking Services,0.04%,$157.31B,17.01,1.55,1.70%,12/14/20,103,,,,,,,,,,,,,,,,,,,,,,,,,,,,,
IYH,iShares U.S. Healthcare ETF,Blackrock,iShares,06/12/00,Open-Ended Fund,0.43%,$2.41B,$8.31M,,"XLV, VHT, FHLC, PSCH, FXH ",,,,,DJ Global United States (All) / Health Care -IND,Market Cap,Market Cap,Thomson Reuters US Healthcare,0.04%,$136.80B,29.06,4.63,1.16%,12/14/20,123,,,,,,,,,,,,,,,,,,,,,,,,,,,,,
IYJ,iShares U.S. Industrials ETF,Blackrock,iShares,06/12/00,Open-Ended Fund,0.42%,$1.17B,$9.10M,,"XLI, VIS, FIDU, PSCI, AMER ",,,,,DJ Global United States (All) / Industrials -IND,Market Cap,Market Cap,Thomson Reuters US Industrials,0.05%,$65.86B,32.31,4.54,1.05%,12/14/20,184,,,,,,,,,,,,,,,,,,,,,,,,,,,,,
IYK,iShares U.S. Consumer Goods ETF,Blackrock,iShares,06/12/00,Open-Ended Fund,0.43%,$706.53M,$3.92M,,"XLP, VDC, FSTA, PSCC, RHS ",,,,,DJ Global United States (All) / Consumer Goods -IND,Market Cap,Market Cap,Thomson Reuters US Non-Cyclicals,0.04%,$157.58B,36.49,5.59,1.63%,12/14/20,98,,,,,,,,,,,,,,,,,,,,,,,,,,,,,
IYLD,iShares Morningstar Multi-Asset Income ETF,Blackrock,iShares,04/05/12,Open-Ended Fund,0.60%,$270.24M,,0.17%,"PCEF, MDIV, YYY, YLD, CVY ",,,,,Morningstar Multi-Asset High Income Index,Fixed,Fixed,N/A,,,,,5.01%,,,,,,12/02/20,,,,,,,,,,,,,,,,,,,,,,,,,
IYM,iShares U.S. Basic Materials ETF,Blackrock,iShares,06/12/00,Open-Ended Fund,0.43%,$848.31M,$15.38M,,"XLB, VAW, FMAT, PSCM, RTM ",,,,,Dow Jones U.S. Basic Materials Index,Market Cap,Market Cap,Thomson Reuters US Basic Materials,0.06%,$50.67B,64.90,2.44,1.61%,12/14/20,37,,,,,,,,,,,,,,,,,,,,,,,,,,,,,
IYR,iShares U.S. Real Estate ETF,Blackrock,iShares,06/12/00,Open-Ended Fund,0.42%,$4.79B,$491.78M,,"NURE, VNQ, SCHH, XLRE, USRT ",,,,,DJ Global United States (All) / Real Estate -SS,Market Cap,Market Cap,Thomson Reuters US Residential & Commercial REITs,0.01%,$36.06B,48.07,2.63,2.97%,12/14/20,85,,,,,,,,,,,,,,,,,,,,,,,,,,,,,
IYT,iShares Transportation Average ETF,Blackrock,iShares,10/06/03,Open-Ended Fund,0.42%,$1.44B,$50.34M,,"XTN, FTXR ",,,,,Dow Jones Transportation Average Index,Price,Committee,Thomson Reuters United States Transportation,0.04%,$48.35B,94.02,3.68,1.03%,12/14/20,22,,,,,,,,,,,,,,,,,,,,,,,,,,,,,
IYW,iShares U.S. Technology ETF,Blackrock,iShares,05/15/00,Open-Ended Fund,0.43%,$6.43B,$33.98M,,"VGT, XLK, SKYY, FTEC, IGM ",,,,,Dow Jones U.S. Technology Capped Index,Market Cap,Market Cap,Thomson Reuters US Technology,0.04%,$835.53B,37.71,9.12,0.60%,12/14/20,159,,,,,,,,,,,,,,,,,,,,,,,,,,,,,
IYY,iShares Dow Jones U.S. ETF,Blackrock,iShares,06/12/00,Open-Ended Fund,0.20%,$1.39B,$3.92M,,"VTI, ITOT, SCHB, IWV, SPTM ",,,,,Dow Jones U.S. Index,Market Cap,Market Cap,MSCI USA IMI,0.04%,$404.06B,38.14,3.74,1.50%,12/14/20,"1,042",,,,,,,,,,,,,,,,,,,,,,,,,,,,,
