Ticker,Name,Segment,Issuer,Expense Ratio,AUM
AGQ,ProShares Ultra Silver,Leveraged Commodities: Precious Metals Silver,ProShares,0.95%,$809.18M
IHDG,WisdomTree International Hedged Quality Dividend Growth Fund,Equity: Developed Markets Ex-U.S. - Total Market,WisdomTree,0.58%,$791.00M
IDU,iShares U.S. Utilities ETF,Equity: U.S. Utilities,Blackrock,0.43%,$785.00M
IWL,iShares Russell Top 200 ETF,Equity: U.S. - Large Cap,Blackrock,0.15%,$784.66M
CORP,PIMCO Investment Grade Corporate Bond Index ETF,"Fixed Income: U.S. - Corporate, Broad-based Investment Grade",Allianz,0.20%,$784.11M
IYT,iShares Transportation Average ETF,Equity: U.S. Transportation,Blackrock,0.42%,$780.31M
IWC,iShares Micro-Cap ETF,Equity: U.S. - Micro Cap,Blackrock,0.60%,$779.23M
IPAY,ETFMG Prime Mobile Payments ETF,Equity: Global Technology,ETFMG,0.75%,$779.01M
IVOG,Vanguard S&P Mid-Cap 400 Growth ETF,Equity: U.S. - Mid Cap Growth,Vanguard,0.15%,$770.02M
RWL,Invesco S&P 500 Revenue ETF,Equity: U.S. - Large Cap,Invesco,0.39%,$769.89M
PHB,Invesco Fundamental High Yield Corporate Bond ETF,"Fixed Income: U.S. - Corporate, Broad-based High Yield Intermediate",Invesco,0.50%,$763.63M
PCEF,Invesco CEF Income Composite ETF,Asset Allocation: Target Outcome,Invesco,2.55%,$761.57M
UDOW,ProShares UltraPro Dow30,Leveraged Equity: U.S. - Large Cap,ProShares,0.95%,$761.55M
QUS,SPDR MSCI USA StrategicFactors ETF,Equity: U.S. - Total Market,State Street Global Advisors,0.15%,$760.38M
EUFN,iShares MSCI Europe Financials ETF,Equity: Developed Europe Financials,Blackrock,0.48%,$759.96M
EBND,SPDR Bloomberg Barclays Emerging Markets Local Bond ETF,"Fixed Income: Emerging Markets - Government, Treasury Investment Grade",State Street Global Advisors,0.30%,$759.34M
QAI,IQ Hedge Multi-Strategy Tracker ETF,Alternatives: Absolute Returns,New York Life,0.80%,$758.78M
GLTR,Aberdeen Standard Physical Precious Metals Basket Shares ETF,Commodities: Precious Metals,Aberdeen Standard Investments,0.60%,$757.10M
IBDQ,iShares iBonds Dec 2025 Term Corporate ETF,"Fixed Income: U.S. - Corporate, Broad-based Investment Grade Intermediate",Blackrock,0.10%,$753.95M
PFXF,VanEck Vectors Preferred Securities ex Financials ETF,"Fixed Income: U.S. - Corporate, Preferred",VanEck,0.41%,$746.18M
DTD,WisdomTree U.S. Total Dividend Fund,Equity: U.S. - Total Market,WisdomTree,0.28%,$741.15M
LIT,Global X Lithium & Battery Tech ETF,Equity: Global Metals & Mining,Mirae Asset,0.75%,$740.40M
BSJK,Invesco BulletShares 2020 High Yield Corporate Bond ETF,"Fixed Income: U.S. - Corporate, Broad-based High Yield Short-Term",Invesco,0.42%,$735.76M
KBWB,Invesco KBW Bank ETF,Equity: U.S. Banks,Invesco,0.35%,$732.42M
GSG,iShares S&P GSCI Commodity Indexed Trust,Commodities: Broad Market,Blackrock,0.85%,$732.36M
RYH,Invesco S&P 500 Equal Weight Health Care ETF,Equity: U.S. Health Care,Invesco,0.40%,$731.41M
FNCL,Fidelity MSCI Financials Index ETF,Equity: U.S. Financials,FMR LLC,0.08%,$728.72M
DHS,WisdomTree U.S. High Dividend Fund,Equity: U.S. - High Dividend Yield,WisdomTree,0.38%,$727.98M
RPAR,RPAR Risk Parity ETF,Alternatives: Absolute Returns,Toroso Investments,0.50%,$723.82M
HTRB,Hartford Total Return Bond ETF,"Fixed Income: Global - Broad Market, Broad-based",The Hartford,0.30%,$721.87M
PWB,Invesco Dynamic Large Cap Growth ETF,Equity: U.S. - Large Cap Growth,Invesco,0.55%,$721.14M
AOK,iShares Core Conservative Allocation ETF,Asset Allocation: Target Risk,Blackrock,0.25%,$717.80M
REGL,ProShares S&P MidCap 400 Dividend Aristocrats ETF,Equity: U.S. - Mid Cap,ProShares,0.40%,$715.96M
FSTA,Fidelity MSCI Consumer Staples Index ETF,Equity: U.S. Consumer Non-cyclicals,FMR LLC,0.08%,$715.73M
CGW,Invesco S&P Global Water Index ETF,Equity:Global Water,Invesco,0.59%,$700.95M
MLPA,Global X MLP ETF,Equity: U.S. MLPs,Mirae Asset,0.46%,$700.84M
XMMO,Invesco S&P Midcap Momentum ETF,Equity: U.S. - Mid Cap,Invesco,0.39%,$700.41M
GWX,SPDR S&P International Small Cap ETF,Equity: Developed Markets Ex-U.S. - Small Cap,State Street Global Advisors,0.40%,$698.45M
MNA,IQ Merger Arbitrage ETF,Alternatives: Absolute Returns,New York Life,0.77%,$695.75M
PKW,Invesco BuyBack Achievers ETF,Equity: U.S. - Total Market,Invesco,0.62%,$692.31M
PPA,Invesco Aerospace & Defense ETF,Equity: U.S. Aerospace & Defense,Invesco,0.59%,$690.26M
FINX,Global X FinTech ETF,Equity: Global Technology,Mirae Asset,0.68%,$689.30M
PFFD,Global X U.S. Preferred ETF,"Fixed Income: U.S. - Corporate, Preferred",Mirae Asset,0.23%,$687.49M
JHEM,John Hancock Multifactor Emerging Markets ETF,Equity: Emerging Markets - Total Market,John Hancock,0.49%,$687.22M
FXN,First Trust Energy AlphaDEX Fund,Equity: U.S. Energy,First Trust,0.65%,$685.26M
VTHR,Vanguard Russell 3000 ETF,Equity: U.S. - Total Market,Vanguard,0.10%,$685.26M
CFA,VictoryShares US 500 Volatility Wtd ETF,Equity: U.S. - Large Cap,Victory Capital,0.35%,$678.36M
JAGG,JPMorgan U.S. Aggregate Bond ETF,"Fixed Income: U.S. - Broad Market, Broad-based Investment Grade",JPMorgan Chase,0.07%,$677.84M
BSJM,Invesco BulletShares 2022 High Yield Corporate Bond ETF,"Fixed Income: U.S. - Corporate, Broad-based High Yield Intermediate",Invesco,0.42%,$675.55M
LVHD,Legg Mason Low Volatility High Dividend ETF,Equity: U.S. - Total Market,Franklin Templeton,0.27%,$671.17M
PWV,Invesco Dynamic Large Cap Value ETF,Equity: U.S. - Large Cap Value,Invesco,0.55%,$668.97M
IYK,iShares U.S. Consumer Goods ETF,Equity: U.S. Consumer Non-cyclicals,Blackrock,0.42%,$667.69M
JKG,iShares Morningstar Mid-Cap ETF,Equity: U.S. - Mid Cap,Blackrock,0.25%,$666.53M
PSC,Principal U.S. Small-Cap Multi-Factor Index ETF,Equity: U.S. - Small Cap,Principal,0.38%,$663.67M
IWX,iShares Russell Top 200 Value ETF,Equity: U.S. - Large Cap Value,Blackrock,0.20%,$661.42M
MFEM,PIMCO RAFI Dynamic Multi-Factor Emerging Markets Equity ETF,Equity: Emerging Markets - Total Market,Allianz,0.49%,$659.67M
SDIV,Global X SuperDividend ETF,Equity: Global - High Dividend Yield,Mirae Asset,0.59%,$652.39M
DVYE,iShares Emerging Markets Dividend ETF,Equity: Emerging Markets - High Dividend Yield,Blackrock,0.49%,$651.53M
PEY,Invesco High Yield Equity Dividend Achievers ETF,Equity: U.S. - High Dividend Yield,Invesco,0.53%,$650.13M
LGLV,SPDR SSGA U.S. Large Cap Low Volatility Index ETF,Equity: U.S. - Large Cap,State Street Global Advisors,0.12%,$648.84M
LDEM,iShares ESG MSCI EM Leaders ETF,Equity: Emerging Markets - Total Market,Blackrock,0.16%,$645.86M
RPV,Invesco S&P 500 Pure Value ETF,Equity: U.S. - Large Cap Value,Invesco,0.35%,$642.47M
FTA,First Trust Large Cap Value AlphaDEX Fund,Equity: U.S. - Large Cap Value,First Trust,0.60%,$640.52M
CFO,VictoryShares U.S. 500 Enhanced Volatility Wtd Index ETF,Equity: U.S. - Large Cap,Victory Capital,0.35%,$640.26M
KBA,KraneShares Bosera MSCI China A Share ETF,Equity: China - Total Market,CICC,0.60%,$635.42M
EPI,WisdomTree India Earnings Fund,Equity: India - Total Market,WisdomTree,0.85%,$634.65M
STPZ,PIMCO 1-5 Year US TIPS Index ETF,"Fixed Income: U.S. - Government, Inflation-linked Investment Grade Short-Term",Allianz,0.20%,$634.64M
SPYX,SPDR S&P 500 Fossil Fuel Reserves Free ETF,Equity: U.S. - Large Cap,State Street Global Advisors,0.20%,$631.38M
WCLD,WisdomTree Cloud Computing Fund,Equity: U.S. Technology,WisdomTree,0.45%,$622.38M
BSCP,Invesco BulletShares 2025 Corporate Bond ETF,"Fixed Income: U.S. - Corporate, Broad-based Investment Grade Intermediate",Invesco,0.10%,$619.15M
KXI,iShares Global Consumer Staples ETF,Equity: Global Consumer Non-cyclicals,Blackrock,0.46%,$615.04M
SDOW,ProShares UltraPro Short Dow30,Inverse Equity: U.S. - Large Cap,ProShares,0.95%,$614.91M
RDIV,Invesco S&P Ultra Dividend Revenue ETF,Equity: U.S. - High Dividend Yield,Invesco,0.39%,$614.84M
OIH,VanEck Vectors Oil Services ETF,Equity: Global Oil & Gas Equipment & Services,VanEck,0.35%,$613.70M
FNX,First Trust Mid Cap Core AlphaDEX Fund,Equity: U.S. - Mid Cap,First Trust,0.61%,$609.18M
ROM,ProShares Ultra Technology,Leveraged Equity: U.S. Technology,ProShares,0.95%,$609.02M
INDY,iShares India 50 ETF,Equity: India - Large Cap,Blackrock,0.93%,$602.52M
DWM,WisdomTree International Equity Fund,Equity: Developed Markets Ex-U.S. - Total Market,WisdomTree,0.48%,$602.29M
DWX,SPDR S&P International Dividend ETF,Equity: Global Ex-U.S. - High Dividend Yield,State Street Global Advisors,0.45%,$601.99M
TZA,Direxion Daily Small Cap Bear 3X Shares,Inverse Equity: U.S. - Small Cap,Direxion,1.07%,$601.96M
PSQ,ProShares Short QQQ,Inverse Equity: U.S. - Large Cap,ProShares,0.95%,$599.26M
SMDV,ProShares Russell 2000 Dividend Growers ETF,Equity: U.S. - Small Cap,ProShares,0.40%,$599.21M
MOO,VanEck Vectors Agribusiness ETF,Equity: Global Agriculture,VanEck,0.56%,$598.48M
LDUR,PIMCO Enhanced Low Duration Active ETF,"Fixed Income: Global - Broad Market, Broad-based Short-Term",Allianz,0.79%,$597.25M
GIGB,Goldman Sachs Access Investment Grade Corporate Bond ETF,"Fixed Income: U.S. - Corporate, Broad-based Investment Grade",Goldman Sachs,0.14%,$588.51M
CDC,VictoryShares US EQ Income Enhanced Volatility Wtd ETF,Equity: U.S. - Large Cap,Victory Capital,0.35%,$588.49M
SECT,Main Sector Rotation ETF,Equity: U.S. - Large Cap,Main Management,0.83%,$588.21M
PBW,Invesco WilderHill Clean Energy ETF,Equity:Global Renewable Energy,Invesco,0.70%,$587.18M
VTC,Vanguard Total Corporate Bond ETF,"Fixed Income: U.S. - Corporate, Broad-based Investment Grade",Vanguard,0.05%,$582.60M
HEZU,iShares Currency Hedged MSCI Eurozone ETF,Equity: Developed Europe - Total Market,Blackrock,0.52%,$572.56M
TDTF,FlexShares iBoxx 5-Year Target Duration TIPS Index Fund,"Fixed Income: U.S. - Government, Inflation-linked Investment Grade Intermediate",Northern Trust,0.18%,$570.84M
NXTG,First Trust Indxx NextG ETF,Equity: Global Telecommunications,First Trust,0.70%,$570.42M
SMLF,iShares MSCI USA Small-Cap Multifactor ETF,Equity: U.S. - Small Cap,Blackrock,0.30%,$569.27M
XHE,SPDR S&P Health Care Equipment ETF,Equity: U.S. Health Care Equipment & Supplies,State Street Global Advisors,0.35%,$565.90M
SWAN,Amplify BlackSwan Growth & Treasury Core ETF,Asset Allocation: Target Outcome,Amplify,0.49%,$565.52M
TLTD,FlexShares Morningstar Developed Markets ex-US Factor Tilt Index Fund,Equity: Developed Markets Ex-U.S. - Total Market,Northern Trust,0.39%,$564.62M
JPUS,JPMorgan Diversified Return U.S. Equity ETF,Equity: U.S. - Large Cap,JPMorgan Chase,0.18%,$564.30M
PTH,Invesco DWA Healthcare Momentum ETF,Equity: U.S. Health Care,Invesco,0.60%,$563.68M
MJ,ETFMG Alternative Harvest ETF,Equity: Global Cannabis,ETFMG,0.75%,$561.53M
RING,iShares MSCI Global Gold Miners ETF,Equity: Global Gold Miners,Blackrock,0.39%,$560.22M
JMST,JPMorgan Ultra-Short Municipal Income ETF,"Fixed Income: U.S. - Government, Local Authority/Municipal Investment Grade Short-Term",JPMorgan Chase,0.18%,$558.23M
LTPZ,PIMCO 15+ Year US TIPS Index ETF,"Fixed Income: U.S. - Government, Inflation-linked Investment Grade Long-Term",Allianz,0.20%,$557.26M
EZM,WisdomTree U.S. MidCap Fund,Equity: U.S. - Mid Cap,WisdomTree,0.38%,$557.22M
EEMA,iShares MSCI Emerging Markets Asia ETF,Equity: Emerging Asia-Pacific - Total Market,Blackrock,0.50%,$555.85M
FCOM,Fidelity MSCI Communication Services Index ETF,Equity: U.S. Telecommunications,FMR LLC,0.08%,$555.84M
EMGF,iShares Edge MSCI Multifactor Emerging Markets ETF,Equity: Emerging Markets - Total Market,Blackrock,0.45%,$546.21M
GMF,SPDR S&P Emerging Asia Pacific ETF,Equity: Emerging Asia-Pacific - Total Market,State Street Global Advisors,0.49%,$545.24M
RHS,Invesco S&P 500 Equal Weight Consumer Staples ETF,Equity: U.S. Consumer Non-cyclicals,Invesco,0.40%,$544.36M
FNGU,MicroSectors FANG+ Index 3X Leveraged ETN,Leveraged Equity: U.S. - Total Market,BMO,0.95%,$543.98M
XSD,SPDR S&P Semiconductor ETF,Equity: U.S. Semiconductors,State Street Global Advisors,0.35%,$542.67M
DTN,WisdomTree U.S. Dividend ex-Financials Fund,Equity: U.S. - Large Cap,WisdomTree,0.38%,$542.35M
DBA,Invesco DB Agriculture Fund,Commodities: Agriculture,Invesco,0.89%,$540.44M
FDVV,Fidelity High Dividend ETF,Equity: Developed Markets - High Dividend Yield,FMR LLC,0.29%,$535.67M
XME,SPDR S&P Metals & Mining ETF,Equity: U.S. Metals & Mining,State Street Global Advisors,0.35%,$535.42M
MDIV,Multi-Asset Diversified Income Index Fund,Asset Allocation: Target Outcome,First Trust,0.73%,$534.92M
KIE,SPDR S&P Insurance ETF,Equity: U.S. Insurance,State Street Global Advisors,0.35%,$534.21M
FIW,First Trust Water ETF,Equity:Global Water,First Trust,0.55%,$533.46M
EWS,iShares MSCI Singapore ETF,Equity: Singapore - Total Market,Blackrock,0.50%,$529.19M
DFEB,FT Cboe Vest U.S. Equity Deep Buffer ETF - February,Equity: U.S. - Large Cap,First Trust,0.85%,$528.17M
OUSA,OShares U.S. Quality Dividend ETF,Equity: U.S. - Large Cap,O'Shares Investments,0.48%,$527.42M
FXO,First Trust Financials AlphaDEX Fund,Equity: U.S. Financials,First Trust,0.63%,$521.81M
SVXY,ProShares Short VIX Short-Term Futures ETF,Inverse Alternatives: U.S. - Volatility,ProShares,1.38%,$518.16M
EWX,SPDR S&P Emerging Markets Small Cap ETF,Equity: Emerging Markets - Small Cap,State Street Global Advisors,0.65%,$517.44M
ARKQ,ARK Autonomous Technology & Robotics ETF,Equity: Global Robotics & AI,ARK,0.75%,$516.61M
MLPX,Global X MLP & Energy Infrastructure ETF,Equity: U.S. MLPs,Mirae Asset,0.45%,$516.00M
KSA,iShares MSCI Saudi Arabia ETF,Equity: Saudi Arabia - Total Market,Blackrock,0.74%,$515.10M
PSJ,Invesco Dynamic Software ETF,Equity: U.S. Software,Invesco,0.58%,$512.51M
CNYA,iShares MSCI China A ETF,Equity: China - Total Market,Blackrock,0.60%,$510.37M
ONEV,SPDR Russell 1000 Low Volatility Focus ETF,Equity: U.S. - Large Cap,State Street Global Advisors,0.20%,$510.07M
NULV,Nuveen ESG Large-Cap Value ETF,Equity: U.S. - Large Cap Value,Nuveen Securities,0.35%,$508.25M
PID,Invesco International Dividend Achievers ETF,Equity: Global Ex-U.S. - Total Market,Invesco,0.54%,$507.96M
JMBS,Janus Henderson Mortgage-Backed Securities ETF,"Fixed Income: U.S. - Government, Mortgage-backed Investment Grade",Janus Henderson,0.32%,$504.85M
IVOV,Vanguard S&P Mid-Cap 400 Value ETF,Equity: U.S. - Mid Cap Value,Vanguard,0.15%,$501.97M
AAAU,Perth Mint Physical Gold ETF,Commodities: Precious Metals Gold,Exchange Traded Concepts,0.18%,$500.86M
MUNI,PIMCO Intermediate Municipal Bond Active ETF,"Fixed Income: U.S. - Government, Local Authority/Municipal Investment Grade Intermediate",Allianz,0.35%,$499.97M
IBDR,iShares iBonds Dec 2026 Term Corporate ETF,"Fixed Income: U.S. - Corporate, Broad-based Investment Grade Intermediate",Blackrock,0.10%,$498.99M
BBH,VanEck Vectors Biotech ETF,Equity: Global Biotech,VanEck,0.35%,$498.44M
JHSC,John Hancock Multifactor Small Cap ETF,Equity: U.S. - Small Cap,John Hancock,0.42%,$495.93M
ERUS,iShares MSCI Russia ETF,Equity: Russia - Total Market,Blackrock,0.59%,$494.65M
VIOV,Vanguard S&P Small-Cap 600 Value ETF,Equity: U.S. - Small Cap Value,Vanguard,0.15%,$494.29M
IQDF,FlexShares International Quality Dividend Index Fund,Equity: Global Ex-U.S. - Total Market,Northern Trust,0.47%,$491.69M
NAIL,Direxion Daily Homebuilders & Supplies Bull 3X Shares,Leveraged Equity: U.S. Homebuilding,Direxion,0.99%,$490.93M
NANR,SPDR S&P North American Natural Resources ETF,Equity: Global Natural Resources,State Street Global Advisors,0.35%,$488.42M
SUSC,iShares ESG Aware USD Corporate Bond ETF,"Fixed Income: U.S. - Corporate, Broad-based Investment Grade",Blackrock,0.18%,$484.47M
ULVM,VictoryShares USAA MSCI USA Value Momentum ETF,Equity: U.S. - Total Market,Victory Capital,0.20%,$483.70M
DBEU,Xtrackers MSCI Europe Hedged Equity ETF,Equity: Developed Europe - Total Market,Deutsche Bank,0.45%,$480.07M
UYG,ProShares Ultra Financials,Leveraged Equity: U.S. Financials,ProShares,0.95%,$479.54M
ARKF,ARK Fintech Innovation ETF,Equity: Global Technology,ARK,0.75%,$479.33M
GUSH,Direxion Daily S&P Oil & Gas Exp. & Prod. Bull 2X Shares,Leveraged Equity: U.S. Oil & Gas Exploration & Production,Direxion,1.17%,$477.49M
HDEF,Xtrackers MSCI EAFE High Dividend Yield Equity ETF,Equity: Developed Markets Ex-U.S. - High Dividend Yield,Deutsche Bank,0.20%,$476.00M
DBO,Invesco DB Oil Fund,Commodities: Energy Crude Oil,Invesco,0.78%,$474.82M
DJP,iPath Bloomberg Commodity Index Total Return ETN,Commodities: Broad Market,Barclays Capital Inc.,0.70%,$473.73M
FLTR,VanEck Vectors Investment Grade Floating Rate ETF,"Fixed Income: U.S. - Corporate, Broad-based Investment Grade Floating Rate",VanEck,0.14%,$473.71M
EQAL,Invesco Russell 1000 Equal Weight ETF,Equity: U.S. - Large Cap,Invesco,0.20%,$471.80M
CMBS,iShares CMBS ETF,"Fixed Income: U.S. - Corporate, Asset-backed Investment Grade",Blackrock,0.25%,$471.22M
EWP,iShares MSCI Spain ETF,Equity: Spain - Total Market,Blackrock,0.50%,$470.84M
FIVG,Defiance Next Gen Connectivity ETF,Equity: Global Telecommunications,Defiance ETFs,0.30%,$470.31M
XNTK,SPDR NYSE Technology ETF,Equity: U.S. Technology,State Street Global Advisors,0.35%,$469.70M
NYF,iShares New York Muni Bond ETF,"Fixed Income: New York - Government, Local Authority/Municipal Investment Grade",Blackrock,0.25%,$468.84M
IMTM,iShares MSCI Intl Momentum Factor ETF,Equity: Developed Markets Ex-U.S. - Total Market,Blackrock,0.30%,$468.75M
FENY,Fidelity MSCI Energy Index ETF,Equity: U.S. Energy,FMR LLC,0.08%,$468.27M
JHMD,John Hancock Multifactor Developed International ETF,Equity: Developed Markets Ex-U.S. - Total Market,John Hancock,0.39%,$467.14M
IVLU,iShares MSCI Intl Value Factor ETF,Equity: Developed Markets Ex-U.S. - Total Market Value,Blackrock,0.30%,$464.03M
VRIG,Invesco Variable Rate Investment Grade ETF,"Fixed Income: U.S. - Broad Market, Broad-based Investment Grade Floating Rate",Invesco,0.30%,$462.45M
ZROZ,PIMCO 25+ Year Zero Coupon US Treasury Index ETF,"Fixed Income: U.S. - Government, Treasury Investment Grade Long-Term",Allianz,0.15%,$460.90M
IVOL,Quadratic Interest Rate Volatility and Inflation Hedge ETF,"Fixed Income: U.S. - Government, Inflation-linked Investment Grade",CICC,0.99%,$456.58M
UITB,VictoryShares USAA Core Intermediate-Term Bond ETF,"Fixed Income: U.S. - Broad Market, Broad-based Intermediate",Victory Capital,0.38%,$456.00M
JKF,iShares Morningstar Large-Cap Value ETF,Equity: U.S. - Large Cap Value,Blackrock,0.25%,$454.66M
QDEF,FlexShares Quality Dividend Defensive Index Fund,Equity: U.S. - Total Market,Northern Trust,0.37%,$452.96M
ECH,iShares MSCI Chile ETF,Equity: Chile - Total Market,Blackrock,0.59%,$451.80M
ILTB,iShares Core 10+ Year USD Bond ETF,"Fixed Income: U.S. - Broad Market, Broad-based Long-Term",Blackrock,0.06%,$450.74M
THD,iShares MSCI Thailand ETF,Equity: Thailand - Total Market,Blackrock,0.59%,$450.42M
PWZ,Invesco California AMT-Free Municipal Bond ETF,"Fixed Income: California - Government, Local Authority/Municipal Investment Grade",Invesco,0.28%,$450.08M
VIDI,Vident International Equity Fund,Equity: Global Ex-U.S. - Total Market,Vident,0.59%,$448.57M
CRBN,iShares MSCI ACWI Low Carbon Target ETF,Equity: Global - Total Market,Blackrock,0.20%,$448.57M
XRT,SPDR S&P Retail ETF,Equity: U.S. Retail,State Street Global Advisors,0.35%,$447.62M
LABU,Direxion Daily S&P Biotech Bull 3X Shares,Leveraged Equity: U.S. Biotech,Direxion,1.04%,$447.11M
BNDW,Vanguard Total World Bond ETF,"Fixed Income: Global - Broad Market, Broad-based Investment Grade",Vanguard,0.06%,$446.19M
LEMB,iShares J.P. Morgan EM Local Currency Bond ETF,"Fixed Income: Emerging Markets - Government, Treasury Investment Grade",Blackrock,0.30%,$446.00M
TIPX,SPDR Bloomberg Barclays 1-10 Year TIPS ETF,"Fixed Income: U.S. - Government, Inflation-linked Investment Grade Intermediate",State Street Global Advisors,0.15%,$444.87M
ESPO,VanEck Vectors Video Gaming and eSports ETF,Equity:Global Video Games & eSports,VanEck,0.55%,$444.12M
IYE,iShares U.S. Energy ETF,Equity: U.S. Energy,Blackrock,0.42%,$440.62M
FEM,First Trust Emerging Markets AlphaDEX Fund,Equity: Emerging Markets - Total Market,First Trust,0.80%,$436.30M
EAGG,iShares ESG Aware U.S. Aggregate Bond ETF,"Fixed Income: U.S. - Broad Market, Broad-based Investment Grade",Blackrock,0.10%,$435.96M
PTMC,Pacer Trendpilot U.S. Mid Cap ETF,Equity: U.S. - Mid Cap,Pacer Advisors,0.62%,$434.10M
DIV,Global X SuperDividend U.S. ETF,Equity: U.S. - High Dividend Yield,Mirae Asset,0.46%,$433.10M
RAVI,FlexShares Ready Access Variable Income Fund,"Fixed Income: Global - Broad Market, Broad-based Investment Grade Short-Term",Northern Trust,0.25%,$429.41M
RWM,ProShares Short Russell2000,Inverse Equity: U.S. - Small Cap,ProShares,0.95%,$429.39M
DIAL,Columbia Diversified Fixed Income Allocation ETF,"Fixed Income: Global - Broad Market, Broad-based","Columbia Management Investment Advisers, LLC",0.28%,$428.28M
CSM,ProShares Large Cap Core Plus,Equity: U.S. - Large Cap,ProShares,0.45%,$427.35M
FDLO,Fidelity Low Volatility Factor ETF,Equity: U.S. - Large Cap,FMR LLC,0.29%,$427.19M
HYEM,VanEck Vectors Emerging Markets High Yield Bond ETF,"Fixed Income: Emerging Markets - Corporate, Broad-based High Yield",VanEck,0.40%,$426.68M
TBT,ProShares UltraShort 20+ Year Treasury,"Inverse Fixed Income: U.S. - Government, Treasury Investment Grade Long-Term",ProShares,0.89%,$425.11M
GNMA,iShares GNMA Bond ETF,"Fixed Income: U.S. - Government, Mortgage-backed Investment Grade",Blackrock,0.15%,$424.88M
FYX,First Trust Small Cap Core AlphaDEX Fund,Equity: U.S. - Small Cap,First Trust,0.63%,$422.90M
SILJ,ETFMG Prime Junior Silver Miners ETF,Equity: Global Silver Miners,ETFMG,0.69%,$421.87M
AVUS,Avantis U.S. Equity ETF,Equity: U.S. - Total Market,American Century Investments,0.15%,$417.96M
FLJP,Franklin FTSE Japan ETF,Equity: Japan - Total Market,Franklin Templeton,0.09%,$417.31M
BNO,United States Brent Oil Fund LP,Commodities: Energy Crude Oil,US Commodity Funds,0.88%,$416.41M
FTSD,Franklin Liberty Short Duration U.S. Government ETF,"Fixed Income: U.S. - Government, Broad-based Investment Grade Short-Term",Franklin Templeton,0.25%,$415.02M
FDT,First Trust Developed Markets ex-US AlphaDEX Fund,Equity: Developed Markets Ex-U.S. - Total Market,First Trust,0.80%,$413.40M
EES,WisdomTree U.S. SmallCap Fund,Equity: U.S. - Small Cap,WisdomTree,0.38%,$412.63M
QCLN,First Trust NASDAQ Clean Edge Green Energy Index Fund,Equity:Global Renewable Energy,First Trust,0.60%,$412.34M
DOG,ProShares Short Dow30,Inverse Equity: U.S. - Large Cap,ProShares,0.95%,$410.24M
UNG,United States Natural Gas Fund LP,Commodities: Energy Natural Gas,US Commodity Funds,1.28%,$408.82M
EPS,WisdomTree U.S. LargeCap Fund,Equity: U.S. - Large Cap,WisdomTree,0.08%,$405.06M
DRSK,Aptus Defined Risk ETF,Asset Allocation: Target Outcome,Aptus Capital Advisors,0.76%,$404.98M
TFLO,iShares Treasury Floating Rate Bond ETF,"Fixed Income: U.S. - Government, Treasury Investment Grade Floating Rate",Blackrock,0.15%,$402.36M
UUP,Invesco DB U.S. Dollar Index Bullish Fund,"Currency: Long USD, Short Global Basket",Invesco,0.79%,$401.56M
VBND,Vident Core U.S. Bond Strategy ETF,"Fixed Income: U.S. - Broad Market, Broad-based Intermediate",Vident,0.41%,$400.34M
SPGM,SPDR Portfolio MSCI Global Stock Market ETF,Equity: Global - Total Market,State Street Global Advisors,0.09%,$399.86M
IGE,iShares North American Natural Resources ETF,Equity: Global Natural Resources,Blackrock,0.46%,$393.99M
PFM,Invesco Dividend Achievers ETF,Equity: U.S. - Total Market,Invesco,0.54%,$393.93M
DMRL,DeltaShares S&P 500 Managed Risk ETF,Asset Allocation: Target Outcome,Transamerica Funds,0.35%,$392.67M
OUNZ,VanEck Merk Gold,Commodities: Precious Metals Gold,Merk,0.25%,$389.96M
PSCH,Invesco S&P SmallCap Health Care ETF,Equity: U.S. Health Care,Invesco,0.29%,$389.19M
OGIG,O'Shares Global Internet Giants ETF,Equity: Global Internet,O'Shares Investments,0.48%,$385.33M
CATH,Global X S&P 500 Catholic Values ETF,Equity: U.S. - Large Cap,Mirae Asset,0.29%,$382.35M
MXI,iShares Global Materials ETF,Equity: Global Basic Materials,Blackrock,0.45%,$381.32M
FIDU,Fidelity MSCI Industrials Index ETF,Equity: U.S. Industrials,FMR LLC,0.08%,$379.76M
JQUA,JPMorgan U.S. Quality Factor ETF,Equity: U.S. - Large Cap,JPMorgan Chase,0.12%,$379.55M
BSJN,Invesco BulletShares 2023 High Yield Corporate Bond ETF,"Fixed Income: U.S. - Corporate, Broad-based High Yield Intermediate",Invesco,0.42%,$378.94M
FGD,First Trust Dow Jones Global Select Dividend Index Fund,Equity: Global - High Dividend Yield,First Trust,0.59%,$378.48M
ONEY,SPDR Russell 1000 Yield Focus ETF,Equity: U.S. - Large Cap,State Street Global Advisors,0.20%,$376.84M
FLGV,Franklin Liberty U.S. Treasury Bond ETF,"Fixed Income: U.S. - Government, Treasury Investment Grade",Franklin Templeton,0.09%,$376.67M
FXE,Invesco CurrencyShares Euro Trust,"Currency: Long EUR, Short USD",Invesco,0.40%,$375.69M
QEFA,SPDR MSCI EAFE StrategicFactors ETF,Equity: Developed Markets Ex-U.S. - Total Market,State Street Global Advisors,0.30%,$373.24M
VTWG,Vanguard Russell 2000 Growth ETF,Equity: U.S. - Small Cap Growth,Vanguard,0.15%,$372.33M
ERX,Direxion Daily Energy Bull 2x Shares,Leveraged Equity: U.S. Energy,Direxion,1.06%,$370.26M
FEP,First Trust Europe AlphaDEX Fund,Equity: Developed Europe - Total Market,First Trust,0.80%,$369.85M
VNM,VanEck Vectors Vietnam ETF,Equity: Vietnam - Total Market,VanEck,0.66%,$368.57M
DDM,ProShares Ultra Dow30,Leveraged Equity: U.S. - Large Cap,ProShares,0.95%,$367.92M
PALL,Aberdeen Standard Physical Palladium Shares ETF,Commodities: Precious Metals Palladium,Aberdeen Standard Investments,0.60%,$365.58M
FM,iShares MSCI Frontier 100 ETF,Equity: Frontier Markets - Total Market,Blackrock,0.79%,$363.83M
SUSB,iShares ESG Aware 1-5 Year USD Corporate Bond ETF,"Fixed Income: U.S. - Corporate, Broad-based Investment Grade Short-Term",Blackrock,0.12%,$363.47M
IYZ,iShares U.S. Telecommunications ETF,Equity: U.S. Telecommunications,Blackrock,0.42%,$361.28M
DOL,WisdomTree International LargeCap Dividend Fund,Equity: Developed Markets Ex-U.S. - Large Cap,WisdomTree,0.48%,$356.58M
ACES,ALPS Clean Energy ETF,Equity:Global Renewable Energy,SS&C,0.65%,$355.07M
IHE,iShares U.S. Pharmaceuticals ETF,Equity: U.S. Pharmaceuticals,Blackrock,0.42%,$354.88M
