Ticker,Name,Segment,Issuer,Expense Ratio,AUM
FQAL,Fidelity Quality Factor ETF,Equity: U.S. - Large Cap,FMR LLC,0.29%,$170.09M
UWM,ProShares Ultra Russell2000,Leveraged Equity: U.S. - Small Cap,ProShares,0.95%,$170.06M
RTM,Invesco S&P 500 Equal Weight Materials ETF,Equity: U.S. Basic Materials,Invesco,0.40%,$169.77M
URA,Global X Uranium ETF,Equity: Global Nuclear Energy,Mirae Asset,0.71%,$169.02M
ECON,Columbia Emerging Markets Consumer ETF,Equity: Emerging Markets Consumer,"Columbia Management Investment Advisers, LLC",0.59%,$167.19M
JPGB,JPMorgan Global Bond Opportunities ETF,"Fixed Income: Global - Broad Market, Broad-based",JPMorgan Chase,0.50%,$167.01M
FNI,First Trust Chindia ETF,Equity: Emerging Asia-Pacific - Total Market,First Trust,0.60%,$166.77M
SDG,iShares MSCI Global Impact ETF,Equity: Global - Total Market,Blackrock,0.49%,$166.15M
FLHY,Franklin Liberty High Yield Corporate ETF,"Fixed Income: Global - Corporate, Broad-based High Yield",Franklin Templeton,0.40%,$166.14M
NUMG,Nuveen ESG Mid-Cap Growth ETF,Equity: U.S. - Mid Cap Growth,Nuveen Securities,0.40%,$164.77M
VSMV,VictoryShares U.S. Multi-Factor Minimum Volatility ETF,Equity: U.S. - Total Market,Victory Capital,0.35%,$164.74M
WPS,iShares International Developed Property ETF,Equity:Global Ex-US Real Estate,Blackrock,0.48%,$164.72M
ATMP,Barclays ETN+ Select MLP ETN,Equity: U.S. MLPs,Barclays Capital Inc.,0.95%,$163.58M
DSTL,Distillate U.S. Fundamental Stability & Value ETF,Equity: U.S. - Large Cap,Distillate Capital,0.39%,$162.84M
ENZL,iShares MSCI New Zealand ETF,Equity: New Zealand - Total Market,Blackrock,0.50%,$162.18M
SPHB,Invesco S&P 500 High Beta ETF,Equity: U.S. - Large Cap,Invesco,0.25%,$161.43M
TOLZ,ProShares DJ Brookfield Global Infrastructure ETF,Equity:Global Infrastructure,ProShares,0.46%,$161.20M
DDWM,WisdomTree Dynamic Currency Hedged International Equity Fund,Equity: Developed Markets Ex-U.S. - Total Market,WisdomTree,0.35%,$161.08M
XMPT,VanEck Vectors CEF Municipal Income ETF,"Fixed Income:U.S. Government, Local Authority/Municipal Broad Credit Broad Maturities",VanEck,1.86%,$160.57M
SRTY,ProShares UltraPro Short Russell2000,Inverse Equity: U.S. - Small Cap,ProShares,0.95%,$160.00M
RTH,VanEck Vectors Retail ETF,Equity: Global Retail,VanEck,0.35%,$159.63M
IDOG,ALPS International Sector Dividend Dogs ETF,Equity: Developed Markets Ex-U.S. - Large Cap,SS&C,0.50%,$159.46M
FXA,Invesco CurrencyShares Australian Dollar Trust,"Currency: Long AUD, Short USD",Invesco,0.40%,$158.88M
IGEB,iShares Edge Investment Grade Enhanced Bond ETF,"Fixed Income: U.S. - Corporate, Broad-based Investment Grade",Blackrock,0.18%,$158.61M
ADME,Aptus Drawdown Managed Equity ETF,Equity: U.S. - Large Cap,Aptus Capital Advisors,0.81%,$158.07M
TOK,iShares MSCI Kokusai ETF,Equity: Developed Markets Ex-Japan - Total Market,Blackrock,0.25%,$157.69M
FBGX,UBS AG FI Enhanced Large Cap Growth ETN,Leveraged Equity: U.S. - Large Cap Growth,UBS,1.29%,$157.22M
FYC,First Trust Small Cap Growth AlphaDEX Fund,Equity: U.S. - Small Cap Growth,First Trust,0.70%,$157.11M
EQL,ALPS Equal Sector Weight ETF,Equity: U.S. - Large Cap,SS&C,0.28%,$156.80M
PSP,Invesco Global Listed Private Equity ETF,Equity: Global Private Equity,Invesco,1.78%,$156.49M
BJAN,Innovator S&P 500 Buffer ETF - January,Equity: U.S. - Large Cap,Innovator,0.80%,$155.68M
IDNA,iShares Genomics Immunology and Healthcare ETF,Equity: Global Health Care Pharmaceuticals & Medical Equipment,Blackrock,0.47%,$155.66M
EDC,Direxion Daily MSCI Emerging Markets Bull 3x Shares,Leveraged Equity: Emerging Markets - Total Market,Direxion,1.33%,$155.50M
TPLC,Timothy Plan U.S. Large/Mid Cap Core ETF,Equity: U.S. - Total Market,Timothy Plan,0.52%,$154.07M
KLDW,Knowledge Leaders Developed World ETF,Equity: Developed Markets - Total Market,Intangible Capital,0.75%,$152.69M
DGP,DB Gold Double Long ETN,Leveraged Commodities: Precious Metals Gold,Deutsche Bank,0.75%,$152.68M
RYF,Invesco S&P 500 Equal Weight Financials ETF,Equity: U.S. Financials,Invesco,0.40%,$152.57M
PIZ,Invesco DWA Developed Markets Momentum ETF,Equity: Developed Markets Ex-U.S. - Total Market,Invesco,0.81%,$152.46M
QEMM,SPDR MSCI Emerging Markets StrategicFactors ETF,Equity: Emerging Markets - Total Market,State Street Global Advisors,0.30%,$151.70M
FEMS,First Trust Emerging Markets Small Cap AlphaDEX Fund,Equity: Emerging Markets - Small Cap,First Trust,0.80%,$151.08M
HDGE,AdvisorShares Ranger Equity Bear ETF,Inverse Equity: U.S. - Total Market,AdvisorShares,3.12%,$149.49M
GSST,Goldman Sachs Access Ultra Short Bond ETF,"Fixed Income: U.S. - Broad Market, Broad-based Investment Grade Ultra-Short Term",Goldman Sachs,0.16%,$149.39M
DEUS,Xtrackers Russell 1000 Comprehensive Factor ETF,Equity: U.S. - Large Cap,Deutsche Bank,0.17%,$148.68M
NUBD,Nuveen ESG U.S. Aggregate Bond ETF,"Fixed Income: U.S. - Broad Market, Broad-based Investment Grade",Nuveen Securities,0.20%,$148.59M
PIE,Invesco DWA Emerging Markets Momentum ETF,Equity: Emerging Markets - Total Market,Invesco,0.90%,$148.30M
IBMM,iShares iBonds Dec 2024 Term Muni Bond ETF,"Fixed Income: U.S. - Government, Local Authority/Municipal Investment Grade Intermediate",Blackrock,0.18%,$147.77M
WBND,Western Asset Total Return ETF,"Fixed Income: Global - Broad Market, Broad-based",Franklin Templeton,0.47%,$147.69M
IQSU,IQ Candriam ESG U.S. Equity ETF,Equity: U.S. - Total Market,New York Life,0.09%,$147.56M
PTIN,Pacer Trendpilot International ETF,Equity: Developed Markets Ex-U.S. - Large Cap,Pacer Advisors,0.65%,$147.23M
RFDI,First Trust RiverFront Dynamic Developed International,Equity: Developed Markets - Total Market,First Trust,0.83%,$147.10M
JUST,Goldman Sachs JUST U.S. Large Cap Equity ETF,Equity: U.S. - Large Cap,Goldman Sachs,0.20%,$147.00M
JPSE,JPMorgan Diversified Return U.S. Small Cap Equity ETF,Equity: U.S. - Small Cap,JPMorgan Chase,0.29%,$146.76M
IBD,Inspire Corporate Bond Impact ETF,"Fixed Income: U.S. - Corporate, Broad-based Investment Grade Intermediate",Inspire,0.50%,$145.26M
PREF,Principal Spectrum Preferred Securities Active ETF,"Fixed Income: Global - Corporate, Preferred",Principal,0.55%,$145.25M
SMOG,VanEck Vectors Low Carbon Energy ETF,Equity:Global Renewable Energy,VanEck,0.62%,$145.23M
GSSC,Goldman Sachs ActiveBeta U.S. Small Cap Equity ETF,Equity: U.S. - Small Cap,Goldman Sachs,0.20%,$145.17M
DAUG,FT Cboe Vest U.S. Equity Deep Buffer ETF - August,Equity: U.S. - Large Cap,First Trust,0.85%,$145.09M
BKF,iShares MSCI BRIC ETF,Equity: Emerging Markets - Total Market,Blackrock,0.69%,$144.62M
UJAN,Innovator S&P 500 Ultra Buffer ETF - January,Equity: U.S. - Large Cap,Innovator,0.79%,$143.77M
PFEB,Innovator S&P 500 Power Buffer ETF - February,Equity: U.S. - Large Cap,Innovator,0.79%,$143.58M
AUSF,Global X Adaptive U.S. Factor ETF,Equity: U.S. - Total Market,Mirae Asset,0.27%,$143.12M
STOT,SPDR DoubleLine Short Duration Total Return Tactical ETF,"Fixed Income: Global - Broad Market, Broad-based Short-Term",State Street Global Advisors,0.45%,$143.05M
IUS,Invesco RAFI Strategic US ETF,Equity: U.S. - Large Cap,Invesco,0.19%,$142.70M
JXI,iShares Global Utilities ETF,Equity: Global Utilities,Blackrock,0.46%,$141.91M
GHYB,Goldman Sachs Access High Yield Corporate Bond ETF,"Fixed Income: U.S. - Corporate, Broad-based High Yield",Goldman Sachs,0.34%,$141.69M
DNOV,FT Cboe Vest U.S. Equity Deep Buffer ETF - November,Equity: U.S. - Large Cap,First Trust,0.85%,$141.65M
NRGU,MicroSectors U.S. Big Oil Index 3X Leveraged ETN,Leveraged Equity: U.S. Oil & Gas,BMO,0.95%,$140.61M
SPEU,SPDR Portfolio Europe ETF,Equity: Europe - Total Market,State Street Global Advisors,0.09%,$139.93M
KEMQ,KraneShares Emerging Markets Consumer Technology Index ETF,Equity: Emerging Markets Technology,CICC,0.60%,$139.82M
GREK,Global X MSCI Greece ETF,Equity: Greece - Total Market,Mirae Asset,0.57%,$139.63M
USMF,WisdomTree U.S. Multifactor Fund,Equity: U.S. - Total Market,WisdomTree,0.28%,$139.47M
DBB,Invesco DB Base Metals Fund,Commodities: Industrial Metals,Invesco,0.80%,$139.25M
PFFA,Virtus InfraCap U.S. Preferred Stock ETF,"Leveraged Fixed Income: U.S. - Corporate, Preferred",Virtus Investment Partners,2.01%,$138.48M
FXC,Invesco CurrencyShares Canadian Dollar Trust,"Currency: Long CAD, Short USD",Invesco,0.40%,$138.45M
CURE,Direxion Daily Healthcare Bull 3x Shares,Leveraged Equity: U.S. Health Care,Direxion,1.08%,$138.35M
IQDG,WisdomTree International Quality Dividend Growth Fund,Equity: Developed Markets Ex-U.S. - Total Market,WisdomTree,0.42%,$138.26M
HCRB,Hartford Core Bond ETF,"Fixed Income: Global - Broad Market, Broad-based Investment Grade",The Hartford,0.29%,$137.20M
IEZ,iShares U.S. Oil Equipment & Services ETF,Equity: U.S. Oil & Gas Equipment & Services,Blackrock,0.42%,$136.37M
VALQ,American Century STOXX U.S. Quality Value ETF,Equity: U.S. - Total Market,American Century Investments,0.29%,$136.24M
ACIO,Aptus Collared Income Opportunity ETF,Equity: U.S. - Large Cap,Aptus Capital Advisors,0.79%,$135.16M
ENTR,ERShares Entrepreneur 30 ETF,Equity: U.S. - Total Market,"EntrepreneurShares, LLC",0.49%,$135.03M
GCOW,Pacer Global Cash Cows Dividend ETF,Equity: Developed Markets - Large Cap,Pacer Advisors,0.60%,$134.40M
DFNL,Davis Select Financial ETF,Equity: Global Financials,Davis Advisers,0.64%,$134.19M
CORN,Teucrium Corn Fund,Commodities: Agriculture Corn,Teucrium,3.71%,$133.76M
ADRE,Invesco BLDRS Emerging Markets 50 ADR Index Fund,Equity: Emerging Markets - Large Cap,Invesco,0.18%,$133.48M
FNOV,FT Cboe Vest U.S. Equity Buffer ETF - November,Equity: U.S. - Large Cap,First Trust,0.85%,$133.21M
CCOR,Core Alternative ETF,Alternatives: Absolute Returns,Core Alternative Capital,1.23%,$132.98M
FIBR,iShares Edge U.S. Fixed Income Balanced Risk ETF,"Fixed Income: U.S. - Broad Market, Broad-based",Blackrock,0.25%,$132.80M
JMOM,JPMorgan U.S. Momentum Factor ETF,Equity: U.S. - Large Cap,JPMorgan Chase,0.12%,$132.68M
RFDA,RiverFront Dynamic US Dividend Advantage ETF,Equity: U.S. - Total Market,SS&C,0.52%,$131.93M
IMTB,iShares Core 5-10 Year USD Bond ETF,"Fixed Income: U.S. - Broad Market, Broad-based Intermediate",Blackrock,0.06%,$131.15M
IEUS,iShares MSCI Europe Small-Cap ETF,Equity: Developed Europe - Small Cap,Blackrock,0.40%,$130.65M
BSJP,Invesco BulletShares 2025 High Yield Corporate Bond ETF,"Fixed Income: U.S. - Corporate, Broad-based High Yield Intermediate",Invesco,0.42%,$130.34M
MMIN,IQ MacKay Municipal Insured ETF,"Fixed Income: U.S. - Government, Local Authority/Municipal Investment Grade",New York Life,0.31%,$129.85M
LDSF,First Trust Low Duration Strategic Focus ETF,"Fixed Income: U.S. - Broad Market, Broad-based Short-Term",First Trust,0.82%,$129.79M
PWC,Invesco Dynamic Market ETF,Equity: U.S. - Total Market,Invesco,0.59%,$129.72M
SHE,SPDR SSGA Gender Diversity Index ETF,Equity: U.S. - Large Cap,State Street Global Advisors,0.20%,$129.36M
BSCS,Invesco BulletShares 2028 Corporate Bond ETF,"Fixed Income: U.S. - Corporate, Broad-based Investment Grade Intermediate",Invesco,0.10%,$129.25M
MVV,ProShares Ultra MidCap400,Leveraged Equity: U.S. - Mid Cap,ProShares,0.95%,$128.84M
RIGS,RiverFront Strategic Income Fund,"Fixed Income: Global - Broad Market, Broad-based",SS&C,0.47%,$128.23M
HYZD,WisdomTree Interest Rate Hedged High Yield Bond Fund,"Fixed Income: U.S. - Corporate, Broad-based High Yield",WisdomTree,0.43%,$128.00M
ISCF,iShares MSCI Intl Small-Cap Multifactor ETF,Equity: Developed Markets Ex-U.S. - Small Cap,Blackrock,0.40%,$127.98M
ELD,WisdomTree Emerging Markets Local Debt Fund,"Fixed Income: Emerging Markets - Broad Market, Broad-based",WisdomTree,0.55%,$127.65M
FXB,Invesco CurrencyShares British Pound Sterling Trust,"Currency: Long GBP, Short USD",Invesco,0.40%,$127.58M
PKB,Invesco Dynamic Building & Construction ETF,Equity: U.S. Construction & Engineering,Invesco,0.60%,$127.56M
FNGO,MicroSectors FANG+ Index 2X Leveraged ETN,Leveraged Equity: U.S. - Total Market,BMO,0.95%,$126.69M
JSMD,Janus Henderson Small/Mid Cap Growth Alpha ETF,Equity: U.S. - Extended Market Growth,Janus Henderson,0.30%,$126.50M
CSML,IQ Chaikin U.S. Small Cap ETF,Equity: U.S. - Small Cap,New York Life,0.35%,$126.15M
DPST,Direxion Daily Regional Banks Bull 3X Shares,Leveraged Equity: U.S. Banks,Direxion,0.99%,$125.89M
RFCI,RiverFront Dynamic Core Income ETF,"Fixed Income: Global - Broad Market, Broad-based",SS&C,0.52%,$125.02M
PICB,Invesco International Corporate Bond ETF,"Fixed Income: Developed Markets Ex-U.S. - Corporate, Broad-based Investment Grade",Invesco,0.50%,$124.51M
EFAD,ProShares MSCI EAFE Dividend Growers ETF,Equity: Developed Markets Ex-U.S. - Total Market,ProShares,0.50%,$124.36M
FLLV,Franklin Liberty U.S. Low Volatility ETF,Equity: U.S. - Total Market,Franklin Templeton,0.29%,$122.98M
EMNT,PIMCO Enhanced Short Maturity Active ESG ETF,"Fixed Income: U.S. - Broad Market, Broad-based Investment Grade Short-Term",Allianz,0.24%,$122.95M
VFVA,Vanguard U.S. Value Factor ETF,Equity: U.S. - Total Market Value,Vanguard,0.14%,$122.02M
EFAX,SPDR MSCI EAFE Fossil Fuel Reserves Free ETF,Equity: Developed Markets Ex-U.S. - Total Market,State Street Global Advisors,0.20%,$121.69M
SPHY,SPDR Portfolio High Yield Bond ETF,"Fixed Income: U.S. - Corporate, Broad-based High Yield",State Street Global Advisors,0.15%,$121.67M
KOKU,Xtrackers MSCI Kokusai Equity ETF,Equity: Developed Markets Ex-Japan - Total Market,Deutsche Bank,0.09%,$121.62M
EPHE,iShares MSCI Philippines ETF,Equity: Philippines - Total Market,Blackrock,0.59%,$121.53M
AFIF,Anfield Universal Fixed Income ETF,"Fixed Income: Global - Broad Market, Broad-based",Regents Park Funds,1.32%,$121.52M
KORP,American Century Diversified Corporate Bond ETF,"Fixed Income: U.S. - Corporate, Broad-based Intermediate",American Century Investments,0.29%,$121.04M
REML,Credit Suisse X-Links Monthly Pay 2xLeveraged Mortgage REIT ETN,Leveraged Equity: U.S. Mortgage REITs,Credit Suisse,1.30%,$120.99M
PJUL,Innovator S&P 500 Power Buffer ETF - July,Equity: U.S. - Large Cap,Innovator,0.79%,$120.58M
OPER,ClearShares Ultra-Short Maturity ETF,"Fixed Income: U.S. - Broad Market, Broad-based Investment Grade Ultra-Short Term",ClearShares,0.20%,$120.16M
ITEQ,BlueStar Israel Technology ETF,Equity: Israel Technology,ETFMG,0.75%,$120.10M
NUSI,Nationwide Risk-Managed Income ETF,Equity: U.S. - Large Cap,Nationwide,0.68%,$119.56M
CVY,Invesco Zacks Multi-Asset Income ETF,Asset Allocation: Target Outcome,Invesco,0.97%,$119.08M
PUTW,WisdomTree CBOE S&P 500 PutWrite Strategy Fund,Equity: U.S. - Large Cap,WisdomTree,0.44%,$118.62M
ACWF,iShares MSCI Global Multifactor ETF,Equity: Global - Total Market,Blackrock,0.35%,$118.30M
USCI,United States Commodity Index Fund,Commodities: Broad Market,US Commodity Funds,1.03%,$118.23M
CHAU,Direxion Daily CSI 300 China A Share Bull 2X Shares,Leveraged Equity: China - Total Market,Direxion,1.21%,$118.17M
BLOK,Amplify Transformational Data Sharing ETF,Equity: Global Blockchain,Amplify,0.70%,$118.08M
GOAU,U.S. Global GO Gold and Precious Metal Miners ETF,Equity: Global Gold Miners,US Global Investors,0.60%,$117.95M
QQH,HCM Defender 100 Index ETF,Equity: U.S. Technology,Howard Capital Management,1.25%,$117.91M
KJAN,Innovator Russell 2000 Power Buffer ETF - January,Equity: U.S. - Small Cap,Innovator,0.79%,$117.50M
DIVC,C-Tracks ETN - Miller/Howard Strategic Dividend Reinvestor,Equity: U.S. - Total Market,Citigroup Inc,0.70%,$117.40M
HDMV,First Trust Horizon Managed Volatility Developed International ETF,Equity: Developed Markets - Total Market,First Trust,0.80%,$117.37M
ESGG,FlexShares STOXX Global ESG Impact Index Fund,Equity: Developed Markets - Total Market,Northern Trust,0.42%,$117.34M
ROBT,First Trust Nasdaq Artificial Intelligence and Robotics ETF,Equity: Global Robotics & AI,First Trust,0.65%,$117.14M
GAMR,Wedbush ETFMG Video Game Tech ETF,Equity:Global Video Games & eSports,ETFMG,0.75%,$116.94M
DOO,WisdomTree International Dividend ex-Financials Fund,Equity: Developed Markets Ex-U.S. - Large Cap,WisdomTree,0.58%,$116.90M
RZG,Invesco S&P SmallCap 600 Pure Growth ETF,Equity: U.S. - Small Cap Growth,Invesco,0.35%,$116.90M
AMZA,InfraCap MLP ETF,Equity: U.S. MLPs,Virtus Investment Partners,2.41%,$116.89M
SNLN,Highland iBoxx Senior Loan ETF,"Fixed Income: U.S. - Corporate, Broad-based High Yield Floating Rate",Highland Capital Management,0.61%,$116.68M
RCD,Invesco S&P 500 Equal Weight Consumer Discretionary ETF,Equity: U.S. Consumer Cyclicals,Invesco,0.40%,$115.87M
IHAK,iShares Cybersecurity and Tech ETF,Equity: Global Technology,Blackrock,0.47%,$115.36M
PHDG,Invesco S&P 500 Downside Hedged ETF,Equity: U.S. - Large Cap,Invesco,0.39%,$115.34M
BLES,Inspire Global Hope ETF,Equity: Global - Large Cap,Inspire,0.52%,$115.32M
PAUG,Innovator S&P 500 Power Buffer ETF - August,Equity: U.S. - Large Cap,Innovator,0.79%,$115.12M
GSC,GS Connect S&P GSCI Enhanced Commodity TR Strategy ETN,Commodities: Broad Market,Goldman Sachs,1.25%,$114.83M
FMHI,First Trust Municipal High Income ETF,"Fixed Income:U.S. Government, Local Authority/Municipal Broad Credit Broad Maturities",First Trust,0.55%,$114.72M
RBIN,Nationwide Risk-Based International Equity ETF,Equity: Developed Markets Ex-U.S. - Large Cap,Nationwide,0.42%,$114.71M
INDL,Direxion Daily MSCI India Bull 3X Shares,Leveraged Equity: India - Total Market,Direxion,1.33%,$114.24M
PSL,Invesco DWA Consumer Staples Momentum ETF,Equity: U.S. Consumer Non-cyclicals,Invesco,0.60%,$114.17M
BFOR,ALPS Barron's 400 ETF,Equity: U.S. - Total Market,SS&C,0.65%,$114.11M
FDHY,Fidelity High Yield Factor ETF,"Fixed Income: Global - Corporate, Broad-based High Yield",FMR LLC,0.45%,$113.88M
TWM,ProShares UltraShort Russell2000,Inverse Equity: U.S. - Small Cap,ProShares,0.95%,$112.90M
INKM,SPDR SSGA Income Allocation ETF,Asset Allocation: Target Outcome,State Street Global Advisors,0.50%,$112.55M
DIG,ProShares Ultra Oil & Gas,Leveraged Equity: U.S. Energy,ProShares,0.95%,$112.41M
RXL,ProShares Ultra Health Care,Leveraged Equity: U.S. Health Care,ProShares,0.95%,$112.20M
TTAC,TrimTabs All Cap U.S. Free-Cash-Flow ETF,Equity: U.S. - Total Market,TrimTabs,0.59%,$112.13M
PJUN,Innovator S&P 500 Power Buffer ETF - June,Equity: U.S. - Large Cap,Innovator,0.79%,$111.87M
OCIO,ClearShares OCIO ETF,Asset Allocation: Target Outcome,ClearShares,0.67%,$111.78M
SOXS,Direxion Daily Semiconductor Bear 3X Shares,Inverse Equity: U.S. Semiconductors,Direxion,1.08%,$111.73M
FTGC,First Trust Global Tactical Commodity Strategy Fund,Commodities: Broad Market,First Trust,0.95%,$111.64M
FDM,First Trust Dow Jones Select MicroCap Index Fund,Equity: U.S. - Micro Cap,First Trust,0.60%,$111.32M
QQXT,First Trust NASDAQ-100 Ex-Technology Sector Index Fund,Equity: U.S. - Large Cap,First Trust,0.60%,$111.29M
HOLD,AdvisorShares Sage Core Reserves ETF,"Fixed Income: U.S. - Broad Market, Broad-based Investment Grade Short-Term",AdvisorShares,0.35%,$111.20M
RZV,Invesco S&P SmallCap 600 Pure Value ETF,Equity: U.S. - Small Cap Value,Invesco,0.35%,$111.00M
WTMF,WisdomTree Managed Futures Strategy Fund,Alternatives: Absolute Returns,WisdomTree,0.65%,$110.96M
QVAL,Alpha Architect U.S. Quantitative Value ETF,Equity: U.S. - Total Market Value,EMPIRICAL FINANCE LLC,0.49%,$110.90M
OVB,Overlay Shares Core Bond ETF,"Fixed Income: U.S. - Broad Market, Broad-based Investment Grade",Liquid Strategies,0.79%,$110.81M
HMOP,Hartford Municipal Opportunities ETF,"Fixed Income:U.S. Government, Local Authority/Municipal Broad Credit Broad Maturities",The Hartford,0.30%,$110.72M
VRAI,Virtus Real Asset Income ETF,Equity: U.S. - Total Market,Virtus Investment Partners,0.55%,$110.68M
RYJ,Invesco Raymond James SB-1 Equity ETF,Equity: U.S. - Total Market,Invesco,0.82%,$110.55M
BIBL,Inspire 100 ETF,Equity: U.S. - Large Cap,Inspire,0.35%,$110.35M
BLCN,Reality Shares Nasdaq NexGen Economy ETF,Equity: Global Blockchain,Reality Shares,0.68%,$110.11M
LRGE,ClearBridge Large Cap Growth ESG ETF,Equity: Global - Large Cap Growth,Franklin Templeton,0.59%,$110.01M
XES,SPDR S&P Oil & Gas Equipment & Services ETF,Equity: U.S. Oil & Gas Equipment & Services,State Street Global Advisors,0.35%,$109.72M
TPHD,Timothy Plan High Dividend Stock ETF,Equity: U.S. - Large Cap,Timothy Plan,0.52%,$109.23M
EDEN,iShares MSCI Denmark ETF,Equity: Denmark - Total Market,Blackrock,0.53%,$109.01M
QLV,FlexShares US Quality Low Volatility Index Fund,Equity: U.S. - Total Market,Northern Trust,0.22%,$108.99M
DTEC,ALPS Disruptive Technologies ETF,Equity: Global Technology,SS&C,0.50%,$108.41M
NUMV,Nuveen ESG Mid-Cap Value ETF,Equity: U.S. - Mid Cap Value,Nuveen Securities,0.40%,$108.41M
HYLV,IQ S&P High Yield Low Volatility Bond ETF,"Fixed Income: U.S. - Corporate, Broad-based High Yield",New York Life,0.40%,$108.41M
SHAG,WisdomTree Yield Enhanced U.S. Short-Term Aggregate Bond ETF,"Fixed Income: U.S. - Broad Market, Broad-based Investment Grade Short-Term",WisdomTree,0.12%,$108.39M
GVIP,Goldman Sachs Hedge Industry VIP ETF,Equity: U.S. - Total Market,Goldman Sachs,0.45%,$108.26M
IAI,iShares U.S. Broker-Dealers & Securities Exchanges ETF,Equity: U.S. Banking and Investment Services,Blackrock,0.42%,$108.12M
KURE,KraneShares MSCI All China Health Care Index ETF,Equity: China Health Care,CICC,0.65%,$107.65M
HSPX,Global X S&P 500 Covered Call ETF,Equity: U.S. - Large Cap,Mirae Asset,0.60%,$107.61M
SIXA,6 Meridian Mega Cap Equity ETF,Equity: U.S. - Large Cap,Exchange Traded Concepts,0.82%,$107.05M
LGH,HCM Defender 500 Index ETF,Equity: U.S. - Large Cap,Howard Capital Management,1.25%,$106.80M
UGA,United States Gasoline Fund LP,Commodities: Energy Gasoline,US Commodity Funds,0.75%,$106.63M
IQSI,IQ Candriam ESG International Equity ETF,Equity: Developed Markets - Total Market,New York Life,0.15%,$106.01M
RBUS,Nationwide Risk-Based U.S. Equity ETF,Equity: U.S. - Large Cap,Nationwide,0.30%,$105.87M
JCPB,JPMorgan Core Plus Bond ETF,"Fixed Income: Global - Broad Market, Broad-based",JPMorgan Chase,0.40%,$105.87M
USTB,VictoryShares USAA Core Short-Term Bond ETF,"Fixed Income: U.S. - Broad Market, Broad-based Short-Term",Victory Capital,0.34%,$105.74M
COPX,Global X Copper Miners ETF,Equity: Global Metals & Mining,Mirae Asset,0.65%,$105.32M
PPTY,PPTY-U.S. Diversified Real Estate ETF,Equity: U.S. Real Estate,Vident,0.49%,$105.07M
RVNU,Xtrackers Municipal Infrastructure Revenue Bond ETF,"Fixed Income: U.S. - Government, Local Authority/Municipal Investment Grade Long-Term",Deutsche Bank,0.15%,$104.86M
SGDJ,Sprott Junior Gold Miners ETF,Equity: Global Gold Miners,"Sprott, Inc.",0.50%,$104.81M
MFMS,MFAM Small-Cap Growth ETF,Equity: U.S. - Small Cap Growth,The Motley Fool,0.85%,$104.77M
DBEM,Xtrackers MSCI Emerging Markets Hedged Equity ETF,Equity: Emerging Markets - Total Market,Deutsche Bank,0.65%,$104.63M
SFY,SoFi Select 500 ETF,Equity: U.S. - Large Cap Growth,Toroso Investments,0.00%,$104.46M
DBAW,Xtrackers MSCI All World ex U.S. Hedged Equity ETF,Equity: Global Ex-U.S. - Total Market,Deutsche Bank,0.40%,$104.06M
JDST,Direxion Daily Junior Gold Miners Index Bear 2X Shares,Inverse Equity: Global Gold Miners,Direxion,1.10%,$104.04M
EIS,iShares MSCI Israel ETF,Equity: Israel - Total Market,Blackrock,0.59%,$103.67M
OUSM,OShares U.S. Small-Cap Quality Dividend ETF,Equity: U.S. - Small Cap,O'Shares Investments,0.48%,$103.21M
SCHJ,Schwab 1-5 Year Corporate Bond ETF,"Fixed Income: U.S. - Corporate, Broad-based Investment Grade Short-Term",Charles Schwab,0.05%,$103.10M
GVAL,Cambria Global Value ETF,Equity: Global - Total Market Value,Cambria,0.69%,$103.04M
UOCT,Innovator S&P 500 Ultra Buffer ETF - October,Equity: U.S. - Large Cap,Innovator,0.80%,$102.88M
DVOL,First Trust Dorsey Wright Momentum & Low Volatility ETF,Equity: U.S. - Total Market,First Trust,0.60%,$102.24M
VALT,ETFMG Sit Ultra Short ETF,"Fixed Income: Global - Broad Market, Broad-based Investment Grade Ultra-Short Term",ETFMG,0.30%,$101.99M
HYLD,High Yield ETF,"Fixed Income: U.S. - Corporate, Broad-based High Yield",Exchange Traded Concepts,1.25%,$101.92M
RYE,Invesco S&P 500 Equal Weight Energy ETF,Equity: U.S. Energy,Invesco,0.40%,$101.89M
BTEC,Principal Healthcare Innovators Index ETF,Equity: U.S. Health Care,Principal,0.42%,$101.69M
XHS,SPDR S&P Health Care Services ETF,Equity: U.S. Health Care Providers & Services,State Street Global Advisors,0.35%,$101.56M
QINT,American Century Quality Diversified International ETF,Equity: Global Ex-U.S. - Total Market,American Century Investments,0.39%,$101.45M
FCTR,First Trust Lunt U.S. Factor Rotation ETF,Equity: U.S. - Large Cap,First Trust,0.65%,$101.40M
DGRS,WisdomTree U.S. Smallcap Quality Dividend Growth Fund,Equity: U.S. - Small Cap,WisdomTree,0.38%,$101.31M
PAWZ,ProShares Pet Care ETF,Equity: Global - Total Market,ProShares,0.50%,$101.12M
IPO,Renaissance IPO ETF,Equity: U.S. - Total Market,Renaissance Capital,0.60%,$100.68M
DWSH,AdvisorShares Dorsey Wright Short ETF,Inverse Equity: U.S. - Large Cap,AdvisorShares,3.07%,$100.51M
RJI,Elements Rogers International Commodity Index-Total Return ETN,Commodities: Broad Market,Swedish Export Credit,0.75%,$100.44M
FXZ,First Trust Materials AlphaDEX Fund,Equity: U.S. Basic Materials,First Trust,0.65%,$99.95M
IDHQ,Invesco S&P International Developed Quality ETF,Equity: Developed Markets Ex-U.S. - Total Market,Invesco,0.29%,$99.39M
BGRN,iShares Global Green Bond ETF,"Fixed Income: Global - Broad Market, Broad-based Investment Grade",Blackrock,0.20%,$99.32M
IHY,VanEck Vectors International High Yield Bond ETF,"Fixed Income: Global Ex-U.S. - Corporate, Broad-based High Yield",VanEck,0.40%,$99.27M
XSMO,Invesco S&P SmallCap Momentum ETF,Equity: U.S. - Small Cap,Invesco,0.39%,$99.02M
BNDC,FlexShares Core Select Bond Fund,"Fixed Income: U.S. - Broad Market, Broad-based Investment Grade",Northern Trust,0.35%,$98.57M
MXDU,Nationwide Maximum Diversification U.S. Core Equity ETF,Equity: U.S. - Total Market,Nationwide,0.34%,$98.56M
PZT,Invesco New York AMT-Free Municipal Bond ETF,"Fixed Income: New York - Government, Local Authority/Municipal Investment Grade",Invesco,0.28%,$98.50M
FVL,First Trust Value Line 100 ETF,Equity: U.S. - Total Market,First Trust,0.70%,$97.56M
